1;fr;En quelle année fut fondée l'entreprise à but lucratif plafonné OpenAI ?;2015;2017;2019;2021;Débutant;En mars 2019, l'association à but non lucratif est devenue une entreprise à but lucratif plafonné, en vue d'attirer des capitaux.;https://fr.wikipedia.org/wiki/OpenAI
2;fr;Dans quelle ville des États-Unis se situe le siège social d'OpenAI ?;San Francisco;Chicago;Los Angeles;Miami;Débutant;L'objectif de cette société est de développer un raisonnement artificiel à visage humain qui profitera à toute l'humanité.;https://fr.wikipedia.org/wiki/OpenAI
3;fr;Qui a quitté OpenAI en 2018 à la suite d'un conflit de direction ?;Elon Musk;Sam Altman;Ilya Sutskever;Greg Brockman;Débutant;Elon Musk voit dans l'absence de publication du code source une trahison de la mission que s'était fixée l'organisation à sa fondation.;https://fr.wikipedia.org/wiki/OpenAI
4;fr;Quelle société a investi un milliard de dollars dans OpenAI en 2019 ?;Microsoft;Facebook;Google;Amazon;Débutant;En échange d'un partenariat privilégié avec OpenAI, lorsque la société commercialisera ses technologies d'intelligence artificielle.;https://fr.wikipedia.org/wiki/OpenAI
5;fr;Quelle intelligence artificielle fut créée par OpenAI en 2019 ?;GPT-2;GPT-1;GPT-3;GPT-4;Débutant;Generative Pre-trained Transformer 2 (GPT-2) était alors capable d'écrire des articles de presse et des oeuvres de fiction.;https://fr.wikipedia.org/wiki/OpenAI
6;fr;Qu'est capable de générer GPT-4 et pas GPT-2 ni GPT-3 ?;Images;Vidéos;Hologrammes;Jeux VR;Débutant;GPT-4 peut aussi lire, analyser et générer jusqu'à 25 000 mots, et écrire dans tous les principaux langages de programmation.;https://fr.wikipedia.org/wiki/OpenAI
7;fr;Quel outil d'OpenAI peut générer du texte de manière autonome ?;ChatGPT;OpenChat;AlphaGo;DALL-E;Débutant;ChatGPT peut aussi être utilisé pour améliorer les systèmes de dialogue en leur fournissant des réponses naturelles et pertinentes.;https://fr.wikipedia.org/wiki/OpenAI
8;fr;Quel président de l'incubateur Y Combinator a cofondé OpenAI ?;Sam Altman;Ilya Sutskever;Greg Brockman;Elon Musk;Débutant;En 2005, à l'âge de 19 ans, il cofonde Loopt, une application mobile de réseautage social, qu'il revendra en 2011 pour 43 millions.;https://fr.wikipedia.org/wiki/Sam_Altman
9;fr;Quelle est la signification de la lettre I dans le nom OpenAI ?;Intelligence;Information;Integration;Impossible;Débutant;Certains scientifiques ont mentionné que l'IA pourrait causer une explosion d'intelligence pouvant mener à l'extinction de l'humanité.;https://fr.wikipedia.org/wiki/OpenAI
10;fr;Quel était le nom du premier modèle de langage développé par OpenAI ?;GPT-1;GPT-2;GPT-3;GPT-4;Débutant;Bien que GPT-1 ait jeté les bases pour les modèles ultérieurs, c'est avec GPT-2 et GPT-3 que les avancées majeures ont été réalisées.;https://fr.wikipedia.org/wiki/OpenAI
11;fr;Quel était le montant du fond initial perçu par la société OpenAI ?;100 millions;10 millions;1 million;1 milliard;Confirmé;OpenAI chercha alors à s'associer à quelques startups utilisant le raisonnement artificiel pour avoir un effet transformateur.;https://fr.wikipedia.org/wiki/OpenAI
12;fr;À quelle somme la société OpenAI était-elle valorisée en 2023 ?;29 milliards;29 millions;290 millions;290 milliards;Confirmé;En janvier 2023, la société OpenAI, cofondée par Sam Altman, Elon Musk, Peter Thiel et Reid Hoffman comptait 375 employés.;https://fr.wikipedia.org/wiki/OpenAI
13;fr;Quel modèle de langage a suscité un grand intérêt en 2021 ?;GPT-3;BERT;DeepMind;OpenChat;Confirmé;Il a attiré une grande attention grâce à sa capacité à générer du texte cohérent, ainsi qu'à sa polyvalence dans diverses applications.;https://fr.wikipedia.org/wiki/OpenAI
14;fr;Quel cofondateur a décrit l'IA comme la pire menace existentielle ?;Elon Musk;Sam Altman;Ilya Sutskever;Greg Brockman;Confirmé;Les fondateurs d'OpenAI prétendent qu'ils concentrent leurs recherches sur les moyens de rendre l'IA bénéfique pour l'humanité.;https://fr.wikipedia.org/wiki/OpenAI
15;fr;Combien de paramètres environ furent intégrés à GPT-3 ?;175 milliards;17 milliards;5 milliards;175 millions;Confirmé;Encore plus puissante que GPT-2, cette intelligence artificielle l'était dix fois plus que n'importe quel autre programme comparable.;https://fr.wikipedia.org/wiki/OpenAI
16;fr;Quel générateur d'images fut développé par la société OpenAI ?;DALL-E;ChatGPT;OpenSIm;Alex;Confirmé;Dérivé du modèle GPT-3, le nom DALL-E est un mot-valise évoquant à la fois le robot de Pixar WALL-E et le peintre Salvador Dali.;https://fr.wikipedia.org/wiki/OpenAI
17;fr;Quel modèle de langage est basé sur l'architecture GPT-3 ?;GPT-3.5;GPT-2;GPT-5;GPT-6;Confirmé;GPT-3.5 peut répondre en langue naturelle à la question « pourquoi le pain est gonflé », en se basant sur l'article Wikipédia.;https://fr.wikipedia.org/wiki/OpenAI
18;fr;Quel était le coût estimé de l'entraînement de GPT-3 d'OpenAI ?;100 millions;10 millions;1 million;1 milliard;Confirmé;Ces coûts d'entraînement montrent l'ampleur des investissements nécessaires pour développer des modèles de langage de pointe.;https://fr.wikipedia.org/wiki/OpenAI
19;fr;Quel projet OpenAI a développé une technologie de modélisation 3D ?;Open3D;OpenGPT;DALL-E;DeepMind;Confirmé;Open3D vise à créer des modèles 3D détaillés et interactifs, ouvrant de nouvelles perspectives dans les domaines de la réalité virtuelle.;https://fr.wikipedia.org/wiki/OpenAI
20;fr;Quel jeu de stratégie a été utilisé par OpenAI pour ses agents d'IA ?;Chess;Poker;Fortnite;Monopoly;Confirmé;Grâce au renforcement, OpenAI a développé des programmes capables de rivaliser avec des joueurs d'échecs expérimentés.;https://fr.wikipedia.org/wiki/OpenAI
21;fr;Quel célèbre auteur de science-fiction a été consultant pour OpenAI ?;Isaac Asimov;Philip K. Dick;Ray Bradbury;Arthur C. Clarke;Expert;L'auteur Isaac Asimov est connu pour ses idées sur l'intelligence artificielle et ses réflexions sur les implications éthiques de l'IA.;https://fr.wikipedia.org/wiki/OpenAI
22;fr;Quel outil OpenAI peut effectuer des traductions de vidéos ou de films ?;Whisper;Weekend;Writer;Windows;Expert;Sorti en 2022, Whisper est un modèle polyvalent et multilingue de reconnaissance vocale qui peut également identifier une langue.;https://fr.wikipedia.org/wiki/OpenAI
23;fr;Quel langage permet d'interagir avec les modèles OpenAI ?;Python;Java;C++;Ruby;Expert;Le langage Python est placé sous une licence libre proche de la licence BSD et fonctionne sur la plupart des plateformes.;https://fr.wikipedia.org/wiki/Python_(langage)
24;fr;Quelle interface API interagit avec les modèles de langage OpenAI ?;OpenAI Codex;OpenChat;LanguageLink;GPTConnect;Expert;Codex a été utilisé pour créer des éditeurs de code assistés par l'IA générant du code en fonction de descriptions en langage naturel.;https://fr.wikipedia.org/wiki/OpenAI
25;fr;Quel modèle d'IA de chez OpenAI permet de jouer au jeu « Dota 2 » ?;OpenAI Five;AlphaGo;AlphaStar;OpenDota;Expert;OpenAI Five a affronté des joueurs professionnels lors d'un événement en ligne en 2018, remportant plusieurs parties.;https://fr.wikipedia.org/wiki/OpenAI
26;fr;Quelle université a remporté un défi de codage pour tester GPT-3 ?;Oxford;Stanford;Harvard;Cambridge;Expert;L'équipe de l'Université d'Oxford a remporté le défi en mettant en évidence la polyvalence du modèle dans le domaine du codage.;https://fr.wikipedia.org/wiki/OpenAI
27;fr;Quel outil OpenAI de visualisation neuronale est sorti en 2020 ?;Microscope;Analyzer;Tubular;Visioscope;Expert;Sorti en 2020, Microscope est un outil utilisé pour mieux comprendre le fonctionnement interne des réseaux de neurones.;https://fr.wikipedia.org/wiki/OpenAI
28;fr;Quel simulateur d'environnement peut entraîner des agents d'IA ?;Gym;OpenSIm;DeepSim;AIEnv;Expert;Gym, d'OpenAI, fournit une interface standardisée pour tester et développer des algorithmes d'apprentissage par renforcement.;https://fr.wikipedia.org/wiki/OpenAI
29;fr;Quel est le nom du célèbre chatbot développé par OpenAI en 2016 ?;Alex;Sophia;Siri;ChatGPT;Expert;Alex a été développé par OpenAI comme un assistant conversationnel avancé, présenté dans diverses démonstrations.;https://fr.wikipedia.org/wiki/OpenAI
30;fr;Quel projet d'OpenAI a réussi à résoudre le Rubik's Cube à une main ?;Dactyl;OpenGPT;OpenRubik;RubikSolver;Expert;Ce projet innovant a permis de démontrer les capacités d'apprentissage et de manipulation de l'IA dans la robotique.;https://fr.wikipedia.org/wiki/OpenAI
1;en;What year was the capped-profit company OpenAI founded ?;2015;2017;2019;2021;Débutant;In March 2019, the nonprofit became a capped-profit venture, with a view to attracting capital.;https://en.wikipedia.org/wiki/OpenAI
2;en;In which city in the United States is OpenAI's headquarters located ?;San Fransisco;Chicago;Los Angeles;Miami;Débutant;The goal of this society is to develop artificial reasoning with a human face that will benefit all of humanity.;https://en.wikipedia.org/wiki/OpenAI
3;en;Who left OpenAI in 2018 over a leadership dispute ?;Elon Musk;Sam Altman;Ilya Sutskever;Greg Brockman;Débutant;Elon Musk sees in the absence of publication of the source code a betrayal of the mission that the organization had set itself at its foundation.;https://en.wikipedia.org/wiki/OpenAI
4;en;Which company invested a billion dollars in OpenAI in 2019 ?;Microsoft;Facebook;Google;Amazon;Débutant;In exchange for a privileged partnership with OpenAI, when the company commercializes its artificial intelligence technologies.;https://en.wikipedia.org/wiki/OpenAI
5;en;What artificial intelligence was created by OpenAI in 2019 ?;GPT-2;GPT-1;GPT-3;GPT-4;Débutant;Generative Pre-trained Transformer 2 (GPT-2) was then able to write news articles and works of fiction.;https://en.wikipedia.org/wiki/OpenAI
6;en;What is able to generate GPT-4 and not GPT-2 nor GPT-3 ?;Pictures;Videos;Holograms;VR games;Débutant;GPT-4 can also read, parse and generate up to 25,000 words, and write in all major programming languages.;https://en.wikipedia.org/wiki/OpenAI
7;en;Which OpenAI tool can autonomously generate text ?;ChatGPT;OpenChat;AlphaGo;DALL-E;Débutant;ChatGPT can also be used to improve chat systems by providing them with natural and relevant responses.;https://en.wikipedia.org/wiki/OpenAI
8;en;Which Y Combinator incubator president co-founded OpenAI ?;Sam Altman;Ilya Sutskever;Greg Brockman;Elon Musk;Débutant;In 2005, at the age of 19, he co-founded Loopt, a mobile social networking application, which he sold in 2011 for 43 million.;https://en.wikipedia.org/wiki/Sam_Altman
9;en;What is the meaning of the letter I in the OpenAI name ?;Intelligence;Information;Integration;Unable;Débutant;Some scientists have mentioned that AI could cause an explosion of intelligence that could lead to the extinction of mankind.;https://en.wikipedia.org/wiki/OpenAI
10;en;What was the name of the first language model developed by OpenAI ?;GPT-1;GPT-2;GPT-3;GPT-4;Débutant;Although GPT-1 laid the foundation for later models, it was with GPT-2 and GPT-3 that major advancements were made.;https://en.wikipedia.org/wiki/OpenAI
11;en;What was the amount of the initial fund received by the OpenAI company ?;100 million;10 million;1 million;1 billion;Confirmé;OpenAI then sought to partner with a few startups using artificial reasoning to have a transformative effect.;https://en.wikipedia.org/wiki/OpenAI
12;en;How much was the OpenAI company valued at in 2023 ?;29 billion;29 million;290 million;290 billion;Confirmé;In January 2023, the OpenAI company, co-founded by Sam Altman, Elon Musk, Peter Thiel and Reid Hoffman had 375 employees.;https://en.wikipedia.org/wiki/OpenAI
13;en;Which language model has generated great interest in 2021 ?;GPT-3;BERT;DeepMind;OpenChat;Confirmé;It has attracted a lot of attention thanks to its ability to generate coherent text, as well as its versatility in various applications.;https://en.wikipedia.org/wiki/OpenAI
14;en;Which co-founder described AI as the worst existential threat ?;Elon Musk;Sam Altman;Ilya Sutskever;Greg Brockman;Confirmé;The founders of OpenAI claim that they focus their research on ways to make AI beneficial to humanity.;https://en.wikipedia.org/wiki/OpenAI
15;en;Approximately how many parameters were integrated into GPT-3 ?;175 billion;17 billion;5 billion;175 million;Confirmé;Even more powerful than GPT-2, this artificial intelligence was ten times more powerful than any other comparable program.;https://en.wikipedia.org/wiki/OpenAI
16;en;Which image generator was developed by the OpenAI company ?;DALL-E;ChatGPT;OpenSIm;Alex;Confirmé;Derived from the GPT-3 model, the name DALL-E is a portmanteau evoking both the Pixar robot WALL-E and the painter Salvador Dali.;https://en.wikipedia.org/wiki/OpenAI
17;en;Which language model is based on the GPT-3 architecture ?;GPT-3.5;GPT-2;GPT-5;GPT-6;Confirmé;GPT-3.5 can answer in natural language the question « why the bread is puffy », based on the Wikipedia article.;https://en.wikipedia.org/wiki/OpenAI
18;en;What was the estimated cost of training OpenAI's GPT-3 ?;100 million;10 million;1 million;1 billion;Confirmé;These training costs show the magnitude of the investment needed to develop state-of-the-art language models.;https://en.wikipedia.org/wiki/OpenAI
19;en;Which OpenAI project developed 3D modeling technology ?;Open3D;OpenGPT;DALL-E;DeepMind;Confirmé;Open3D aims to create detailed and interactive 3D models, opening new perspectives in the fields of virtual reality.;https://en.wikipedia.org/wiki/OpenAI
20;en;Which strategy game was used by OpenAI for its AI agents ?;Chess;Poker;Fortnite;Monopoly;Confirmé;Thanks to reinforcement, OpenAI has developed programs that can compete with experienced chess players.;https://en.wikipedia.org/wiki/OpenAI
21;en;Which famous science fiction author has been a consultant for OpenAI ?;Issac Asimov;Philip K. Dick;Ray Bradbury;Arthur C. Clarke;Expert;Author Isaac Asimov is known for his ideas on artificial intelligence and his thoughts on the ethical implications of AI.;https://en.wikipedia.org/wiki/OpenAI
22;en;Which OpenAI tool can perform video or movie translations ?;Whisper;Gym;Alex;Dactyl;Expert;Released in 2022, Whisper is a versatile, multilingual voice recognition model that can also identify a language.;https://en.wikipedia.org/wiki/OpenAI
23;en;Which language allows to interact with OpenAI models ?;Python;Java;C++;Ruby;Expert;The Python language is placed under a free license close to the BSD license and works on most platforms.;https://en.wikipedia.org/wiki/Python_(programming_language)
24;en;Which API interface interacts with OpenAI language models ?;OpenAI Codex;OpenChat;LanguageLink;GPTConnect;Expert;Codex has been used to create AI-assisted code editors that generate code based on natural language descriptions.;https://en.wikipedia.org/wiki/OpenAI
25;en;Which AI model from OpenAI can play the game « Dota 2 » ?;OpenAI Five;AlphaGo;AlphaStar;OpenDota;Expert;OpenAI Five competed against professional gamers in an online event in 2018, winning several games.;https://en.wikipedia.org/wiki/OpenAI
26;en;Which university won a coding challenge to test GPT-3 ?;Oxford;Stanford;Harvard;Cambridge;Expert;The Oxford University team won the challenge by highlighting the model's versatility in the field of coding.;https://en.wikipedia.org/wiki/OpenAI
27;en;Which OpenAI neural visualization tool came out in 2020 ?;Microscope;Analyzer;Tubular;Visioscope;Expert;Released in 2020, Microscope is a tool used to better understand the inner workings of neural networks.;https://en.wikipedia.org/wiki/OpenAI
28;en;What environment simulator can train AI agents ?;Gym;OpenSIm;DeepSim;AIEnv;Expert;Gym, from OpenAI, provides a standardized interface for testing and developing reinforcement learning algorithms.;https://en.wikipedia.org/wiki/OpenAI
29;en;What is the name of the famous chatbot developed by OpenAI in 2016 ?;Alex;Sophie;Siri;ChatGPT;Expert;Alex was developed by OpenAI as an advanced conversational assistant, featured in various demos.;https://en.wikipedia.org/wiki/OpenAI
30;en;Which OpenAI project managed to solve the one-handed Rubik's Cube ?;Dactyl;OpenGPT;OpenRubik;RubikSolver;Expert;This innovative project demonstrated the learning and manipulation capabilities of AI in robotics.;https://en.wikipedia.org/wiki/OpenAI
1;de;In welchem Jahr wurde das gewinnorientierte Unternehmen OpenAI gegründet ?;2015;2017;2019;2021;Débutant;Im März 2019 wurde die gemeinnützige Organisation in ein Unternehmen mit begrenztem Gewinn umgewandelt, um Kapital anzuziehen.;https://de.wikipedia.org/wiki/OpenAI
2;de;In welcher Stadt in den Vereinigten Staaten befindet sich der Hauptsitz von OpenAI ?;San Francisco;Chicago;Los Angeles;Miami;Débutant;Das Ziel dieser Gesellschaft ist es, künstliches Denken mit menschlichem Antlitz zu entwickeln, das der gesamten Menschheit zugute kommt.;https://de.wikipedia.org/wiki/OpenAI
3;de;Wer hat OpenAI 2018 aufgrund eines Führungsstreits verlassen ?;Elon Musk;Sam Altman;Ilya Sutskever;Greg Brockman;Débutant;Elon Musk sieht in der fehlenden Veröffentlichung des Quellcodes einen Verrat an der Mission, die sich die Organisation bei ihrer Gründung gesetzt hatte.;https://de.wikipedia.org/wiki/OpenAI
4;de;Welches Unternehmen hat 2019 eine Milliarde Dollar in OpenAI investiert ?;Microsoft;Facebook;Google;Amazon;Débutant;Im Austausch für eine privilegierte Partnerschaft mit OpenAI, wenn das Unternehmen seine Technologien der künstlichen Intelligenz kommerzialisiert.;https://de.wikipedia.org/wiki/OpenAI
5;de;Welche künstliche Intelligenz wurde 2019 von OpenAI geschaffen ?;GPT-2;GPT-1;GPT-3;GPT-4;Débutant;Der Generative Pre-trained Transformer 2 (GPT-2) war dann in der Lage, Nachrichtenartikel und Romane zu schreiben.;https://de.wikipedia.org/wiki/OpenAI
6;de;Was kann GPT-4 generieren und nicht GPT-2 oder GPT-3 ?;Bilder;Videos;Hologramme;VR-Spiele;Débutant;GPT-4 kann außerdem bis zu 25.000 Wörter lesen, analysieren und generieren und in allen wichtigen Programmiersprachen schreiben.;https://de.wikipedia.org/wiki/OpenAI
7;de;Welches OpenAI-Tool kann autonom Text generieren ?;ChatGPT;OpenChat;AlphaGo;DALL-E;Débutant;ChatGPT kann auch zur Verbesserung von Chat-Systemen verwendet werden, indem ihnen natürliche und relevante Antworten bereitgestellt werden.;https://de.wikipedia.org/wiki/OpenAI
8;de;Welcher Präsident des Y-Combinator-Inkubators war Mitbegründer von OpenAI ?;Sam Altman;Ilya Sutskever;Greg Brockman;Elon Musk;Débutant;Im Jahr 2005, im Alter von 19 Jahren, war er Mitbegründer von Loopt, einer mobilen Social-Networking-Anwendung, die er 2011 für 43 Millionen verkaufte.;https://de.wikipedia.org/wiki/Sam_Altman
9;de;Was bedeutet der Buchstabe I im OpenAI-Namen ?;Intelligenz;Informationen;Integration;Nicht möglich;Débutant;Einige Wissenschaftler haben erwähnt, dass KI eine Explosion der Intelligenz auslösen könnte, die zum Aussterben der Menschheit führen könnte.;https://de.wikipedia.org/wiki/OpenAI
10;de;Wie hieß das erste von OpenAI entwickelte Sprachmodell ?;GPT-1;GPT-2;GPT-3;GPT-4;Débutant;Obwohl GPT-1 den Grundstein für spätere Modelle legte, wurden mit GPT-2 und GPT-3 große Fortschritte erzielt.;https://de.wikipedia.org/wiki/OpenAI
11;de;Wie hoch war der anfängliche Betrag, den das Unternehmen OpenAI erhalten hat ?;100 Millionen;10 Millionen;1 Million;1 Milliarde;Confirmé;OpenAI versuchte dann, mit einigen Start-ups zusammenzuarbeiten, die künstliches Denken nutzten, um eine transformative Wirkung zu erzielen.;https://de.wikipedia.org/wiki/OpenAI
12;de;Wie hoch war der Wert des OpenAI-Unternehmens im Jahr 2023 ?;29 Milliarden;29 Millionen;290 Millionen;290 Milliarden;Confirmé;Im Januar 2023 beschäftigte das von Sam Altman, Elon Musk, Peter Thiel und Reid Hoffman mitbegründete Unternehmen OpenAI 375 Mitarbeiter.;https://de.wikipedia.org/wiki/OpenAI
13;de;Welches Sprachmodell hat im Jahr 2021 großes Interesse geweckt ?;GPT-3;BERT;DeepMind;OpenChat;Confirmé;Aufgrund seiner Fähigkeit, kohärenten Text zu erzeugen, sowie seiner Vielseitigkeit in verschiedenen Anwendungen hat es große Aufmerksamkeit erregt.;https://de.wikipedia.org/wiki/OpenAI
14;de;Welcher Mitbegründer beschrieb KI als die schlimmste existenzielle Bedrohung ?;Elon Musk;Sam Altman;Ilya Sutskever;Greg Brockman;Confirmé;Die Gründer von OpenAI behaupten, dass sie ihre Forschung auf Möglichkeiten konzentrieren, KI für die Menschheit von Nutzen zu machen.;https://de.wikipedia.org/wiki/OpenAI
15;de;Wie viele Parameter wurden ungefähr in GPT-3 integriert ?;175 Milliarden;17 Milliarden;5 Milliarden;175 Millionen;Confirmé;Diese künstliche Intelligenz war sogar noch leistungsfähiger als GPT-2 und zehnmal leistungsfähiger als jedes andere vergleichbare Programm.;https://de.wikipedia.org/wiki/OpenAI
16;de;Welcher Bildgenerator wurde von der Firma OpenAI entwickelt ?;DALL-E;ChatGPT;OpenSIm;Alex;Confirmé;Der vom GPT-3-Modell abgeleitete Name DALL-E ist ein Kunstwort, das sowohl an den Pixar-Roboter WALL-E als auch an den Maler Salvador Dali erinnert.;https://de.wikipedia.org/wiki/OpenAI
17;de;Welches Sprachmodell basiert auf der GPT-3-Architektur ?;GPT-3.5;GPT-2;GPT-5;GPT-6;Confirmé;GPT-3.5 kann die Frage « warum das Brot aufgedunsen ist » in natürlicher Sprache beantworten, basierend auf dem Wikipedia-Artikel.;https://de.wikipedia.org/wiki/OpenAI
18;de;Wie hoch waren die geschätzten Kosten für das Training von OpenAIs GPT-3 ?;100 Millionen;10 Millionen;1 Million;1 Milliarde;Confirmé;Diese Schulungskosten zeigen, wie groß die Investitionen sind, die für die Entwicklung hochmoderner Sprachmodelle erforderlich sind.;https://de.wikipedia.org/wiki/OpenAI
19;de;Welches OpenAI-Projekt hat die 3D-Modellierungstechnologie entwickelt ?;Open3D;OpenGPT;DALL-E;DeepMind;Confirmé;Ziel von Open3D ist die Erstellung detaillierter und interaktiver 3D-Modelle, die neue Perspektiven im Bereich der virtuellen Realität eröffnen.;https://de.wikipedia.org/wiki/OpenAI
20;de;Welches Strategiespiel hat OpenAI für seine KI-Agenten verwendet ?;Schach;Poker;Fortnite;Monopol;Confirmé;Dank der Verstärkung hat OpenAI Programme entwickelt, die mit erfahrenen Schachspielern konkurrieren können.;https://de.wikipedia.org/wiki/OpenAI
21;de;Welcher berühmte Science-Fiction-Autor war Berater für OpenAI ?;Issac Asimov;Philip K. Dick;Ray Bradbury;Arthur C. Clarke;Expert;Der Autor Isaac Asimov ist bekannt für seine Ideen zur künstlichen Intelligenz und seine Gedanken zu den ethischen Implikationen der KI.;https://de.wikipedia.org/wiki/OpenAI
22;de;Welches OpenAI-Tool kann Video- oder Filmübersetzungen durchführen ?;Whisper;Gym;Alex;Dactyl;Expert;Whisper wurde 2022 veröffentlicht und ist ein vielseitiges, mehrsprachiges Spracherkennungsmodell, das auch eine Sprache identifizieren kann.;https://de.wikipedia.org/wiki/OpenAI
23;de;Welche Sprache ermöglicht die Interaktion mit OpenAI-Modellen ?;Python;Java;C++;Rubin;Expert;Die Python-Sprache steht unter einer kostenlosen Lizenz, die der BSD-Lizenz ähnelt, und funktioniert auf den meisten Plattformen.;https://de.wikipedia.org/wiki/Python_(Programmiersprache)
24;de;Welche API-Schnittstelle interagiert mit OpenAI-Sprachmodellen ?;OpenAI-Codex;OpenChat;LanguageLink;GPTConnect;Expert;Codex wurde verwendet, um KI-gestützte Code-Editoren zu erstellen, die Code basierend auf Beschreibungen in natürlicher Sprache generieren.;https://de.wikipedia.org/wiki/OpenAI
25;de;Welches KI-Modell von OpenAI kann das Spiel « Dota 2 » spielen ?;OpenAI Five;AlphaGo;AlphaStar;OpenDota;Expert;OpenAI Five trat 2018 in einem Online-Event gegen professionelle Gamer an und gewann mehrere Spiele.;https://de.wikipedia.org/wiki/OpenAI
26;de;Welche Universität hat einen Coding-Challenge zum Testen von GPT-3 gewonnen ?;Oxford;Stanford;Harvard;Cambridge;Expert;Das Team der Universität Oxford gewann die Herausforderung, indem es die Vielseitigkeit des Modells im Bereich der Codierung hervorhob.;https://de.wikipedia.org/wiki/OpenAI
27;de;Welches OpenAI-Tool zur neuronalen Visualisierung kam 2020 auf den Markt ?;Microscope;Analyzer;Tubular;Visioscope;Expert;Microscope wurde im Jahr 2020 veröffentlicht und ist ein Werkzeug, das dazu dient, das Innenleben neuronaler Netze besser zu verstehen.;https://de.wikipedia.org/wiki/OpenAI
28;de;Mit welchem Umgebungssimulator können KI-Agenten trainiert werden ?;Gym;OpenSIm;DeepSim;AIEnv;Expert;Gym von OpenAI bietet eine standardisierte Schnittstelle zum Testen und Entwickeln von Reinforcement-Learning-Algorithmen.;https://de.wikipedia.org/wiki/OpenAI
29;de;Wie heißt der berühmte Chatbot, der 2016 von OpenAI entwickelt wurde ?;Alex;Sophie;Siri;ChatGPT;Expert;Alex wurde von OpenAI als fortschrittlicher Konversationsassistent entwickelt und in verschiedenen Demos vorgestellt.;https://de.wikipedia.org/wiki/OpenAI
30;de;Welches OpenAI-Projekt hat es geschafft, den einhändigen Zauberwürfel zu lösen ?;Dactyl;OpenGPT;OpenRubik;RubikSolver;Expert;Dieses innovative Projekt demonstrierte die Lern- und Manipulationsfähigkeiten der KI in der Robotik.;https://de.wikipedia.org/wiki/OpenAI
1;es;¿En qué año se fundó la empresa de beneficios limitados OpenAI ?;2015;2017;2019;2021;Débutant;En marzo de 2019, la organización sin fines de lucro se convirtió en una empresa de ganancias limitadas, con miras a atraer capital.;https://es.wikipedia.org/wiki/OpenAI
2;es;¿En qué ciudad de Estados Unidos se encuentra la sede de OpenAI ?;San Francisco;Chicago;Los Ángeles;Miami;Débutant;El objetivo de esta sociedad es desarrollar un razonamiento artificial con rostro humano que beneficie a toda la humanidad.;https://es.wikipedia.org/wiki/OpenAI
