29;de;Welche Schutzpflanze ist Norwegens Nationalblume ?;Kallu;Besen;Gelber Fingerhut;Fiebergras;Expert;Wenn ein junges Mädchen in Schottland einen Zweig weißes Heidekraut (Calluna vulgaris) findet, ist es sicher, dass es innerhalb eines Jahres verheiratet ist.;https://de.wikipedia.org/wiki/Besenheide
30;de;Welche Pflanze wurde aufgrund ihrer schädlichen Wirkung als Tollwurz bezeichnet ?;Datum;Kallu;Koriander;Wilder Fenchel;Expert;Der Dornapfel in Salbe, Trank oder Rauch verursacht Realitätsverlust, Halluzinationen und Schlaf.;https://de.wikipedia.org/wiki/Stechäpfel
1;es;¿Qué planta se vuelve mágica cuando tiene al menos cuatro hojas ?;trébol;hierba de la fiebre;Valeriana officinalis;Calle de la vid;Débutant;Una fuerte tradición irlandesa dice que San Patricio usó la hoja de trébol para ilustrar el misterio de la Trinidad.;
2;es;¿Qué planta trató el trauma nervioso en los combatientes de guerra ?;Valeriana officinalis;Barba de Júpiter;artemisa;Albahaca;Débutant;Una vez que fue una poderosa poción de amor, la hierba gatera ahora se usa principalmente en tés de hierbas soporíferos.;
3;es;¿Las semillas de qué planta que encontramos en nuestra ropa serían diuréticas ?;Lino;hamamelis;cicuta;Cilantro;Débutant;Fue Philippe de Girard quien, con su máquina de hilar lino, convirtió el norte de Francia en un centro industrial de hilados.;
4;es;¿Qué planta aromática se ofrece en las farmacias como antiparasitario ?;Albahaca;Bryonia dioica;Albahaca;Fecha;Débutant;La albahaca se usa ampliamente en la cocina italiana, con otras variedades comunes en algunas cocinas asiáticas.;https://es.wikipedia.org/wiki/Ocimum_basilicum
5;es;¿Qué planta venenosa fue la base del veneno oficial de los atenienses ?;cicuta;avens comunes;Calle de la vid;artemisa;Débutant;Sócrates murió después de beber cicuta, mientras que Mitrídates VI se volvió inmune tomando dosis crecientes.;
6;es;¿Qué planta con propiedades afrodisíacas se usa en algunos panes de jengibre ?;jengibre;hierba de la fiebre;Fecha;calluna;Débutant;El capítulo 7 del Kamasutra analiza su uso en las prácticas sexuales : « El jengibre ayuda en la naturaleza lujuriosa ».;https://es.wikipedia.org/wiki/Zingiber officinale
7;es;¿Qué planta molida, la base del curry, promueve la producción de esperma ?;Cilantro;Jazmín blanco;Hiedra terrestre;cicuta;Débutant;El aceite esencial de cilantro se usa en la industria farmacéutica para enmascarar el amargor de ciertos medicamentos.;https://es.wikipedia.org/wiki/Coriandrum sativum
8;es;¿Qué planta se menciona en la canción « Purple Haze » de Jimi Hendrix ?;Cáñamo cultivado;belladona;calluna;Escoba;Débutant;Originaria de Asia Central, esta planta se usa a veces en medicina, pero especialmente para hacer textiles y cuerdas.;https://es.wikipedia.org/wiki/Cannabis_sativa
9;es;¿Qué planta estaba asociada con la clarividencia en la antigua Grecia ?;Hinojo silvestre;amaranto caudado;Cáñamo cultivado;jengibre;Débutant;El cultivo del hinojo común fue recomendado en los dominios reales por Carlomagno en el capítulo De Villis.;https://es.wikipedia.org/wiki/Foeniculum_vulgare
10;es;¿Cuál es el fitomedicamento prescrito hoy contra la crisis nerviosa ?;Hierba de San Juan perforada;trébol;Lino;Arum manchado;Débutant;El uso medicinal de la hierba de San Juan se remonta al menos a 2.400 años, cuando Dioscórides la recomendaba en sus recetas.;
11;es;A pesar de su rojo carmesí, visible desde lejos, ¿qué planta te haría invisible ?;amaranto caudado;Hierba de San Juan perforada;Arum manchado;Salado;Confirmé;También se le llama Kiwicha, por su nombre en lengua quechua en Perú, donde se cultiva con fines alimentarios.;https://es.wikipedia.org/wiki/Amaranthus_caudatus
12;es;¿Qué planta se usaba para conservar la cerveza antes del uso del lúpulo ?;Hiedra terrestre;Arum manchado;Jazmín blanco;Lino;Confirmé;Colocada debajo de la cama de las madres jóvenes, la hiedra tenía la virtud de darles fuerza después del parto.;https://es.wikipedia.org/wiki/Glechoma_hederacea
13;es;¿Qué arbusto de hoja caduca puede curar las venas varicosas y las hemorroides ?;hamamelis;jengibre;ajo silvestre;trébol;Confirmé;El hamamelis también trataría contusiones, esguinces, heridas menores, inflamación de la piel y las membranas mucosas.;
14;es;¿Qué arbusto seco se ha usado durante mucho tiempo para hacer escobas ?;Escoba;Salado;Barba de Júpiter;Valeriana officinalis;Confirmé;Tradicionalmente, la flor de Scotch Broom se usaba como diurético y para el tratamiento de trastornos circulatorios.;
15;es;¿Qué planta de elección se utiliza contra las infecciones respiratorias ?;Salado;Cáñamo cultivado;amaranto caudado;La cizaña embriagadora;Confirmé;Las hojas se han utilizado como condimento desde la antigüedad, tanto para sazonar carnes a la brasa, salsas y verduras.;https://es.wikipedia.org/wiki/Satureja
16;es;¿Qué flor de Pakistán se encuentra en « Absolutely Irrésistible » de Givenchy ?;Jazmín blanco;cicuta;La cizaña embriagadora;Bryonia dioica;Confirmé;Las flores de jazmín se utilizan en la medicina china para refrescar la sangre y restablecer el equilibrio de las energías.;https://es.wikipedia.org/wiki/Jasminum_officinale
17;es;¿Qué flor de Pakistán se encuentra en « Absolutely Irrésistible » de Givenchy ?;Jazmín blanco;cicuta;La cizaña embriagadora;Bryonia dioica;Confirmé;Las flores de jazmín se utilizan en la medicina china para refrescar la sangre y restablecer el equilibrio de las energías.;https://es.wikipedia.org/wiki/Jasminum_officinale
18;es;¿Qué planta de apariencia vagamente humana tendría virtudes mágicas ?;mandrágora;Cilantro;hamamelis;avens comunes;Confirmé;La raíz de mandrágora trata las enfermedades de la piel y la gota, mientras que las hojas son eficaces para curar heridas.;https://es.wikipedia.org/wiki/Mandragora officinarum
19;es;¿Qué hierba tiene fama de ser la planta medicinal para las patologías cardíacas ?;Dedalera amarilla;Hinojo silvestre;Bryonia dioica;Escoba;Confirmé;Ahora protegido, Digitalis yellow es menos popular que Digitalis purple porque contiene menos ingredientes activos.;https://es.wikipedia.org/wiki/Digitalis_lutea
20;es;¿Qué planta venenosa de bayas negras contiene atropina ?;belladona;La cizaña embriagadora;mandrágora;Dedalera amarilla;Confirmé;Es peligroso para el hombre comer o beber de la bella dama, porque ella golpea su espíritu y de alguna manera lo mata.;https://es.wikipedia.org/wiki/Atropa belladonna
21;es;¿Qué herbácea perenne por su raíz aumentaría la tolerancia al alcohol ?;Bryonia dioica;artemisa;Salado;hamamelis;Expert;Es una planta de seto trepador, con bayas rojas y negras, cuya raíz carnosa es almidonosa y fuertemente purgante.;
22;es;¿Qué nombre se le da también a la angélica del bosque o angélica sylvester ?;hierba de la fiebre;hierba gatera;hierba blanca;Hierba de los Dioses;Expert;Según la leyenda, angélica protegería a los niños, combatiría la peste y se curaría de las mordeduras de las bestias rabiosas.;
23;es;¿Qué planta regula el ciclo de la menstruación en la menopausia ?;artemisa;Calle de la vid;avens comunes;ajo silvestre;Expert;Ponerse en los zapatos, Artemisa también tendría la virtud de reducir la fatiga al caminar.;https://es.wikipedia.org/wiki/Artemisia_vulgaris
24;es;¿Qué antigua planta medicinal se utiliza para aromatizar el brandy ?;Calle de la vid;Dedalera amarilla;Hierba de San Juan perforada;Barba de Júpiter;Expert;Tóxico en altas dosis, corre el rumor de que la hija de Titus murió tras consumirlo durante un aborto forzado.;https://es.wikipedia.org/wiki/Ruta_graveolens
25;es;¿De qué hierba se usó la raíz seca para reemplazar el clavo ?;avens comunes;Albahaca;hamamelis;Cáñamo cultivado;Expert;En la Edad Media, la hierba del buen soldado era la aliada de los monjes exorcistas que usaban avens para ahuyentar al diablo.;
26;es;¿Qué planta rica en vitamina C tiene propiedades para adelgazar ?;ajo silvestre;Lino;trébol;amaranto caudado;Expert;Según una leyenda, después de que los osos hibernan, estos mamíferos irían en busca de sus hojas para purgarse.;https://es.wikipedia.org/wiki/Allium_ursinum
27;es;¿Qué planta venenosa, utilizada como cataplasma, puede curar las verrugas ?;Arum manchado;Hiedra terrestre;Hinojo silvestre;Jazmín blanco;Expert;Los tubérculos contienen cristales de oxalato de calcio que los hacen inadecuados para el consumo sin preparación.;https://es.wikipedia.org/wiki/Arum_maculatum
28;es;¿Qué planta adherida al techo de las cabañas protegería contra los rayos ?;Barba de Júpiter;Cabello de Zeus;Ceja de Juno;Cabra de Nerón;Expert;En Francia, la Houseleek de los tejados se encuentra especialmente en el Jura, los Alpes, el Macizo Central y los Pirineos.;https://es.wikipedia.org/wiki/Sempervivum_tectorum
29;es;¿Qué planta protectora es la flor nacional de Noruega ?;calluna;Escoba;Dedalera amarilla;hierba de la fiebre;Expert;En Escocia, si una joven encuentra una ramita de brezo blanco (calluna vulgaris), seguramente se casará dentro de un año.;https://es.wikipedia.org/wiki/Calluna_vulgaris
30;es;¿Qué planta ha sido apodada hierba loca debido a sus efectos nocivos ?;Fecha;calluna;Cilantro;Hinojo silvestre;Expert;La manzana espinosa en pomada, poción o humo provoca desconexión de la realidad, alucinaciones y sueño.;https://es.wikipedia.org/wiki/Datura
1;it;Quale pianta diventa magica quando ha almeno quattro foglie ?;trifoglio;Febbre Erba;Valeriana officinalis;Via della vite;Débutant;Una forte tradizione irlandese vuole che San Patrizio usasse il quadrifoglio per illustrare il mistero della Trinità.;
2;it;Quale pianta ha curato il trauma nervoso nei combattenti di guerra ?;Valeriana officinalis;Barba di Giove;artemisia;Basilio;Débutant;Un tempo potente pozione d'amore, l'erba gatta è ora usata principalmente nelle tisane soporifere.;
3;it;I semi di quale pianta trovata nei nostri vestiti sarebbero diuretici ?;Lino;amamelide;cicuta;coriandolo;Débutant;Fu Philippe de Girard che, con il suo filatoio di lino, trasformò il nord della Francia in un centro di filatura industriale.;
4;it;Quale pianta aromatica viene offerta in farmacia come vermifugo ?;Basilio;Dioico Bryony;Basilio;Datura;Débutant;Il basilico è ampiamente utilizzato nella cucina italiana, con altre varietà comuni in alcune cucine asiatiche.;https://it.wikipedia.org/wiki/Ocimum_basilicum
5;it;Quale pianta velenosa era alla base del veleno ufficiale degli Ateniesi ?;cicuta;aven comuni;Via della vite;artemisia;Débutant;Socrate morì dopo aver bevuto la cicuta mentre Mitridate VI ne divenne immune assumendo dosi crescenti.;
6;it;Quale pianta dalle proprietà afrodisiache viene utilizzata in alcuni pan di zenzero ?;zenzero;Febbre Erba;Datura;calluna;Débutant;Il capitolo 7 del Kamasutra ne discute l'uso nelle pratiche sessuali : « Lo zenzero aiuta nella natura lussuriosa ».;https://it.wikipedia.org/wiki/Zingiber officinale
7;it;Quale pianta macinata, alla base del curry, favorisce la produzione di sperma ?;coriandolo;Gelsomino bianco;Edera terrestre;cicuta;Débutant;L'olio essenziale di coriandolo viene utilizzato nell'industria farmaceutica per mascherare l'amaro di alcuni farmaci.;https://it.wikipedia.org/wiki/Coriandrum sativum
8;it;Quale pianta è menzionata nella canzone « Purple Haze » di Jimi Hendrix ?;Canapa coltivata;belladonna;calluna;scopa;Débutant;Originaria dell'Asia centrale, questa pianta è talvolta usata in medicina ma soprattutto per realizzare tessuti e corde.;https://it.wikipedia.org/wiki/Cannabis_sativa
9;it;Quale pianta era associata alla chiaroveggenza nell'antica Grecia ?;Finocchietto selvatico;amaranto caudato;Canapa coltivata;zenzero;Débutant;La coltivazione del finocchio comune fu raccomandata nei domini reali da Carlo Magno nel capitolo De Villis.;https://it.wikipedia.org/wiki/Foeniculum_vulgare
10;it;Qual è la fitomedicina oggi prescritta contro l'esaurimento nervoso ?;Erba di San Giovanni perforata;trifoglio;Lino;Arum maculato;Débutant;L'uso medicinale dell'erba di San Giovanni risale ad almeno 2400 anni fa, quando Dioscoride la raccomandava nelle sue prescrizioni.;
11;it;Nonostante il suo rosso cremisi, visibile da lontano, quale pianta ti renderebbe invisibile ?;amaranto caudato;Erba di San Giovanni perforata;Arum maculato;salato;Confirmé;Viene anche chiamato Kiwicha, dal suo nome in lingua quechua in Perù, dove viene coltivato a scopo alimentare.;https://it.wikipedia.org/wiki/Amaranthus_caudatus
12;it;Quale pianta veniva utilizzata per conservare la birra prima dell'uso del luppolo ?;Edera terrestre;Arum maculato;Gelsomino bianco;Lino;Confirmé;Posta sotto il letto delle giovani madri, l'edera aveva la virtù di dar loro forza dopo il travaglio del parto.;https://it.wikipedia.org/wiki/Glechoma_hederacea
13;it;Quale arbusto deciduo può curare le vene varicose e le emorroidi ?;amamelide;zenzero;aglio selvatico;trifoglio;Confirmé;Amamelide curerebbe anche lividi, distorsioni, ferite minori, infiammazioni della pelle e delle mucose.;
14;it;Quale arbusto essiccato è stato a lungo utilizzato per fare le scope ?;scopa;salato;Barba di Giove;Valeriana officinalis;Confirmé;Tradizionalmente, il fiore di Scotch Broom era usato come diuretico e per il trattamento dei disturbi circolatori.;
15;it;Quale pianta preferita viene utilizzata contro le infezioni respiratorie ?;salato;Canapa coltivata;amaranto caudato;Tares inebrianti;Confirmé;Le foglie sono state usate come condimento fin dall'antichità, sia per condire carni alla griglia, salse e verdure.;https://it.wikipedia.org/wiki/Satureja
16;it;Quale fiore del Pakistan si trova in « Absolutely Irrésistible » di Givenchy ?;Gelsomino bianco;cicuta;Tares inebrianti;Dioico Bryony;Confirmé;I fiori di gelsomino sono usati nella medicina cinese per raffreddare il sangue e ripristinare l'equilibrio delle energie.;https://it.wikipedia.org/wiki/Jasminum_officinale
17;it;Quale fiore del Pakistan si trova in « Absolutely Irrésistible » di Givenchy ?;Gelsomino bianco;cicuta;Tares inebrianti;Dioico Bryony;Confirmé;I fiori di gelsomino sono usati nella medicina cinese per raffreddare il sangue e ripristinare l'equilibrio delle energie.;https://it.wikipedia.org/wiki/Jasminum_officinale
18;it;Quale pianta dall'aspetto vagamente umano avrebbe virtù magiche ?;mandragora;coriandolo;amamelide;aven comuni;Confirmé;La radice di mandragora cura le malattie della pelle e la gotta, mentre le foglie sono efficaci nella guarigione delle ferite.;
19;it;Quale erba è considerata la pianta medicinale per le patologie cardiache ?;Digitale gialla;Finocchietto selvatico;Dioico Bryony;scopa;Confirmé;Ora protetto, il giallo digitale è meno popolare del viola digitale perché contiene meno principi attivi.;https://it.wikipedia.org/wiki/Digitalis_lutea
20;it;Quale pianta velenosa di bacche nere contiene atropina ?;belladonna;Tares inebrianti;mandragora;Digitale gialla;Confirmé;È pericoloso per l'uomo mangiare o bere dalla bella signora, perché colpisce il suo spirito e in qualche modo lo uccide.;https://it.wikipedia.org/wiki/Atropa belladonna
21;it;Quale erbacea perenne per radice aumenterebbe la tolleranza all'alcol ?;Dioico Bryony;artemisia;salato;amamelide;Expert;Si tratta di una pianta rampicante da siepe, con bacche rosse e nere, la cui radice carnosa è amidacea e fortemente purgativa.;
22;it;Quale nome viene dato anche all'angelica dei boschi o angelica sylvester ?;Febbre Erba;erba gatta;Erba bianca;Erba degli Dei;Expert;Secondo la leggenda, l'angelica avrebbe protetto i bambini, combattuto la peste e guarito dai morsi delle bestie rabbiose.;
23;it;Quale pianta regola il ciclo mestruale in menopausa ?;artemisia;Via della vite;aven comuni;aglio selvatico;Expert;Messa nelle scarpe, l'Artemisia avrebbe anche il pregio di ridurre la fatica mentre si cammina.;https://it.wikipedia.org/wiki/Artemisia_vulgaris
24;it;Quale pianta un tempo medicinale viene usata per aromatizzare il brandy ?;Via della vite;Digitale gialla;Erba di San Giovanni perforata;Barba di Giove;Expert;Tossico ad alte dosi, si dice che la figlia di Titus sia morta dopo averla consumata durante un aborto forzato.;https://it.wikipedia.org/wiki/Ruta_graveolens
25;it;Di quale erba veniva usata la radice essiccata per sostituire il chiodo di garofano ?;aven comuni;Basilio;amamelide;Canapa coltivata;Expert;Nel medioevo l'erba del buon soldato era alleata dei monaci esorcisti che usavano gli aven per scacciare il diavolo.;
26;it;Quale pianta ricca di vitamina C ha proprietà dimagranti ?;aglio selvatico;Lino;trifoglio;amaranto caudato;Expert;Secondo una leggenda, dopo il letargo degli orsi, questi mammiferi sarebbero andati alla ricerca delle sue foglie per purificarsi.;https://it.wikipedia.org/wiki/Allium_ursinum
27;it;Quale pianta velenosa, usata come cataplasma, può curare le verruche ?;Arum maculato;Edera terrestre;Finocchietto selvatico;Gelsomino bianco;Expert;I tuberi contengono cristalli di ossalato di calcio che li rendono inadatti al consumo senza preparazione.;https://it.wikipedia.org/wiki/Arum_maculatum
28;it;Quale pianta attaccata al tetto dei cottage proteggerebbe dai fulmini ?;Barba di Giove;Capelli di Zeus;Sopracciglio di Giunone;Capra di Nerone;Expert;In Francia il Semprevivo dei tetti si trova soprattutto nel Giura, nelle Alpi, nel Massiccio Centrale e nei Pirenei.;https://it.wikipedia.org/wiki/Sempervivum_tectorum
29;it;Quale pianta protettiva è il fiore nazionale della Norvegia ?;calluna;scopa;Digitale gialla;Febbre Erba;Expert;In Scozia, se una ragazza trova un rametto di erica bianca (calluna vulgaris), si sposerà sicuramente entro un anno.;https://it.wikipedia.org/wiki/Calluna_vulgaris
30;it;Quale pianta è stata soprannominata erba pazza a causa dei suoi effetti deleteri ?;Datura;calluna;coriandolo;Finocchietto selvatico;Expert;La mela spinosa in unguento, pozione o fumo provoca la disconnessione dalla realtà, allucinazioni e sonno.;https://it.wikipedia.org/wiki/Datura
1;nl;Welke plant wordt magisch als hij minstens vier bladeren heeft ?;Klaver;Koorts Gras;Valeriaan officinalis;Wijnstokstraat;Débutant;Volgens een sterke Ierse traditie gebruikte Saint Patrick het klaverblad om het mysterie van de Drie-eenheid te illustreren.;
2;nl;Welke plant behandelde zenuwtrauma bij oorlogsjagers ?;Valeriaan officinalis;Jupiters baard;bijvoet;Basilicum;Débutant;Eens een krachtig liefdesdrankje, wordt kattenkruid nu voornamelijk gebruikt in slaapverwekkende kruidenthee.;
3;nl;De zaden van welke plant in onze kleding zouden diuretisch zijn ?;Linnen;toverhazelaar;hemlock;Koriander;Débutant;Het was Philippe de Girard die met zijn vlasspinmachine het noorden van Frankrijk ombouwde tot een industrieel spinnerijcentrum.;
4;nl;Welke aromatische plant wordt in de apotheek aangeboden als ontwormingsmiddel ?;Basilicum;Tweehuizige Bryony;Basilicum;Datum;Débutant;Basilicum wordt veel gebruikt in de Italiaanse keuken, met andere variëteiten die in sommige Aziatische keukens voorkomen.;https://nl.wikipedia.org/wiki/Basilicum_(soort)
5;nl;Welke giftige plant was de basis van het officiële gif van de Atheners ?;hemlock;gemeenschappelijke avens;Wijnstokstraat;bijvoet;Débutant;Socrates stierf na het drinken van hemlock, terwijl Mithridates VI er immuun voor werd door toenemende doses te nemen.;
6;nl;Welke plant met lustopwekkende eigenschappen wordt in sommige peperkoek gebruikt ?;Gember;Koorts Gras;Datum;calluna;Débutant;Hoofdstuk 7 van de Kamasutra bespreekt het gebruik ervan in seksuele praktijken : « Gember helpt bij de wellustige aard ».;https://nl.wikipedia.org/wiki/Zingiber officinale
7;nl;Welke grondplant, de basis van curry's, bevordert de spermaproductie ?;Koriander;Witte Jasmijn;Gemalen klimop;hemlock;Débutant;Essentiële olie van koriander wordt in de farmaceutische industrie gebruikt om de bitterheid van bepaalde medicijnen te maskeren.;https://nl.wikipedia.org/wiki/Koriander
8;nl;Welke plant wordt genoemd in het nummer « Purple Haze » van Jimi Hendrix ?;Gekweekte hennep;belladonna;calluna;Bezem;Débutant;Oorspronkelijk uit Centraal-Azië, wordt deze plant soms gebruikt in de geneeskunde maar vooral om textiel en touwen te maken.;https://nl.wikipedia.org/wiki/Hennep
9;nl;Welke plant werd in het oude Griekenland geassocieerd met helderziendheid ?;Wilde venkel;Caudate amarant;Gekweekte hennep;Gember;Débutant;De teelt van gewone venkel werd in de koninklijke domeinen aanbevolen door Karel de Grote in het hoofdstuk De Villis.;https://nl.wikipedia.org/wiki/Venkel
10;nl;Wat is het fytomedicijn dat tegenwoordig wordt voorgeschreven tegen zenuwinzinking ?;Geperforeerd sint-janskruid;Klaver;Linnen;Gevlekte Aronskelk;Débutant;Het medicinale gebruik van sint-janskruid dateert van minstens 2.400 jaar, toen Dioscorides het in zijn voorschriften aanbeval.;
11;nl;Welke plant zou je onzichtbaar maken, ondanks zijn karmozijnrode, van verre zichtbare kleur ?;Caudate amarant;Geperforeerd sint-janskruid;Gevlekte Aronskelk;Hartig;Confirmé;Het wordt ook Kiwicha genoemd, van zijn naam in de Quechua-taal in Peru, waar het wordt gekweekt voor voedseldoeleinden.;https://nl.wikipedia.org/wiki/Kattenstaartamarant
12;nl;Welke plant werd gebruikt om bier te bewaren vóór het gebruik van hop ?;Gemalen klimop;Gevlekte Aronskelk;Witte Jasmijn;Linnen;Confirmé;Geplaatst onder het bed van jonge moeders, had klimop de deugd hen kracht te geven na de bevalling.;https://nl.wikipedia.org/wiki/Hondsdraf
13;nl;Welke bladverliezende struik kan spataderen en aambeien genezen ?;toverhazelaar;Gember;wilde knoflook;Klaver;Confirmé;Toverhazelaar zou ook kneuzingen, verstuikingen, kleine wonden, ontstekingen van de huid en slijmvliezen behandelen.;
14;nl;Welke gedroogde struik wordt al lang gebruikt om bezems te maken ?;Bezem;Hartig;Jupiters baard;Valeriaan officinalis;Confirmé;Traditioneel werd Scotch Broom-bloem gebruikt als diureticum en voor de behandeling van stoornissen in de bloedsomloop.;
15;nl;Welke plant naar keuze wordt gebruikt tegen luchtweginfecties ?;Hartig;Gekweekte hennep;Caudate amarant;Bedwelmend onkruid;Confirmé;De bladeren worden al sinds de oudheid als smaakmaker gebruikt, zowel om gegrild vlees, sauzen als groenten op smaak te brengen.;https://nl.wikipedia.org/wiki/Bonenkruid
16;nl;Welke bloem uit Pakistan wordt gevonden in « Absolutely Irrésistible » van Givenchy ?;Witte Jasmijn;hemlock;Bedwelmend onkruid;Tweehuizige Bryony;Confirmé;Jasmijnbloemen worden in de Chinese geneeskunde gebruikt om het bloed te koelen en de energiebalans te herstellen.;
17;nl;Welke bloem uit Pakistan wordt gevonden in « Absolutely Irrésistible » van Givenchy ?;Witte Jasmijn;hemlock;Bedwelmend onkruid;Tweehuizige Bryony;Confirmé;Jasmijnbloemen worden in de Chinese geneeskunde gebruikt om het bloed te koelen en de energiebalans te herstellen.;
18;nl;Welke plant met een vaag menselijk uiterlijk zou magische deugden hebben ?;mandrake;Koriander;toverhazelaar;gemeenschappelijke avens;Confirmé;Mandrakewortel behandelt huidziekten en jicht, terwijl de bladeren effectief zijn bij het genezen van wonden.;https://nl.wikipedia.org/wiki/Alruin
19;nl;Welk kruid staat bekend als de medicinale plant voor hartpathologieën ?;Geel vingerhoedskruid;Wilde venkel;Tweehuizige Bryony;Bezem;Confirmé;Nu beschermd, is Digitalis-geel minder populair dan Digitalis-paars omdat het minder actieve ingrediënten bevat.;https://nl.wikipedia.org/wiki/Geel_vingerhoedskruid
20;nl;Welke giftige zwarte bessenplant bevat atropine ?;belladonna;Bedwelmend onkruid;mandrake;Geel vingerhoedskruid;Confirmé;Het is gevaarlijk voor de man om van de mooie dame te eten of te drinken, omdat ze zijn geest slaat en hem op de een of andere manier doodt.;https://nl.wikipedia.org/wiki/Wolfskers
21;nl;Welke kruidachtige vaste plant zou bij zijn wortel de alcoholtolerantie verhogen ?;Tweehuizige Bryony;bijvoet;Hartig;toverhazelaar;Expert;Het is een klimhaagplant, met rode en zwarte bessen, waarvan de vlezige wortel zetmeelrijk en sterk zuiverend is.;
22;nl;Welke naam wordt ook gegeven aan de engelwortel van het bos of engelwortel sylvester ?;Koorts Gras;Kattenkruid;Wit gras;Gras van de Goden;Expert;Volgens de legende zou engelwortel kinderen beschermen, de pest bestrijden en genezen van de beten van hondsdolle beesten.;
23;nl;Welke plant reguleert de menstruatiecyclus tijdens de menopauze ?;bijvoet;Wijnstokstraat;gemeenschappelijke avens;wilde knoflook;Expert;In schoenen gedaan, zou Bijvoet ook de verdienste hebben om vermoeidheid tijdens het lopen te verminderen.;https://nl.wikipedia.org/wiki/Bijvoet
24;nl;Welke eens medicinale plant wordt gebruikt om brandewijn op smaak te brengen ?;Wijnstokstraat;Geel vingerhoedskruid;Geperforeerd sint-janskruid;Jupiters baard;Expert;Giftig in hoge doses, het gerucht gaat dat de dochter van Titus stierf na het consumeren ervan tijdens een gedwongen abortus.;https://nl.wikipedia.org/wiki/Wijnruit
25;nl;Van welk kruid werd de gedroogde wortel gebruikt om de kruidnagel te vervangen ?;gemeenschappelijke avens;Basilicum;toverhazelaar;Gekweekte hennep;Expert;In de Middeleeuwen was het kruid van de goede soldaat de bondgenoot van exorcistische monniken die avens gebruikten om de duivel te verjagen.;
26;nl;Welke plant rijk aan vitamine C heeft eigenschappen om af te vallen ?;wilde knoflook;Linnen;Klaver;Caudate amarant;Expert;Volgens een legende zouden deze zoogdieren, nadat de beren hun winterslaap hadden gehouden, op zoek gaan naar de bladeren om zichzelf te zuiveren.;https://nl.wikipedia.org/wiki/Daslook
27;nl;Welke giftige plant, gebruikt als kompres, kan wratten genezen ?;Gevlekte Aronskelk;Gemalen klimop;Wilde venkel;Witte Jasmijn;Expert;De knollen bevatten kristallen van calciumoxalaat waardoor ze ongeschikt zijn voor consumptie zonder voorbereiding.;https://nl.wikipedia.org/wiki/Gevlekte_aronskelk
