19;de;Welcher Film von J. J. Abrams ist eine Hommage an Spielbergs fantastisches Kino ?;« Super 8 »;« Cloverfield »;« Armageddon »;« The Suburbans »;Confirmé;Der von Steven Spielberg koproduzierte « Super 8 »-Film diente 2011 als Eröffnungsfilm des Internationalen Filmfestivals von Locarno.;https://de.wikipedia.org/wiki/Super_8_(Film)
20;de;In welchem Film dringt ein Dieb während eines gemeinsamen Traums ins Unterbewusstsein ein ?;« Inception »;« Monsters »;« Another Earth »;« Nummer Vier »;Confirmé;Die Produktionsfirmen stellten ein Budget von 160 Millionen Dollar bereit, plus 100 Millionen für die Promotion des Films.;https://de.wikipedia.org/wiki/Inception
21;de;Welcher Film von Shane Black ist der vierte in einer Franchise, die 1987 begann ?;« The Predator »;« Iron Man 4 »;« L'Arme fatale »;« Pacific Rim »;Expert;Arnold Schwarzenegger hat bestätigt, dass er wegen der Rückkehr seines Charakters Major Dutch mit Shane Black in Kontakt stand.;https://de.wikipedia.org/wiki/Predator_–_Upgrade
22;de;In welchem Film werden die Rümpfe von zwölf außerirdischen Raumschiffen genannt ?;« Erster Kontakt »;« Passengers »;« Cloverfield »;« God Particle »;Expert;Die vergleichende Sprachwissenschaftlerin Louise Banks wird von der Armee angeworben, um Kontakt herzustellen und vor allem ihre Ziele zu kennen.;
23;de;In welchem Film mit Tom Cruise dringen organisierte Mimics in Europa ein ?;« Edge of Tomorrow »;« Die Mumie »;« Oblivion »;« Rock Forever »;Expert;Das Thema einer Figur, die von einer Situation ausgeht, war Gegenstand mehrerer Filme, insbesondere « Un jour sans fin ».;https://de.wikipedia.org/wiki/Edge_of_Tomorrow
24;de;In welchem Film kommt ein Team durch ein Wurmloch, das in der Nähe von Saturn aufgetaucht ist ?;« Interstellar »;« Upside Down »;« The Rover »;« Time Lapse »;Expert;Der Film basiert auf der Arbeit des amerikanischen Physikers Kip Thorne, der für die wissenschaftliche Glaubwürdigkeit des Films gesorgt hat.;https://de.wikipedia.org/wiki/Interstellar
25;de;In welchem Film begegnen Studenten dem Computergenie NOMAD ?;« The Signal »;« Gantz »;« Antiviral »;« Iron Sky »;Expert;Als sie sich mitten in einem isolierten Gebiet wiederfinden, in dem alles völlig schwarz wird, entdecken sie, dass sie Teil einer Verschwörung sind.;https://de.wikipedia.org/wiki/The_Signal_(2014)
26;de;In welchem Film wird Wasser aus den Ozeanen zu den Kolonien von Titan gepumpt ?;« Oblivion »;« Under the Skin »;« Upside Down »;« Snowpiercer »;Expert;Wir können in « Oblivion » auch eine Inspiration und eine beeindruckende Hommage an den Roman « Brave New World » von Aldous Huxley sehen.;https://de.wikipedia.org/wiki/Oblivion_(Film)
27;de;Welcher Schauspieler spielt John Carter im gleichnamigen Science-Fiction-Film ?;Taylor Kitsch;Willem Dafoe;Keanu Reeves;Bruce Willis;Expert;Es ist eine lose Adaption des 1917 erschienenen Romans « Eine Prinzessin vom Mars » des amerikanischen Autors Edgar Rice Burroughs.;https://de.wikipedia.org/wiki/John_Carter_–_Zwischen_zwei_Welten
28;de;In welchem Film hat sich Boxen zum Hightech-Sport entwickelt ?;« Real Steel »;« Time Out »;« World Invasion »;« Die Agentur »;Expert;Das Projekt wurde im September 2009 an Shawn Levy vergeben und Hugh Jackman wurde für 9.000.000 US-Dollar eingestellt.;https://de.wikipedia.org/wiki/Real_Steel
29;de;In welchem Film spielt Denzel Washington einen Kriegermönch ?;« Das Buch Eli »;« Skyline »;« Repo Men »;« Eva »;Expert;Dieser rasante futuristische Thriller unter der Regie von Albert und Allen Hughes ist irgendwo zwischen « Mad Max II » und «  Am Legend » angesiedelt.;https://de.wikipedia.org/wiki/The_Book_of_Eli
30;de;Welcher Science-Fiction-Film bezieht sich auf einen berühmten südafrikanischen Kaugummi ?;« Chappie »;« Divergente »;« Sayonara »;« Mute »;Expert;Am Set in Johannesburg machte Sharlto Copley das Motion Capture für die Figur von Chappie.;https://de.wikipedia.org/wiki/Chappie
1;es;¿Qué película de ciencia ficción de 2018 gira en torno a un animal prehistórico ?;« Megalodón »;« The Discovery »;« Geostrom »;« Mute »;Débutant;Tras su estreno en Norteamérica, la película destronó a « Mission impossible : Fallout », recaudando 45 millones de dólares en su primer fin de semana.;https://es.wikipedia.org/wiki/Megalodón
2;es;¿Qué película sigue al primer « Blade Runner » dirigido por Ridley Scott ?;« Blade Runner 2049 »;« Equals »;« Labyrinthe »;« Zoe »;Débutant;El título de la película se reveló en octubre de 2016 y corresponde a la fecha de la historia que, por lo tanto, tiene lugar treinta años después de la primera película.;https://es.wikipedia.org/wiki/Blade_Runner_2049
3;es;¿En qué película se reduce a Matt Damon a un tamaño humano de unos 12 cm ?;« Downsizing »;« Paranoïa »;« Seul sur Mars »;« Interstellar »;Débutant;« Downsizing » (o « Pequeño formato ») es una comedia dramática de ciencia ficción estadounidense de 2017 dirigida por Alexander Payne.;https://es.wikipedia.org/wiki/Downsizing
4;es;¿Qué cuarta entrega de la serie « Jurassic Park » se estrenó en 2015 ?;« Jurassic World »;« El mundo perdido »;« Pacific Rim »;« Regresión »;Débutant;La historia de « Jurassic World » transcurre veintidós años después de los acontecimientos de « Jurassic Park », en la misma isla : Isla Nublar.;https://es.wikipedia.org/wiki/Jurassic_World
5;es;¿Qué actor terminó solo en Marte en una película de Ridley Scott ?;mate damon;Gerard Butler;bruce willis;Tom Hanks;Débutant;La película es la adaptación cinematográfica de « Alone on Mars », la primera novela de Andy Weir, publicada como libro electrónico en 2011.;https://es.wikipedia.org/wiki/The_Martian
6;es;¿En qué película de ciencia ficción Brad Pitt tiene que luchar contra zombis ?;« World War Z »;« Fury »;« El estratega »;« Megamind »;Débutant;La película ganó $ 202 millones en ingresos estadounidenses y $ 337 millones en ingresos internacionales.;https://es.wikipedia.org/wiki/Guerra_mundial_Z_(película)
7;es;¿Qué película protagonizada por George Clooney y Sandra Bullock ganó siete premios Oscar ?;« Gravity »;« Riddick »;« Pacific Rim »;« Europa Report »;Débutant;En julio de 2010, Scarlett Johansson dio un acuerdo verbal para protagonizar la película y coprotagonizar a Robert Downey Jr.;https://es.wikipedia.org/wiki/Gravity_(película)
8;es;¿Qué película se planeó originalmente como una precuela de « Alien, el octavo pasajero » ?;« Prometheus »;« La Resurrección »;« Covenant »;« Requiem »;Débutant;El escenario de « Prometheus » se fue alejando poco a poco de la saga « Alien », aunque se inspira mucho en ésta.;https://es.wikipedia.org/wiki/Prometheus_(película)
9;es;¿Qué película de Wachowski, estrenada en 2012, cuenta seis historias distintas ?;« Cloud Atlas »;« Speed Racer »;« Bound »;« Matrix »;Débutant;Los actores principales de la película « Cloud Atlas » interpretan hasta seis papeles, uno por época, que difieren en edad, apariencia o género.;https://es.wikipedia.org/wiki/Cloud_Atlas
10;es;¿En qué película Josh Brolin interpreta a un joven Tommy Lee Jones ?;« Men in Black 3 »;« Line of Fire »;« Sicario »;« Sin City »;Débutant;Nicole Scherzinger aparece en esta tercera película, así como Lady Gaga, haciendo una pequeña aparición allí como un extraterrestre.;https://es.wikipedia.org/wiki/Hombres_de_negro_III
11;es;¿Qué película de ciencia ficción unió a Emma Watson y Tom Hanks ?;« The Circle »;« Colonia »;« Regression »;« Noé »;Confirmé;Tras una experiencia revolucionaria, Emma Watson será filmada continuamente por una minicámara conectada SeeChange.;https://es.wikipedia.org/wiki/El_círculo_(película_de_2017)
12;es;¿Quién dirigió « Solo: A Star Wars Story », estrenada en las pantallas en 2018 ?;Ron Howard;Jon Turteltaub;Ridley Scott;Luc Besson;Confirmé;Tercera película derivada de la franquicia « Star Wars », es la primera película en la que el intérprete de Han Solo no es Harrison Ford.;https://es.wikipedia.org/wiki/Han_Solo:_una_historia_de_Star_Wars
13;es;¿Qué agente espacio-temporal viajó por la Ciudad de los Mil Planetas ?;Valeriana;Korben Dallas;Pablo Safranek;doctor mann;Confirmé;La película de Luc Besson es una adaptación libre del universo de la serie de cómics francesa « Valérian et Laureline ».;
14;es;¿Qué desastrosa película de ciencia ficción protagonizada por Gerard Butler se estrenó en 2017 ?;« Geostrom »;« Machine Gun »;« Ultimate Game »;« Le Chantage »;Confirmé;El mal uso de un dispositivo armado podría causar una geotormenta global.;https://es.wikipedia.org/wiki/Geostorm
15;es;¿Qué película es una adaptación de la serie literaria de Veronica Roth ?;« Divergente »;« Collateral »;« Minority Report »;« Hunger Games »;Confirmé;Esta saga trata sobre aquellos que representan una amenaza para la élite gobernante de un país al no permitirles controlarlos.;https://es.wikipedia.org/wiki/Divergente (película)
16;es;¿Qué película parte del postulado de que solo usamos el 10% de las capacidades del cerebro ?;« Lucy »;« Looper »;« El Congreso »;« Riddick »;Confirmé;A finales de 2014, « Lucy » de Luc Besson se convirtió en el mayor éxito del cine francés en el extranjero con más de 53 millones de espectadores.;https://es.wikipedia.org/wiki/Lucy_(película_de_2014)
17;es;¿En qué estación espacial las cabinas permiten curar enfermedades ?;« Elysium »;« Europa »;« Gravity »;« Oblivion »;Confirmé;La película de Neill Blomkamp reunió en las pantallas a Matt Damon y Jodie Foster en el papel del Secretario de Defensa.;https://es.wikipedia.org/wiki/Elysium_(película)
18;es;¿En qué película las organizaciones criminales viajan en el tiempo ?;« Looper »;« Space Battleship »;« Source Code »;« Time Out »;Confirmé;Muchos críticos ven en « Looper » una pequeña joya de anticipación dirigida por un joven cineasta talentoso, Rian Johnson.;https://es.wikipedia.org/wiki/Looper (película)
19;es;¿Qué película de J. J. Abrams rinde homenaje al cine fantástico de Spielberg ?;« Super 8 »;« Cloverfield »;« Armageddon »;« The Suburbans »;Confirmé;Coproducida por Steven Spielberg, la película « Super 8 » fue la película inaugural del Festival Internacional de Cine de Locarno en 2011.;https://es.wikipedia.org/wiki/Super_8_(película)
20;es;¿En qué película un ladrón se infiltra en el subconsciente durante un sueño compartido ?;« Inception »;« Monsters »;« Another Earth »;« Número cuatro »;Confirmé;Las productoras destinaron un presupuesto de 160 millones de dólares, más 100 millones destinados a la promoción de la película.;https://es.wikipedia.org/wiki/Inception
21;es;¿Qué película de Shane Black es la cuarta de una franquicia que comenzó en 1987 ?;« The Predator »;« Iron Man 4 »;« L'Arme fatale »;« Pacific Rim »;Expert;Arnold Schwarzenegger ha confirmado que ha estado en contacto con Shane Black sobre el regreso de su personaje, Major Dutch.;https://es.wikipedia.org/wiki/El_Depredador
22;es;¿En qué película hay doce naves extraterrestres apodadas los cascos ?;« Primer contacto »;« Passengers »;« Cloverfield »;« God Particle »;Expert;La experta en lingüística comparada Louise Banks es reclutada por el ejército para establecer contacto y, sobre todo, conocer sus objetivos.;
23;es;¿En qué película con Tom Cruise los miméticos organizados invaden Europa ?;« Edge of Tomorrow »;« La Momia »;« Oblivion »;« Rock Forever »;Expert;El tema de un personaje que vuelve a empezar una situación ha sido objeto de varias películas, en particular « Un jour sans fin ».;https://es.wikipedia.org/wiki/Al_filo_del_mañana
24;es;¿En qué película un equipo atraviesa un agujero de gusano que apareció cerca de Saturno ?;« Interstellar »;« Upside Down »;« The Rover »;« Time Lapse »;Expert;La película está basada en el trabajo del físico estadounidense Kip Thorne, quien aseguró la verosimilitud científica de la película.;https://es.wikipedia.org/wiki/Interstellar
25;es;¿En qué película los estudiantes se enfrentan a NOMAD, un genio de la informática ?;« The Signal »;« Gantz »;« Antiviral »;« Iron Sky »;Expert;Al encontrarse en medio de un área aislada donde todo se vuelve totalmente negro, descubren que son parte de una conspiración.;https://es.wikipedia.org/wiki/The_Signal
26;es;¿En qué película se bombea agua de los océanos a las colonias de Titán ?;« Oblivion »;« Under the Skin »;« Upside Down »;« Snowpiercer »;Expert;También podemos ver en « Oblivion » una inspiración y un impactante homenaje a la novela « Brave New World » de Aldous Huxley.;https://es.wikipedia.org/wiki/Oblivion_(película_de_2013)
27;es;¿Qué actor interpreta a John Carter en una película de ciencia ficción del mismo nombre ?;Taylor Kitsch;Willem Dafoe;Keanu Reeves;Bruce Willis;Expert;Es una adaptación libre de la novela « A Princess of Mars » del autor estadounidense Edgar Rice Burroughs, publicada en 1917.;https://es.wikipedia.org/wiki/John_Carter_(película)
28;es;¿En qué película el boxeo se convirtió en un deporte de alta tecnología ?;« Real Steel »;« Time Out »;« World Invasion »;« La Agencia »;Expert;El proyecto fue asignado a Shawn Levy en septiembre de 2009 y Hugh Jackman fue contratado por $9,000,000.;https://es.wikipedia.org/wiki/Real_Steel
29;es;¿En qué película Denzel Washington interpreta a un monje guerrero ?;« El Libro de Eli »;« Skyline »;« Repo Men »;« Eva »;Expert;Este trepidante thriller futurista, dirigido por Albert y Allen Hughes, se sitúa en algún lugar entre « Mad Max II » y « I Am Legend ».;https://es.wikipedia.org/wiki/The_Book_of_Eli
30;es;¿Qué película de ciencia ficción hace referencia a un famoso chicle sudafricano ?;« Chappie »;« Divergente »;« Sayonara »;« Mute »;Expert;En el set en Johannesburgo, Sharlto Copley hizo la captura de movimiento del personaje de Chappie.;https://es.wikipedia.org/wiki/Chappie
1;it;Quale film di fantascienza del 2018 ruota attorno a un animale preistorico ?;« Shark : Il primo squalo »;« The Discovery »;« Geostrom »;« Mute »;Débutant;Al momento della sua uscita in Nord America, il film ha detronizzato « Mission impossible : Fallout », incassando 45 milioni di dollari nel primo fine settimana.;https://it.wikipedia.org/wiki/Shark_-_Il_primo_squalo
2;it;Quale film segue il primo « Blade Runner » diretto da Ridley Scott ?;« Blade Runner 2049 »;« Equals »;« Labyrinthe »;« Zoe »;Débutant;Il titolo del film è stato svelato nell'ottobre 2016 e corrisponde alla data della storia che quindi si colloca a trent'anni di distanza da quella del primo film.;https://it.wikipedia.org/wiki/Blade_Runner_2049
3;it;In quale film Matt Damon viene ridotto a una dimensione umana di circa 12 cm ?;« Downsizing »;« Paranoïa »;« Seul sur Mars »;« Interstellar »;Débutant;« Downsizing » (o « Piccolo formato ») è una commedia drammatica di fantascienza americana del 2017 diretta da Alexander Payne.;https://it.wikipedia.org/wiki/Downsizing_-_Vivere_alla_grande
4;it;Quale quarto capitolo della serie « Jurassic Park » è stato pubblicato nel 2015 ?;« Jurassic World »;« Il mondo perduto »;« Pacific Rim »;« Regressione »;Débutant;La storia di « Jurassic World » si svolge ventidue anni dopo gli eventi di « Jurassic Park », sulla stessa isola : Isla Nublar.;https://it.wikipedia.org/wiki/Jurassic_World
5;it;Quale attore è finito da solo su Marte in un film di Ridley Scott ?;Matt Damon;Gerard Butler;Bruce Willis;Tom Hanks;Débutant;Il film è l'adattamento cinematografico di « Alone on Mars », il primo romanzo di Andy Weir, pubblicato come e-book nel 2011.;https://it.wikipedia.org/wiki/Sopravvissuto_-_The_Martian
6;it;In quale film di fantascienza Brad Pitt deve combattere gli zombi ?;« World War Z »;« Fury »;« Lo stratega »;« Megamind »;Débutant;Il film ha guadagnato $ 202 milioni di entrate negli Stati Uniti e $ 337 milioni di entrate internazionali.;https://it.wikipedia.org/wiki/World_War_Z
7;it;Quale film con George Clooney e Sandra Bullock ha vinto sette Oscar ?;« Gravity »;« Riddick »;« Pacific Rim »;« Europa Report »;Débutant;Nel luglio 2010, Scarlett Johansson ha dato un accordo verbale per recitare nel film e co-protagonista Robert Downey Jr.;https://it.wikipedia.org/wiki/Gravity_(film)
8;it;Quale film era originariamente previsto come prequel di « Alien, l'ottavo passeggero » ?;« Prometheus »;« La Resurrezione »;« Covenant »;« Requiem »;Débutant;Lo scenario di « Prometheus » si è via via allontanato dalla saga « Alien », anche se è molto ispirato da questa.;https://it.wikipedia.org/wiki/Prometheus_(film)
9;it;Quale film di Wachowski, uscito nel 2012, racconta sei storie distinte ?;« Cloud Atlas »;« Speed Racer »;« Bound »;« Matrix »;Débutant;Gli attori principali del film « Cloud Atlas » interpretano fino a sei ruoli, uno per epoca, diversi per età, aspetto o sesso.;https://it.wikipedia.org/wiki/Cloud_Atlas
10;it;In quale film Josh Brolin interpreta un giovane Tommy Lee Jones ?;« Men in Black 3 »;« Line of Fire »;« Sicario »;« Sin City »;Débutant;Nicole Scherzinger appare in questo terzo film, così come Lady Gaga, facendo una piccola apparizione lì come aliena.;https://it.wikipedia.org/wiki/Men_in_Black_3
11;it;Quale film di fantascienza ha unito Emma Watson e Tom Hanks ?;« The Circle »;« Colonia »;« Regression »;« Noé »;Confirmé;Dopo un'esperienza rivoluzionaria, Emma Watson sarà continuamente ripresa da una mini-camera collegata SeeChange.;https://it.wikipedia.org/wiki/The_Circle_(film_2017)
12;it;Chi ha diretto « Solo: A Star Wars Story », uscito sugli schermi nel 2018 ?;Ron Howard;Jon Turteltaub;Ridley Scott;Luc Besson;Confirmé;Terzo film derivato dal franchise « Star Wars », è il primo film in cui l'interprete di Han Solo non è Harrison Ford.;https://it.wikipedia.org/wiki/Solo:_A_Star_Wars_Story
13;it;Quale agente spazio-temporale ha viaggiato attraverso la Città dei Mille Pianeti ?;Valeriano;Korben Dallas;Paul Safranek;Dottor Mann;Confirmé;Il film di Luc Besson è un adattamento gratuito dell'universo della serie di fumetti francese « Valérian et Laureline ».;
14;it;Quale disastroso film di fantascienza con Gerard Butler è uscito nel 2017 ?;« Geostrom »;« Machine Gun »;« Ultimate Game »;« Le Chantage »;Confirmé;L'uso improprio di un dispositivo armato potrebbe causare una geotempesta globale.;https://it.wikipedia.org/wiki/Geostorm
15;it;Quale film è un adattamento della serie letteraria di Veronica Roth ?;« Divergente »;« Collateral »;« Minority Report »;« Hunger Games »;Confirmé;Questa saga parla di coloro che rappresentano una minaccia per l'élite dominante di un paese non permettendo loro di controllarli.;https://it.wikipedia.org/wiki/Divergent (film)
16;it;Quale film parte dal postulato che utilizziamo solo il 10% delle capacità del cervello ?;« Lucy »;« Looper »;« Il Congresso »;« Riddick »;Confirmé;Alla fine del 2014, « Lucy » di Luc Besson è diventato il più grande successo del cinema francese all'estero con oltre 53 milioni di spettatori.;https://it.wikipedia.org/wiki/Lucy_(film_2014)
17;it;In quale stazione spaziale le cabine consentono la guarigione delle malattie ?;« Elysium »;« Europa »;« Gravity »;« Oblivion »;Confirmé;Il film di Neill Blomkamp ha riunito sugli schermi Matt Damon e Jodie Foster nel ruolo del Segretario alla Difesa.;https://it.wikipedia.org/wiki/Elysium_(film_2013)
18;it;In quale film le organizzazioni criminali viaggiano nel tempo ?;« Looper »;« Space Battleship »;« Source Code »;« Time Out »;Confirmé;Molti critici vedono in « Looper » un piccolo gioiello di anticipazione diretto da un giovane e dotato regista, Rian Johnson.;https://it.wikipedia.org/wiki/Looper
19;it;Quale film di J. J. Abrams rende omaggio al fantastico cinema di Spielberg ?;« Super 8 »;« Cloverfield »;« Armageddon »;« The Suburbans »;Confirmé;Coprodotto da Steven Spielberg, il film « Super 8 » è stato il film di apertura del Festival Internazionale del Film di Locarno nel 2011.;https://it.wikipedia.org/wiki/Super_8_(film)
20;it;In quale film un ladro si infiltra nel subconscio durante un sogno condiviso ?;« Inception »;« Monsters »;« Another Earth »;« Numero quattro »;Confirmé;Le case di produzione hanno stanziato un budget di 160 milioni di dollari, più 100 milioni destinati alla promozione del film.;https://it.wikipedia.org/wiki/Inception
21;it;Quale film di Shane Black è il quarto di un franchise iniziato nel 1987 ?;« The Predator »;« Iron Man 4 »;« L'Arme fatale »;« Pacific Rim »;Expert;Arnold Schwarzenegger ha confermato di essere stato in contatto con Shane Black per il ritorno del suo personaggio, il maggiore Dutch.;https://it.wikipedia.org/wiki/The_Predator_(film)
22;it;In quale film dodici astronavi aliene sono soprannominate gli scafi ?;« Primo contatto »;« Passengers »;« Cloverfield »;« God Particle »;Expert;L'esperta di linguistica comparata Louise Banks viene reclutata dall'esercito per stabilire un contatto e, soprattutto, per conoscerne gli obiettivi.;
23;it;In quale film con Tom Cruise i mimic organizzati invadono l'Europa ?;« Edge of Tomorrow »;« La mummia »;« Oblivion »;« Rock Forever »;Expert;Il tema di un personaggio che ricomincia una situazione è stato oggetto di diversi film, in particolare « Un jour sans fin ».;https://it.wikipedia.org/wiki/Edge_of_Tomorrow_-_Senza_domani
24;it;In quale film una squadra riesce a superare un wormhole apparso vicino a Saturno ?;« Interstellar »;« Upside Down »;« The Rover »;« Time Lapse »;Expert;Il film è basato sul lavoro del fisico americano Kip Thorne, che ha assicurato la verosimiglianza scientifica al film.;https://it.wikipedia.org/wiki/Interstellar
25;it;In quale film gli studenti si confrontano con NOMAD, un genio del computer ?;« The Signal »;« Gantz »;« Antiviral »;« Iron Sky »;Expert;Trovandosi nel mezzo di una zona isolata dove tutto diventa totalmente nero, scoprono di far parte di un complotto.;https://it.wikipedia.org/wiki/The_Signal_(film_2014)
26;it;In quale film l'acqua degli oceani viene pompata alle colonie di Titano ?;« Oblivion »;« Under the Skin »;« Upside Down »;« Snowpiercer »;Expert;Possiamo anche vedere in « Oblivion » un'ispirazione e un sorprendente omaggio al romanzo « Brave New World » di Aldous Huxley.;https://it.wikipedia.org/wiki/Oblivion_(film_2013)
27;it;Quale attore interpreta John Carter in un film di fantascienza con lo stesso nome ?;Taylor Kitsch;Willem Dafoe;Keanu Reeves;Bruce Willis;Expert;È un ampio adattamento del romanzo « A Princess of Mars » dell'autore americano Edgar Rice Burroughs, pubblicato nel 1917.;https://it.wikipedia.org/wiki/John_Carter_(film)
28;it;In quale film la boxe si è evoluta in uno sport high-tech ?;« Real Steel »;« Time Out »;« World Invasion »;« L'Agenzia »;Expert;The project was assigned to Shawn Levy in September 2009 and Hugh Jackman was hired for $9,000,000.;https://it.wikipedia.org/wiki/Real_Steel
29;it;In quale film Denzel Washington interpreta un monaco guerriero ?;« Il libro di Eli »;« Skyline »;« Repo Men »;« Eva »;Expert;Questo frenetico thriller futuristico, diretto da Albert e Allen Hughes, si colloca tra « Mad Max II » e « I Am Legend ».;https://it.wikipedia.org/wiki/Codice_Genesi
30;it;Quale film di fantascienza si riferisce a una famosa gomma da masticare sudafricana ?;« Chappie »;« Divergente »;« Sayonara »;« Mute »;Expert;Sul set di Johannesburg, Sharlto Copley ha realizzato il motion capture per il personaggio di Chappie.;https://it.wikipedia.org/wiki/Humandroid
1;nl;Welke sciencefictionfilm uit 2018 draait om een prehistorisch dier ?;« The Meg »;« The Discovery »;« Geostrom »;« Mute »;Débutant;Na de Noord-Amerikaanse release onttroonde de film « Mission impossible : Fallout », met een brutowinst van $ 45 miljoen in het eerste weekend.;https://nl.wikipedia.org/wiki/The_Meg
2;nl;Welke film volgt op de eerste « Blade Runner » geregisseerd door Ridley Scott ?;« Blade Runner 2049 »;« Equals »;« Labyrinthe »;« Zoe »;Débutant;De titel van de film werd onthuld in oktober 2016 en komt overeen met de datum van het verhaal dat zich dus dertig jaar na die van de eerste film afspeelt.;https://nl.wikipedia.org/wiki/Blade_Runner_2049
3;nl;In welke film is Matt Damon verkleind tot een mensenmaat van ongeveer 12 cm ?;« Downsizing »;« Paranoïa »;« Seul sur Mars »;« Interstellar »;Débutant;« Downsizing » (of « Small format ») is een Amerikaans sciencefictionkomedie-drama uit 2017, geregisseerd door Alexander Payne.;https://nl.wikipedia.org/wiki/Downsizing
4;nl;Welk vierde deel in de « Jurassic Park »-serie werd in 2015 uitgebracht ?;« Jurassic World »;« De verloren wereld »;« Pacific Rim »;« Regressie »;Débutant;Het verhaal van « Jurassic World » speelt zich tweeëntwintig jaar na de gebeurtenissen van « Jurassic Park » af, op hetzelfde eiland : Isla Nublar.;https://nl.wikipedia.org/wiki/Jurassic_World
5;nl;Welke acteur eindigde alleen op Mars in een Ridley Scott-film ?;Matt Damon;Gerard Butler;Bruce Willis;Tom Hanks;Débutant;De film is de verfilming van « Alone on Mars », de eerste roman van Andy Weir, die in 2011 als e-book werd gepubliceerd.;https://nl.wikipedia.org/wiki/The_Martian_(film)
