6;nl;In welke sciencefictionfilm moet Brad Pitt het opnemen tegen zombies ?;« World War Z »;« Fury »;« De strateeg »;« Megamind »;Débutant;De film verdiende $ 202 miljoen aan Amerikaanse inkomsten en $ 337 miljoen aan internationale inkomsten.;https://nl.wikipedia.org/wiki/World_War_Z
7;nl;Welke film met George Clooney en Sandra Bullock won zeven Oscars ?;« Gravity »;« Riddick »;« Pacific Rim »;« Europa Report »;Débutant;In juli 2010 gaf Scarlett Johansson een mondelinge overeenkomst om te schitteren in de film en co-ster Robert Downey Jr.;https://nl.wikipedia.org/wiki/Gravity_(film)
8;nl;Welke film was oorspronkelijk gepland als prequel op « Alien, the Eighth Passenger » ?;« Prometheus »;« De opstanding »;« Covenant »;« Requiem »;Débutant;Het scenario van « Prometheus » wijkt geleidelijk af van de sage « Alien », ook al is het hier sterk op geïnspireerd.;https://nl.wikipedia.org/wiki/Prometheus_(film)
9;nl;Welke Wachowski-film, uitgebracht in 2012, vertelt zes verschillende verhalen ?;« Cloud Atlas »;« Speed Racer »;« Bound »;« Matrix »;Débutant;De hoofdrolspelers van de film « Cloud Atlas » spelen tot zes rollen, één per tijdperk, verschillend in leeftijd, uiterlijk of geslacht.;https://nl.wikipedia.org/wiki/Cloud_Atlas
10;nl;In welke film speelt Josh Brolin een jonge Tommy Lee Jones ?;« Men in Black 3 »;« Line of Fire »;« Sicario »;« Sin City »;Débutant;Nicole Scherzinger verschijnt in deze derde film, evenals Lady Gaga, en maakt daar een kleine verschijning als buitenaards wezen.;https://nl.wikipedia.org/wiki/Men_in_Black_III
11;nl;Welke sciencefictionfilm bracht Emma Watson en Tom Hanks samen ?;« The Circle »;« Colonia »;« Regression »;« Noé »;Confirmé;Na een revolutionaire ervaring zal Emma Watson continu worden gefilmd door een SeeChange aangesloten minicamera.;https://nl.wikipedia.org/wiki/The_Circle_(2017)
12;nl;Wie regisseerde « Solo: A Star Wars Story », dat in 2018 op schermen verscheen ?;Ron Howard;Jon Turteltaub;Ridley Scott;Luc Besson;Confirmé;Derde film afgeleid van de franchise « Star Wars », het is de eerste film waarin de vertolker van Han Solo niet Harrison Ford is.;https://nl.wikipedia.org/wiki/Solo:_A_Star_Wars_Story
13;nl;Welke ruimte-tijdelijke agent reisde door de stad met duizend planeten ?;Valeriaan;Korben Dallas;Paul Safranek;Dokter Mann;Confirmé;De film van Luc Besson is een vrije bewerking van het universum van de Franse stripreeks « Valérian et Laureline ».;
14;nl;Welke rampzalige sciencefictionfilm met in de hoofdrol Gerard Butler werd uitgebracht in 2017 ?;« Geostrom »;« Machine Gun »;« Ultimate Game »;« Le Chantage »;Confirmé;Misbruik van een bewapend apparaat kan een wereldwijde geostorm veroorzaken.;https://nl.wikipedia.org/wiki/Geostorm
15;nl;Welke film is een bewerking van de literaire serie van Veronica Roth ?;« Divergente »;« Collateral »;« Minority Report »;« Hunger Games »;Confirmé;Deze saga gaat over degenen die een bedreiging vormen voor de heersende elite van een land door hen niet te laten controleren.;https://nl.wikipedia.org/wiki/Divergent (film)
16;nl;Welke film vertrekt vanuit de stelling dat we maar 10% van de hersencapaciteiten gebruiken ?;« Lucy »;« Looper »;« Het congres »;« Riddick »;Confirmé;Eind 2014 werd « Lucy » van Luc Besson het grootste succes van de Franse cinema in het buitenland met meer dan 53 miljoen opnames.;https://nl.wikipedia.org/wiki/Lucy_(film)
17;nl;In welk ruimtestation laten cabines de genezing van ziekten toe ?;« Elysium »;« Europa »;« Gravity »;« Oblivion »;Confirmé;De film van Neill Blomkamp bracht op de schermen Matt Damon en Jodie Foster samen in de rol van minister van Defensie.;https://nl.wikipedia.org/wiki/Elysium_(film)
18;nl;In welke film reizen de criminele organisaties door de tijd ?;« Looper »;« Space Battleship »;« Source Code »;« Time Out »;Confirmé;Veel critici zien in « Looper » een klein juweeltje van anticipatie, geregisseerd door een begaafde jonge filmmaker, Rian Johnson.;https://nl.wikipedia.org/wiki/Looper (film)
19;nl;Welke film van J.J. Abrams is een eerbetoon aan de fantastische cinema van Spielberg ?;« Super 8 »;« Cloverfield »;« Armageddon »;« The Suburbans »;Confirmé;De « Super 8 »-film, gecoproduceerd door Steven Spielberg, diende als openingsfilm op het Locarno International Film Festival in 2011.;https://nl.wikipedia.org/wiki/Super_8_(speelfilm)
20;nl;In welke film infiltreert een dief het onderbewustzijn tijdens een gedeelde droom ?;« Inception »;« Monsters »;« Another Earth »;« Nummer Vier »;Confirmé;De productiemaatschappijen kenden een budget van 160 miljoen dollar toe, plus 100 miljoen voor de promotie van de film.;https://nl.wikipedia.org/wiki/Inception
21;nl;Welke Shane Black-film is de vierde in een franchise die in 1987 begon ?;« The Predator »;« Iron Man 4 »;« L'Arme fatale »;« Pacific Rim »;Expert;Arnold Schwarzenegger heeft bevestigd dat hij contact heeft gehad met Shane Black over de terugkeer van zijn personage, Major Dutch.;https://nl.wikipedia.org/wiki/The_Predator_(film)
22;nl;In welke film worden twaalf buitenaardse ruimteschepen de rompen genoemd ?;« Eerste contact »;« Passengers »;« Cloverfield »;« God Particle »;Expert;De vergelijkende taalkundige Louise Banks wordt door het leger gerekruteerd om contact te leggen en vooral om hun doelen te kennen.;
23;nl;In welke film met Tom Cruise vallen georganiseerde mimics Europa binnen ?;« Edge of Tomorrow »;« De Mummie »;« Oblivion »;« Rock Forever »;Expert;Het thema van een personage dat opnieuw begint in een situatie is het onderwerp geweest van verschillende films, met name « Un jour sans fin ».;https://nl.wikipedia.org/wiki/Edge_of_Tomorrow
24;nl;In welke film komt een team door een wormgat dat in de buurt van Saturnus verscheen ?;« Interstellar »;« Upside Down »;« The Rover »;« Time Lapse »;Expert;De film is gebaseerd op het werk van de Amerikaanse natuurkundige Kip Thorne, die voor de wetenschappelijke waarheidsgetrouwheid van de film zorgde.;https://nl.wikipedia.org/wiki/Interstellar
25;nl;In welke film gaan studenten de confrontatie aan met NOMAD, een computergenie ?;« The Signal »;« Gantz »;« Antiviral »;« Iron Sky »;Expert;Ze bevinden zich midden in een afgelegen gebied waar alles totaal zwart wordt en ontdekken dat ze deel uitmaken van een samenzwering.;
26;nl;In welke film wordt water uit de oceanen naar de kolonies van Titan gepompt ?;« Oblivion »;« Under the Skin »;« Upside Down »;« Snowpiercer »;Expert;Ook zien we in « Oblivion » een inspiratie en een treffend eerbetoon aan de roman « Brave New World » van Aldous Huxley.;https://nl.wikipedia.org/wiki/Oblivion_(2013)
27;nl;Welke acteur speelt John Carter in een sciencefictionfilm met dezelfde naam ?;Taylor Kitsch;Willem Dafoe;Keanu Reeves;Bruce Willis;Expert;Het is een losse bewerking van de roman « A Princess of Mars » van de Amerikaanse auteur Edgar Rice Burroughs, gepubliceerd in 1917.;https://nl.wikipedia.org/wiki/John_Carter_(film)
28;nl;In welke film evolueerde boksen naar een hightech sport ?;« Real Steel »;« Time Out »;« World Invasion »;« Het Agentschap »;Expert;Het project werd toegewezen aan Shawn Levy in september 2009 en Hugh Jackman werd ingehuurd voor $ 9.000.000.;https://nl.wikipedia.org/wiki/Real_Steel
29;nl;In welke film speelt Denzel Washington een krijgermonnik ?;« Het boek van Eli »;« Skyline »;« Repo Men »;« Eva »;Expert;Deze snelle, futuristische thriller, geregisseerd door Albert en Allen Hughes, bevindt zich ergens tussen« Mad Max II » en « I Am Legend ».;https://nl.wikipedia.org/wiki/The_Book_of_Eli
30;nl;Welke sciencefictionfilm verwijst naar een beroemde Zuid-Afrikaanse kauwgom ?;« Chappie »;« Divergente »;« Sayonara »;« Mute »;Expert;Op de set in Johannesburg deed Sharlto Copley de motion capture voor het personage van Chappie.;https://nl.wikipedia.org/wiki/Chappie
