2;es;Aparte de los pies, ¿cuál es la forma más fácil de moverse con los esquís ?;En el hombro;Debajo del brazo;En la espalda;En la cabeza;Débutant;El conjunto de encuadernaciones, zapatos y ropa se benefician del espectacular aumento de los materiales durante sesenta años.;https://es.wikipedia.org/wiki/Esquí
3;es;Después de un día de esquí, ¿cuál es el ingrediente principal de la fondue de Saboya ?;Queso;Carne;Salchicha;Tocino;Débutant;La fondue de Saboya se ha convertido en una receta de cocina popular en Francia con el auge de los deportes de invierno y el turismo alpino.;
4;es;¿Qué otro nombre más familiar le damos al esquí que te lleva a la cima de las pistas ?;Glúteos;Lazo del brazo;Reposapiés;Rompecabezas;Débutant;El principio de la culata es pasar entre las piernas un dispositivo (pluma o carrete) generalmente terminado por una arandela.;https://es.wikipedia.org/wiki/Telesquí
5;es;¿Cuál de estos colores no permite conocer la dificultad de una pista de esquí ?;Malva;Verde;Azul;Rojo;Débutant;Sin embargo, ninguna norma define cómo se asignan los colores a las pistas de esquí, ya que la elección se deja a los operadores.;
6;es;¿Qué se necesita para usar elevadores mecánicos ?;Paquete;Huella;Bonnet;Satchel;Débutant;El precio a menudo incluye un paquete común que va desde un día hasta una semana en estaciones de esquí para esquí alpino.;https://es.wikipedia.org/wiki/Remonte_(esquí)
7;es;¿Qué te pondrás para una caminata sobre nieve blanda ?;Raquetas;Rodillos;Botas;Alpargatas;Débutant;La raqueta, fija debajo del zapato para caminar, aumenta la superficie de contacto con la nieve y, a menudo, permite que no se hunda.;https://es.wikipedia.org/wiki/Raquetas_de_nieve
8;es;Aparte de las protuberancias, ¿en qué tipo de nieve está el monoski ?;Polvo;Negro;En granos;Mojado;Débutant;El monoski todavía se practica a alto nivel en freeride y alta montaña y aún rivaliza con el esquí y el snowboard.;
9;es;¿Qué estamos haciendo en las pistas de esquí entre las 5 pm y las 9 am ?;Daños;Secado;Amarre;Rociado;Débutant;Un peluquero de nieve es un vehículo sobre orugas diseñado para mejorar la calidad de la nieve para la práctica de deportes de tabla.;https://es.wikipedia.org/wiki/Snowcat
10;es;¿Qué deporte se practica en el hielo con pesadas piedras de granito pulidas ?;Curling;Bobsleigh;Esqueleto;Luge;Débutant;El objetivo del rizado es colocar las piedras lo más cerca posible de un objetivo circular dibujado en el hielo, llamado la casa.;https://es.wikipedia.org/wiki/Curling
11;es;¿Qué nombre se le da a la parte ubicada en la parte delantera de una fijación de esquí ?;Meta;Tacón;Primavera;Télémark;Confirmé;La fijación es un componente capaz de resistir las repentinas sacudidas del esquí mientras se relaja en caso de caída.;https://es.wikipedia.org/wiki/Fijación_de_esquí
12;es;¿Qué mapas te permiten encontrarte en las montañas durante las caminatas ?;IGN;DKV;PMU;APK;Confirmé;El IGN fue creado por decreto en 1940 (firmado por Albert Lebrun y Philippe Painain) y sucedió al Servicio Geográfico del Ejército.;https://es.wikipedia.org/wiki/Instituto_Geográfico_Nacional_(Francia)
13;es;¿Por qué color brillante señalan su presencia las máquinas de aseo ?;Naranja;Verde;Azul;Malva;Confirmé;Los términos resurfacer y surfacer se refieren a los vehículos utilizados para volver a trabajar las superficies de hielo.;https://es.wikipedia.org/wiki/Snowcat
14;es;¿Cuál de estos quesos no es necesario para la creación de una fondue de Saboya ?;Roquefort;Emmental;Condado;Beaufort;Confirmé;Algunas variaciones de la receta permiten agregar una pequeña cantidad de alcohol de cereza (kirsch) para mejorar el sabor.;
15;es;¿Qué sustancia se usa para obtener un deslizamiento perfecto de sus esquís ?;Pedo;Jojoba;Cérumen;Parafina;Confirmé;En general, hay dos categorías principales de este recubrimiento específico: cera deslizante y retención de cera.;
16;es;¿Cuál es el porcentaje máximo de pendiente que puede tener una pista azul ?;25%;15%;35%;45%;Confirmé;Las pistas sin aplanar, llamadas Skiroute, son por su parte indicadas por un rombo generalmente de color rojo.;
17;es;¿Qué estación de esquí de Guillaume Tell hubiera apreciado especialmente ?;Les Arcs;La Plagne;Medley;Tignes;Confirmé;Las aldeas y pueblos de Les Arcs (Arc 1600, Arc 1800 y Arc 2000) son las llamadas estaciones integradas de tercera generación.;https://es.wikipedia.org/wiki/Les_Arcs_(estación_de_esquí)
18;es;¿Qué técnica se utiliza para subir una pendiente suave sin un levantamiento mecánico ?;Montado en pato;Montado en conejo;Montado en cebra;Montado en osos;Confirmé;Aunque están diseñados para levantar esquiadores en la montaña, los ascensores también se pueden usar cuesta abajo.;https://es.wikipedia.org/wiki/Remonte_(esquí)
19;es;¿En qué país se encuentra la popular estación de esquí de Innsbruck ?;Austria;Alemania;Suiza;Francia;Confirmé;Innsbruck tiene un nivel de vida muy alto, como el resto de los Alpes austriacos, con un PIB de 75,000 dólares por año y per cápita.;https://es.wikipedia.org/wiki/Innsbruck
20;es;¿Cuál es la forma característica del esquí cuesta abajo ?;En s;En t;En u;En v;Confirmé;Debido al peligro de la carrera cuesta abajo, los esquiadores deben entrenar varias veces en el campo antes de la carrera.;https://es.wikipedia.org/wiki/Descenso_(esquí)
21;es;¿Qué estación francesa es considerada la cuna del esquí nórdico ?;Autrans;Les Arcs;Isola 2000;Chamrousse;Expert;El esquí nórdico se refiere a varias disciplinas de esquí de inspiración escandinava relacionadas con las actividades nórdicas.;https://es.wikipedia.org/wiki/Esquí_nórdico
22;es;¿En qué país se puede utilizar la gran zona de esquí de Courmayeur ?;Italia;Francia;Suiza;Austria;Expert;La temporada de operaciones de invierno de Courmayeur generalmente comienza a principios de diciembre y termina a mediados de abril.;https://es.wikipedia.org/wiki/Courmayeur
23;es;¿Qué tipo de esquiador podemos ver a veces abordando ?;Teletransportador;Snowboarder;Freestyler;Rastreador;Expert;Esta es una de las técnicas de esquí más antiguas inventadas por un carpintero del condado de Telemark en Noruega, Sondre Norheim.;https://es.wikipedia.org/wiki/Telemark_(esquí)
24;es;En la nieve, ¿qué sensibilidad ISO es la más adecuada para la fotografía ?;100 ISO;ISO 200;400 ISO;800 ISO;Expert;En fotografía, la sensibilidad ISO es la medida de la sensibilidad a la luz de películas y sensores digitales.;https://es.wikipedia.org/wiki/Escala_de_sensibilidad_fotográfica
25;es;¿Cuántos niveles tiene la escala de avalancha ?;Cinco;Seis;Siete;Ocho;Expert;Los cinco niveles que componen el gráfico de escala son: muy débil, débil, medio, alto (XL) y excepcional (XXL).;https://es.wikipedia.org/wiki/Alud
26;es;¿En qué estación francesa se puede esquiar en una larga pista de 22 km ?;Alpe d'Huez;Chamrousse;Autrans;Grenoble;Expert;Alpe d'Huez tiene 135 senderos marcados que incluyen 42 verdes, 37 azules, 39 rojos y 17 negros, pero también 2 snowparks.;https://es.wikipedia.org/wiki/Alpe_d'Huez
27;es;¿Cuál es el nombre del espacio entre dos esquís colocados lado a lado ?;Cambre;Medio tubo;Tallo;Télémark;Expert;La comba varía mucho más el freeride o el esquí fuera de pista, disminuyendo el esquí alpino que se aproxima al esquí de montaña.;https://es.wikipedia.org/wiki/Esquí
28;es;¿Cuál es la diferencia entre un manipulador telescópico y una pinza fija ?;Velocidad;Color;Material;Comodidad;Expert;Un asiento suspendido en una abrazadera fija aún funciona a la misma velocidad, mientras que un asiento desacelerado está inactivo en la entrada de la estación.;https://es.wikipedia.org/wiki/Télésiège
29;es;¿En qué estación podemos ver Mont-Blanc por un lado y el Mediterráneo por el otro ?;Isola 2000;Les Arcs;Autrans;Chamrousse;Expert;Este complejo de deportes de invierno lleva su nombre debido a su altitud media, que es de unos 2 000 metros.;
30;es;¿Qué deporte de descenso se practica en una máquina equipada con un manillar ?;Snowscoot;Snowkite;Télémark;Velocidad de conducción;Expert;Este deporte de invierno, nacido en los años 90 e inspirado en el BMX, se practica deslizándose sobre la nieve con la ayuda de un manillar.;
1;it;Nello sci, qual è il livello di difficoltà associato a una pista verde ?;Facile;Medio;Difficile;Molto difficile;Débutant;I colori traccia vengono assegnati in base alla pendenza, alla lunghezza, alla larghezza e all'esposizione al sole e al vento.;https://it.wikipedia.org/wiki/Pista_sciistica
2;it;Oltre ai piedi, qual è il modo più semplice per spostarsi con gli sci ?;Sulla spalla;Sotto il braccio;Nella parte posteriore;Sulla testa;Débutant;Il set di rilegature, scarpe e vestiti beneficiano della spettacolare crescita dei materiali per sessant'anni.;https://it.wikipedia.org/wiki/Sci
3;it;Dopo una giornata di sci, qual è l'ingrediente principale della fonduta savoiarda ?;Formaggio;Carne;Salsiccia;Bacon;Débutant;La fonduta savoiarda è diventata una ricetta di cucina popolare in Francia con l'aumento degli sport invernali e del turismo alpino.;https://it.wikipedia.org/wiki/Fonduta_savoiarda
4;it;Quale altro nome, più familiare, a volte diamo allo sci che ti porta in cima alle piste ?;Natiche;Cravatta a braccia;Poggiapiedi;Puzzle;Débutant;Il principio del calcio è di passare tra le gambe un dispositivo (braccio o bobina) generalmente terminato da una rondella.;https://it.wikipedia.org/wiki/Skilift
5;it;Quale di questi colori non consente di conoscere la difficoltà di una pista da sci ?;Malva;Verde;Blu;Rosso;Débutant;Tuttavia, nessuno standard definisce come vengono assegnati i colori alle piste da sci, poiché la scelta è lasciata agli operatori.;https://it.wikipedia.org/wiki/Pista_sciistica
6;it;Cosa è necessario per utilizzare i sollevatori meccanici ?;Pacchetto;Impronta;Bonnet;Cartella;Débutant;Il prezzo include spesso un pacchetto comune che va da un giorno ad una settimana nelle stazioni sciistiche per lo sci alpino.;
7;it;Cosa indosserai per un'escursione sulla neve soffice ?;Racchette;Rulli;Stivali;Espadrillas;Débutant;La racchetta, fissata sotto la scarpa da camminata, aumenta la superficie di contatto con la neve e spesso consente di non affondare.;https://it.wikipedia.org/wiki/Racchette_da_neve
8;it;A parte i colpi, in che tipo di neve c'è il monosci ?;Polvere;Nero;In grani;Bagnato;Débutant;Il monosci è ancora praticato ad alto livello nel freeride e in alta montagna e continua a competere con lo sci e lo snowboard.;
9;it;Cosa stiamo facendo sulle piste da sci tra le 17:00 e le 9:00 ?;Danno;Essiccazione;Ormeggio;Spruzzatura;Débutant;Un battipista è un veicolo cingolato progettato per migliorare la qualità della neve per la pratica degli sport da tavola.;https://it.wikipedia.org/wiki/Gatto delle nevi
10;it;Che sport si pratica sul ghiaccio con pesanti pietre di granito levigato ?;Curling;Bob;Scheletro;Luge;Débutant;L'obiettivo del curling è di posizionare le pietre il più vicino possibile a un bersaglio circolare disegnato sul ghiaccio, chiamato casa.;https://it.wikipedia.org/wiki/Curling
11;it;Quale nome viene dato alla parte situata nella parte anteriore di una rilegatura da sci ?;Obiettivo;Heel;Primavera;Télémark;Confirmé;La rilegatura è un componente in grado di resistere alle improvvise sobbalzi dello sci e allo stesso tempo di rilassarsi in caso di caduta.;https://it.wikipedia.org/wiki/Attacco_(sci)
12;it;Quali mappe ti permettono di trovarti in montagna durante le escursioni ?;IGN;DKV;PMU;APK;Confirmé;L'IGN fu creato con decreto nel 1940 (firmato da Albert Lebrun e Philippe Pétain) e succedette al servizio geografico dell'esercito.;https://it.wikipedia.org/wiki/Institut_géographique_national_(Francia)
13;it;Con quale colore brillante le macchine governatrici segnalano la loro presenza ?;Arancione;Verde;Blu;Malva;Confirmé;I termini resurfacer e surfacer si riferiscono ai veicoli utilizzati per rielaborare le superfici ghiacciate.;https://it.wikipedia.org/wiki/Gatto delle nevi
14;it;Quale di questi formaggi non è necessario per la creazione di una fonduta savoiarda ?;Roquefort;Emmental;Contea;Beaufort;Confirmé;Alcune varianti della ricetta consentono l'aggiunta di una piccola quantità di alcol di ciliegio (kirsch) per migliorare il gusto.;https://it.wikipedia.org/wiki/Fonduta_savoiarda
15;it;Quale sostanza viene utilizzata per ottenere una perfetta planata dei suoi sci ?;Scoreggia;Jojoba;Cérumen;Paraffina;Confirmé;Complessivamente, ci sono due categorie principali di questo rivestimento specifico: cera per glide e cera trattenere.;https://it.wikipedia.org/wiki/Sciolina
16;it;Qual è la percentuale di pendenza massima che può avere una traccia blu ?;25%;15%;35%;45%;Confirmé;I brani non decorati, chiamati Skiroute, sono per la loro parte indicati da un rombo generalmente di colore rosso.;https://it.wikipedia.org/wiki/Pista_sciistica
17;it;Quale stazione sciistica di Guillaume Tell avrebbe particolarmente apprezzato ?;Les Arcs;La Plagne;Medley;Tignes;Confirmé;I villaggi-villaggi di Les Arcs (Arc 1600, Arc 1800 e Arc 2000) sono le cosiddette stazioni integrate di terza generazione.;https://it.wikipedia.org/wiki/Les_Arcs
18;it;Quale tecnica viene utilizzata per scalare un pendio senza un sollevamento meccanico ?;Montato in anatra;Montato in coniglio;Montato in zebra;Montato negli orsi;Confirmé;Sebbene sia progettato per sollevare gli sciatori sulla montagna, gli ascensori possono essere utilizzati anche in discesa.;
19;it;In quale paese si trova la famosa località sciistica di Innsbruck ?;Austria;Germania;Svizzera;Francia;Confirmé;Innsbruck ha uno standard di vita molto elevato, come il resto delle Alpi austriache, con un PIL di 75.;https://it.wikipedia.org/wiki/Innsbruck
20;it;Qual è la forma caratteristica dello sci in discesa ?;In S;In T;In U;In V;Confirmé;A causa del pericolo della discesa, gli sciatori devono allenarsi più volte sul percorso prima della gara.;https://it.wikipedia.org/wiki/Discesa_libera
21;it;Quale stazione francese è considerata la culla dello sci nordico ?;Autrans;Les Arcs;Isola 2000;Chamrousse;Expert;Lo sci nordico si riferisce a diverse discipline sciistiche di ispirazione scandinava legate alle attività nordiche.;https://it.wikipedia.org/wiki/Sci_nordico
22;it;In quale paese è possibile utilizzare l'ampio comprensorio sciistico di Courmayeur ?;Italia;Francia;Svizzera;Austria;Expert;La stagione operativa invernale di Courmayeur inizia generalmente all'inizio di dicembre e termina a metà aprile.;https://it.wikipedia.org/wiki/Courmayeur
23;it;Che tipo di sciatore possiamo a volte vedere affrontare ?;Teleporter;Snowboarder;Freestyler;Tracker;Expert;Questa è una delle più antiche tecniche di sci inventate da un falegname della contea di Telemark in Norvegia, Sondre Norheim.;https://it.wikipedia.org/wiki/Telemark_(sci)
24;it;Sulla neve, quale sensibilità ISO è più adatta per la fotografia ?;100 ISO;ISO 200;400 ISO;800 ISO;Expert;Nella fotografia, la sensibilità ISO è la misura della sensibilità alla luce di film e sensori digitali.;https://it.wikipedia.org/wiki/Velocità_della_pellicola
25;it;Quanti livelli ha la scala da valanga ?;Cinque;Sei;Sette;Otto;Expert;I cinque livelli che compongono la scala sono: molto debole, debole, medio, alto (XL) ed eccezionale (XXL).;https://it.wikipedia.org/wiki/Valanga
26;it;In quale stazione francese puoi sciare su una lunga pista di 22 km ?;Alpe d'Huez;Chamrousse;Autrans;Grenoble;Expert;Alpe d'Huez ha 135 percorsi segnati di cui 42 verdi, 37 blu, 39 rossi e 17 neri, ma anche 2 snowpark.;https://it.wikipedia.org/wiki/Alpe_d'Huez
27;it;Qual è il nome dello spazio tra due sci affiancati ?;Cambre;Half-pipe;Stelo;Télémark;Expert;Il camber varia molto più freeride o fuori pista, declinando lo sci alpino che si avvicina allo scialpinismo.;https://it.wikipedia.org/wiki/Sci
28;it;Qual è la differenza tra un sollevatore telescopico e una pinza fissa ?;Velocità;Colore;Materiale;Comfort;Expert;Un sedile sospeso su un morsetto fisso funziona ancora alla stessa velocità, mentre un sedile in decelerazione è inattivo all'ingresso della stazione.;https://it.wikipedia.org/wiki/Télésiège
29;it;In quale stazione possiamo vedere il Monte Bianco da un lato e il Mediterraneo dall'altro ?;Isola 2000;Les Arcs;Autrans;Chamrousse;Expert;Questa stazione di sport invernali prende il nome dalla sua altitudine media di circa 2 000 metri.;https://it.wikipedia.org/wiki/Isola_2000
30;it;Che sport in discesa si pratica su una macchina equipaggiata con un manubrio ?;Snowscoot;Snowkite;Télémark;Guida veloce;Expert;Questo sport invernale, nato negli anni '90 e ispirato alla BMX, viene praticato scivolando sulla neve con l'aiuto di un manubrio.;
1;nl;Wat is de moeilijkheidsgraad van skiën in het skiën ?;Eenvoudig;Medium;Moeilijk;Heel moeilijk;Débutant;Trackkleuren worden toegewezen op basis van helling, lengte, breedte en blootstelling aan zon en wind.;https://nl.wikipedia.org/wiki/Skipiste
2;nl;Wat is, naast de voeten, de gemakkelijkste manier om met ski's te bewegen ?;Op de schouder;Onder de arm;Aan de achterkant;Op het hoofd;Débutant;De set bindingen, schoenen en kleding profiteren al zestig jaar van de spectaculaire opkomst van materialen.;https://nl.wikipedia.org/wiki/Skiën
3;nl;Na een dag skiën, wat is het belangrijkste ingrediënt van fondue uit de Savoie ?;Kaas;Vlees;Worst;Bacon;Débutant;De fondue van Savoie is een populair kookrecept in Frankrijk geworden met de opkomst van wintersport en alpine toerisme.;
4;nl;Welke andere, meer bekende naam geven we soms aan de ski die je naar de top van de hellingen brengt ?;Billen;Wapening;Voetensteun;Puzzel;Débutant;Het principe van de kolf is om tussen de benen een inrichting (giek of haspel) door te laten die in het algemeen wordt afgesloten door een wasmachine.;
5;nl;Welke van deze kleuren laat niet toe de moeilijkheidsgraad van een skipiste te kennen ?;Mauve;Groen;Blauw;Rood;Débutant;Geen enkele standaard definieert hoe kleuren worden toegewezen aan skihellingen, omdat de keuze aan de exploitanten wordt overgelaten.;https://nl.wikipedia.org/wiki/Skipiste
6;nl;Wat is nodig om mechanische liften te gebruiken ?;Pakket;Voetafdruk;Bonnet;Satchel;Débutant;De prijs omvat vaak een gemeenschappelijk pakket dat varieert van één dag tot één week in skiresorts voor alpineskiën.;https://nl.wikipedia.org/wiki/Skilift
7;nl;Wat ga je dragen voor een wandeling op zachte sneeuw ?;Rackets;Rollers;Laarzen;Espadrilles;Débutant;Het racket, bevestigd onder de loopschoen, vergroot het contactoppervlak met de sneeuw en laat vaak niet wegzakken.;https://nl.wikipedia.org/wiki/Sneeuwschoen
8;nl;Afgezien van hobbels, in wat voor soort sneeuw is de monoski ?;Poeder;Zwart;In granen;Nat;Débutant;De monoski wordt nog steeds op hoog niveau beoefend in freeride en hoge bergen en nog steeds rivalen skiën en snowboarden.;https://nl.wikipedia.org/wiki/Monoski
9;nl;Wat doen we op de skihellingen tussen 17.00 en 9.00 uur ?;Schade;Drogen;Ligplaats;Beregening;Débutant;Een sneeuwgroommachine is een rupsvoertuig dat is ontworpen om de kwaliteit van sneeuw te verbeteren voor het beoefenen van boardsporten.;
10;nl;Welke sport wordt er beoefend op het ijs met zwaar gepolijste granieten stenen ?;Curling;Bobslee;Skelet;Luge;Débutant;Het doel van curling is om de stenen zo dicht mogelijk bij een rond doelwit te plaatsen dat op het ijs is getekend, het huis genoemd.;https://nl.wikipedia.org/wiki/Curling
11;nl;Welke naam wordt gegeven aan het onderdeel aan de voorkant van een skibinding ?;Doel;Heel;Lente;Télémark;Confirmé;De binding is een onderdeel dat bestand is tegen de plotselinge schokken van de ski en tegelijkertijd kan ontspannen in geval van val.;
12;nl;Met welke kaarten kun je tijdens een wandeling jezelf in de bergen vinden ?;IGN;DKV;PMU;APK;Confirmé;De IGN werd gecreëerd bij decreet in 1940 (ondertekend door Albert Lebrun en Philippe Pétain) en is geslaagd voor de Geografische Dienst van het Leger.;
13;nl;Door welke heldere kleur signaleren de verzorgingsmachines hun aanwezigheid ?;Oranje;Groen;Blauw;Mauve;Confirmé;De termen resurfacer en surfacer verwijzen naar de voertuigen die worden gebruikt om de ijsoppervlakken opnieuw te bewerken.;
14;nl;Welke van deze kazen is niet nodig om een fondue van de Savoie te maken ?;Roquefort;Emmental;Comté;Beaufort;Confirmé;Sommige variaties van het recept maken toevoeging van een kleine hoeveelheid kersenalcohol (kirsch) mogelijk om de smaak te verbeteren.;
15;nl;Welke stof wordt gebruikt om een perfecte glijvlucht van zijn ski's te krijgen ?;Scheet;Jojoba;Cérumen;Paraffine;Confirmé;Over het algemeen zijn er twee hoofdcategorieën van deze specifieke coating: glijwas en waxbehuizing.;https://nl.wikipedia.org/wiki/Waxen (ski)
16;nl;Wat is het maximale hellingspercentage dat een blauwe track kan hebben ?;25%;15%;35%;45%;Confirmé;De niet-verzorgde nummers, Skiroute genaamd, zijn van hun kant aangegeven met een ruit in het algemeen van rode kleur.;https://nl.wikipedia.org/wiki/Skipiste
17;nl;Welk wintersportdorp Guillaume Tell zou bijzonder op prijs gesteld zijn ?;Les Arcs;La Plagne;Medley;Tignes;Confirmé;De dorpen-dorpen van Les Arcs (Arc 1600, Arc 1800 en Arc 2000) zijn zogenaamde derde generatie geïntegreerde stations.;https://nl.wikipedia.org/wiki/Les_Arcs_(Savoie)
18;nl;Welke techniek wordt gebruikt om zonder lift een zachte helling te beklimmen ?;Gemonteerd in eend;Gemonteerd in konijn;Gemonteerd in zebra;Gemonteerd in beren;Confirmé;Hoewel ze ontworpen zijn om skiërs de berg op te hijsen, kunnen liften ook heuvelafwaarts worden gebruikt.;https://nl.wikipedia.org/wiki/Skilift
19;nl;In welk land ligt het populaire skioord Innsbruck ?;Oostenrijk;Duitsland;Zwitserland;Frankrijk;Confirmé;Innsbruck heeft een zeer hoge levensstandaard, net als de rest van de Oostenrijkse Alpen, met een BNP van 75.;https://nl.wikipedia.org/wiki/Innsbruck
20;nl;Wat is de karakteristieke vorm van ski downhill ?;In S;In T;In U;In V;Confirmé;Vanwege het gevaar van de afdaling moeten skiërs verschillende keren trainen op de baan vóór de race.;https://nl.wikipedia.org/wiki/Afdaling
21;nl;Welk Frans station wordt beschouwd als de bakermat van langlaufen ?;Autrans;Les Arcs;Isola 2000;Chamrousse;Expert;Langlaufen verwijst naar verschillende Scandinavisch geïnspireerde skidisciplines met betrekking tot Noordse activiteiten.;https://nl.wikipedia.org/wiki/Noords_skiën
22;nl;In welk land kunt u het grote skigebied Courmayeur gebruiken ?;Italië;Frankrijk;Zwitserland;Oostenrijk;Expert;Het winterbedrijf van Courmayeur begint over het algemeen begin december en eindigt medio april.;https://nl.wikipedia.org/wiki/Courmayeur
23;nl;Wat voor type skiër kunnen we soms zien aan het draaien van genuflexie ?;Teleporter;Snowboarder;Freestyler;Tracker;Expert;Dit is een van de oudste skitechnieken die is uitgevonden door een timmerman uit de provincie Telemark in Noorwegen, Sondre Norheim.;https://nl.wikipedia.org/wiki/Telemarken_(skiën)
24;nl;Op sneeuw, welke gevoeligheid is ISO het meest geschikt voor fotografie ?;100 ISO;ISO 200;400 ISO;800 ISO;Expert;In fotografie is ISO-gevoeligheid de maat van de lichtgevoeligheid van films en digitale sensoren.;https://nl.wikipedia.org/wiki/Filmgevoeligheid
25;nl;Hoeveel niveaus heeft de lawineschaal ?;Vijf;Zes;Seven;Acht;Expert;De vijf niveaus waaruit de schaalgrafiek bestaat, zijn: erg zwak, zwak, gemiddeld, hoog (XL) en uitzonderlijk (XXL).;https://nl.wikipedia.org/wiki/Lawine
26;nl;In welk Frans oord kan je skiën op een lang pad van 22 km ?;Alpe d'Huez;Chamrousse;Autrans;Grenoble;Expert;Alpe d'Huez heeft 135 gemarkeerde routes, waaronder 42 groene, 37 blauwe, 39 rode en 17 zwarte, maar ook 2 snowparks.;https://nl.wikipedia.org/wiki/Alpe_d'Huez
27;nl;Wat is de naam van de ruimte tussen twee naast elkaar geplaatste ski's ?;Cambre;Halve pijp;Steel;Télémark;Expert;De camber varieert veel meer freeride of off-piste skiën, dalende alpine skiën naderen van de skitochten.;https://nl.wikipedia.org/wiki/Skiën
28;nl;Wat is het verschil tussen een verreiker en een vaste grijper ?;Snelheid;Kleur;Materiaal;Comfort;Expert;Een stoel opgehangen aan een vaste klem draait nog steeds met dezelfde snelheid, terwijl een vertragende stoel stationair draait bij de ingang van het station.;https://nl.wikipedia.org/wiki/Télésiège
29;nl;In welk station kunnen we de Mont-Blanc aan de ene kant en de Middellandse Zee aan de andere kant zien ?;Isola 2000;Les Arcs;Autrans;Chamrousse;Expert;Dit wintersportresort is genoemd vanwege zijn gemiddelde hoogte van ongeveer 2 000 meter.;
30;nl;Welke afdalingssport wordt beoefend op een machine die is uitgerust met een stuur ?;Snowscoot;Snowkite;Télémark;Snel rijden;Expert;Deze wintersport, geboren in de jaren 1990 en geïnspireerd door BMX, wordt beoefend door in de sneeuw te glijden met behulp van een stuur.;
