1;fr;À quel département Bernadette et Jacques Chirac étaient-ils fortement liés ?;Corrèze;Vosges;Pas-de-Calais;Landes;Débutant;Située à l'ouest du Massif central, la Corrèze se compose de la Montagne, des plateaux et du bassin de Brive.;https://fr.wikipedia.org/wiki/Corrèze_(département)
2;fr;Dans quel département Versailles s'est-elle développée autour de son château ?;Yvelines;Charente;Gard;Aisne;Débutant;Le château de Versailles accueille le Parlement lorsqu'il se réunit en Congrès pour adopter une révision de la Constitution.;https://fr.wikipedia.org/wiki/Yvelines
3;fr;Comment sont nommés les habitants du département de l'Hérault ?;Héraultais;Gard;Morbihan;Savoie;Débutant;Georges Brassens (Sète), Boby Lapointe (Pézenas), Émilie Simon (Montpellier), Juliette Gréco (Montpellier) étaient héraultais.;https://fr.wikipedia.org/wiki/Hérault_(département)
4;fr;Quel département français regroupe l'Artois et une partie de l'ancienne Picardie ?;Pas-de-Calais;Calvados;Aisne;Nord;Débutant;Bien que réunis, ces deux territoires restent encore aujourd'hui assez différents culturellement et économiquement.;https://fr.wikipedia.org/wiki/Pas-de-Calais
5;fr;Quel deuxième aéroport de France se situe dans le département de l'Essone ?;Paris-Orly;Jura;Gironde;Creuse;Débutant;Plaque tournante importante du transport aérien, l'aéroport brasse un trafic d'environ 30 millions de passagers chaque année.;https://fr.wikipedia.org/wiki/Essonne_(département)
6;fr;Quel département tient son nom de la rivière localement appelée le Gardon ?;Gard;Morbihan;Charente;Vaucluse;Débutant;La rivière, navigable en canoë-kayak sur environ 70 km, est franchie par le pont du Gard, pont-aqueduc romain du Ier siècle.;https://fr.wikipedia.org/wiki/Gard
7;fr;Quel département de Bretagne a pour préfecture la ville de Vannes ?;Morbihan;Ille-et-Vilaine;Finistère;Côtes-d'Armor;Débutant;Il correspond pour l'essentiel au royaume, devenu comté puis baillie de Broërec et plus anciennement à la cité des Vénètes.;https://fr.wikipedia.org/wiki/Morbihan
8;fr;Lequel de ces départements a un nom provenant des deux rivières le traversant ?;Loir-et-Cher;Puy-de-Dôme;Pas-de-Calais;Charente-Maritime;Débutant;Le département de Loir-et-Cher est connu en France notamment grâce à la chanson de Michel Delpech écrite en 1977.;https://fr.wikipedia.org/wiki/Loir-et-Cher
9;fr;Quel département est géographiquement situé le plus à l'ouest de la France ?;Finistère;Lozère;Pas-de-Calais;Dordogne;Débutant;Premier département côtier de France, le Finistère compte 117 communes littorales sur 282 et près d'un quart du littoral français.;https://fr.wikipedia.org/wiki/Finistère
10;fr;Dans quel département mange-t-on le potjevleesch, le waterzooi et le welsh ?;Nord;Deux-Sèvres;Lozère;Finistère;Débutant;Plusieurs chansons parlent du Nord, l'une des plus connues est probablement « Les Corons » de Pierre Bachelet.;https://fr.wikipedia.org/wiki/Nord_(département_français)
11;fr;Dans quel département êtes-vous en vous promenant sur le vieux bassin d'Honfleur ?;Calvados;Deux-Sèvres;Yvelines;Finistère;Confirmé;Ses étroites maisons en ardoises se reflétant dans le bassin en font la principale attraction touristique d'Honfleur.;https://fr.wikipedia.org/wiki/Calvados_(département)
12;fr;Dans quel département l'agglomération d'Épinal dépasse-t-elle les 40 000 habitants ?;Vosges;Gironde;Aude;Jura;Confirmé;Connue d'abord pour son imagerie, fondée en 1796 par Pellerin, la ville l'est également pour son château et sa basilique.;https://fr.wikipedia.org/wiki/Vosges_(département)
13;fr;Quel est le troisième département forestier de France avec 418 000 hectares ?;Dordogne;Creuse;Vosges;Sarthe;Confirmé;On y trouve Feuillus, conifères, prairies, collines, vallons, vallées, vignes, truffières, falaises, cours d'eau, gorges et grottes.;https://fr.wikipedia.org/wiki/Dordogne_(département)
14;fr;Quel est le plus vaste département de France métropolitaine ?;Gironde;Aude;Savoie;Yvelines;Confirmé;Long de 75 kilomètres et large de 12 kilomètres à son embouchure, l'estuaire de la Gironde est le plus grand estuaire d'Europe.;https://fr.wikipedia.org/wiki/Gironde_(département)
15;fr;De quel département François Fillon a-t-il été député et sénateur ?;Sarthe;Manche;Finistère;Lozère;Confirmé;Sa campagne fut mise en question par des révélations de la presse, puis des poursuites l'impliquant avec son épouse, Penelope.;https://fr.wikipedia.org/wiki/Sarthe_(département)
16;fr;Dans quel département pouvez-vous assister aux 24 Heures du Mans ?;Sarthe;Moselle;Corrèze;Charente;Confirmé;La compétition, initiée en 1923 et se déroulant chaque année au mois de juin, attire un peu plus de 240 000 spectateurs.;https://fr.wikipedia.org/wiki/Sarthe_(département)
17;fr;Quel département est réputé pour ses vins blancs dont son cépage Savagnin ?;Jura;Yvelines;Nord;Corrèze;Confirmé;On trouve également dans le Jura des vins singuliers comme les vins liquoreux que sont le macvin ou le vin de paille.;https://fr.wikipedia.org/wiki/Jura_(département)
18;fr;Quel département français est frontalier avec le Luxembourg et l'Allemagne ?;Moselle;Savoie;Manche;Gironde;Confirmé;Au niveau européen, la Moselle fait partie de la Grande Région et de l'Eurodistrict SaarMoselle (pour une partie du département).;https://fr.wikipedia.org/wiki/Moselle_(département)
19;fr;Quel département ayant pour code 73 est le plus montagneux de France ?;Savoie;Loir-et-Cher;Creuse;Calvados;Confirmé;La grande majorité des massifs de la Savoie sont des massifs alpins, auxquels s'ajoute la partie la plus méridionale du Jura.;https://fr.wikipedia.org/wiki/Savoie_(département)
20;fr;Dans quel département français est situé le mont Ventoux ?;Vaucluse;Gard;Lozère;Aude;Confirmé;Surnommé le mont Chauve, le mont Ventoux est le point culminant des monts de Vaucluse et le plus haut sommet de Vaucluse.;https://fr.wikipedia.org/wiki/Vaucluse_(département)
21;fr;Quel département français a pour emblème un escargot avec des ailes ?;Charente;Dordogne;Vaucluse;Manche;Expert;Le département tire son nom du fleuve qui, à l'époque gallo-romaine, était connu sous le nom grec de Kanentelos.;https://fr.wikipedia.org/wiki/Charente_(département)
22;fr;De quel département Cherbourg-en-Cotentin est-elle le principal pôle culturel ?;Manche;Sarthe;Calvados;Loir-et-Cher;Expert;Le chanteur Allain Leprest, originaire de Lestre, est resté fidèle à son département et à sa mer d'origine qu'il a chantés.;https://fr.wikipedia.org/wiki/Manche_(département)
23;fr;Dans quel département fête-t-on le carnaval de Limoux durant plus de dix semaines ?;Aude;Corrèze;Moselle;Deux-Sèvres;Expert;Se déroulant dans la ville de Limoux, sur la place de la République, c'est l'un des plus longs carnavals du monde.;https://fr.wikipedia.org/wiki/Aude_(département)
24;fr;Dans quelle ville de la Somme trouve-t-on la Tour Perret et la maison de Jules Verne ?;Amiens;Vaucluse;Jura;Gard;Expert;On distingue deux grandes zones riches en sites touristiques : la côte picarde et Abbeville, l'Amiénois et la Haute Somme.;https://fr.wikipedia.org/wiki/Somme_(département)
25;fr;Quel est le deuxième département le moins peuplé de France après la Lozère ?;Creuse;Pas-de-Calais;Dordogne;Vosges;Expert;La Creuse est limitrophe des départements de la Corrèze, de la Haute-Vienne, de l'Allier, du Puy-de-Dôme, du Cher et de l'Indre.;https://fr.wikipedia.org/wiki/Creuse_(département)
26;fr;Quel département français est surnommé le département des sources ?;Lozère;Vosges;Sarthe;Morbihan;Expert;C'est le seul département français métropolitain dans lequel toutes les rivières qui s'écoulent prennent également leur source.;https://fr.wikipedia.org/wiki/Lozère_(département)
27;fr;Quel barrage est situé sur la Truyère, dans le département du Cantal ?;Grandval;Pareloup;Maury;Tignes;Expert;La scène du contrôle de la Feldgendarmerie sur le barrage du film « La Grande Vadrouille » y a été tournée en 1966.;https://fr.wikipedia.org/wiki/Cantal_(département)
28;fr;Dans quel département la ville de Niort compte-t-elle plus de 50 000 habitants ?;Deux-Sèvres;Nord;Landes;Moselle;Expert;Comparé à la densité de la France métropolitaine, le département des Deux-Sèvres apparaît comme moyennement peuplé.;https://fr.wikipedia.org/wiki/Deux-Sèvres
29;fr;Dans quel département les habitants sont-ils appelés les Axonais ?;Aisne;Ain;Allier;Ariège;Expert;L'Aisne a perdu un peu de sa population dans la seconde moitié du XIXe siècle, en raison de l'exode rural, pourtant limité.;https://fr.wikipedia.org/wiki/Aisne_(département)
30;fr;Dans quel département la renommée des conditions de surf est-elle mondiale ?;Landes;Manche;Moselle;Gironde;Expert;Les Landes sont également réputées culinairement au travers du foie gras, des magrets, des poulets et des vins AOC Tursan.;https://fr.wikipedia.org/wiki/Landes_(département)
1;en;To which department are Bernadette and Jacques Chirac strongly linked ?;Correze;Vosges;Pas-de-Calais;Landes;Débutant;Located to the west of the Massif Central, Corrèze is made up of the Mountain, the plateaus and the Brive basin.;
2;en;In which department did Versailles develop around its castle ?;Yvelines;Charente;Gard;aisne;Débutant;The Palace of Versailles welcomes the Parliament when it meets in Congress to adopt a revision of the Constitution.;https://en.wikipedia.org/wiki/Yvelines
3;en;What are the inhabitants of the department of Hérault called ?;Hérault people;Gard;Morbihan;Savoy;Débutant;Georges Brassens (Sète), Boby Lapointe (Pézenas), Émilie Simon (Montpellier), Juliette Gréco (Montpellier) were from Hérault.;
4;en;Which French department brings together Artois and part of the former Picardy ?;Pas-de-Calais;calvados;aisne;North;Débutant;Although united, these two territories are still today quite different culturally and economically.;https://en.wikipedia.org/wiki/Pas-de-Calais
5;en;Which second airport in France is located in the Essone department ?;Paris-Orly;Jura;Gironde;Hollow;Débutant;A major air transport hub, the airport handles approximately 30 million passengers each year.;
6;en;Which department takes its name from the river locally called the Gardon ?;Gard;Morbihan;Charente;Vaucluse;Débutant;The river, navigable by canoe-kayak for about 70 km, is crossed by the Pont du Gard, a Roman aqueduct from the 1st century.;https://en.wikipedia.org/wiki/Gard
7;en;Which department of Brittany has the city of Vannes as its prefecture ?;Morbihan;Ille-et-Vilaine;Finistere;Côtes-d'Armor;Débutant;It essentially corresponds to the kingdom, which became county then bailiff of Broërec and more formerly to the city of Vénètes.;https://en.wikipedia.org/wiki/Morbihan
8;en;Which of these departments has a name coming from the two rivers crossing it ?;Loire-et-Cher;Puy-de-Dome;Pas-de-Calais;Charente Maritime;Débutant;The department of Loir-et-Cher is known in France in particular thanks to the song by Michel Delpech written in 1977.;https://en.wikipedia.org/wiki/Loir-et-Cher
9;en;Which department is geographically the most westerly in France ?;Finistere;Lozere;Pas-de-Calais;Dordogne;Débutant;First coastal department of France, Finistère has 117 coastal municipalities out of 282 and nearly a quarter of the French coast.;
10;en;In which department do we eat potjevleesch, waterzooi and welsh ?;North;Two-Sevres;Lozere;Finistere;Débutant;Several songs are about the North, one of the best known is probably « Les Corons » by Pierre Bachelet.;
11;en;In which department are you walking on the old basin of Honfleur ?;calvados;Two-Sevres;Yvelines;Finistere;Confirmé;Its narrow slate houses reflected in the basin make it the main tourist attraction of Honfleur.;
12;en;In which department does the agglomeration of Épinal exceed 40,000 inhabitants ?;Vosges;Gironde;aude;Jura;Confirmé;First known for its imagery, founded in 1796 by Pellerin, the city is also known for its castle and its basilica.;
13;en;What is the third largest forest department in France with 418,000 hectares ?;Dordogne;Hollow;Vosges;Sarthe;Confirmé;There are leafy trees, conifers, meadows, hills, valleys, vineyards, truffle fields, cliffs, streams, gorges and caves.;
14;en;What is the largest department in metropolitan France ?;Gironde;aude;Savoy;Yvelines;Confirmé;75 kilometers long and 12 kilometers wide at its mouth, the Gironde estuary is the largest estuary in Europe.;
15;en;From which department was François Fillon a deputy and senator ?;Sarthe;Channel;Finistere;Lozere;Confirmé;His campaign was challenged by press revelations and later lawsuits implicating him and his wife, Penelope.;
16;en;In which department can you attend the 24 Hours of Le Mans ?;Sarthe;Mosel;Correze;Charente;Confirmé;The competition, initiated in 1923 and taking place every year in June, attracts just over 240,000 spectators.;
17;en;What department is famous for its white wines including its Savagnin grape variety ?;Jura;Yvelines;North;Correze;Confirmé;There are also unique wines in the Jura such as sweet wines such as macvin or straw wine.;
18;en;Which French department borders Luxembourg and Germany ?;Mosel;Savoy;Channel;Gironde;Confirmé;At European level, the Moselle is part of the Greater Region and the Eurodistrict SaarMoselle (for part of the department).;
19;en;Which department with code 73 is the most mountainous in France ?;Savoy;Loire-et-Cher;Hollow;calvados;Confirmé;The vast majority of the massifs of Savoie are alpine massifs, to which is added the southernmost part of the Jura.;
20;en;In which French department is Mont Ventoux located ?;Vaucluse;Gard;Lozere;aude;Confirmé;Nicknamed Mont Chauve, Mont Ventoux is the highest point of the Monts de Vaucluse and the highest peak in Vaucluse.;
21;en;Which French department has a snail with wings as its emblem ?;Charente;Dordogne;Vaucluse;Channel;Expert;The department takes its name from the river which, in Gallo-Roman times, was known by the Greek name of Kanentelos.;
22;en;Which department is Cherbourg-en-Cotentin the main cultural center of ?;Channel;Sarthe;calvados;Loire-et-Cher;Expert;The singer Allain Leprest, originally from Lestre, remained faithful to his department and his sea of origin which he sang.;
23;en;In which department is the carnival of Limoux celebrated for more than ten weeks ?;aude;Correze;Mosel;Two-Sevres;Expert;Taking place in the city of Limoux, on the Place de la République, it is one of the longest carnivals in the world.;
24;en;In which city of the Somme do we find the Perret Tower and the house of Jules Verne ?;amiens;Vaucluse;Jura;Gard;Expert;There are two major areas rich in tourist sites : the Picardy coast and Abbeville, the Amiens and the Haute Somme.;
25;en;What is the second least populated department in France after Lozère ?;Hollow;Pas-de-Calais;Dordogne;Vosges;Expert;La Creuse borders the departments of Corrèze, Haute-Vienne, Allier, Puy-de-Dôme, Cher and Indre.;
26;en;Which French department is nicknamed the department of sources ?;Lozere;Vosges;Sarthe;Morbihan;Expert;It is the only metropolitan French department in which all the rivers that flow also have their source.;
27;en;Which dam is located on the Truyère, in the Cantal department ?;grandval;Pareloup;Maury;Tignes;Expert;The scene of the Feldgendarmerie checking the dam from the film « La Grande Vadrouille » was filmed there in 1966.;
28;en;In which department does the city of Niort have more than 50,000 inhabitants ?;Two-Sevres;North;Landes;Mosel;Expert;Compared to the density of metropolitan France, the department of Deux-Sèvres appears to be moderately populated.;
29;en;In which department are the inhabitants called the Axonais ?;aisne;Ain;ally;Ariège;Expert;The Aisne lost some of its population in the second half of the 19th century, due to the rural exodus, however limited.;
30;en;In which department is the world famous surfing conditions ?;Landes;Channel;Mosel;Gironde;Expert;The Landes are also famous culinary through foie gras, duck breast, chicken and AOC Tursan wines.;
1;de;Mit welcher Abteilung sind Bernadette und Jacques Chirac eng verbunden ?;Korrize;Vogesen;Pas-de-Calais;Landes;Débutant;Corrèze liegt im Westen des Zentralmassivs und besteht aus dem Berg, den Hochebenen und dem Brive-Becken.;
2;de;In welchem Departement hat sich Versailles um sein Schloss herum entwickelt ?;Yvelines;Charente;Gard;aise;Débutant;Das Schloss von Versailles begrüßt das Parlament, wenn es im Kongress zusammentritt, um eine Revision der Verfassung anzunehmen.;https://de.wikipedia.org/wiki/Département Yvelines
3;de;Wie heißen die Einwohner des Departements Hérault ?;Hérault-Leute;Gard;Morbihan;Wirsing;Débutant;Georges Brassens (Sète), Boby Lapointe (Pézenas), Émilie Simon (Montpellier), Juliette Gréco (Montpellier) stammten aus Hérault.;
4;de;Welches französische Departement vereint Artois und einen Teil der ehemaligen Picardie ?;Pas-de-Calais;Calvados;aise;Norden;Débutant;Obwohl vereint, sind diese beiden Gebiete noch heute kulturell und wirtschaftlich sehr unterschiedlich.;https://de.wikipedia.org/wiki/Département Pas-de-Calais
5;de;Welcher zweite Flughafen in Frankreich befindet sich im Departement Essone ?;Paris-Orly;Jura;Gironde;Hohl;Débutant;Der Flughafen ist ein wichtiger Luftverkehrsknotenpunkt und fertigt jedes Jahr etwa 30 Millionen Passagiere ab.;
6;de;Welches Departement hat seinen Namen von dem Fluss namens Gardon ?;Gard;Morbihan;Charente;Vaucluse;Débutant;Der Fluss, der etwa 70 km mit Kanus und Kajaks befahrbar ist, wird vom Pont du Gard, einem römischen Aquädukt aus dem 1. Jahrhundert, überquert.;https://de.wikipedia.org/wiki/Département Gard
7;de;Welches Departement der Bretagne hat die Stadt Vannes als Präfektur ?;Morbihan;Ille-et-Vilaine;Finistère;Côtes-d'Armor;Débutant;Es entspricht im Wesentlichen dem Königreich, das zur Grafschaft, dann zum Gerichtsvollzieher von Broërec und früher zur Stadt Vénètes wurde.;https://de.wikipedia.org/wiki/Département Morbihan
8;de;Welches dieser Departements hat einen Namen, der von den beiden Flüssen stammt, die es durchqueren ?;Loire-et-Cher;Puy-de-Dome;Pas-de-Calais;Charente-Maritime;Débutant;Das Departement Loir-et-Cher ist in Frankreich vor allem durch das Lied von Michel Delpech aus dem Jahr 1977 bekannt.;https://de.wikipedia.org/wiki/Département Loir-et-Cher
9;de;Welches Departement liegt geografisch am westlichsten in Frankreich ?;Finistère;Lozère;Pas-de-Calais;Dordogne;Débutant;Als erstes Küstendepartement Frankreichs hat Finistère 117 von 282 Küstengemeinden und fast ein Viertel der französischen Küste.;
10;de;In welcher Abteilung essen wir Potjevleesch, Waterzooi und Welsh ?;Norden;Zwei-Sèvres;Lozère;Finistère;Débutant;Mehrere Lieder handeln vom Norden, eines der bekanntesten ist wahrscheinlich « Les Corons » von Pierre Bachelet.;
11;de;In welcher Abteilung gehen Sie auf dem alten Becken von Honfleur ?;Calvados;Zwei-Sèvres;Yvelines;Finistère;Confirmé;Seine schmalen Schieferhäuser, die sich im Becken spiegeln, machen ihn zur Haupttouristenattraktion von Honfleur.;
12;de;In welchem Departement hat die Agglomeration von Épinal mehr als 40.000 Einwohner ?;Vogesen;Gironde;Aude;Jura;Confirmé;Die 1796 von Pellerin gegründete Stadt wurde zunächst für ihre Bilderwelt bekannt, ist aber auch für ihr Schloss und ihre Basilika bekannt.;
13;de;Welches ist mit 418.000 Hektar das drittgrößte Forstdepartement Frankreichs ?;Dordogne;Hohl;Vogesen;Sarthe;Confirmé;Es gibt Laubbäume, Koniferen, Wiesen, Hügel, Täler, Weinberge, Trüffelfelder, Klippen, Bäche, Schluchten und Höhlen.;
14;de;Was ist das größte Departement im französischen Mutterland ?;Gironde;Aude;Wirsing;Yvelines;Confirmé;Mit einer Länge von 75 Kilometern und einer Breite von 12 Kilometern an der Mündung ist die Gironde-Mündung die größte Mündung Europas.;
15;de;Aus welchem Departement war François Fillon Abgeordneter und Senator ?;Sarthe;Ärmel;Finistère;Lozère;Confirmé;Seine Kampagne wurde durch Presseenthüllungen und spätere Klagen in Frage gestellt, in die er und seine Frau Penelope verwickelt waren.;
16;de;In welcher Abteilung kann man an den 24 Stunden von Le Mans teilnehmen ?;Sarthe;Mosel;Korrize;Charente;Confirmé;Der 1923 ins Leben gerufene Wettbewerb, der jedes Jahr im Juni stattfindet, zieht knapp über 240.000 Zuschauer an.;
17;de;Welches Departement ist berühmt für seine Weißweine, einschließlich der Rebsorte Savagnin ?;Jura;Yvelines;Norden;Korrize;Confirmé;Es gibt auch einzigartige Weine im Jura wie Süßweine wie Macvin oder Strohwein.;
18;de;Welches französische Departement grenzt an Luxemburg und Deutschland ?;Mosel;Wirsing;Ärmel;Gironde;Confirmé;Auf europäischer Ebene ist die Mosel Teil der Großregion und des Eurodistrikts SaarMosel (für einen Teil des Departements).;
19;de;Welches Departement mit Code 73 ist das gebirgigste in Frankreich ?;Wirsing;Loire-et-Cher;Hohl;Calvados;Confirmé;Die überwiegende Mehrheit der Massive von Savoyen sind Alpenmassive, zu denen der südlichste Teil des Jura hinzukommt.;
20;de;In welchem französischen Departement liegt Mont Ventoux ?;Vaucluse;Gard;Lozère;Aude;Confirmé;Der Mont Ventoux mit dem Spitznamen Mont Chauve ist der höchste Punkt der Monts de Vaucluse und der höchste Gipfel im Vaucluse.;
21;de;Welches französische Departement hat eine Schnecke mit Flügeln als Emblem ?;Charente;Dordogne;Vaucluse;Ärmel;Expert;Das Departement hat seinen Namen von dem Fluss, der in gallo-römischer Zeit unter dem griechischen Namen Kanentelos bekannt war.;
22;de;In welchem Departement ist Cherbourg-en-Cotentin das wichtigste kulturelle Zentrum ?;Ärmel;Sarthe;Calvados;Loire-et-Cher;Expert;Der aus Lestre stammende Sänger Allain Leprest blieb seiner Abteilung und seinem Ursprungsmeer treu, das er sang.;
23;de;In welchem Departement wird der Karneval von Limoux länger als zehn Wochen gefeiert ?;Aude;Korrize;Mosel;Zwei-Sèvres;Expert;Er findet in der Stadt Limoux am Place de la République statt und ist einer der längsten Karnevale der Welt.;
24;de;In welcher Stadt an der Somme finden wir den Perret-Turm und das Haus von Jules Verne ?;Amiens;Vaucluse;Jura;Gard;Expert;Es gibt zwei große Gebiete, die reich an Touristenattraktionen sind : die Picardie-Küste und Abbeville, die Amiénois und die Haute Somme.;
25;de;Was ist nach Lozère das am zweitdünnsten besiedelte Departement Frankreichs ?;Hohl;Pas-de-Calais;Dordogne;Vogesen;Expert;La Creuse grenzt an die Departements Corrèze, Haute-Vienne, Allier, Puy-de-Dôme, Cher und Indre.;
26;de;Welche französische Abteilung trägt den Spitznamen Quellenabteilung ?;Lozère;Vogesen;Sarthe;Morbihan;Expert;Es ist das einzige städtische französische Departement, in dem alle Flüsse, die fließen, auch ihre Quelle haben.;
27;de;Welcher Staudamm befindet sich auf der Truyère im Departement Cantal ?;grandval;Pareloup;Maury;Tignes;Expert;Dort wurde 1966 die Szene der Feldgendarmerie bei der Kontrolle des Staudamms aus dem Film « La Grande Vadrouille » gedreht.;
28;de;In welchem Departement hat die Stadt Niort mehr als 50.000 Einwohner ?;Zwei-Sèvres;Norden;Landes;Mosel;Expert;Im Vergleich zur Dichte des französischen Mutterlandes scheint das Departement Deux-Sèvres mäßig besiedelt zu sein.;
29;de;In welchem Departement heißen die Einwohner Axonais ?;aise;Ain;Verbündeter;Ariège;Expert;Die Aisne verlor in der zweiten Hälfte des 19. Jahrhunderts durch die dennoch begrenzte Landflucht einen Teil ihrer Bevölkerung.;
30;de;In welcher Abteilung sind die weltberühmten Surfbedingungen ?;Landes;Ärmel;Mosel;Gironde;Expert;Die Landes sind auch kulinarisch für Foie Gras, Entenbrust, Hähnchen und AOC-Tursan-Weine bekannt.;
1;es;¿A qué departamento están fuertemente vinculados Bernadette y Jacques Chirac ?;Corrección;Vosgos;Paso de Calais;Landas;Débutant;Situada al oeste del Macizo Central, Corrèze está formada por la Montaña, las mesetas y la cuenca de Brive.;
2;es;¿En qué departamento se desarrolló Versalles alrededor de su castillo ?;Yvelines;charente;jardín;aisne;Débutant;El Palacio de Versalles da la bienvenida al Parlamento cuando se reúne en el Congreso para aprobar una revisión de la Constitución.;https://es.wikipedia.org/wiki/Yvelines
3;es;¿Cómo se llaman los habitantes del departamento de Hérault ?;Gente de Hérault;jardín;Morbihan;Saboya;Débutant;Georges Brassens (Sète), Boby Lapointe (Pézenas), Émilie Simon (Montpellier), Juliette Gréco (Montpellier) eran de Hérault.;
4;es;¿Qué departamento francés reúne a Artois y parte de la antigua Picardía ?;Paso de Calais;calvados;aisne;Norte;Débutant;Aunque unidos, estos dos territorios siguen siendo hoy bastante diferentes cultural y económicamente.;https://es.wikipedia.org/wiki/Paso de Calais (departamento)
5;es;¿Qué segundo aeropuerto de Francia se encuentra en el departamento de Essone ?;París-Orly;Jura;Gironda;Hueco;Débutant;Un importante centro de transporte aéreo, el aeropuerto maneja aproximadamente 30 millones de pasajeros cada año.;
6;es;¿Qué departamento toma su nombre del río localmente llamado Gardon ?;jardín;Morbihan;charente;Vaucluse;Débutant;El río, navegable en canoa-kayak durante unos 70 km, está atravesado por el Pont du Gard, un acueducto romano del siglo I.;https://es.wikipedia.org/wiki/Gard
7;es;¿Qué departamento de Bretaña tiene como prefectura la ciudad de Vannes ?;Morbihan;Ille-et-Vilaine;Finisterre;Costas de Armor;Débutant;Corresponde esencialmente al reino, que se convirtió en condado y luego en alguacil de Broërec y más antiguamente en la ciudad de Vénètes.;https://es.wikipedia.org/wiki/Morbihan
