8;es;¿Cuál de estos departamentos tiene un nombre que proviene de los dos ríos que lo cruzan ?;Loira y Cher;Puy-de-Dome;Paso de Calais;Charente Marítimo;Débutant;El departamento de Loir-et-Cher es conocido en Francia en particular gracias a la canción de Michel Delpech escrita en 1977.;https://es.wikipedia.org/wiki/Loir y Cher
9;es;¿Qué departamento es geográficamente el más occidental de Francia ?;Finisterre;Lozère;Paso de Calais;Dordoña;Débutant;Primer departamento costero de Francia, Finisterre tiene 117 municipios costeros de 282 y casi una cuarta parte de la costa francesa.;
10;es;¿En qué departamento comemos potjevleesch, waterzooi y welsh ?;Norte;Dos Sevres;Lozère;Finisterre;Débutant;Varias canciones tratan sobre el Norte, una de las más conocidas es probablemente « Les Corons » de Pierre Bachelet.;
11;es;¿En qué departamento estás caminando sobre la antigua cuenca de Honfleur ?;calvados;Dos Sevres;Yvelines;Finisterre;Confirmé;Sus estrechas casas de pizarra reflejadas en la cuenca la convierten en la principal atracción turística de Honfleur.;
12;es;¿En qué departamento la aglomeración de Épinal supera los 40.000 habitantes ?;Vosgos;Gironda;aude;Jura;Confirmé;Conocida primero por su imaginería, fundada en 1796 por Pellerin, la ciudad también es conocida por su castillo y su basílica.;
13;es;¿Cuál es el tercer departamento forestal más grande de Francia con 418.000 hectáreas ?;Dordoña;Hueco;Vosgos;Sarthe;Confirmé;Hay árboles frondosos, coníferas, prados, colinas, valles, viñedos, campos de trufas, acantilados, arroyos, desfiladeros y cuevas.;
14;es;¿Cuál es el departamento más grande de la Francia metropolitana ?;Gironda;aude;Saboya;Yvelines;Confirmé;Con 75 kilómetros de largo y 12 kilómetros de ancho en su desembocadura, el estuario de la Gironda es el estuario más grande de Europa.;
15;es;¿De qué departamento era diputado y senador François Fillon ?;Sarthe;Manga;Finisterre;Lozère;Confirmé;Su campaña fue desafiada por revelaciones de prensa y juicios posteriores que lo implicaban a él y a su esposa, Penélope.;
16;es;¿En qué departamento puedes asistir a las 24 Horas de Le Mans ?;Sarthe;Mosela;Corrección;charente;Confirmé;La competición, iniciada en 1923 y que tiene lugar todos los años en junio, atrae a poco más de 240.000 espectadores.;
17;es;¿Qué departamento es famoso por sus vinos blancos, incluida su variedad de uva Savagnin ?;Jura;Yvelines;Norte;Corrección;Confirmé;También hay vinos únicos en el Jura como los vinos dulces como el macvin o el vino de paja.;
18;es;¿Qué departamento francés limita con Luxemburgo y Alemania ?;Mosela;Saboya;Manga;Gironda;Confirmé;A nivel europeo, el Mosela forma parte de la Gran Región y del Eurodistrito SaarMoselle (para una parte del departamento).;
19;es;¿Qué departamento con el código 73 es el más montañoso de Francia ?;Saboya;Loira y Cher;Hueco;calvados;Confirmé;La gran mayoría de los macizos de Saboya son macizos alpinos, a los que se suma la parte más meridional del Jura.;
20;es;¿En qué departamento francés se encuentra Mont Ventoux ?;Vaucluse;jardín;Lozère;aude;Confirmé;Apodado Mont Chauve, Mont Ventoux es el punto más alto de los Monts de Vaucluse y el pico más alto de Vaucluse.;
21;es;¿Qué departamento francés tiene un caracol con alas como emblema ?;charente;Dordoña;Vaucluse;Manga;Expert;El departamento toma su nombre del río que, en la época galo-romana, era conocido con el nombre griego de Kanentelos.;
22;es;¿De qué departamento Cherbourg-en-Cotentin es el principal centro cultural ?;Manga;Sarthe;calvados;Loira y Cher;Expert;El cantante Allain Leprest, originario de Lestre, se mantuvo fiel a su departamento y a su mar de origen que cantaba.;
23;es;¿En qué departamento se celebra el carnaval de Limoux desde hace más de diez semanas ?;aude;Corrección;Mosela;Dos Sevres;Expert;Teniendo lugar en la ciudad de Limoux, en la Place de la République, es uno de los carnavales más largos del mundo.;
24;es;¿En qué ciudad del Somme encontramos la Torre Perret y la casa de Julio Verne ?;amiens;Vaucluse;Jura;jardín;Expert;Hay dos grandes áreas ricas en sitios turísticos : la costa de Picardía y Abbeville, Amiénois y Haute Somme.;
25;es;¿Cuál es el segundo departamento menos poblado de Francia después de Lozère ?;Hueco;Paso de Calais;Dordoña;Vosgos;Expert;La Creuse limita con los departamentos de Corrèze, Haute-Vienne, Allier, Puy-de-Dôme, Cher e Indre.;
26;es;¿Qué departamento francés recibe el sobrenombre de departamento de las fuentes ?;Lozère;Vosgos;Sarthe;Morbihan;Expert;Es el único departamento francés metropolitano en el que todos los ríos que corren también tienen su nacimiento.;
27;es;¿Qué presa se encuentra en el Truyère, en el departamento de Cantal ?;grandval;Pareloup;mauri;Tignes;Expert;La escena de la Feldgendarmerie revisando la presa de la película « La Grande Vadrouille » fue filmada allí en 1966.;
28;es;¿En qué departamento la ciudad de Niort tiene más de 50.000 habitantes ?;Dos Sevres;Norte;Landas;Mosela;Expert;En comparación con la densidad de la Francia metropolitana, el departamento de Deux-Sèvres parece estar moderadamente poblado.;
29;es;¿En qué departamento los habitantes se llaman Axonais ?;aisne;Aín;aliado;Arieja;Expert;El Aisne perdió parte de su población en la segunda mitad del siglo XIX, debido al éxodo rural, aunque limitado.;
30;es;¿En qué departamento se encuentran las mundialmente famosas condiciones para surfear ?;Landas;manga;Mosela;Gironda;Expert;Las Landas también son reconocidas culinariamente a través del foie gras, la pechuga de pato, el pollo y los vinos AOC Tursan.;
1;it;A quale dipartimento sono fortemente legati Bernadette e Jacques Chirac ?;Correggere;Vosgi;Passo di Calais;Lande;Débutant;Situata ad ovest del Massiccio Centrale, la Corrèze è formata dalla Montagna, dagli altipiani e dalla conca del Brive.;
2;it;In quale dipartimento si sviluppò Versailles attorno al suo castello ?;Yveline;Charente;Gard;aisne;Débutant;La Reggia di Versailles accoglie il Parlamento quando si riunisce al Congresso per adottare una revisione della Costituzione.;https://it.wikipedia.org/wiki/Yvelines
3;it;Come si chiamano gli abitanti del dipartimento dell'Hérault ?;Persone dell'Hérault;Gard;Morbihan;Savoia;Débutant;Georges Brassens (Sète), Boby Lapointe (Pézenas), Émilie Simon (Montpellier), Juliette Gréco (Montpellier) provenivano dall'Hérault.;
4;it;Quale dipartimento francese riunisce Artois e parte dell'ex Piccardia ?;Passo di Calais;calvados;aisne;nord;Débutant;Sebbene uniti, questi due territori sono ancora oggi culturalmente ed economicamente molto diversi.;https://it.wikipedia.org/wiki/Passo di Calais
5;it;Quale secondo aeroporto in Francia si trova nel dipartimento dell'Essone ?;Parigi-Orly;Giura;Gironda;Cavo;Débutant;Un importante snodo del trasporto aereo, l'aeroporto gestisce circa 30 milioni di passeggeri ogni anno.;
6;it;Quale dipartimento prende il nome dal fiume chiamato localmente Gardon ?;Gard;Morbihan;Charente;Vaucluse;Débutant;Il fiume, navigabile in canoa-kayak per circa 70 km, è attraversato dal Pont du Gard, acquedotto romano del I secolo.;https://it.wikipedia.org/wiki/Gard
7;it;Quale dipartimento della Bretagna ha come prefettura la città di Vannes ?;Morbihan;Ille-et-Vilaine;Finistere;Côtes-d'Armor;Débutant;Corrisponde essenzialmente al regno, che divenne contea poi ufficiale giudiziario di Broërec e più anticamente città di Vénètes.;https://it.wikipedia.org/wiki/Morbihan
8;it;Quale di questi dipartimenti ha un nome derivante dai due fiumi che lo attraversano ?;Loire-et-Cher;Puy-de-Dome;Passo di Calais;Charente Marittima;Débutant;Il dipartimento di Loir-et-Cher è conosciuto in Francia in particolare grazie alla canzone di Michel Delpech scritta nel 1977.;https://it.wikipedia.org/wiki/Loir-et-Cher
9;it;Qual è il dipartimento geograficamente più occidentale della Francia ?;Finistere;Lozera;Passo di Calais;Dordogna;Débutant;Primo dipartimento costiero della Francia, Finistère ha 117 comuni costieri su 282 e quasi un quarto della costa francese.;
10;it;In quale dipartimento si mangia potjevleesch, waterzooi e welsh ?;nord;Due Sevres;Lozera;Finistere;Débutant;Diverse canzoni parlano del Nord, una delle più conosciute è probabilmente « Les Corons » di Pierre Bachelet.;
11;it;In quale dipartimento stai camminando sull'antica conca di Honfleur ?;calvados;Due Sevres;Yveline;Finistere;Confirmé;Le sue strette case di ardesia riflesse nella conca ne fanno la principale attrazione turistica di Honfleur.;
12;it;In quale dipartimento l'agglomerato di Épinal supera i 40.000 abitanti ?;Vosgi;Gironda;aude;Giura;Confirmé;Conosciuta prima per il suo immaginario, fondata nel 1796 da Pellerin, la città è nota anche per il suo castello e la sua basilica.;
13;it;Qual è il terzo dipartimento forestale più grande della Francia con 418.000 ettari ?;Dordogna;Cavo;Vosgi;Sarthe;Confirmé;Ci sono alberi frondosi, conifere, prati, colline, valli, vigneti, tartufaie, scogliere, ruscelli, gole e grotte.;
14;it;Qual è il dipartimento più grande della Francia metropolitana ?;Gironda;aude;Savoia;Yveline;Confirmé;Lungo 75 chilometri e largo 12 alla foce, l'estuario della Gironda è il più grande estuario d'Europa.;
15;it;Di quale dipartimento era deputato e senatore François Fillon ?;Sarthe;manica;Finistere;Lozera;Confirmé;La sua campagna è stata contestata da rivelazioni alla stampa e successive cause legali che hanno coinvolto lui e sua moglie, Penelope.;
16;it;In quale reparto puoi assistere alla 24 Ore di Le Mans ?;Sarthe;Mosella;Correggere;Charente;Confirmé;La competizione, iniziata nel 1923 e che si svolge ogni anno a giugno, attira poco più di 240.000 spettatori.;
17;it;Quale dipartimento è famoso per i suoi vini bianchi compreso il vitigno Savagnin ?;Giura;Yveline;nord;Correggere;Confirmé;Ci sono anche vini unici nel Giura come vini dolci come il macvin o il vino passito.;
18;it;Quale dipartimento francese confina con il Lussemburgo e la Germania ?;Mosella;Savoia;manica;Gironda;Confirmé;A livello europeo, la Mosella fa parte della Greater Region e dell'Eurodistrict SaarMoselle (per parte del dipartimento).;
19;it;Quale dipartimento con codice 73 è il più montuoso della Francia ?;Savoia;Loire-et-Cher;Cavo;calvados;Confirmé;La stragrande maggioranza dei massicci della Savoia sono massicci alpini, ai quali si aggiunge la parte più meridionale del Giura.;
20;it;In quale dipartimento francese si trova il Mont Ventoux ?;Vaucluse;Gard;Lozera;aude;Confirmé;Soprannominato Mont Chauve, Mont Ventoux è il punto più alto dei Monts de Vaucluse e la vetta più alta del Vaucluse.;
21;it;Quale dipartimento francese ha come emblema una lumaca con le ali ?;Charente;Dordogna;Vaucluse;manica;Expert;Il dipartimento prende il nome dal fiume che, in epoca gallo-romana, era conosciuto con il nome greco di Kanentelos.;
22;it;Di quale dipartimento Cherbourg-en-Cotentin è il principale centro culturale ?;manica;Sarthe;calvados;Loire-et-Cher;Expert;Il cantante Allain Leprest, originario di Lestre, è rimasto fedele al suo reparto e al suo mare d'origine che cantava.;
23;it;In quale dipartimento si festeggia da più di dieci settimane il carnevale di Limoux ?;aude;Correggere;Mosella;Due Sevres;Expert;Si svolge nella città di Limoux, in Place de la République, è uno dei carnevali più lunghi del mondo.;
24;it;In quale città della Somme troviamo la Torre Perret e la casa di Jules Verne ?;amiens;Vaucluse;Giura;Gard;Expert;Ci sono due grandi aree ricche di siti turistici : la costa della Piccardia e Abbeville, l'Amiénois e l'Haute Somme.;
25;it;Qual è il secondo dipartimento meno popolato della Francia dopo la Lozère ?;Cavo;Passo di Calais;Dordogna;Vosgi;Expert;La Creuse confina con i dipartimenti di Corrèze, Haute-Vienne, Allier, Puy-de-Dôme, Cher e Indre.;
26;it;Quale dipartimento francese è soprannominato dipartimento delle fonti ?;Lozera;Vosgi;Sarthe;Morbihan;Expert;È l'unico dipartimento metropolitano francese in cui hanno la loro sorgente anche tutti i fiumi che scorrono.;
27;it;Quale diga si trova sulla Truyère, nel dipartimento del Cantal ?;grandvale;Pareloup;Maurizio;Tignes;Expert;La scena della Feldgendarmerie che controlla la diga del film « La Grande Vadrouille » è stata girata lì nel 1966.;
28;it;In quale dipartimento la città di Niort conta più di 50.000 abitanti ?;Due Sevres;nord;Lande;Mosella;Expert;Rispetto alla densità della Francia metropolitana, il dipartimento di Deux-Sèvres appare moderatamente popolato.;
29;it;In quale dipartimento sono gli abitanti chiamati Axonais ?;aisne;Ain;alleato;Ariege;Expert;L'Aisne perse parte della sua popolazione nella seconda metà del XIX secolo, a causa dell'esodo rurale, per quanto limitato.;
30;it;In quale dipartimento si trovano le condizioni di surf famose in tutto il mondo ?;Lande;manica;Mosella;Gironda;Expert;Le Landes sono anche rinomate culinarie grazie al foie gras, al petto d'anatra, al pollo e ai vini Tursan AOC.;
1;nl;Met welke afdeling zijn Bernadette en Jacques Chirac sterk verbonden ?;Corrèze;Vogezen;Pas-de-Calais;Landes;Débutant;Corrèze, gelegen ten westen van het Centraal Massief, bestaat uit de berg, de plateaus en het bekken van Brive.;
2;nl;In welk departement ontwikkelde Versailles zich rond zijn kasteel ?;Yvelines;Charente;Gard;aisne;Débutant;Het paleis van Versailles verwelkomt het parlement wanneer het in het congres bijeenkomt om een herziening van de grondwet aan te nemen.;https://nl.wikipedia.org/wiki/Yvelines
3;nl;Hoe heten de inwoners van het departement Hérault ?;Hérault mensen;Gard;Morbihan;Savoye;Débutant;Georges Brassens (Sète), Boby Lapointe (Pézenas), Émilie Simon (Montpellier), Juliette Gréco (Montpellier) kwamen uit de Hérault.;
4;nl;Welk Franse departement brengt Artois en een deel van het voormalige Picardië samen ?;Pas-de-Calais;calvados;aisne;Noord;Débutant;Hoewel ze verenigd zijn, zijn deze twee gebieden vandaag de dag nog steeds heel verschillend cultureel en economisch.;https://nl.wikipedia.org/wiki/Pas-de-Calais
5;nl;Welke tweede luchthaven in Frankrijk ligt in het departement Essone ?;Parijs-Orly;Jura;Gironde;Hol;Débutant;De luchthaven is een belangrijk luchtvervoersknooppunt en verwerkt jaarlijks ongeveer 30 miljoen passagiers.;
6;nl;Welk departement dankt zijn naam aan de rivier die plaatselijk de Gardon wordt genoemd ?;Gard;Morbihan;Charente;Vaucluse;Débutant;De rivier, bevaarbaar per kano-kajak voor ongeveer 70 km, wordt doorkruist door de Pont du Gard, een Romeins aquaduct uit de 1e eeuw.;https://nl.wikipedia.org/wiki/Gard (departement)
7;nl;Welk departement van Bretagne heeft de stad Vannes als prefectuur ?;Morbihan;Ille-et-Vilaine;Finistère;Côtes-d'Armor;Débutant;Het komt in wezen overeen met het koninkrijk, dat graafschap werd, dan baljuw van Broërec en vroeger de stad Vénètes.;https://nl.wikipedia.org/wiki/Morbihan
8;nl;Welke van deze departementen heeft een naam die afkomstig is van de twee rivieren die het doorkruisen ?;Loire-et-Cher;Puy-de-Dome;Pas-de-Calais;Charente Maritiem;Débutant;Het departement Loir-et-Cher is in Frankrijk vooral bekend dankzij het lied van Michel Delpech uit 1977.;https://nl.wikipedia.org/wiki/Loir-et-Cher
9;nl;Welk departement ligt geografisch gezien het meest westelijk van Frankrijk ?;Finistère;Lozère;Pas-de-Calais;Dordogne;Débutant;Finistère, het eerste kustdepartement van Frankrijk, heeft 117 kustgemeenten van de 282 en bijna een kwart van de Franse kust.;
10;nl;Op welke afdeling eten we potjevleesch, waterzooi en welsh ?;Noord;Twee-Sèvres;Lozère;Finistère;Débutant;Verschillende nummers gaan over het noorden, een van de bekendste is waarschijnlijk « Les Corons » van Pierre Bachelet.;
11;nl;In welk departement loop je op het oude bassin van Honfleur ?;calvados;Twee-Sèvres;Yvelines;Finistère;Confirmé;De smalle leistenen huizen weerspiegeld in het bassin maken het de belangrijkste toeristische attractie van Honfleur.;
12;nl;In welk departement heeft de agglomeratie van Épinal meer dan 40.000 inwoners ?;Vogezen;Gironde;aude;Jura;Confirmé;De stad stond eerst bekend om zijn beeldspraak, gesticht in 1796 door Pellerin, en staat ook bekend om zijn kasteel en zijn basiliek.;
13;nl;Wat is het op twee na grootste bosdepartement van Frankrijk met 418.000 hectare ?;Dordogne;Hol;Vogezen;Sarthe;Confirmé;Er zijn lommerrijke bomen, naaldbomen, weiden, heuvels, valleien, wijngaarden, truffelvelden, kliffen, beekjes, kloven en grotten.;
14;nl;Wat is het grootste departement in Europees Frankrijk ?;Gironde;aude;Savoye;Yvelines;Confirmé;De monding van de Gironde, 75 kilometer lang en 12 kilometer breed aan de monding, is de grootste riviermonding van Europa.;
15;nl;Van welk departement was François Fillon een plaatsvervanger en senator ?;Sarthe;Mouw;Finistère;Lozère;Confirmé;Zijn campagne werd uitgedaagd door onthullingen in de pers en latere rechtszaken waarbij hij en zijn vrouw Penelope betrokken waren.;
16;nl;In welke afdeling kun je de 24 uur van Le Mans bijwonen ?;Sarthe;Moezel;Corrèze;Charente;Confirmé;De wedstrijd, die in 1923 van start ging en elk jaar in juni plaatsvindt, trekt iets meer dan 240.000 toeschouwers.;
17;nl;Welk departement staat bekend om zijn witte wijnen, waaronder de Savagnin-druivensoort ?;Jura;Yvelines;Noord;Corrèze;Confirmé;Er zijn ook unieke wijnen in de Jura zoals zoete wijnen zoals macvin of strowijn.;
18;nl;Welk Franse departement grenst aan Luxemburg en Duitsland ?;Moezel;Savoye;Mouw;Gironde;Confirmé;Op Europees niveau maakt de Moezel deel uit van de Grote Regio en het Eurodistrict SaarMoezel (voor een deel van het departement).;
19;nl;Welk departement met code 73 is het meest bergachtig van Frankrijk ?;Savoye;Loire-et-Cher;Hol;calvados;Confirmé;De overgrote meerderheid van de massieven van de Savoie zijn alpenmassieven, waaraan het zuidelijkste deel van de Jura wordt toegevoegd.;
20;nl;In welk Franse departement ligt de Mont Ventoux ?;Vaucluse;Gard;Lozère;aude;Confirmé;Bijgenaamd Mont Chauve, Mont Ventoux is het hoogste punt van de Monts de Vaucluse en de hoogste piek in de Vaucluse.;
21;nl;Welk Franse departement heeft een slak met vleugels als embleem ?;Charente;Dordogne;Vaucluse;Mouw;Expert;Het departement dankt zijn naam aan de rivier die in de Gallo-Romeinse tijd bekend stond onder de Griekse naam Kanentelos.;
22;nl;Van welk departement is Cherbourg-en-Cotentin het belangrijkste culturele centrum ?;Mouw;Sarthe;calvados;Loire-et-Cher;Expert;De zanger Allain Leprest, oorspronkelijk uit Lestre, bleef trouw aan zijn afdeling en zijn zee van oorsprong die hij zong.;
23;nl;In welk departement wordt het carnaval van Limoux al meer dan tien weken gevierd ?;aude;Corrèze;Moezel;Twee-Sèvres;Expert;Het vindt plaats in de stad Limoux, op de Place de la République, en is een van de langste carnavals ter wereld.;
24;nl;In welke stad van de Somme vinden we de Perret-toren en het huis van Jules Verne ?;amiens;Vaucluse;Jura;Gard;Expert;Er zijn twee grote gebieden die rijk zijn aan toeristische trekpleisters : de Picardische kust en Abbeville, de Amiénois en de Haute Somme.;
25;nl;Wat is het op één na dunst bevolkte departement van Frankrijk na Lozère ?;Hol;Pas-de-Calais;Dordogne;Vogezen;Expert;La Creuse grenst aan de departementen Corrèze, Haute-Vienne, Allier, Puy-de-Dôme, Cher en Indre.;
26;nl;Welke Franse afdeling heet de afdeling bronnen ?;Lozère;Vogezen;Sarthe;Morbihan;Expert;Het is het enige grootstedelijke Franse departement waar alle rivieren die stromen ook hun oorsprong hebben.;
27;nl;Welke dam ligt op de Truyère, in het departement Cantal ?;grandval;Pareloup;Maury;Tignes;Expert;De scène van de Feldgendarmerie die de dam controleert uit de film « La Grande Vadrouille » werd daar in 1966 opgenomen.;
28;nl;In welk departement heeft de stad Niort meer dan 50.000 inwoners ?;Twee-Sèvres;Noord;Landes;Moezel;Expert;Vergeleken met de dichtheid van het grootstedelijke Frankrijk, lijkt het departement Deux-Sèvres matig bevolkt.;
29;nl;In welk departement heten de inwoners de Axonais ?;aisne;Ain;bondgenoot;Ariège;Expert;De Aisne verloor een deel van haar bevolking in de tweede helft van de 19e eeuw, als gevolg van de plattelandsvlucht, hoe beperkt ook.;
30;nl;In welke afdeling zijn de wereldberoemde surfcondities ?;Landes;Mouw;Moezel;Gironde;Expert;De Landes zijn ook culinair bekend door foie gras, eendenborst, kip en AOC Tursan-wijnen.;
