30;de;Welcher Trainer sollte 1988 anstelle von Johan Cruyff für Barca unterschreiben ?;Javier Clemente;Leo Beenhakker;Arsenio Iglesias;Vicente Cantatore;Expert;1971 beendete eine schwere Verletzung Javier Clementes Karriere als Spieler, als er erst 21 Jahre alt war.;https://de.wikipedia.org/wiki/Javier_Clemente
1;es;¿Cuál era el apodo del mediocampista ofensivo argentino Alberto Marico ?;Beto;Mouzo;Russo;Pumpido;Débutant;Beto tenía la particularidad, como jugador, de comer principalmente pizzas, de ocho a diez por semana según él.;
2;es;¿A quién le debemos la fantástica volea en la final de la Eurocopa de 1988 contra la URSS ?;Marco van Basten;Jean-Pierre Papin;Roberto Baggio;Ruud Gullit;Débutant;Marco van Basten, nacido en 1964 en Utrecht, es un futbolista internacional holandés que se convirtió en entrenador y luego entrenador.;https://es.wikipedia.org/wiki/Marco_van_Basten
3;es;¿Qué catástrofe global empañó la victoria del Dynamo Kiev contra el Madrid en 1986 ?;Chernobyl;Bhopal;Chalk River;Fleurus;Débutant;Durante este partido, los soviéticos asfixiaron físicamente a los españoles al anotar tres veces en el contraataque (3-0).;https://es.wikipedia.org/wiki/FC_Dinamo_de_Kiev
4;es;En 1983, ¿por qué Michel Platini habló la técnica en persona ?;Patrick;Nike;Puma;Adidas;Débutant;La empresa fue absorbida por el grupo belga Cortina en 2009 y hoy tiene su sede en Oudenaarde (Bélgica).;https://es.wikipedia.org/wiki/Patrick_(marca)
5;es;¿Qué número 10 de genio podría haber hecho palidecer al rey Pelé en el Mundial de 1982 ?;Zico;Nunes;Edmar;Careca;Débutant;El Pelé Blanc brasileño marcó 52 goles en sus 72 selecciones con el equipo de Brasil entre 1976 y 1988.;https://es.wikipedia.org/wiki/Zico
6;es;¿Qué espectáculo no quiso perderse Renaud en una de sus canciones ?;« Telefoot »;« Pie y compañía »;« Día del fútbol »;« Etapa 2 »;Débutant;La música actual en los créditos es un título de la banda sonora de « Kill Bill » : « Batalla sin honor ni humanidad ».;
7;es;¿Quién marcó el gol número 1200 en la historia del Mundial de Fútbol de 1986 ?;Jean-Pierre Papin;Marco Van Basten;Roberto Baggio;Ruud Gullit;Débutant;Jean-Pierre Papin fue en 1991 el tercer jugador francés en ganar el Balón de Oro, después de Raymond Kopa y Michel Platini.;https://es.wikipedia.org/wiki/Jean-Pierre_Papin
8;es;¿Dónde se prepararon los Blues para los mundiales de fútbol de 1982 y 1986 ?;Font-Romeu;Bourg-Madame;Targassonne;Vernet-les-Bains;Débutant;La localidad está situada al oeste del departamento de Pirineos Orientales, en el corazón del Pirineo catalán, en la Cerdanya.;https://es.wikipedia.org/wiki/Font-Romeu-Odeillo-Via
9;es;¿Cuál fue el primer equipo africano en superar a las gallinas en el Mundial ?;Marruecos;Argelia;Sudán;Togo;Débutant;La organización del Mundial 1986 fue encomendada inicialmente en 1978 a Colombia, que tuvo que retirarse en 1982.;
10;es;¿Qué país iba a organizar originalmente el Mundial de 1986 en casa ?;Colombia;Argentina;Brasil;Bolivia;Débutant;Abandonado por motivos económicos, el evento se trasladó luego a México, dieciséis años después de la edición de 1970.;
11;es;¿Qué tan fuerte fue el terremoto de México que ocurrió antes del Mundial ?;8.1;7.1;6.1;5.1;Confirmé;Este terremoto ocurrió el 19 de septiembre de 1985 causó aproximadamente 10,000 muertes y 30,000 heridos en la Ciudad de México.;
12;es;¿Qué futbolista francés cantó en el himno inicial de los Restos du Coeur ?;Michel Platini;Alain Giresse;Bernard Lacombe;Manuel Amoros;Confirmé;Creador de juego emblemático de la selección francesa de 1976 a 1987, Michel Platini marcó 356 goles durante su carrera.;https://es.wikipedia.org/wiki/Michel_Platini
13;es;Delio Onnis dejó su carrera en 1986 con ¿cuántos goles a su nombre ?;299;269;239;209;Confirmé;Este delantero italo-argentino es el máximo goleador de la historia de la Premier League francesa con 299 goles.;https://es.wikipedia.org/wiki/Delio_Onnis
14;es;¿Cómo transmitió Sócrates mensajes políticos en medio de un juego ?;En diademas;En su camiseta;En sus calcetines;En sus pantalones cortos;Confirmé;Sus mensajes fueron escritos contra la dictadura en Brasil, como la democracia, el voto o no temen el terror.;https://es.wikipedia.org/wiki/Programa Sócrates
15;es;¿Qué marca se convirtió en el proveedor oficial en inglés en 1984 ?;Umbro;Slazenger;KooGa;Gola;Confirmé;Umbro es un fabricante de equipos deportivos fundada en 1924 en Wilmslow en Inglaterra bajo el nombre de Ropa Humphrey Brothers.;https://es.wikipedia.org/wiki/Umbro (marca)
16;es;¿Qué internacional danés se incorporó al Girondin a finales de los 80 ?;Jesper Olsen;Soren Lerby;Ivan Nielsen;Ole Rasmussen;Confirmé;Este extremo izquierdo se dio a conocer bajo la camiseta del Ajax Amsterdam, entre 1981 y 1984, luego del Manchester United.;https://es.wikipedia.org/wiki/Jesper_Olsen
17;es;¿Qué tubo francés salió al aire durante la Copa del Mundo de 1986 ?;« Viva les Bleus »;« Uno Dos Tres »;« Todo por el fútbol »;« Sagrado Marius »;Confirmé;Entre los cantantes podemos citar a Enrico Macias, Philippe Lavil, Sacha Distel, Sim, Carlos, Michel Boujenah y Marcel Amont.;
18;es;¿A quién sucedió Jean Fournet-Fayard al frente de la FFF en 1985 ?;Fernand Sastre;Jacques Georges;Claude Simonet;Antoine Chiarisoli;Confirmé;Con la responsabilidad de la FFF implicada en el drama de Furiani el 5 de mayo de 1992, Fournet-Fayard será procesada.;
19;es;¿Quién ha sido declarado el entrenador más amistoso de la Copa Mundial de 1986 ?;Henri Michel;Michel Hidalgo;Laurent Blanc;Roger Lemerre;Confirmé;Luego se convertirá, en particular, en entrenador del Paris Saint-Germain y de varios clubes africanos y selecciones nacionales.;https://es.wikipedia.org/wiki/Henri_Michel_(futbolista)
20;es;¿A qué equipo le otorgó François Mitterrand la Coupe de France en junio de 1981 ?;SC Bastia;RC Lens;AS Angoulême;Paris FC;Confirmé;Esta 64a edición de la Coupe de France es la primera ganada por el club corso (aquí en AS Saint-Étienne en la final).;
21;es;¿Quién fue expulsado después de 56 segundos del partido Uruguay-Escocia en el Mundial de 1986 ?;Batista;Rivero;Ramos;Cabrera;Expert;El árbitro Joël Quinou explicará : No pude aceptar que un jugador regrese al campo para destruir a un oponente.;
22;es;¿Cuál fue el apodo que se le dio al internacional francés Bruno Bellone ?;Lucky Lyke;Popeye;Inspector Gadget;Asterix;Expert;Apodado Lucky Luke en referencia a su velocidad, se entrenó en el AS Monaco con el que ganó el campeonato de Francia en 1982.;https://es.wikipedia.org/wiki/Bruno_Bellone
23;es;En 1986, ¿quién marcó 18 goles en 15 días de campeonato ?;Philippe Fargeon;Vincent Estève;David Ginola;Frank Leboeuf;Expert;Convertido en agente inmobiliario, también es concejal en la localidad de Bouscat, cerca de Burdeos.;
24;es;¿Qué club comprado por Elton John alcanzó el D1 en mayo de 1982 ?;Watford FC;Ciudad de Cardiff;Southampton FC;Crystal Palace;Expert;Campeón de Inglaterra D3 en 1969 y 1998, Watford FC será ascendido a la Premier League al final de la temporada 2014-15.;https://es.wikipedia.org/wiki/Watford_Football_Club
25;es;¿Qué club comprado por Elton John alcanzó el D1 en mayo de 1982 ?;Watford FC;Ciudad de Cardiff;Southampton FC;Crystal Palace;Expert;Campeón de Inglaterra D3 en 1969 y 1998, Watford FC será ascendido a la Premier League al final de la temporada 2014-15.;https://es.wikipedia.org/wiki/Watford_Football_Club
26;es;En 1988, ¿en qué ciudad tuvo lugar la primera exposición de pintura de Eric Cantona ?;Marsella;Paris;Brest;Orleans;Expert;Sus pinturas serán descritas como violentas, expresionistas, muy coloridas, con fuego y dólares en todas partes.;
27;es;¿Cómo se llamaba la mascota del Mundial de España de 1982 ?;Naranjito;Gauchito;Juanito;Ciao;Expert;Representa una naranja, fruta típica de España, vistiendo la camiseta roja de la selección nacional y un balón de fútbol bajo el brazo.;https://es.wikipedia.org/wiki/Naranjito (mascota)
28;es;¿La hija de qué jugador del Stade Brestois de los 80 se convirtió en cantante ?;Nolwenn Leroy;Vanessa Paradis;Jennifer;Lorie Pester;Expert;Jean-Luc Le Maqueresse se lo pasó genial en Stade Brestois, RC Paris, RC Lens, antes de terminar en EA Guingamp.;
29;es;¿Cuántas selecciones cuenta Michel Platini con los Blues ?;72;62;82;92;Expert;Michel Platini también jugó durante su carrera un partido oficial con Kuwait el 27 de noviembre de 1988 contra la URSS.;https://es.wikipedia.org/wiki/Michel_Platini
30;es;En 1988, ¿qué entrenador ficharía por el Barça en lugar de Johan Cruyff ?;Javier Clemente;Leo Beenhakker;Arsenio Iglesias;Vicente Cantatore;Expert;En 1971, una grave lesión acabó con la carrera como jugador de Javier Clemente cuando solo tenía 21 años.;https://es.wikipedia.org/wiki/Javier_Clemente
1;it;Qual era il soprannome del trequartista argentino Alberto Marico ?;Beto;Mouzo;Russo;Pumpido;Débutant;Beto aveva la particolarità, da giocatore, di mangiare principalmente pizze, dalle otto alle dieci a settimana secondo lui.;
2;it;A chi si deve il fantastico tiro al volo nella finale di Euro 1988 contro l'Urss ?;Marco van Basten;Jean-Pierre Papin;Roberto Baggio;Ruud Gullit;Débutant;Marco van Basten, nato nel 1964 a Utrecht, è un calciatore della nazionale olandese diventato allenatore e poi allenatore.;https://it.wikipedia.org/wiki/Marco_van_Basten
3;it;Quale catastrofe globale ha rovinato la vittoria della Dynamo Kiev contro il Madrid nel 1986 ?;Chernobyl;Bhopal;Chalk River;Fleurus;Débutant;Durante questa partita, i sovietici soffocarono fisicamente gli spagnoli segnando tre volte in contropiede (3-0).;https://it.wikipedia.org/wiki/Futbol'nyj_Klub_Dynamo_Kyïv
4;it;Nel 1983, perché Michel Platini parlava della tecnica di persona ?;Patrick;Nike;Puma;Adidas;Débutant;L'azienda è stata rilevata dal gruppo belga Cortina nel 2009 e oggi ha sede a Oudenaarde (Belgio).;https://it.wikipedia.org/wiki/Patrick_(azienda)
5;it;Quale numero 10 di genio avrebbe potuto far impallidire re Pelé ai Mondiali del 1982 ?;Zico;Nunes;Edmar;Careca;Débutant;Il Brasiliano Pelé Blanc ha segnato 52 goal nelle sue 72 selezioni con la squadra del Brasile tra il 1976 e il 1988.;https://it.wikipedia.org/wiki/Zico
6;it;Quale spettacolo Renaud non voleva perdere in una delle sue canzoni ?;« Telefoot »;« Foot and Co »;« Giornata del calcio »;« Fase 2 »;Débutant;La musica attuale nei titoli di coda è un titolo della colonna sonora di « Kill Bill » : « Battaglia senza onore né umanità ».;
7;it;Chi ha segnato il 1.200esimo gol nella storia dei mondiali di calcio nel 1986 ?;Jean-Pierre Papin;Marco Van Basten;Roberto Baggio;Ruud Gullit;Débutant;Jean-Pierre Papin è stato nel 1991 il terzo giocatore francese a vincere il Pallone d'Oro, dopo Raymond Kopa e Michel Platini.;https://it.wikipedia.org/wiki/Jean-Pierre_Papin
8;it;Dove si sono preparati i Blues per i Mondiali di calcio nel 1982 e nel 1986 ?;Font-Romeu;Bourg-Madame;Targassonne;Vernet-les-Bains;Débutant;La città si trova a ovest del dipartimento dei Pirenei Orientali, nel cuore dei Pirenei catalani, in Cerdanya.;https://it.wikipedia.org/wiki/Font-Romeu-Odeillo-Via
9;it;Qual è stata la prima squadra africana a superare le galline ai Mondiali ?;Marocco;Algeria;Sudan;Togo;Débutant;L'organizzazione del Mundial 1986 fu inizialmente affidata nel 1978 alla Colombia, che dovette ritirarsi nel 1982.;
10;it;Quale paese originariamente avrebbe organizzato in casa i Mondiali del 1986 ?;Colombia;Argentina;Brasile;Bolivia;Débutant;Abbandonata per motivi finanziari, la manifestazione è stata poi spostata in Messico, sedici anni dopo l'edizione del 1970.;
11;it;Quanto è stato potente il terremoto in Messico che si è verificato prima della Coppa del Mondo ?;8.1;7.1;6.1;5.1;Confirmé;Questo terremoto è avvenuto il 19 settembre 1985 ha causato circa 10.000 morti e 30.000 feriti a Città del Messico.;
12;it;Quale calciatore francese ha cantato nell'inno iniziale dei Restos du Coeur ?;Michel Platini;Alain Giresse;Bernard Lacombe;Manuel Amoros;Confirmé;Trequartista emblematico per la Francia dal 1976 al 1987, Michel Platini ha segnato 356 gol durante la sua carriera.;https://it.wikipedia.org/wiki/Michel_Platini
13;it;Delio Onnis ha lasciato la carriera nel 1986 con quanti gol all'attivo ?;299;269;239;209;Confirmé;Questo attaccante italo-argentino è il capocannoniere nella storia della Premier League francese con 299 gol.;https://it.wikipedia.org/wiki/Delio_Onnis
14;it;In che modo Socrate trasmetteva messaggi politici nel bel mezzo di una partita ?;Su cerchietti;Sulla sua maglia;Sulle sue calze;Sui suoi pantaloncini;Confirmé;I suoi messaggi sono stati scritti contro la dittatura in Brasile, come la democrazia, vota o non temono il terrore.;https://it.wikipedia.org/wiki/Programma Socrates
15;it;Quale marchio è diventato il fornitore ufficiale inglese nel 1984 ?;Umbro;Slazenger;KooGa;Gola;Confirmé;Umbro è un produttore di attrezzature sportive fondata nel 1924 a Wilmslow in Inghilterra sotto il nome di abbigliamento di Humphrey Brothers.;https://it.wikipedia.org/wiki/Umbro (azienda)
16;it;Quale nazionale danese si è unito ai Girondini alla fine degli anni '80 ?;Jesper Olsen;Soren Lerby;Ivan Nielsen;Ole Rasmussen;Confirmé;Quest'ala sinistra divenne nota con la maglia dell'Ajax Amsterdam, tra il 1981 e il 1984, poi del Manchester United.;https://it.wikipedia.org/wiki/Jesper_Olsen
17;it;Quale tubo francese ha colpito le onde radio durante la Coppa del Mondo del 1986 ?;« Viva les Bleus »;« Uno due tre »;« Tutto per il calcio »;« Sacro Mario »;Confirmé;Tra i cantanti possiamo citare Enrico Macias, Philippe Lavil, Sacha Distel, Sim, Carlos, Michel Boujenah e Marcel Amont.;
18;it;Chi è riuscito Jean Fournet-Fayard a guidare la FFF nel 1985 ?;Fernand Sastre;Jacques Georges;Claude Simonet;Antoine Chiarisoli;Confirmé;Con la responsabilità della FFF implicata nel dramma di Furiani del 5 maggio 1992, Fournet-Fayard sarà incriminato.;
19;it;Chi è stato dichiarato l'allenatore più amichevole della Coppa del Mondo del 1986 ?;Henri Michel;Michel Hidalgo;Laurent Blanc;Roger Lemerre;Confirmé;Successivamente diventerà, in particolare, allenatore del Paris Saint-Germain e di diversi club e nazionali africani.;https://it.wikipedia.org/wiki/Henri_Michel_(calciatore)
20;it;A quale squadra François Mitterrand ha assegnato la Coupe de France nel giugno 1981 ?;SC Bastia;RC Lens;AS Angoulême;Paris FC;Confirmé;Questa 64esima edizione della Coupe de France è la prima in assoluto vinta dal club corso (qui sull'AS Saint-Étienne in finale).;https://it.wikipedia.org/wiki/Coppa_di_Francia_1980-1981
21;it;Chi è stato espulso dopo 56 secondi della partita Uruguay-Scozia ai Mondiali del 1986 ?;Batista;Rivero;Ramos;Cabrera;Expert;L'arbitro Joël Quinou spiegherà : non potevo accettare che un giocatore ritorna sul campo per distruggere un avversario.;
22;it;Qual è stato il soprannome dato al nazionale francese Bruno Bellone ?;Lucky Lyke;Popeye;Ispettore Gadget;Asterix;Expert;Soprannominato Lucky Luke in riferimento alla sua velocità, si è allenato all'AS Monaco con il quale ha vinto il campionato francese nel 1982.;https://it.wikipedia.org/wiki/Bruno_Bellone
23;it;Nel 1986, chi ha segnato 18 gol in 15 giornate di campionato ?;Philippe Fargeon;Vincent Estève;David Ginola;Frank Leboeuf;Expert;Diventato agente immobiliare, è anche consigliere comunale nella città di Bouscat, vicino a Bordeaux.;https://it.wikipedia.org/wiki/Philippe_Fargeon
24;it;Quale club acquistato da Elton John ha raggiunto il D1 nel maggio 1982 ?;Watford FC;Cardiff City;Southampton FC;Crystal Palace;Expert;Campione dell'Inghilterra D3 nel 1969 e nel 1998, il Watford FC sarà promosso in Premier League alla fine della stagione 2014-15.;https://it.wikipedia.org/wiki/Watford_Football_Club
25;it;Quale club acquistato da Elton John ha raggiunto il D1 nel maggio 1982 ?;Watford FC;Cardiff City;Southampton FC;Crystal Palace;Expert;Campione dell'Inghilterra D3 nel 1969 e nel 1998, il Watford FC sarà promosso in Premier League alla fine della stagione 2014-15.;https://it.wikipedia.org/wiki/Watford_Football_Club
26;it;Nel 1988, in quale città si è svolta la prima mostra di pittura di Eric Cantona ?;Marsiglia;Parigi;Brest;Orleans;Expert;I suoi dipinti saranno descritti come violenti, espressionisti, molto colorati, con fuoco e dollari ovunque.;
27;it;Qual era il nome della mascotte dei Mondiali del 1982 in Spagna ?;Naranjito;Gauchito;Juanito;Ciao;Expert;Raffigura un'arancia, frutto tipico della Spagna, indossa la maglia rossa della nazionale e un pallone da calcio sotto il braccio.;
28;it;La figlia di quale suonatore dello Stade Brestois degli anni '80 è diventata cantante ?;Nolwenn Leroy;Vanessa Paradis;Jennifer;Lorie Pester;Expert;Jean-Luc Le Maqueresse si è divertito molto allo Stade Brestois, RC Paris, RC Lens, prima di finire all'EA Guingamp.;
29;it;Quante selezioni conta Michel Platini con i Blues ?;72;62;82;92;Expert;Michel Platini ha anche giocato durante la sua carriera una partita ufficiale con il Kuwait il 27 novembre 1988 contro l'URSS.;https://it.wikipedia.org/wiki/Michel_Platini
30;it;Nel 1988, quale allenatore avrebbe firmato per il Barca al posto di Johan Cruyff ?;Javier Clemente;Leo Beenhakker;Arsenio Iglesias;Vicente Cantatore;Expert;Nel 1971, un grave infortunio pose fine alla carriera da giocatore di Javier Clemente quando aveva solo 21 anni.;https://it.wikipedia.org/wiki/Javier_Clemente
1;nl;Wat was de bijnaam van de Argentijnse aanvallende middenvelder Alberto Marico ?;Beto;Mouzo;Russo;Pumpido;Débutant;Beto had als speler de bijzonderheid om volgens hem voornamelijk pizza's te eten, van acht tot tien per week.;
2;nl;Aan wie hebben we de fantastische volley in de finale van Euro 1988 tegen de USSR te danken ?;Marco van Basten;Jean-Pierre Papin;Roberto Baggio;Ruud Gullit;Débutant;Marco van Basten, geboren in 1964 in Utrecht, is een Nederlands international voetballer die coach en vervolgens manager werd.;https://nl.wikipedia.org/wiki/Marco_van_Basten
3;nl;Welke wereldwijde ramp heeft de overwinning van Dynamo Kiev tegen Madrid in 1986 ontsierd ?;Tsjernobyl;Bhopal;Chalk River;Fleurus;Débutant;Tijdens deze wedstrijd verstikten de Sovjets de Spanjaarden fysiek door driemaal te scoren op de tegenaanval (3-0).;https://nl.wikipedia.org/wiki/FC_Dynamo_Kiev
4;nl;In 1983, waarom sprak Michel Platini de techniek persoonlijk ?;Patrick;Nike;Puma;Adidas;Débutant;Het bedrijf werd in 2009 overgenomen door de Belgische groep Cortina en is vandaag gevestigd in Oudenaarde (België).;https://nl.wikipedia.org/wiki/Patrick_(bedrijf)
5;nl;Welke geniale nummer 10 had koning Pelé bleek kunnen doen verbleken op het WK van 1982 ?;Zico;Nunes;Edmar;Careca;Débutant;De Braziliaanse Pelé Blanc markeerde 52 doelpunten op zijn 72 selecties met het Brazilië tussen 1976 en 1988.;https://nl.wikipedia.org/wiki/Zico
6;nl;Welke show wilde Renaud niet missen in een van zijn liedjes ?;« Telefoot »;« Foot and Co »;« Voetbaldag »;« Fase 2 »;Débutant;De huidige muziek in de aftiteling is een titel uit de « Kill Bill » soundtrack : « Battle without Honour or humanity ».;
7;nl;Wie scoorde het 1.200ste doelpunt in de geschiedenis van het WK voetbal in 1986 ?;Jean-Pierre Papin;Marco Van Basten;Roberto Baggio;Ruud Gullit;Débutant;Jean-Pierre Papin was in 1991 de derde Franse speler die de Gouden Bal won, na Raymond Kopa en Michel Platini.;https://nl.wikipedia.org/wiki/Jean-Pierre_Papin
8;nl;Waar hebben de Blues zich voorbereid op de voetbalwereld in 1982 en 1986 ?;Font-Romeu;Bourg-Madame;Targassonne;Vernet-les-Bains;Débutant;De stad ligt ten westen van het departement Pyrénées-Orientales, in het hart van de Catalaanse Pyreneeën, in Cerdanya.;https://nl.wikipedia.org/wiki/Font-Romeu-Odeillo-Via
9;nl;Wat was het eerste Afrikaanse team dat de duivinnen passeerde op het WK ?;Marokko;Algerije;Soedan;Togo;Débutant;De organisatie van de Mundial 1986 werd aanvankelijk in 1978 toevertrouwd aan Colombia, dat zich in 1982 moest terugtrekken.;
10;nl;Welk land zou oorspronkelijk het WK 1986 thuis organiseren ?;Colombia;Argentinië;Brazilië;Bolivia;Débutant;Het evenement werd om financiële redenen verlaten en verhuisde vervolgens naar Mexico, zestien jaar na de editie van 1970.;
11;nl;Hoe krachtig was de aardbeving in Mexico die plaatsvond vóór het WK ?;8.1;7.1;6.1;5.1;Confirmé;Deze aardbeving vond plaats op 19 september 1985 veroorzaakt ongeveer 10.000 sterfgevallen en 30.000 gewonden in Mexico-stad.;
12;nl;Welke Franse voetballer zong in de eerste hymne van de Restos du Coeur ?;Michel Platini;Alain Giresse;Bernard Lacombe;Manuel Amoros;Confirmé;De kenmerkende spelmaker voor het Franse team van 1976 tot 1987, Michel Platini scoorde 356 doelpunten tijdens zijn carrière.;https://nl.wikipedia.org/wiki/Michel_Platini
13;nl;Delio Onnis stopte zijn carrière in 1986 met hoeveel doelpunten op zijn naam ?;299;269;239;209;Confirmé;Deze Italiaans-Argentijnse spits is met 299 doelpunten de topscorer in de geschiedenis van de Franse Premier League.;https://nl.wikipedia.org/wiki/Delio_Onnis
14;nl;Hoe bracht Socrates midden in een spel politieke boodschappen over ?;Op hoofdbanden;Op zijn trui;Op zijn sokken;Op zijn korte broek;Confirmé;Zijn berichten werden geschreven tegen de dictatuur in Brazilië, zoals democratie, stemmen of zijn niet bang voor terreur.;
15;nl;Welk merk werd in 1984 de officiële Engelse leverancier ?;Umbro;Slazenger;KooGa;Gola;Confirmé;Umbro is een fabrikant van sportuitrusting die in 1924 in Wilmslow in Engeland is opgericht onder de naam Humphrey Brothers Clothing.;https://nl.wikipedia.org/wiki/Umbro
16;nl;Welke Deense international kwam eind jaren tachtig bij de Girondins ?;Jesper Olsen;Soren Lerby;Ivan Nielsen;Ole Rasmussen;Confirmé;Deze linksbuiten werd tussen 1981 en 1984 bekend onder het shirt van Ajax Amsterdam, toen van Manchester United.;https://nl.wikipedia.org/wiki/Jesper_Olsen
17;nl;Welke Franse buis kwam in de ether tijdens het WK 1986 ?;« Viva les Bleus »;« Een twee drie »;« Alles voor voetbal »;« Heilige Marius »;Confirmé;Onder de zangers kunnen we Enrico Macias, Philippe Lavil, Sacha Distel, Sim, Carlos, Michel Boujenah en Marcel Amont noemen.;
18;nl;Wie slaagde Jean Fournet-Fayard aan het hoofd van de FFF in 1985 ?;Fernand Sastre;Jacques Georges;Claude Simonet;Antoine Chiarisoli;Confirmé;Met de verantwoordelijkheid van de FFF die betrokken is bij het drama van Furiani op 5 mei 1992, zal Fournet-Fayard worden aangeklaagd.;
19;nl;Wie is de meest vriendelijke coach van de World Cup van 1986 verklaard ?;Henri Michel;Michel Hidalgo;Laurent Blanc;Roger Lemerre;Confirmé;Hij wordt dan in het bijzonder coach van Paris Saint-Germain en van verschillende Afrikaanse clubs en nationale teams.;https://nl.wikipedia.org/wiki/Henri_Michel
20;nl;Aan welk team reikte François Mitterrand de Coupe de France in juni 1981 toe ?;SC Bastia;RC Lens;AS Angoulême;Paris FC;Confirmé;Deze 64ste editie van de Coupe de France is de allereerste gewonnen door de Corsicaanse club (hier op AS Saint-Étienne in de finale).;https://nl.wikipedia.org/wiki/Coupe_de_France_1980/81
21;nl;Wie werd er na 56 seconden van de wedstrijd Uruguay-Schotland op het WK 1986 weggestuurd ?;Batista;Rivero;Ramos;Cabrera;Expert;De scheidsrechter Joël Quiniou zal uitleggen : ik kon niet accepteren dat een speler terugkeert naar het veld om een  ? ?tegenstander te vernietigen.;
22;nl;Wat was de bijnaam die aan de Franse international Bruno Bellone werd gegeven ?;Lucky Lyke;Popeye;Inspectorgadget;Asterix;Expert;Bijgenaamd Lucky Luke vanwege zijn snelheid, werd hij opgeleid bij AS Monaco met wie hij in 1982 het Franse kampioenschap won.;https://nl.wikipedia.org/wiki/Bruno_Bellone
23;nl;Wie scoorde in 1986 18 doelpunten in 15 kampioenschapsdagen ?;Philippe Fargeon;Vincent Estève;David Ginola;Frank Leboeuf;Expert;Als makelaar in onroerend goed is hij ook gemeenteraadslid in de stad Bouscat, nabij Bordeaux.;
24;nl;Welke club, gekocht door Elton John, bereikte de D1 in mei 1982 ?;Watford FC;Cardiff City;FC Southampton;Crystal Palace;Expert;Watford FC, de Engelse D3-kampioen in 1969 en 1998, promoveert aan het einde van het seizoen 2014-15 naar de Premier League.;https://nl.wikipedia.org/wiki/Watford_FC
25;nl;Welke club, gekocht door Elton John, bereikte de D1 in mei 1982 ?;Watford FC;Cardiff City;FC Southampton;Crystal Palace;Expert;Watford FC, de Engelse D3-kampioen in 1969 en 1998, promoveert aan het einde van het seizoen 2014-15 naar de Premier League.;https://nl.wikipedia.org/wiki/Watford_FC
26;nl;In welke stad vond in 1988 de eerste schildertentoonstelling van Eric Cantona plaats ?;Marseille;Parijs;Brest;Orleans;Expert;De schilderijen zullen worden omschreven als gewelddadige, expressionisten, zeer kleurrijk, met vuur en dollars overal.;
27;nl;Hoe heette de mascotte van het WK 1982 in Spanje ?;Naranjito;Gauchito;Juanito;Ciao;Expert;Het vertegenwoordigt een oranje, typisch Spaanse vrucht, met de rode trui van het nationale team en een voetbal onder de arm.;https://nl.wikipedia.org/wiki/Naranjito (mascotte)
28;nl;De dochter waarvan Stade Brestois-speler uit de jaren 80 zangeres werd ?;Nolwenn Leroy;Vanessa Paradis;Jennifer;Lorie Pester;Expert;Jean-Luc Le Maqueresse had een geweldige tijd in Stade Brestois, RC Paris, RC Lens, voordat hij eindigde bij EA Guingamp.;
29;nl;Hoeveel selecties telt Michel Platini bij de Blues ?;72;62;82;92;Expert;Michel Platini speelde tijdens zijn carrière ook een officiële wedstrijd met Koeweit op 27 november 1988 tegen de USSR.;https://nl.wikipedia.org/wiki/Michel_Platini
