11;es;¿Qué término científico se utiliza para referirse al azúcar de mesa ?;Sacarosa;Fructosa;Glucosa;Maltosa;Confirmé;El poder edulcorante de la sacarosa se utiliza como referencia en la escala de productos edulcorantes.;https://es.wikipedia.org/wiki/Sacarosa
12;es;¿Cuántos kilos de azúcar consumen de media los franceses al año ?;30 kg;50 kg;10 kg;70 kg;Confirmé;El azúcar es una sustancia de sabor suave que se extrae principalmente de la caña de azúcar y la remolacha azucarera.;https://es.wikipedia.org/wiki/Azúcar
13;es;¿Cuántas veces más poder endulzante tiene la stevia que la sacarosa ?;300 veces;30 veces;3 veces;3000 veces;Confirmé;La stevia fue estudiada por primera vez por el botánico y médico español Petrus Jacobus Stevus, quien le dio su nombre a la planta.;https://es.wikipedia.org/wiki/Stevia (género)
14;es;En el siglo XII, ¿cómo se usaba el azúcar, inicialmente reservado a los boticarios ?;Medicación;Curador;Tratar;Castigo;Confirmé;El azúcar no se convertirá realmente en un ingrediente utilizado en la cocina hasta el siglo XVIII.;https://es.wikipedia.org/wiki/Azúcar
15;es;¿Cuál es la impresionante vida útil del azúcar ?;Ilimitado;5 años;15 años;25 años;Confirmé;En Francia, las ventas de azúcar aumentaron de 5 kg / año / cápita en 1850 a 30-35 kg en la década de 1970.;https://es.wikipedia.org/wiki/Azúcar
16;es;¿A qué temperatura se debe calentar el azúcar para obtener caramelo ?;150 ° C;100 ° C;50 ° C;200 ° C;Confirmé;El apellido Caramel también existe y es bastante común en el sur de Francia.;https://es.wikipedia.org/wiki/Caramelo
17;es;¿Qué país es el mayor exportador de azúcar de remolacha ?;Brasil;Rusia;Francia;Camerún;Confirmé;El cultivo de remolacha azucarera ocupa alrededor de 4,4 millones de hectáreas en todo el mundo.;
18;es;¿Qué azúcar se obtiene por cristalización lenta de un jarabe formando cristales grandes ?;Candi;Pearl;Hielo;Rubio;Confirmé;El azúcar dulce, que apareció en Europa en el siglo XIX, está compuesto de azúcar de caña en forma de cristales muy grandes.;https://es.wikipedia.org/wiki/Azúcar_piedra
19;es;¿Cuál es el porcentaje de sacarosa que contiene una caña de azúcar ?;14%;24%;34%;44%;Confirmé;Con dos mil millones de toneladas producidas, la caña de azúcar es la primera planta cultivada en todo el mundo.;
20;es;¿Cuál es el color natural del azúcar de remolacha después de la extracción y purificación ?;Blanco;Morena;Amarillo;Negro;Confirmé;La remolacha azucarera se utiliza para la producción de azúcar (incluida la verguesa) y, en segundo lugar, alcohol y etanol combustible.;
21;es;¿Cuántas calorías te aporta un terrón de azúcar de seis gramos ?;24 kcal;37 kcal;42 kcal;54 kcal;Expert;El azúcar en terrones se clasifica por tamaño : « dominó número 4 » indicará que la caja (1 kg) tiene 4 filas.;
22;es;¿Qué líder permitió el desarrollo del azúcar de remolacha en Francia ?;Napoleón;Louis XIV;Felipe II;Charles VI;Expert;Primer emperador de Francia, Napoleón reorganizó y reformó el estado y la sociedad de forma duradera.;
23;es;¿Cuántos países producen azúcar en el mundo ?;119;99;79;59;Expert;De los 119 países productores, 40 cultivan remolacha azucarera y proporcionaron alrededor del 20% de la producción en 2011.;https://es.wikipedia.org/wiki/Azúcar
24;es;¿Qué sabor primario complementa al dulce, salado y ácido ?;El amargo;El picante;Grasa;El picante;Expert;El amargor es una característica importante de la cerveza, al igual que el contenido de alcohol, por ejemplo.;https://es.wikipedia.org/wiki/Sabor amargo
25;es;¿En qué año nació el azúcar en terrones, elaborado mediante un proceso artesanal ?;1841;1949;1742;1644;Expert;El azúcar en terrones se elabora uniendo cristales de azúcar con jarabe de azúcar.;
26;es;¿Quién introdujo la caña de azúcar en Europa ?;Persas;Griegos;Árabes;Francos;Expert;La caña de azúcar es una gran hierba herbácea tropical con hábito de junco, cuya altura varía de dos a seis metros.;
27;es;La palabra azúcar, que designa carbohidratos con poder edulcorante, ¿de qué palabra sánscrita proviene ?;Sarkara;Sucara;Soukra;Sinakra;Expert;El término azúcar proviene del término italiano zucchero, tomado del árabe sukkar.;https://es.wikipedia.org/wiki/Azúcar
28;es;¿Quién fue el primero en extraer azúcar de remolacha en grandes cantidades ?;B. Delessert;S. Bernard;Th. Gauge;D. Botón;Expert;Benjamin Delessert es también el fundador de las Cajas de Ahorros en Francia en 1818.;https://es.wikipedia.org/wiki/Jules_Paul_Benjamin_Delessert
29;es;¿Cuántos kilos de azúcar da en promedio una tonelada de remolacha ?;140 kg;110 kg;170 kg;200 kg;Expert;En los últimos años, el jugo de remolacha azucarera se ha utilizado como fondant para carreteras en América del Norte.;
30;es;¿Qué le agregas al azúcar glas para evitar que se apelmace ?;Almidón;Petróleo;Jugo de limon;Lecitina;Expert;El azúcar glas se utiliza principalmente para decorar pasteles o para endulzar los blancos de nieve.;https://es.wikipedia.org/wiki/Azúcar_glas
1;it;Nelle nostre regioni, da quale barbabietola da zucchero viene estratta principalmente ?;Zuccheriera;Trince semoventi;Orto;Marinaio;Débutant;Le barbabietole da zucchero, di cui esistono molte varietà, sono di colore bianco e molto interrate.;
2;it;Di quale composto è composta la maggior parte dello zucchero ?;Saccarosio;Glucosio;Maltosio;Fruttosio;Débutant;I carboidrati, e più specificamente il saccarosio, una volta erano chiamati carboidrati.;https://it.wikipedia.org/wiki/Saccarosio
3;it;Come si chiama lo zucchero nella frutta ?;Fruttosio;Glucosio;Galattosio;Maltosio;Débutant;Il fruttosio ha un potere dolcificante superiore al saccarosio, dal 20 al 40% a seconda delle condizioni.;https://it.wikipedia.org/wiki/Fruttosio
4;it;Quanti pezzi di zucchero contiene una lattina da 33 cl di Coca-Cola ?;7;3;11;15;Débutant;Il consumo di bevande zuccherate, se non compensato da un'ora di sport per lattina, è dannoso per tutta la vita.;https://it.wikipedia.org/wiki/Coca-Cola
5;it;Quale malattia può essere causata da un consumo eccessivo di zucchero ?;Diabete;Influenza;Depressione;Ipertensione;Débutant;Il diabete mellito (con glicosuria), il più comune in noi, è legato ad un'anomalia nella sintesi o nell'azione dell'insulina.;
6;it;Quale nome è comunemente usato per designare lo zucchero di canna ?;Zucchero di canna;Zucchero candito;Zucchero a velo;Zucchero gelificante;Débutant;In Belgio e nel nord della Francia, lo zucchero di canna si riferisce anche a una sorta di vergeoise.;
7;it;In cottura cosa forma lo zucchero bianco mescolato con un po 'd'acqua ?;Sciroppo;Gelato;Impasto;Jam;Débutant;Il termine sciroppo è anche usato per descrivere liquidi viscosi contenenti qualcosa di diverso dallo zucchero in soluzione.;https://it.wikipedia.org/wiki/Sciroppo
8;it;Quale dei seguenti non si riferisce a un carboidrato con potere dolcificante ?;Alitosi;Fruttosio;Glucosio;Maltosio;Débutant;L'alitosi, o alito cattivo, è quando hai un alito che ha un cattivo odore.;https://it.wikipedia.org/wiki/Alitosi
9;it;Quale problema con lo zucchero può distruggere lo smalto dei denti ?;Decadimento;Gengivite;Deglutizione;Fluoro;Débutant;Per la maggior parte degli altri mammiferi, la carie è un segno di cattiva salute generale e carenze nutrizionali.;https://it.wikipedia.org/wiki/Carie_dentaria
10;it;Qual è lo zucchero che fa “fissarsi” più facilmente marmellate e gelatine ?;Agente gelificante;Candi;Perla;Ghiaccio;Débutant;L'origine animale della gelatina non deve essere specificata secondo i regolamenti a meno che l'origine non sia bovina.;
11;it;Quale termine scientifico viene utilizzato per riferirsi allo zucchero da tavola ?;Saccarosio;Fruttosio;Glucosio;Maltosio;Confirmé;Il potere dolcificante del saccarosio è utilizzato come parametro di riferimento nella scala dei prodotti dolcificanti.;https://it.wikipedia.org/wiki/Saccarosio
12;it;Quanti chili di zucchero consumano in media ogni anno i francesi ?;30 kg;50 kg;10 kg;70 kg;Confirmé;Lo zucchero è una sostanza dal sapore delicato che viene estratta principalmente dalla canna da zucchero e dalle barbabietole da zucchero.;
13;it;Quante volte più potere dolcificante è la stevia del saccarosio ?;300 volte;30 volte;3 volte;3.000 volte;Confirmé;La stevia fu studiata per la prima volta dal botanico e medico spagnolo Petrus Jacobus Stevus, che diede il nome alla pianta.;
14;it;Nel XII secolo come si utilizzava lo zucchero, inizialmente riservato agli speziali ?;Farmaco;Curatore;Trattare;Punizione;Confirmé;Lo zucchero non diventerà davvero un ingrediente utilizzato in cucina fino al XVIII secolo.;
15;it;Qual è l'impressionante durata di conservazione dello zucchero ?;Illimitato;5 anni;15 anni;25 anni;Confirmé;In Francia, le vendite di zucchero sono passate da 5 kg / anno / pro capite nel 1850 a 30-35 kg negli anni '70.;
16;it;A che temperatura va riscaldato lo zucchero per ottenere il caramello ?;150 ° C;100 ° C;50 ° C;200 ° C;Confirmé;Il cognome Caramel esiste anche ed è piuttosto comune nel sud della Francia.;https://it.wikipedia.org/wiki/Caramello
17;it;Quale paese è il più grande esportatore di zucchero di barbabietola ?;Brasile;Russia;Francia;Camerun;Confirmé;La coltivazione della barbabietola da zucchero occupa circa 4,4 milioni di ettari nel mondo.;
18;it;Quale zucchero si ottiene dalla cristallizzazione lenta di uno sciroppo formando grossi cristalli ?;Candi;Perla;Ghiaccio;Biondo;Confirmé;Lo zucchero candito, apparso in Europa nel XIX secolo, è costituito da zucchero di canna sotto forma di cristalli molto grandi.;
19;it;Qual è la percentuale di saccarosio contenuta in una canna da zucchero ?;14%;24%;34%;44%;Confirmé;Con due miliardi di tonnellate prodotte, la canna da zucchero è la prima pianta coltivata al mondo.;
20;it;Qual è il colore naturale dello zucchero di barbabietola dopo l'estrazione e la purificazione ?;Bianco;Bruna;Giallo;Nero;Confirmé;La barbabietola da zucchero viene utilizzata per la produzione di zucchero (compresa la vergeoise) e secondariamente alcol ed etanolo combustibile.;
21;it;Quante calorie ti dà una zolletta di zucchero da sei grammi ?;24 kcal;37 kcal;42 kcal;54 kcal;Expert;La zolletta di zucchero è classificata per dimensione : « numero 4 di domino » indicherà che la scatola (1 kg) ha 4 righe.;
22;it;Quale leader ha consentito lo sviluppo dello zucchero di barbabietola in Francia ?;Napoleone;Louis XIV;Filippo II;Carlo VI;Expert;Primo imperatore dei francesi, Napoleone riorganizzò e riformò lo stato e la società in modo duraturo.;
23;it;Quanti paesi producono zucchero nel mondo ?;119;99;79;59;Expert;Su 119 paesi produttori, 40 coltivano barbabietola da zucchero e hanno fornito circa il 20% della produzione nel 2011.;
24;it;Quale sapore principale completa il dolce, il salato e l'acido ?;L'amaro;La piccantezza;Grasso;Il piccante;Expert;L'amaro è una caratteristica importante della birra, così come il contenuto di alcol, ad esempio.;https://it.wikipedia.org/wiki/Amaro (sapore)
25;it;In che anno è nata la zolletta di zucchero, prodotta con procedimento artigianale ?;1841;1949;1742;1644;Expert;Lo zucchero in grumi si ottiene legando i cristalli di zucchero con lo sciroppo di zucchero.;
26;it;Da quali persone è stata introdotta la canna da zucchero in Europa ?;Persiani;Greci;Arabi;Franchi;Expert;La canna da zucchero è una grande erba erbacea tropicale con un portamento di canna, che varia in altezza da due a sei metri.;
27;it;Da quale parola sanscrita deriva la parola zucchero, che designa i carboidrati con potere dolcificante ?;Sarkara;Sucara;Soukra;Sinakra;Expert;Il termine zucchero deriva dal termine italiano zucchero, a sua volta preso in prestito dall'arabo sukkar.;
28;it;Chi è stato il primo a estrarre lo zucchero di barbabietola in grandi quantità ?;B. Delessert;S. Bernard;Th. Gauge;Pulsante D.;Expert;Benjamin Delessert è anche il fondatore delle casse di risparmio in Francia nel 1818.;https://it.wikipedia.org/wiki/Benjamin_Delessert
29;it;Quanti chili di zucchero dà in media una tonnellata di barbabietole ?;140 kg;110 kg;170 kg;200 kg;Expert;Negli ultimi anni, il succo di barbabietola da zucchero è stato utilizzato come fondente da strada in Nord America.;
30;it;Cosa aggiungete allo zucchero a velo per evitare che si raggrumi ?;Amido;Olio;Succo di limone;Lecitina;Expert;Lo zucchero a velo viene utilizzato principalmente per decorare la pasticceria o per addolcire i bianchi della neve.;https://it.wikipedia.org/wiki/Zucchero_a_velo
1;nl;Van welke suikerbiet wordt in onze streken voornamelijk gewonnen ?;Suikerpot;Hakselaar;Moestuin;Matroos;Débutant;Suikerbieten, waarvan er veel soorten zijn, zijn wit van kleur en erg begraven.;
2;nl;Van welke samenstelling is de meeste suiker gemaakt ?;Sucrose;Glucose;Maltose;Fructose;Débutant;Koolhydraten, en meer specifiek sucrose, werden ooit koolhydraten genoemd.;https://nl.wikipedia.org/wiki/Sacharose
3;nl;Hoe heet de suiker in fruit ?;Fructose;Glucose;Galactose;Maltose;Débutant;Fructose heeft een hogere zoetkracht dan sucrose, van 20 tot 40% afhankelijk van de omstandigheden.;https://nl.wikipedia.org/wiki/Fructose
4;nl;Hoeveel stukjes suiker bevat een blikje Coca-Cola van 33 cl ?;7;3;11;15;Débutant;De consumptie van suikerhoudende dranken, indien niet gecompenseerd door een uur sporten per blik, is schadelijk voor het leven.;https://nl.wikipedia.org/wiki/Coca-Cola
5;nl;Welke ziekte kan worden veroorzaakt door overmatige consumptie van suiker ?;Diabetes;Griep;Depressie;Hypertensie;Débutant;Diabetes mellitus (met glycosurie), de meest voorkomende bij ons, houdt verband met een afwijking in de synthese of werking van insuline.;
6;nl;Welke naam wordt gewoonlijk gebruikt om bruine suiker aan te duiden ?;Bruine suiker;Kandijsuiker;Poedersuiker;Gelerende suiker;Débutant;In België en Noord-Frankrijk verwijst bruine suiker ook naar een soort berm.;
7;nl;Wat vormt bij het bakken witte suiker gemengd met een beetje water ?;Siroop;IJs;Deeg;Jam;Débutant;De term siroop wordt ook gebruikt om stroperige vloeistoffen te beschrijven die iets anders dan suiker in oplossing bevatten.;https://nl.wikipedia.org/wiki/Stroop
8;nl;Welke van de volgende heeft geen betrekking op een koolhydraat met zoetkracht ?;Halitosis;Fructose;Glucose;Maltose;Débutant;Halitose, of slechte adem, is wanneer je een slechte adem hebt.;https://nl.wikipedia.org/wiki/Halitose
9;nl;Welk probleem met suiker kan tandglazuur vernietigen ?;Verval;Tandvleesontsteking;Slikken;Fluor;Débutant;Voor de meeste andere zoogdieren is bederf een teken van een slechte algemene gezondheid en voedingstekorten.;https://nl.wikipedia.org/wiki/Cariës
10;nl;Welke suiker zorgt ervoor dat jam en gelei gemakkelijker ;Geleermiddel;Candi;Parel;IJs;Débutant;De dierlijke oorsprong van de gelatine hoeft niet te worden gespecificeerd volgens de regelgeving, tenzij de oorsprong van runderen is.;
11;nl;Welke wetenschappelijke term wordt gebruikt om naar tafelsuiker te verwijzen ?;Sucrose;Fructose;Glucose;Maltose;Confirmé;De zoetkracht van sucrose wordt gebruikt als maatstaf in de schaal van zoetstoffen.;https://nl.wikipedia.org/wiki/Sacharose
12;nl;Hoeveel kilo suiker consumeren de Fransen gemiddeld per jaar ?;30 kg;50 kg;10 kg;70 kg;Confirmé;Suiker is een mild smakende stof die voornamelijk wordt gewonnen uit suikerriet en suikerbieten.;https://nl.wikipedia.org/wiki/Tafelsuiker
13;nl;Hoeveel keer meer zoetkracht is stevia dan sucrose ?;300 keer;30 keer;3 keer;3.000 keer;Confirmé;Stevia werd voor het eerst bestudeerd door de Spaanse botanicus en arts Petrus Jacobus Stevus, die de plant zijn naam gaf.;https://nl.wikipedia.org/wiki/Stevia (geslacht)
14;nl;Hoe werd in de 12e eeuw suiker gebruikt, aanvankelijk gereserveerd voor apothekers ?;Medicatie;Curator;Behandelen;Straf;Confirmé;Suiker zal pas in de 18e eeuw een ingrediënt worden dat wordt gebruikt bij het koken.;https://nl.wikipedia.org/wiki/Tafelsuiker
15;nl;Wat is de indrukwekkende houdbaarheid van suiker ?;Onbeperkt;5 jaar;15 jaar;25 jaar;Confirmé;In Frankrijk steeg de suikerverkoop van 5 kg / jaar / inwoner in 1850 tot 30-35 kg in de jaren zeventig.;https://nl.wikipedia.org/wiki/Tafelsuiker
16;nl;Op welke temperatuur moet de suiker worden verwarmd om karamel te verkrijgen ?;150 ° C;100 ° C;50 ° C;200 ° C;Confirmé;De achternaam Caramel bestaat ook en komt vrij veel voor in Zuid-Frankrijk.;https://nl.wikipedia.org/wiki/Karamel
17;nl;Welk land is de grootste exporteur van bietsuiker ?;Brazilië;Rusland;Frankrijk;Kameroen;Confirmé;De teelt van suikerbieten beslaat wereldwijd ongeveer 4,4 miljoen hectare.;
18;nl;Welke suiker wordt verkregen door langzame kristallisatie van een siroop die grote kristallen vormt ?;Candi;Parel;IJs;Blond;Confirmé;Kandijsuiker, die in de 19e eeuw in Europa verscheen, bestaat uit rietsuiker in de vorm van zeer grote kristallen.;https://nl.wikipedia.org/wiki/Kandij
19;nl;Wat is het percentage sucrose in een suikerriet ?;14%;24%;34%;44%;Confirmé;Met 2 miljard ton geproduceerd, is suikerriet de eerste gecultiveerde plant ter wereld.;
20;nl;Wat is de natuurlijke kleur van bietsuiker na extractie en zuivering ?;Wit;Brunette;Geel;Zwart;Confirmé;Suikerbiet wordt gebruikt voor de productie van suiker (inclusief bermen), en in de tweede plaats alcohol en brandstof ethanol.;
21;nl;Hoeveel calorieën levert een klontje suiker van zes gram u op ?;24 kcal;37 kcal;42 kcal;54 kcal;Expert;De suikerklontjes zijn ingedeeld naar grootte : « domino nummer 4 » geeft aan dat de doos (1 kg) 4 rijen heeft.;https://nl.wikipedia.org/wiki/Suikerklontje
22;nl;Welke leider heeft de ontwikkeling van bietsuiker in Frankrijk mogelijk gemaakt ?;Napoleon;Lodewijk XIV;Philip II;Charles VI;Expert;Napoleon, de eerste keizer van de Fransen, reorganiseerde en hervormde de staat en de samenleving duurzaam.;
23;nl;Hoeveel landen produceren suiker in de wereld ?;119;99;79;59;Expert;Van de 119 producerende landen telen er 40 suikerbieten, die in 2011 voor ongeveer 20% van de productie zorgden.;https://nl.wikipedia.org/wiki/Tafelsuiker
24;nl;Welke primaire smaak vormt een aanvulling op zoet, zout en zuur ?;De bittere;De kruidigheid;Vet;De pittige;Expert;Bitterheid is een belangrijk kenmerk van bier, net als bijvoorbeeld het alcoholgehalte.;https://nl.wikipedia.org/wiki/Bitter (smaak)
25;nl;In welk jaar werd suikerklontjes geboren, gemaakt met een artisanaal proces ?;1841;1949;1742;1644;Expert;Suikerklontjes worden gemaakt door suikerkristallen te binden met suikersiroop.;https://nl.wikipedia.org/wiki/Suikerklontje
26;nl;Door welke mensen is suikerriet in Europa geïntroduceerd ?;Perzen;Grieken;Arabieren;Frank;Expert;Suikerriet is een groot tropisch kruidachtig gras met een rietvorm, variërend in hoogte van twee tot zes meter.;
27;nl;Het woord suiker, dat koolhydraten met zoetkracht aanduidt, komt van welk Sanskrietwoord ?;Sarkara;Sucara;Soukra;Sinakra;Expert;De term suiker komt van de Italiaanse term zucchero, zelf ontleend aan het Arabische sukkar.;https://nl.wikipedia.org/wiki/Tafelsuiker
28;nl;Wie was de eerste die bietsuiker in grote hoeveelheden won ?;B. Delessert;S. Bernard;Th. Spoor;D. knop;Expert;Benjamin Delessert is ook de oprichter van de spaarbanken in Frankrijk in 1818.;
29;nl;Hoeveel kilo suiker geeft gemiddeld een ton bieten ?;140 kg;110 kg;170 kg;200 kg;Expert;In de afgelopen jaren is suikerbietensap in Noord-Amerika als wegfondant gebruikt.;
30;nl;Wat voeg je toe aan de poedersuiker om klontering te voorkomen ?;Zetmeel;Olie;Citroensap;Lecithine;Expert;Poedersuiker wordt voornamelijk gebruikt voor het decoreren van gebak of voor het zoeten van sneeuwwitjes.;https://nl.wikipedia.org/wiki/Poedersuiker
