3;es;¿Cuál fue el primer coche francés que ofreció un modelo de tres puertas ?;R5;C4;106;Clío;Débutant;Gran éxito para la marca, el Renault 5 vendió más de cinco millones de unidades entre 1972 y 1984.;https://es.wikipedia.org/wiki/Renault_5
4;es;En « Le Corniaud », ¿qué coche choca con Bourvil ?;Rolls Royce;Cadillac;2 CV;Jaguar;Débutant;La trama de la película está inspirada en uno de los episodios del desmantelamiento de la Conexión Francesa a principios de los años 1960.;
5;es;¿En qué coche fue asesinado el presidente Kennedy de Estados Unidos ?;Lincoln Continental;Chrysler Newport;Chevrolet Corvair;Ford 300;Débutant;En Nueva York se presentó un Continental completamente nuevo, lanzado en 2016, para reemplazar al MKS.;https://es.wikipedia.org/wiki/Lincoln_Continental
6;es;¿Qué circuito de carreras también se llama Toboggan des Ardennes ?;Spa-Francorchamps;Monza;Zandvoort;Mónaco;Débutant;Es uno de los circuitos favoritos de los pilotos por la variedad de su trazado en el paisaje montañoso de las Ardenas belgas.;https://es.wikipedia.org/wiki/Circuito_de_Spa-Francorchamps
7;es;¿Quién es el fabricante del coche de la película « Regreso al futuro » ?;DeLorean;Pagani;Gumpert;McLaren;Débutant;El DeLorean DMC-12, un deportivo diseñado y fabricado por DMC, es el único modelo producido y comercializado por este fabricante.;https://es.wikipedia.org/wiki/Máquina_del_tiempo_DeLorean
8;es;¿En qué circuito de Fórmula 1 murió Ayrton Senna ?;Imola;Spa-Francorchamps;Monza;Zandvoort;Débutant;Fue reconocido por sus actuaciones en pistas mojadas, con victorias legendarias como la del Gran Premio de Portugal de 1985.;https://es.wikipedia.org/wiki/Ayrton_Senna
9;es;En Francia, ¿cómo se llaman comúnmente las luces de cruce ?;Códigos;Diodos;LED;Terminales;Débutant;Estos dispositivos de iluminación se utilizan en vehículos de motor y ayudan a conducir estos vehículos durante la noche.;
10;es;¿Cuál fue el vehículo más vendido en Francia en 2016 ?;Renault Clio;Citroën C3;Dacia Duster;Peugeot 206;Débutant;El Renault Clio I se fabricó entre 1990 y 1999, se rediseñó en 1994 y 1996 y finalmente fue sustituido en 1998 por el Clio II.;https://es.wikipedia.org/wiki/Renault_Clio
11;es;¿Qué marca de 4x4 utiliza el personal de « Jurassic Park » ?;Jeep;Ford;Renault;Toyota;Confirmé;Jeep es un fabricante de automóviles estadounidense perteneciente al grupo Fiat desde 2010, que se convirtió en Stellantis en 2021.;https://es.wikipedia.org/wiki/Jeep
12;es;¿Qué líder reunió a los fabricantes Renault, Mitsubishi y Nissan ?;Carlos Ghosn;Mathieu Gallet;Estanislao Guérini;Óscar Ghez;Confirmé;Fue detenido en 2018 por la justicia japonesa, sospechoso de ocultar ingresos en las publicaciones financieras de Nissan.;https://es.wikipedia.org/wiki/Carlos_Ghosn
13;es;¿Cuál es la nacionalidad del fabricante Kia Motors ?;Corea del Sur;Chino;japonés;Corea del Norte;Confirmé;Kia Motors Company, que emplea a más de 32.000 personas, es actualmente el fabricante de automóviles más antiguo de Corea.;https://es.wikipedia.org/wiki/Kia_Motors
14;es;¿Cómo se llaman tradicionalmente las camionetas BMW ?;Turismo;GT;Cortar;Minivan;Confirmé;Por ejemplo, el modelo BMW Serie 3 es un sedán familiar, que también está disponible en versión familiar (touring) y Gran Turismo (GT).;
15;es;¿Quién fue el mayor fabricante de automóviles del mundo en 2016 ?;Volkswagen;BMW;Ford;Tesla;Confirmé;Los orígenes de la marca se remontan a la Alemania nazi en los años 30 con el proyecto de construir el futuro Escarabajo.;https://es.wikipedia.org/wiki/Volkswagen
16;es;¿Cuáles son los dos colores del Chevrolet Camaro de la película « Transformers » ?;Amarillo y negro;Rojo y blanco;Verde y gris;Blanco y azul;Confirmé;Cuando se lanzó al mercado, Chevrolet especificó que el nombre del nuevo modelo provenía de una palabra francesa, camaro, que en jerga significa camarada.;https://es.wikipedia.org/wiki/Chevrolet_Camaro
17;es;¿En qué año apareció el limpiaparabrisas en los vehículos de motor ?;1910;1948;1923;1971;Confirmé;Un limpiaparabrisas tiene una vida útil media según los fabricantes de 500.000 ciclos, lo que corresponde a un año de uso.;https://es.wikipedia.org/wiki/Limpiaparabrisas
18;es;¿Cuál de estos fabricantes de automóviles no es japonés ?;Kia;Mazda;Honda;Mitsubishi;Confirmé;La primera sílaba Ki significa « revelarse al mundo », la segunda es la primera letra de la palabra Asia (Asia se revela al mundo).;https://es.wikipedia.org/wiki/Kia_Motors
19;es;¿Qué modelo de Lada consiguió victorias de etapa en el Dakkar ?;Niva;Vesta;Granta;Sámara;Confirmé;El éxito de este modelo fue tal que aparecieron clubes y escuelas donde se enseñaba a conducir todoterreno en el Niva.;https://es.wikipedia.org/wiki/Lada_Niva/VAZ-2121
20;es;¿Qué modelo de Lada consiguió victorias de etapa en el Dakkar ?;Niva;Vesta;Granta;Sámara;Confirmé;El éxito de este modelo fue tal que aparecieron clubes y escuelas donde se enseñaba a conducir todoterreno en el Niva.;https://es.wikipedia.org/wiki/Lada_Niva/VAZ-2121
21;es;¿Qué modelo de Lada consiguió victorias de etapa en el Dakkar ?;Niva;Vesta;Granta;Sámara;Expert;El éxito de este modelo fue tal que aparecieron clubes y escuelas donde se enseñaba a conducir todoterreno en el Niva.;https://es.wikipedia.org/wiki/Lada_Niva/VAZ-2121
22;es;¿Qué modelo de Lada consiguió victorias de etapa en el Dakkar ?;Niva;Vesta;Granta;Sámara;Expert;El éxito de este modelo fue tal que aparecieron clubes y escuelas donde se enseñaba a conducir todoterreno en el Niva.;https://es.wikipedia.org/wiki/Lada_Niva/VAZ-2121
23;es;¿Qué modelo de Lada consiguió victorias de etapa en el Dakkar ?;Niva;Vesta;Granta;Sámara;Expert;El éxito de este modelo fue tal que aparecieron clubes y escuelas donde se enseñaba a conducir todoterreno en el Niva.;https://es.wikipedia.org/wiki/Lada_Niva/VAZ-2121
24;es;¿Qué modelo de Lada consiguió victorias de etapa en el Dakkar ?;Niva;Vesta;Granta;Sámara;Expert;El éxito de este modelo fue tal que aparecieron clubes y escuelas donde se enseñaba a conducir todoterreno en el Niva.;https://es.wikipedia.org/wiki/Lada_Niva/VAZ-2121
25;es;¿Qué modelo de Lada consiguió victorias de etapa en el Dakkar ?;Niva;Vesta;Granta;Sámara;Expert;El éxito de este modelo fue tal que aparecieron clubes y escuelas donde se enseñaba a conducir todoterreno en el Niva.;https://es.wikipedia.org/wiki/Lada_Niva/VAZ-2121
26;es;¿Qué modelo de Lada consiguió victorias de etapa en el Dakkar ?;Niva;Vesta;Granta;Sámara;Expert;El éxito de este modelo fue tal que aparecieron clubes y escuelas donde se enseñaba a conducir todoterreno en el Niva.;https://es.wikipedia.org/wiki/Lada_Niva/VAZ-2121
27;es;¿Qué modelo de Lada consiguió victorias de etapa en el Dakkar ?;Niva;Vesta;Granta;Sámara;Expert;El éxito de este modelo fue tal que aparecieron clubes y escuelas donde se enseñaba a conducir todoterreno en el Niva.;https://es.wikipedia.org/wiki/Lada_Niva/VAZ-2121
28;es;¿Qué modelo de Lada consiguió victorias de etapa en el Dakkar ?;Niva;Vesta;Granta;Sámara;Expert;El éxito de este modelo fue tal que aparecieron clubes y escuelas donde se enseñaba a conducir todoterreno en el Niva.;https://es.wikipedia.org/wiki/Lada_Niva/VAZ-2121
29;es;¿Qué modelo de Lada consiguió victorias de etapa en el Dakkar ?;Niva;Vesta;Granta;Sámara;Expert;El éxito de este modelo fue tal que aparecieron clubes y escuelas donde se enseñaba a conducir todoterreno en el Niva.;https://es.wikipedia.org/wiki/Lada_Niva/VAZ-2121
30;es;¿Qué modelo de Lada consiguió victorias de etapa en el Dakkar ?;Niva;Vesta;Granta;Sámara;Expert;El éxito de este modelo fue tal que aparecieron clubes y escuelas donde se enseñaba a conducir todoterreno en el Niva.;https://es.wikipedia.org/wiki/Lada_Niva/VAZ-2121
1;it;Qual è il marchio di lusso della casa automobilistica Toyota ?;Lexus;Infiniti;Maybach;Panamera;Débutant;Creato nel 1989, il marchio Lexus è il primo produttore di fascia alta ad aver incorporato versioni ibride nei suoi prodotti.;https://it.wikipedia.org/wiki/Lexus
2;it;Quale prestigiosa marca automobilistica ha l'emblema dello Spirito dell'Estasi ?;Rolls-Royce;Loto;Cadillac;Lamborghini;Débutant;La statuetta fu creata nel 1911 dallo scultore inglese Charles Sykes per impreziosire i tappi dei radiatori del marchio.;https://it.wikipedia.org/wiki/Spirit_of_Ecstasy
3;it;Qual è stata la prima vettura francese a offrire un modello a tre porte ?;R5;C4;106;Clio;Débutant;Un grande successo per la marca, la Renault 5 ha venduto più di cinque milioni di unità tra il 1972 e il 1984.;https://it.wikipedia.org/wiki/Renault_5
4;it;In « Le Corniaud », quale macchina si scontra con Bourvil ?;Rolls-Royce;Cadillac;2 CV;Giaguaro;Débutant;La trama del film è ispirata a uno degli episodi dello smantellamento della French Connection all'inizio degli anni '60.;https://it.wikipedia.org/wiki/Colpo_grosso_ma_non_troppo
5;it;In quale macchina fu assassinato il presidente americano Kennedy ?;Lincoln continentale;Chrysler Newport;Chevrolet Corvair;Ford 300;Débutant;Una nuovissima Continental, lanciata nel 2016, è stata presentata a New York per sostituire la MKS.;https://it.wikipedia.org/wiki/Lincoln_Continental
6;it;Quale circuito è anche chiamato Toboggan des Ardennes ?;Spa-Francorchamps;Monza;Zandvoort;Monaco;Débutant;È uno dei circuiti preferiti dai piloti per la varietà del suo tracciato nel paesaggio montuoso delle Ardenne belghe.;https://it.wikipedia.org/wiki/Circuito_di_Spa-Francorchamps
7;it;Chi è il produttore dell'auto nel film « Ritorno al futuro » ?;DeLorean;Pagani;Gumpert;Mclaren;Débutant;La DeLorean DMC-12, un'auto sportiva progettata e prodotta da DMC, è l'unico modello prodotto e commercializzato da questo produttore.;https://it.wikipedia.org/wiki/DeLorean_(macchina_del_tempo)
8;it;In quale circuito di Formula 1 è morto Ayrton Senna ?;Imola;Spa-Francorchamps;Monza;Zandvoort;Débutant;È stato riconosciuto per le sue prestazioni sulle piste bagnate, con vittorie leggendarie come quella al Gran Premio del Portogallo del 1985.;https://it.wikipedia.org/wiki/Ayrton_Senna
9;it;In Francia, come vengono comunemente chiamate le luci anabbaglianti ?;Codici;Diodi;LED;Terminali;Débutant;Questi dispositivi di illuminazione vengono utilizzati sui veicoli a motore, aiutandoli a guidare di notte.;
10;it;Qual è stato il veicolo più venduto in Francia nel 2016 ?;Renault Clio;Citroën C3;Dacia Duster;Peugeot 206;Débutant;La Renault Clio I venne prodotta dal 1990 al 1999, restyling nel 1994 e nel 1996 ed infine sostituita nel 1998 dalla Clio II.;https://it.wikipedia.org/wiki/Renault_Clio
11;it;Quale marca di 4x4 utilizza lo staff di « Jurassic Park » ?;Jeep;Ford;Renault;Toyota;Confirmé;Jeep è una casa automobilistica americana appartenente al gruppo Fiat dal 2010, divenuto Stellantis nel 2021.;https://it.wikipedia.org/wiki/Jeep (azienda)
12;it;Quale leader ha riunito i produttori Renault, Mitsubishi e Nissan ?;Carlos Ghosn;Mathieu Gallet;Stanislao Guerini;Oscar Ghez;Confirmé;È stato arrestato nel 2018 dalla giustizia giapponese, sospettato di aver nascosto entrate nelle pubblicazioni finanziarie di Nissan.;https://it.wikipedia.org/wiki/Carlos_Ghosn
13;it;Qual è la nazionalità del produttore Kia Motors ?;Corea del Sud;Cinese;giapponese;Nordcoreano;Confirmé;Con più di 32.000 dipendenti, Kia Motors Company è attualmente la più antica casa automobilistica coreana.;https://it.wikipedia.org/wiki/Kia_Motors
14;it;Come vengono tradizionalmente chiamate le station wagon BMW ?;Touring;GT;Taglia;Minivan;Confirmé;Ad esempio, il modello BMW Serie 3 è una berlina familiare, disponibile anche come station wagon (touring) e Gran Turismo (GT).;
15;it;Chi era la più grande casa automobilistica del mondo nel 2016 ?;Volkswagen;BMW;Ford;Tesla;Confirmé;Le origini del marchio vanno ricercate nella Germania nazista degli anni '30 con il progetto di costruire il futuro Maggiolino.;https://it.wikipedia.org/wiki/Volkswagen
16;it;Quali sono i due colori della Chevrolet Camaro del film « Transformers » ?;Giallo e nero;Rosso e bianco;Verde e grigio;Bianco e blu;Confirmé;Quando venne lanciato sul mercato, Chevrolet precisò che il nome del nuovo modello derivava da una parola francese, camaro, che in slang significa compagno.;https://it.wikipedia.org/wiki/Chevrolet_Camaro
17;it;In che anno è apparso il tergicristallo sui veicoli a motore ?;1910;1948;1923;1971;Confirmé;Secondo i produttori, un tergicristallo ha una durata media di 500.000 cicli, che corrisponde a un anno di utilizzo.;https://it.wikipedia.org/wiki/Tergicristallo
18;it;Quale di queste case automobilistiche non è giapponese ?;Kia;Mazda;Honda;Mitsubishi;Confirmé;La prima sillaba Ki significa « rivelarsi al mondo », la seconda è la prima lettera della parola Asia (L'Asia si rivela al mondo).;https://it.wikipedia.org/wiki/Kia_Motors
19;it;Quale modello Lada ha ottenuto vittorie di tappa alla Dakkar ?;Niva;Vesta;Granta;Samara;Confirmé;Il successo di questo modello fu tale che apparvero club e scuole dove veniva insegnata la guida fuoristrada su Niva.;https://it.wikipedia.org/wiki/Lada-Vaz_Niva
20;it;Quale modello Lada ha ottenuto vittorie di tappa alla Dakkar ?;Niva;Vesta;Granta;Samara;Confirmé;Il successo di questo modello fu tale che apparvero club e scuole dove veniva insegnata la guida fuoristrada su Niva.;https://it.wikipedia.org/wiki/Lada-Vaz_Niva
21;it;Quale modello Lada ha ottenuto vittorie di tappa alla Dakkar ?;Niva;Vesta;Granta;Samara;Expert;Il successo di questo modello fu tale che apparvero club e scuole dove veniva insegnata la guida fuoristrada su Niva.;https://it.wikipedia.org/wiki/Lada-Vaz_Niva
22;it;Quale modello Lada ha ottenuto vittorie di tappa alla Dakkar ?;Niva;Vesta;Granta;Samara;Expert;Il successo di questo modello fu tale che apparvero club e scuole dove veniva insegnata la guida fuoristrada su Niva.;https://it.wikipedia.org/wiki/Lada-Vaz_Niva
23;it;Quale modello Lada ha ottenuto vittorie di tappa alla Dakkar ?;Niva;Vesta;Granta;Samara;Expert;Il successo di questo modello fu tale che apparvero club e scuole dove veniva insegnata la guida fuoristrada su Niva.;https://it.wikipedia.org/wiki/Lada-Vaz_Niva
24;it;Quale modello Lada ha ottenuto vittorie di tappa alla Dakkar ?;Niva;Vesta;Granta;Samara;Expert;Il successo di questo modello fu tale che apparvero club e scuole dove veniva insegnata la guida fuoristrada su Niva.;https://it.wikipedia.org/wiki/Lada-Vaz_Niva
25;it;Quale modello Lada ha ottenuto vittorie di tappa alla Dakkar ?;Niva;Vesta;Granta;Samara;Expert;Il successo di questo modello fu tale che apparvero club e scuole dove veniva insegnata la guida fuoristrada su Niva.;https://it.wikipedia.org/wiki/Lada-Vaz_Niva
26;it;Quale modello Lada ha ottenuto vittorie di tappa alla Dakkar ?;Niva;Vesta;Granta;Samara;Expert;Il successo di questo modello fu tale che apparvero club e scuole dove veniva insegnata la guida fuoristrada su Niva.;https://it.wikipedia.org/wiki/Lada-Vaz_Niva
27;it;Quale modello Lada ha ottenuto vittorie di tappa alla Dakkar ?;Niva;Vesta;Granta;Samara;Expert;Il successo di questo modello fu tale che apparvero club e scuole dove veniva insegnata la guida fuoristrada su Niva.;https://it.wikipedia.org/wiki/Lada-Vaz_Niva
28;it;Quale modello Lada ha ottenuto vittorie di tappa alla Dakkar ?;Niva;Vesta;Granta;Samara;Expert;Il successo di questo modello fu tale che apparvero club e scuole dove veniva insegnata la guida fuoristrada su Niva.;https://it.wikipedia.org/wiki/Lada-Vaz_Niva
29;it;Quale modello Lada ha ottenuto vittorie di tappa alla Dakkar ?;Niva;Vesta;Granta;Samara;Expert;Il successo di questo modello fu tale che apparvero club e scuole dove veniva insegnata la guida fuoristrada su Niva.;https://it.wikipedia.org/wiki/Lada-Vaz_Niva
30;it;Quale modello Lada ha ottenuto vittorie di tappa alla Dakkar ?;Niva;Vesta;Granta;Samara;Expert;Il successo di questo modello fu tale che apparvero club e scuole dove veniva insegnata la guida fuoristrada su Niva.;https://it.wikipedia.org/wiki/Lada-Vaz_Niva
1;nl;Wat is het luxemerk van autofabrikant Toyota ?;Lexus;Infiniti;Maybach;Panamera;Débutant;Het merk Lexus, opgericht in 1989, is de eerste high-end fabrikant die hybride versies in zijn producten heeft opgenomen.;https://nl.wikipedia.org/wiki/Lexus
2;nl;Welk prestigieus automerk heeft het Spirit of Ecstasy-embleem ?;Rolls-Royce;Lotus;Cadillac;Lamborghini;Débutant;Het beeldje werd in 1911 gemaakt door de Engelse beeldhouwer Charles Sykes om de radiatordoppen van het merk te verfraaien.;https://nl.wikipedia.org/wiki/Spirit_of_Ecstasy
3;nl;Wat was de eerste Franse auto met een driedeursmodel ?;R5;C4;106;Clio;Débutant;Een groot succes voor het merk : van de Renault 5 werden tussen 1972 en 1984 meer dan vijf miljoen exemplaren verkocht.;https://nl.wikipedia.org/wiki/Renault_5
4;nl;Welke auto komt in « Le Corniaud » in botsing met Bourvil ?;Rolls-Royce;Cadillac;2 CV;Jaguar;Débutant;De verhaallijn van de film is geïnspireerd op een van de afleveringen van de ontmanteling van de French Connection begin jaren zestig.;https://nl.wikipedia.org/wiki/Le_Corniaud
5;nl;In welke auto werd de Amerikaanse president Kennedy vermoord ?;Lincoln Continentaal;Chrysler Nieuwpoort;Chevrolet Corvair;Ford 300;Débutant;Een geheel nieuwe Continental, uitgebracht in 2016, werd onthuld in New York ter vervanging van de MKS.;https://nl.wikipedia.org/wiki/Lincoln_Continental
6;nl;Welk racecircuit wordt ook wel de Toboggan des Ardennes genoemd ?;Spa-Francorchamps;Monza;Zandvoort;Monaco;Débutant;Het is een van de favoriete circuits van de coureurs vanwege de verscheidenheid aan lay-outs in het bergachtige landschap van de Belgische Ardennen.;https://nl.wikipedia.org/wiki/Circuit_de_Spa-Francorchamps
7;nl;Wie is de fabrikant van de auto in de film « Back to the Future » ?;DeLorean;Pagani;Gumpert;McLaren;Débutant;De DeLorean DMC-12, een sportwagen ontworpen en vervaardigd door DMC, is het enige model dat door deze fabrikant wordt geproduceerd en op de markt gebracht.;https://nl.wikipedia.org/wiki/DeLorean-tijdmachine
8;nl;Op welk Formule 1-circuit stierf Ayrton Senna ?;Imola;Spa-Francorchamps;Monza;Zandvoort;Débutant;Hij werd erkend voor zijn prestaties op natte circuits, met legendarische overwinningen zoals tijdens de Portugese Grand Prix van 1985.;https://nl.wikipedia.org/wiki/Ayrton_Senna
9;nl;Hoe worden dimlichten in Frankrijk gewoonlijk genoemd ?;Codes;Diodes;LED's;Terminals;Débutant;Deze verlichtingsapparaten worden gebruikt op motorvoertuigen en helpen bij het besturen van deze voertuigen 's nachts.;https://nl.wikipedia.org/wiki/Dimlicht
10;nl;Wat was het best verkochte voertuig in Frankrijk in 2016 ?;Renault Clio;Citroën C3;Dacia Duster;Peugeot 206;Débutant;De Renault Clio I werd geproduceerd van 1990 tot 1999, gerestyled in 1994 en 1996 en uiteindelijk in 1998 vervangen door de Clio II.;https://nl.wikipedia.org/wiki/Renault_Clio
11;nl;Welk merk 4x4 gebruikt het personeel van « Jurassic Park » ?;Jeep;Ford;Renault;Toyota;Confirmé;Jeep is een Amerikaanse autofabrikant die sinds 2010 deel uitmaakt van de Fiat-groep, die in 2021 Stellantis werd.;https://nl.wikipedia.org/wiki/Jeep
12;nl;Welke leider bracht de fabrikanten Renault, Mitsubishi en Nissan samen ?;Carlos Ghosn;Mathieu Gallet;Stanislas Guerini;Oscar Ghez;Confirmé;Hij werd in 2018 gearresteerd door de Japanse justitie, op verdenking van het verbergen van inkomsten in de financiële publicaties van Nissan.;https://nl.wikipedia.org/wiki/Carlos_Ghosn
13;nl;Wat is de nationaliteit van de fabrikant Kia Motors ?;Zuid-Koreaans;Chinees;Japans;Noord-Koreaans;Confirmé;Met ruim 32.000 medewerkers is Kia Motors Company momenteel de oudste autofabrikant van Korea.;https://nl.wikipedia.org/wiki/Kia_Motors
14;nl;Hoe worden BMW stationwagens traditioneel genoemd ?;Toeren;GT;Knippen;Minivan;Confirmé;Het model van de BMW 3 Serie is bijvoorbeeld een familiesedan, ook verkrijgbaar als stationwagen (touring) en Gran Turismo (GT).;
15;nl;Wie was de grootste autofabrikant ter wereld in 2016 ?;Volkswagen;BMW;Ford;Tesla;Confirmé;De oorsprong van het merk ligt in nazi-Duitsland in de jaren dertig met het project om de toekomstige Kever te bouwen.;https://nl.wikipedia.org/wiki/Volkswagen
16;nl;Wat zijn de twee kleuren van de Chevrolet Camaro uit de film « Transformers » ?;Geel en zwart;Rood en wit;Groen en grijs;Wit en blauw;Confirmé;Toen het werd uitgebracht, specificeerde Chevrolet dat de naam van het nieuwe model afkomstig was van een Frans woord, camaro, wat kameraad in straattaal betekent.;https://nl.wikipedia.org/wiki/Chevrolet_Camaro
17;nl;In welk jaar verscheen de ruitenwisser op motorvoertuigen ?;1910;1948;1923;1971;Confirmé;Een ruitenwisser heeft volgens de fabrikanten een gemiddelde levensduur van 500.000 cycli, wat overeenkomt met één jaar gebruik.;https://nl.wikipedia.org/wiki/Ruitenwisser
18;nl;Welke van deze autofabrikanten is niet Japans ?;Kia;Mazda;Honda;Mitsubishi;Confirmé;De eerste lettergreep Ki betekent « openbaart zich aan de wereld », de tweede is de eerste letter van het woord Azië (Azië openbaart zich aan de wereld).;https://nl.wikipedia.org/wiki/Kia_Motors
19;nl;Welk Lada-model behaalde etappezeges op de Dakkar ?;Niva;Vesta;Granta;Samara;Confirmé;Het succes van dit model was zo groot dat er clubs en scholen verschenen waar off-road rijden op Niva werd onderwezen.;https://nl.wikipedia.org/wiki/Lada_Niva
20;nl;Welk Lada-model behaalde etappezeges op de Dakkar ?;Niva;Vesta;Granta;Samara;Confirmé;Het succes van dit model was zo groot dat er clubs en scholen verschenen waar off-road rijden op Niva werd onderwezen.;https://nl.wikipedia.org/wiki/Lada_Niva
21;nl;Welk Lada-model behaalde etappezeges op de Dakkar ?;Niva;Vesta;Granta;Samara;Expert;Het succes van dit model was zo groot dat er clubs en scholen verschenen waar off-road rijden op Niva werd onderwezen.;https://nl.wikipedia.org/wiki/Lada_Niva
22;nl;Welk Lada-model behaalde etappezeges op de Dakkar ?;Niva;Vesta;Granta;Samara;Expert;Het succes van dit model was zo groot dat er clubs en scholen verschenen waar off-road rijden op Niva werd onderwezen.;https://nl.wikipedia.org/wiki/Lada_Niva
23;nl;Welk Lada-model behaalde etappezeges op de Dakkar ?;Niva;Vesta;Granta;Samara;Expert;Het succes van dit model was zo groot dat er clubs en scholen verschenen waar off-road rijden op Niva werd onderwezen.;https://nl.wikipedia.org/wiki/Lada_Niva
24;nl;Welk Lada-model behaalde etappezeges op de Dakkar ?;Niva;Vesta;Granta;Samara;Expert;Het succes van dit model was zo groot dat er clubs en scholen verschenen waar off-road rijden op Niva werd onderwezen.;https://nl.wikipedia.org/wiki/Lada_Niva
25;nl;Welk Lada-model behaalde etappezeges op de Dakkar ?;Niva;Vesta;Granta;Samara;Expert;Het succes van dit model was zo groot dat er clubs en scholen verschenen waar off-road rijden op Niva werd onderwezen.;https://nl.wikipedia.org/wiki/Lada_Niva
26;nl;Welk Lada-model behaalde etappezeges op de Dakkar ?;Niva;Vesta;Granta;Samara;Expert;Het succes van dit model was zo groot dat er clubs en scholen verschenen waar off-road rijden op Niva werd onderwezen.;https://nl.wikipedia.org/wiki/Lada_Niva
27;nl;Welk Lada-model behaalde etappezeges op de Dakkar ?;Niva;Vesta;Granta;Samara;Expert;Het succes van dit model was zo groot dat er clubs en scholen verschenen waar off-road rijden op Niva werd onderwezen.;https://nl.wikipedia.org/wiki/Lada_Niva
28;nl;Welk Lada-model behaalde etappezeges op de Dakkar ?;Niva;Vesta;Granta;Samara;Expert;Het succes van dit model was zo groot dat er clubs en scholen verschenen waar off-road rijden op Niva werd onderwezen.;https://nl.wikipedia.org/wiki/Lada_Niva
29;nl;Welk Lada-model behaalde etappezeges op de Dakkar ?;Niva;Vesta;Granta;Samara;Expert;Het succes van dit model was zo groot dat er clubs en scholen verschenen waar off-road rijden op Niva werd onderwezen.;https://nl.wikipedia.org/wiki/Lada_Niva
30;nl;Welk Lada-model behaalde etappezeges op de Dakkar ?;Niva;Vesta;Granta;Samara;Expert;Het succes van dit model was zo groot dat er clubs en scholen verschenen waar off-road rijden op Niva werd onderwezen.;https://nl.wikipedia.org/wiki/Lada_Niva
