1;fr;De quelles couleurs sont généralement balisés les chemins de grande randonnée ?;Rouge et blanche;Bleue et verte;Jaune et rouge;Orange et grise;Débutant;Les sentiers de grande randonnée sont en Europe des itinéraires pédestres balisés parfois sur plusieurs centaines de kilomètres.;https://fr.wikipedia.org/wiki/Sentier_de_grande_randonnée
2;fr;Par quelle lettre sont identifiés les sentiers européens de grande randonnée ?;E;R;G;S;Débutant;Chacun de ces sentiers, long de plusieurs milliers de kilomètres, traverse plusieurs pays européens.;https://fr.wikipedia.org/wiki/Sentier_européen_de_grande_randonnée
3;fr;De quelle grande ville de France le GR 1 fait-il le tour ?;Paris;Lyon;Marseille;Lille;Débutant;Le GR 1 passe par la Porte Maillot, le Bois de Boulogne, les forêts de Marly, Rambouillet, Fontainebleau, Crécy et enfin Feucherolles.;https://fr.wikipedia.org/wiki/Sentier_de_grande_randonnée_1

4;fr;Lequel de ces accessoires est le plus adapté à une grande randonnée ?;Boussole;Tire-bouchon;Aiguille;Oreiller;Débutant;Cet instrument de navigation est constitué d'une aiguille magnétisée qui s'aligne sur le champ magnétique de la Terre.;https://fr.wikipedia.org/wiki/Boussole
5;fr;Quel type de randonnée s'effectue à pied  en suivant un itinéraire généralement balisé ?;Pédestre;Asine;Équestre;Cyclotouriste;Débutant;C'est à la fois un loisir de découverte et une forme d'exercice physique, facilement accessible et praticable.;https://fr.wikipedia.org/wiki/Randonnée_pédestre
6;fr;Quelle forme de randonnée pédestre utilise des bâtons de marche spécifiques ?;Marche nordique;Marche afghane;Marche sportive;Marche rapide;Débutant;La marche nordique, extrêmement populaire dans les pays scandinaves, se pratique été comme hiver.;https://fr.wikipedia.org/wiki/Marche_nordique
7;fr;Que faut-il éviter de faire lorsque vous vous lancez dans une randonnée ?;Partir seul;Regarder le ciel;Avertir un proche;Préparer son sac;Débutant;En randonnée, un incident peut parfois prendre une tournure beaucoup plus grave en raison de l'isolement.;https://fr.wikipedia.org/wiki/Randonnée_pédestre
8;fr;Lequel de ces objets désigne un des éléments les plus importants du randonneur ?;Un sac à dos;Des pantoufles;Une console de jeu;Une tirelire;Débutant;Si le sac à dos est trop lourd, mal réglé ou si son contenu mal réparti, des effets sur la santé peuvent apparaître.;https://fr.wikipedia.org/wiki/Sac_à_dos
9;fr;Quel bâtiment situé en montagne est destiné à fournir un abri aux randonneurs ?;Un refuge;Une caserne;Un bunker;Une tenaille;Débutant;Actuellement, le Club alpin français gère un tiers des refuges ouverts au public, soit 127, principalement dans les Alpes et les Pyrénées.;https://fr.wikipedia.org/wiki/Refuge_de_montagne
10;fr;Quelle pratique de randonnée est devenue un loisir très prisé du monde naturiste ?;Randonue;Trekking;Marche nordique;Biathlon;Débutant;La randonue consiste à profiter de la sensation de bien-être que procure un corps débarrassé de vêtements en pleine nature.;https://fr.wikipedia.org/wiki/Randonue
11;fr;Où se trouve le siège de la Fédération française de la randonnée pédestre ?;Paris;Lyon;Marseille;Toulouse;Confirmé;Tout d'abord nommé Comité national des sentiers de grande randonnée (CNSGR), il est reconnu d'utilité publique en 1971.;https://fr.wikipedia.org/wiki/Fédération_française_de_la_randonnée_pédestre
12;fr;Dans quel pays ont été tracés les premiers sentiers de grande randonnée (GR) ?;France;Belgique;Espagne;Suisse;Confirmé;La plupart des sentiers GR de France, du Luxembourg et de Belgique sont publiés par la Fédération Française de la Randonnée Pédestre.;https://fr.wikipedia.org/wiki/Sentier_de_grande_randonnée
13;fr;Quelles personnes des fédérations nationales gèrent les sentiers et les balisages des GR ?;Bénévoles;Alpinistes;Officiels;Bûcherons;Confirmé;En France, le balisage des GRP est identique au balisage des GR mais les traits blancs sont remplacés par des traits jaunes.;https://fr.wikipedia.org/wiki/Sentier_de_grande_randonnée
14;fr;Quel sentier de grande randonnée relie Amsterdam à Paris via la Belgique ?;GR 12;GR 5;GR 20;GR 10;Confirmé;En France, les départements traversés par le GR 12 sont les Ardennes, l'Aisne, l'Oise et le Val-d'Oise.;https://fr.wikipedia.org/wiki/GR_12
15;fr;Combien existe-t-il de sentiers européens de grande randonnée ?;Douze;Dix;Quinze;Vingt;Confirmé;Les sentiers européens de grande randonnée ont été créés sous l'égide de la Fédération européenne de la randonnée pédestre.;https://fr.wikipedia.org/wiki/Sentier_européen_de_grande_randonnée
16;fr;Quel parcours de randonnée se situe entre le canton du Valais et la Vallée d'Aoste ?;Tour du Cervin;Gorges du Seyon;Bisse du Trient;Via Alpina;Confirmé;Ce tour a été inauguré officiellement en 2002, il commence et se termine au village de Randa, et il compte environ 10 étapes.;https://fr.wikipedia.org/wiki/Tour_du_Cervin
17;fr;Comment appelle-t-on une randonnée pédestre dans une région montagneuse ?;Trekking;Marche nordique;Bivouac;Raid;Confirmé;Depuis une vingtaine d'années, la définition s'est élargie et désigne désormais une randonnée itinérante de plusieurs jours.;https://fr.wikipedia.org/wiki/Trekking
18;fr;Quel campement rudimentaire permet de passer la nuit en pleine nature ?;Le bivouac;La guitoune;Le gîte;La colonie;Confirmé;Pour de nombreux peuples nomades dans le monde, le bivouac est encore un mode d'hébergement courant.;https://fr.wikipedia.org/wiki/Bivouac
19;fr;Quelle île est traversée du nord au sud par le GR 20 via une chaîne de montagnes ?;Corse;Jamaïque;Sicile;Tasmanie;Confirmé;Bien qu'aucun équipement particulier ne soit suggéré, le GR 20 reste un parcours de montagne.;https://fr.wikipedia.org/wiki/GR_20
20;fr;Qui a réalisé le film « Mortelle Randonnée », sorti sur les écrans en 1983 ?;Claude Miller;Michel Audiard;Claude Berri;Élie Chouraqui;Confirmé;Le film est tiré d'un roman de Marc Behm, également adapté en 1999 par Stephan Elliott avec Ewan McGregor et Ashley Judd.;https://fr.wikipedia.org/wiki/Mortelle_Randonnée_(film)
21;fr;En quelle année est né le GR 5, premier sentier de grande randonnée belge ?;1962;1954;1977;1983;Expert;Totalisant 2 600 kilomètres de distance, le GR 5 part de la mer du Nord pour rejoindre la mer Méditerranée à Nice en France.;https://fr.wikipedia.org/wiki/GR_5
22;fr;En France, que représente environ la distance cumulée des GR ?;60 000 km;40 000 km;20 000 km;80 000 km;Expert;En Belgique, toutes variantes et alternatives confondues, cela représente environ 6 400 km de traits blancs et rouges.;https://fr.wikipedia.org/wiki/Sentier_de_grande_randonnée
23;fr;Le trait rouge des GR est en fait la marque de quelle communauté ?;Les bûcherons;Les alpinistes;Les montagnards;Les bergers;Expert;Ce choix peut être vu comme une réminiscence des deux couleurs prédominantes dans les peintures et les masques des Amérindiens.;https://fr.wikipedia.org/wiki/Sentier_de_grande_randonnée
24;fr;Quelle est la longueur totale du GR 5 reliant la Mer du Nord à la Méditerranée ?;2 600 km;1 300 km;3 900 km;5 200 km;Expert;Le GR 5 passe aux Pays-Bas, en Belgique, au Luxembourg, en France où il traverse les Vosges et le Jura, en Suisse.;https://fr.wikipedia.org/wiki/GR_5
25;fr;Comment est appelé le sentier européen du littoral s'étendant le long des côtes d'Europe ?;E9;GR 20;GRP 7;PR 5;Expert;Le sentier suit les côtes atlantiques du Portugal, de l'Espagne et de la France jusqu'à Roscoff.;https://fr.wikipedia.org/wiki/Sentier_européen_du_littoral
26;fr;Laquelle de ces propositions est un chemin du pèlerinage de Saint-Jacques-de-Compostelle ?;Via Podiensis;Via Romana;Via Francosa;Via Dominicis;Expert;De Genève à Pampelune, les deux chemins sont balisés en tant que sentier de grande randonnée GR 65.;https://fr.wikipedia.org/wiki/Via_Podiensis
27;fr;Quel a été le premier chemin de grande randonnée balisé en France ?;GR 3;GR 2;GR 1;GR 4;Expert;Les débuts de sa réalisation remontent à 1947, année de la création de la Fédération française de la randonnée pédestre.;https://fr.wikipedia.org/wiki/Sentier_de_grande_randonnée_3
28;fr;Sur quel canal peut-on lancer un appel d'urgence lors d'une randonnée en montagne ?;Canal E;Canal Z;Canal +;Canal J;Expert;Certains talkie-walkies dédiés à la randonnée pédestre présentent un bouton d'urgence réglé sur cette fréquence.;https://fr.wikipedia.org/wiki/Canal_E_(VHF)
29;fr;Quel sentier de randonnée permet de traverser les Cévennes, le Gardon et le Gard ?;GR 6;GR 12;GR 18;GR 24;Expert;Sur le trajet du GR 6, on peut admirer, entre autres merveilles, plusieurs sites du patrimoine mondial de l'UNESCO.;https://fr.wikipedia.org/wiki/Sentier_de_grande_randonnée_6
30;fr;Quel sentier est considéré comme l'un des classiques des sentiers de longue distance ?;TMB;VGA;CGI;USB;Expert;La route circulaire du Tour du Mont-Blanc est normalement empruntée dans le sens antihoraire, sur une durée de 7 à 10 jours.;https://fr.wikipedia.org/wiki/Tour_du_Mont-Blanc
