1;fr;Sur quelle baie la célèbre et touristique promenade des Anglais se trouve-t-elle ?;Baie des Anges;Baie des Canards;Baie des Dieux;Baie des Requins;Débutant;Outre des manifestations nombreuses, la promenade était réputée pour ses « chaises bleues » et ses pergolas.;https://fr.wikipedia.org/wiki/Promenade_des_Anglais
2;fr;Avec quelle importante métropole brésilienne la ville de Nice est-elle jumelée ?;Rio de Janeiro;Salvador;Recife;Belo Horizonte;Débutant;La ville de Nice a menée une politique de jumelage particulièrement active, en raison de l'importance du tourisme pour son économie.;https://fr.wikipedia.org/wiki/Nice
3;fr;Quel cinéaste a dirigé le film « La Nuit Américaine », tourné à Nice aux studios Riviera ?;François Truffaut;Jean-Luc Godard;Jacques Demy;Claude Chabrol;Débutant;Le film a été tourné aux Studios de la Victorine dans les décors de « La Folle de Chaillot » ainsi qu'à l'hôtel Atlantic de Nice.;https://fr.wikipedia.org/wiki/La_Nuit_américaine_(film)
4;fr;Quelle est la couleur de la façade du Château de l'Anglais, construit à Nice de 1856 à 1858 ?;Rose;Verte;Bleue;Jaune;Débutant;De par sa couleur et sa forme, il demeure comme l'un des témoignages forts des folies qui sont érigées sur la Riviera.;https://fr.wikipedia.org/wiki/Château_de_l'Anglais
5;fr;Comment se prénomme le héros surfeur incarné par Jean Dujardin en 2005 ?;Brice;Joris;Mathis;Loris;Débutant;Apparu tout d'abord dans les sketches de Jean Dujardin, le personnage est ensuite devenu un héros de films.;https://fr.wikipedia.org/wiki/Brice_de_Nice
6;fr;Combien y a-t-il de lignes de tramway parcourant le centre et les alentours de Nice ?;1;3;5;7;Débutant;Dans les mois qui ont suivi le lancement du tramway, on comptabilisait entre 65 000 et 70 000 voyages quotidiens.;https://fr.wikipedia.org/wiki/Tramway_de_Nice
7;fr;Quel café de Nice, construit au XIXe siècle, fut un haut lieu de rencontre piémontais ?;Café de Turin;Café de Naples;Café de Florence;Café de Milan;Débutant;Le café de Turin, situé place Garibaldi, reste encore aujourd'hui l'un des cafés les plus connus de la ville de Nice.;https://fr.wikipedia.org/wiki/Nice
8;fr;Dans combien de casinos pourrez-vous tenter de faire fortune à Nice ?;Deux;Quatre;Six;Huit;Débutant;Situés à une centaine de mètres l'un de l'autre, les casinos appartiennent aux deux plus grands groupes français.;https://fr.wikipedia.org/wiki/Nice
9;fr;Depuis 2001, à Nice, durant quel mois les musées sont-ils gratuits pour les jeunes ?;Mars;Juillet;Mai;Septembre;Débutant;Nice possède de nombreux musées, consacrés à l'art, à l'histoire, ou à l'histoire et aux traditions locales.;https://fr.wikipedia.org/wiki/Nice
10;fr;Quel peintre, auteur du tableau « Le Déjeuner des canotiers », possédait un atelier à Nice ?;Auguste Renoir;Claude Monet;Antoine Watteau;Pablo Picasso;Débutant;Membre du groupe impressionniste, Renoir évolue dans les années 1880 vers un style plus réaliste sous l'influence de Raphaël.;https://fr.wikipedia.org/wiki/Auguste_Renoir
11;fr;À base de quel poisson le plat niçois nommé « estocafic » est-il préparé ?;De morue;De thon;De crevette;De sardine;Confirmé;L'usage de cuisiner et de consommer de la morue séchée provient de Scandinavie et notamment de Norvège.;https://fr.wikipedia.org/wiki/Estocafic
12;fr;Laquelle de ces propositions ne désigne pas une gare ferroviaire de Nice ?;Nice-Arénas;Nice-Ville;Nice-CP;Nice Saint-Augustin;Confirmé;Grâce à une urbanisation linéaire et continue, tous les habitants de l'aire urbaine de Nice peuvent accéder au réseau TER.;https://fr.wikipedia.org/wiki/Nice
13;fr;Quelle est environ la longueur du réseau de tramway de la ville de Nice ?;9 km;19 km;29 km;39 km;Confirmé;Le tramway de Nice est actuellement composé d'une seule ligne et exploité par la Régie Ligne d'Azur.;https://fr.wikipedia.org/wiki/Tramway_de_Nice
14;fr;Quelle église de l'Annonciation, située à Nice, a été complètement rénovée en 1685 ?;Sainte-Rita;Sainte-Anne;Sainte-Carmen;Sainte-Cécile;Confirmé;Elle porte également les noms de chapelle Saint-Jaume, chapelle Saint-Giaume et chapelle Sainte-Rita.;https://fr.wikipedia.org/wiki/Église_de_l'Annonciation_de_Nice
15;fr;À quel numéro de la promenade des Anglais se situe l'hôtel Negresco ?;Au 37;Au 17;Au 27;Au 47;Confirmé;Avec sa cinquième étoile obtenue en août 2009, il est l'un des rares survivants de l'hôtellerie du début du XXe siècle.;https://fr.wikipedia.org/wiki/Hôtel_Negresco
16;fr;Lequel de ces joueurs de football n'a jamais évolué sous les couleurs de l'OGC Nice ?;Sonny Andreson;Just Fontaine;Francis Isnard;Hugo Lloris;Confirmé;Les terrains d'entraînement du groupe professionnel se situent au sein du parc des sports Charles-Ehrmann.;https://fr.wikipedia.org/wiki/Olympique_Gymnaste_Club_Nice_Côte_d'Azur
17;fr;Laquelle de ces propositions ne désigne pas un château de Nice ?;Gourdon;Gairaut;Valrose;L'Anglais;Confirmé;Le château de Gourdon, dans les Alpes-Maritimes, est un château fortifié construit au Moyen Âge et remanié au VXIIe siècle.;https://fr.wikipedia.org/wiki/Château_de_Gourdon
18;fr;La chapelle du Saint-Sépulcre de Nice est également appelée chapelle des pénitents...;Bleus;Blancs;Noirs;Rouges;Confirmé;La façade est de style à la fois néoclassique et baroque tardif pour la partie supérieure. Le balcon a été rajouté en 1841.;https://fr.wikipedia.org/wiki/Chapelle_du_Saint-Sépulcre_de_Nice
19;fr;Quel est le nom de la villa dans laquelle le musée Matisse s'est installé ?;Villa des Arènes;Villa Gillet;Villa Marlioz;Villa Florentine;Confirmé;La collection permanente du musée s'est constituée grâce à diverses donations, d'abord celle de Matisse en personne.;https://fr.wikipedia.org/wiki/Musée_Matisse_de_Nice
20;fr;Quel rappeur, auteur des tubes « On verra » et « Reuf », est né à Nice ?;Nekfeu;Booba;Joey Starr;Kaaris;Confirmé;Son premier album solo, « Feu », bénéficie d'une couverture médiatique importante ainsi que de critiques très positives.;https://fr.wikipedia.org/wiki/Nekfeu
21;fr;Quand le palais de la Méditerranée, fermé pour cause financière, a-t-il rouvert ses portes ?;2004;2014;1994;1984;Expert;Ce luxueux complexe hôtelier est situé aux numéros 13 et 15 de la promenade des Anglais.;https://fr.wikipedia.org/wiki/Palais_de_la_Méditerranée
22;fr;Quel écrivain niçois a donné son nom à une bibliothèque de la ville ouverte depuis 2002 ?;Louis Nucréa;Jean-Claude Lattès;Jacques Barbéri;Charles Calais;Expert;La bibliothèque municipale à vocation régionale de Nice (BMVR) est détentrice de la majeure partie de ses manuscrits.;https://fr.wikipedia.org/wiki/Louis_Nucéra
23;fr;À quel écrivain et poète niçois doit-on l'hymne « Nissa la bella » ?;Menica Rondelly;Jorgi Tasso;Michel Grisolia;Claude Ber;Expert;Menica Rondelly a écrit de nombreux textes et chansons en langue niçoise dont plusieurs pour le carnaval de Nice.;https://fr.wikipedia.org/wiki/Menica_Rondelly
24;fr;Quel fleuve long de plus de douze kilomètres traverse la ville de Nice ?;Le Magnan;Le Sée;Le Golo;L'Arques;Expert;À sec entre 2006 et 2013, avec un régime d'oued, le Magnan coule à nouveau en continu toute l'année.;https://fr.wikipedia.org/wiki/Magnan_(Nice)
25;fr;Lequel de ces fleuves côtiers se jette dans la baie des Anges, à Nice ?;Paillon;Durdent;Nez;Scie;Expert;Malgré ses débordements, il est intimement lié à la vie quotidienne des Niçois car il représente sa principale source d'énergie.;https://fr.wikipedia.org/wiki/Paillon
26;fr;Qui a donné son nom au musée international d'art naïf de Nice grâce à ses donations ?;Anatole Jakovsky;Antonio Ligabue;André Bauchant;Ferdinand Desnos;Expert;Sa veuve a légué le reste de ses collections à la commune de Blainville-Crevon, non loin de Rouen.;https://fr.wikipedia.org/wiki/Anatole_Jakovsky
27;fr;Quelle cathédrale a inspiré la construction, à Nice, de la basilique Notre-Dame ?;Angers;Reims;Tours;Lyon;Expert;Sa construction s'inscrivait dans le cadre d'une volonté des autorités de franciser la ville après l'annexion du comté de Nice à la France.;https://fr.wikipedia.org/wiki/Basilique_Notre-Dame_de_Nice
28;fr;Quelle grotte et site préhistorique se situe à Nice, aux pieds du mont Boron ?;Grotte du Lazaret;Grotte de la Balme;Grotte Chauvet;Grotte de Clamouse;Expert;La grotte est connue depuis 1826 et a fait l'objet de fouilles à partir de 1950 sous la direction de François Charles Ernest Octobon.;https://fr.wikipedia.org/wiki/Grotte_du_Lazaret
29;fr;Quel est le style architectural de l'ancien hôtel de Nice, connu sous le nom d'Alhambra ?;Néo-mauresque;Constructiviste;Romano-byzantin;Gothique;Expert;L'hôtel ouvre en 1901. Il possède tout le confort pour attirer une clientèle fortunée pendant la saison qui se limite alors à l'hiver.;https://fr.wikipedia.org/wiki/Alhambra_(Nice)
30;fr;Comment s'appelle la structure habitable de la bibliothèque Louis-Nucréa de Nice ?;Tête Carrée;Pied Rond;Dos Courbé;Main Plate;Expert;Nice comprend une bibliothèque centrale, onze bibliothèques de quartier et une bibliothèque patrimoniale et d'étude.;https://fr.wikipedia.org/wiki/Nice
