14;nl;Welke Californische producent Meghan Markle trouwde na zeven jaar samen ?;Trevor Engelson;Marc Sorkin;Michel Gohou;Roy Marten;Confirmé;Trevor Engelson werd geboren in 1976 in Great Neck, New York, heeft een Amerikaanse nationaliteit en behoort tot de blanke etnische gemeenschap.;https://nl.wikipedia.org/wiki/Meghan_Markle
15;nl;In welke speelfilm van Robert Pattinson verscheen Meghan Markle ?;« Onthoud mij »;« Bel Ami »;« Cosmopolis »;« De Rover »;Confirmé;Ondanks uitstekende recepten, waren de critici erg sceptisch en klaagden ze dat de film te veel leek op de « Twilight » saga.;https://nl.wikipedia.org/wiki/Remember_Me_(2010)
16;nl;Welke religie werd door Meghan Markle aangenomen voordat Anglicaans werd ?;Protestants;Katholiek;Orthodox;Hindu;Confirmé;De privéceremonie werd gevierd in de koninklijke kapel van Saint James Palace, voorgezeten door de aartsbisschop van Canterbury, Justin Welby.;https://nl.wikipedia.org/wiki/Meghan_Markle
17;nl;In welke Brits-Hongaarse dramafilm speelde Meghan Markle haar laatste rol ?;« Asociaal »;« Paper World »;« De zoon van Saul »;« Uitsterven »;Confirmé;In deze film worden op dit moment verschillende acties uitgevoerd in de stad Londen tegen de gewelddadige omgeving van wapenhandel.;
18;nl;Welke bloem die Diana dierbaar was, verlichtte het boeket van Meghan Markle's tweede bruiloft ?;Myosotis;Magnolia;Mimosa;Sint-janskruid;Confirmé;Bloemen werden geplukt door Prins Harry zelf, de dag voor de bruiloft, in de tuin van hun woning in Kensington Palace.;https://nl.wikipedia.org/wiki/Vergeet-mij-nietje
19;nl;In welke serie van « Experts » speelde Meghan Markle Veronica Perez ?;Manhattan;Miami;San Francisco;Texas;Confirmé;« The Experts: Manhattan » hebben slechts een paar scènes buitenshuis gefilmd in New York, de rest wordt opgenomen in de studio.;https://nl.wikipedia.org/wiki/CSI:_NY_(televisieserie)
20;nl;In welke serie interpreteerde Meghan Markle de Sleeping Beauty ?;« Kasteel »;« Helden »;« Roddelmeisje »;« Lelijke Betty »;Confirmé;Volgens het tijdschrift Variety zou ABC binnenkort een serie « Castle » kunnen lanceren, het verhaal rond Derrick Storm.;
21;nl;In welk jaar ontving Meghan Markle een BA in theater en internationale betrekkingen ?;2003;2005;2007;2009;Expert;Meghan Markle studeerde aan privéscholen in Los Angeles en vervolgens aan de Northwestern University in Chicago, Illinois.;https://nl.wikipedia.org/wiki/Meghan_Markle
22;nl;In welk land hoopt Meghan Markle een politieke carriëre te volgen ?;Argentinië;Spanje;Griekenland;Canada;Expert;Na zijn studie werkte Meghan Markle een tijdje op de Amerikaanse ambassade in Buenos Aires, Argentinië.;https://nl.wikipedia.org/wiki/Meghan_Markle
23;nl;Welk bedrijf heeft Meghan Markle freelance om zijn rekeningen te betalen ?;Calligraphe;Veterinaire;Web ontwerper;Accountant;Expert;Meghan Markle heeft in deeltijd geoefend met kalligrafie op trouwkaarten.;https://nl.wikipedia.org/wiki/Kalligrafie
24;nl;Voor welke warenhuisketen is Meghan Markle een reclamefranchise geworden ?;Reitmans;Hamleys;Canadese gans;Liberty And Co;Expert;Meghan Markle houdt van online winkelen bij Reitmans, Canada's toonaangevende winkelketen voor damesmode.;https://nl.wikipedia.org/wiki/Meghan_Markle
25;nl;Voor welke jaarlijkse top sprak Meghan Markle over moderne slavernij ?;Een jonge wereld;Gordonia;Nozem;Fimcap;Expert;De jonge leiders van deze top worden gekozen na een lang selectieproces, beoordeeld op hun leiderschapspotentieel.;
26;nl;Welke Canadese culinaire chef, Meghan Markle, heeft het uitgemaakt in 2016 ?;Cory Vitiello;Renaud Cyr;Anthony Sedlak;Normand Laprise;Expert;Meghan Markle zou twee jaar bij Toronto-chef Cory Vitiello hebben doorgebracht, nadat hij hem had ontmoet in zijn oude restaurant.;https://nl.wikipedia.org/wiki/Meghan_Markle
27;nl;Welke andere Amerikaanse gescheiden persoon is naast Meghan Markle ook in de koninklijke familie gekomen ?;Wallis Simpson;Sally Howard;Priscilla Presbury;Sarah Cassaway;Expert;Na zijn scheiding van Earl Winfield Spencer Jr. hertrouwde Wallis Simpson op 21 juli 1928 met Ernest Aldrich Simpson.;https://nl.wikipedia.org/wiki/Wallis_Simpson
28;nl;Welke koning van Engeland is een voorouder van de vader van Meghan Markle ?;Edward III;Henri III;John zonder land;Charles II;Expert;Edward werd op 1 februari 1327 op 14-jarige leeftijd gekroond in Westminster (Londen) vanwege het ontslag van zijn vader Edward II.;
29;nl;Welke betere vriendin van Meghan Markle vergezelde haar naar haar prinselijke bruiloft ?;Jessica Mulroney;Sarah Rafferty;Katherine Heigl;Amanda Schull;Expert;Rachel Meghan Markle, bekend als Meghan Markle, werd geboren op 4 augustus 1981 in Los Angeles, Californië, aan Amerikaanse ouders.;
30;nl;Hoeveel kostte het dure stuk dat de tradities verdreef op zijn prinselijke bruiloft met Harry ?;EUR 57.000;EUR 43.000;EUR 38.000;EUR 22.000;Expert;Breaking met de klassieke gekonfijte fruitpudding, deze koninklijke cake, gemaakt van biologische ingrediënten, werd gemaakt door Claire Ptak.;
