22;de;In welchem Land hofft Meghan Markle auf eine politische Karriere ?;Argentinien;Spanien;Griechenland;Kanada;Expert;Nach dem College arbeitete Meghan Markle eine Weile an der amerikanischen Botschaft in Buenos Aires, Argentinien.;https://de.wikipedia.org/wiki/Meghan,_Duchess_of_Sussex
23;de;Welches Geschäft hat Meghan Markle freiberuflich, um seine Rechnungen zu bezahlen ?;Kalligraph;Veterinär;Webdesigner;Buchhalter;Expert;Meghan Markle übte in Teilzeit eine personalisierte Kalligraphie auf Hochzeitseinladungskarten aus.;https://de.wikipedia.org/wiki/Kalligrafie
24;de;Für welche Kaufhauskette ist Meghan Markle zum Werbefranchise geworden ?;Reitmans;Hamleys;Kanadagans;Liberty And Co;Expert;Meghan Markle kauft gerne online bei Reitmans, Kanadas führender Einzelhandelskette für Damenmode.;https://de.wikipedia.org/wiki/Meghan,_Duchess_of_Sussex
25;de;Auf welchem jährlichen Gipfel sprach Meghan Markle über moderne Sklaverei ?;Eine junge Welt;Gordonia;Nozem;Fimcap;Expert;Die jungen Führungskräfte dieses Gipfels werden nach einem langen Auswahlprozess ausgewählt, der nach ihrem Führungspotential beurteilt wird.;
26;de;Welche kanadische Küchenchefin, Meghan Markle, hat sich 2016 getrennt ?;Cory Vitiello;Renaud Cyr;Anthony Sedlak;Normand Laprise;Expert;Meghan Markle hätte zwei Jahre mit dem Torontoer Koch Cory Vitiello verbracht, nachdem er ihn in seinem alten Restaurant getroffen hatte.;https://de.wikipedia.org/wiki/Meghan,_Duchess_of_Sussex
27;de;Welche andere amerikanische Scheidung ist neben Meghan Markle ebenfalls in die königliche Familie eingetreten ?;Wallis Simpson;Sally Howard;Priscilla Presbury;Sarah Cassaway;Expert;Nach seiner Scheidung von Earl Winfield Spencer Jr. heiratete Wallis Simpson am 21. Juli 1928 erneut mit Ernest Aldrich Simpson.;https://de.wikipedia.org/wiki/Wallis_Simpson
28;de;Welcher König von England ist ein Vorfahr des Vaters von Meghan Markle ?;Edward III;Henri III;Johannes ohne Land;Charles II;Expert;Edward wurde am 1. Februar 1327 im Alter von 14 Jahren in Westminster (London) gekrönt, weil sein Vater Edward II entlassen worden war.;
29;de;Welche bessere Freundin von Meghan Markle begleitete sie zu ihrer fürstlichen Hochzeit ?;Jessica Mulroney;Sarah Rafferty;Katherine Heigl;Amanda Schull;Expert;Rachel Meghan Markle, bekannt als Meghan Markle, wurde am 4. August 1981 in Los Angeles, Kalifornien, als Tochter amerikanischer Eltern geboren.;https://de.wikipedia.org/wiki/Hochzeit_von_Prinz_Harry_und_Meghan_Markle
30;de;Wie viel kostete das teure Stück, das die Traditionen bei seiner fürstlichen Hochzeit mit Harry durcheinander brachte ?;57.000 EUR;43.000 EUR;38.000 EUR;22.000 EUR;Expert;Dieser aus Bio-Zutaten hergestellte königliche Kuchen wurde von Claire Ptak hergestellt, um mit dem klassischen kandierten Fruchtpudding zu brechen.;https://de.wikipedia.org/wiki/Hochzeit_von_Prinz_Harry_und_Meghan_Markle
1;es;¿Qué título recibió Meghan Markle después de su segundo matrimonio ?;Duquesa de Sussex;Condesa de York;Alteza Real;Princesa de Windsor;Débutant;Anteriormente, nunca hubo una duquesa de Sussex, a pesar de que Augustus Frederick (primer propietario) se casó dos veces.;https://es.wikipedia.org/wiki/Ducado_de_Sussex
2;es;¿Cuál era el trabajo de Meghan Markle antes de convertirse en duquesa ?;Actriz;Tenista;Abogado;Presentador de televisión;Débutant;Fue en la famosa serie de televisión estadounidense « Suits » que Meghan Markle interpretó a Rachel Zane, una asistente legal.;https://es.wikipedia.org/wiki/Suits
3;es;¿Después de qué temporada dejó Meghan Markle la serie « Suits » ?;Séptimo;Sexto;Quinto;Ocho;Débutant;En 2017, después de sus compromisos con el Príncipe Harry, dejó la serie « Suits » y tomó la decisión de interrumpir su carrera como actriz.;https://es.wikipedia.org/wiki/Meghan_de_Sussex
4;es;¿Con qué coche famoso salió Meghan Markle en televisión ?;K 2000;Christine;General Lee;Máquina de misterio;Débutant;« The Return of K 2000 » (Knight Rider) es una serie dramática estadounidense creada por David Andron y producida por Doug Liman.;https://es.wikipedia.org/wiki/Knight_Rider_(serie_de_2008)
5;es;¿Cuántos años tiene Meghan Markle el cumpleaños de su esposo, el príncipe Harry ?;Tres años;Cinco años;Siete años;Nueve años;Débutant;El 8 de noviembre de 2016, se anunció oficialmente que Meghan Markle era la compañera del Príncipe Harry, y esto desde junio de 2016.;https://es.wikipedia.org/wiki/Boda_real_entre_Enrique_de_Sussex_y_Meghan_Markle
6;es;¿Cuántos hijos de honor han acompañado a Meghan Markle en su boda principesca ?;Diez;Ocho;Seis;Cuatro;Débutant;Meghan Markle ha elegido cinco : sus dos ahijados Rylan y Remi Ritt y los tres hijos de su mejor amiga, Jessica Mulroney.;https://es.wikipedia.org/wiki/Boda_real_entre_Enrique_de_Sussex_y_Meghan_Markle
7;es;¿Qué negocio sigue ejerciendo hoy la madre de Meghan Markle ?;Profesora de yoga;Estilista;Esteticista;Novelista;Débutant;Meghan Markle fue criada en Los Ángeles por su madre afroamericana, Doria Ragland, y su padre, Thomas Wayne Markle.;https://es.wikipedia.org/wiki/Meghan_de_Sussex
8;es;¿Cuántos invitados estuvieron presentes en el servicio principesco de bodas de Meghan Markle ?;600;500;400;300;Débutant;El código de vestimenta impone un traje o cola para hombres, un vestido de cóctel y un sombrero para mujeres.;https://es.wikipedia.org/wiki/Boda_real_entre_Enrique_de_Sussex_y_Meghan_Markle
9;es;¿A quién escribió Meghan Markle una famosa carta de queja a la edad de once años ?;Hillary Clinton;Laura Bush;Michelle Obama;Nancy Reagan;Débutant;El presidente de Procter And Gamble cambiará el texto de un comercial de televisión nacional que ella consideró demasiado sexista.;https://es.wikipedia.org/wiki/Hillary_Clinton
10;es;¿Cuál fue la marca del vestido de novia de Meghan Markle en su segundo matrimonio ?;Givenchy;Lacroix;Versace;Chanel;Débutant;Llevaba un moño bajo coronado por una tiara de diamantes donada por la reina, que data de 1932, en un broche de 1893.;https://es.wikipedia.org/wiki/Boda_real_entre_Enrique_de_Sussex_y_Meghan_Markle
11;es;¿En qué telenovela hizo Meghan Markle su primera aparición en las pantallas ?;« Hospital Central »;« Emergencia »;« Dr. House »;« Chicago Med »;Confirmé;Es hoy la primera telenovela estadounidense más larga y antigua en producción frente a « The Fires of Love » y « Love, Glory and Beauty ».;
12;es;¿En qué país fue Meghan Markle en 2014 para apoyar a las tropas estadounidenses ?;Afganistán;Jordania;Mongolia;Camboya;Confirmé;Esto fue parte de la gira organizada por United Service Organizations, presidida por el Jefe de Estado Mayor del Ejército de EE.;https://es.wikipedia.org/wiki/Meghan_de_Sussex
13;es;¿En qué serie de ficción de ciencia ficción Meghan Markle ha encarnado a Amy Jessup ?;« Fringe »;« Archivos X »;« Ángel Oscuro »;« Más allá de »;Confirmé;En la serie, el equipo usa lo que se conoce en inglés como ciencia marginal para investigar fenómenos inexplicables.;
14;es;¿Con qué productor californiano, Meghan Markle, se casó después de siete años juntos ?;Trevor Engelson;Marc Sorkin;Michel Gohou;Roy Marten;Confirmé;Trevor Engelson nació en 1976 en Great Neck, Nueva York, tiene nacionalidad estadounidense y pertenece a la comunidad étnica blanca.;https://es.wikipedia.org/wiki/Meghan_de_Sussex
15;es;¿En qué largometraje de Robert Pattinson apareció Meghan Markle ?;« Recordarme »;« Bel Ami »;« Cosmópolis »;« El Rover »;Confirmé;A pesar de las excelentes recetas, los críticos se mostraron muy escépticos y se quejaron de que la película era demasiado similar a la saga « Twilight ».;https://es.wikipedia.org/wiki/Recuérdame_(película)
16;es;¿Cuál fue la religión adoptada por Meghan Markle antes de convertirse en anglicana ?;Protestante;Católica;Ortodoxos;Hindú;Confirmé;La ceremonia privada se celebró en la Capilla Real del Palacio de Saint James, presidida por el Arzobispo de Canterbury, Justin Welby.;https://es.wikipedia.org/wiki/Meghan_de_Sussex
17;es;¿En qué película dramática británico-húngara interpretó Meghan Markle su último papel ?;« Antisocial »;« Mundo del papel »;« El Hijo de Saúl »;« Extinción »;Confirmé;En esta película, se llevan a cabo varias acciones en la ciudad de Londres, en nuestro momento, contra el ambiente violento del tráfico de armas.;
18;es;¿Qué flor querida por Diana iluminó el ramo de la segunda boda de Meghan Markle ?;Miosotis;Magnolia;Mimosa;Hierba de San Juan;Confirmé;El príncipe Harry mismo recogió flores, el día antes de la boda, en el jardín de su residencia en el Palacio de Kensington.;https://es.wikipedia.org/wiki/Myosotis
19;es;¿En qué serie de « Expertos » interpretó Meghan Markle a Veronica Perez ?;Manhattan;Miami;San Francisco;Texas;Confirmé;« Los expertos: Manhattan » solo tienen algunas escenas al aire libre filmadas en Nueva York, el resto se filma en el estudio.;https://es.wikipedia.org/wiki/CSI:_Nueva_York
20;es;¿En qué serie interpretó Meghan Markle la bella durmiente ?;« Castillo »;« Héroes »;« Gossip Girl »;« Betty fea »;Confirmé;Según la revista Variety, ABC pronto podría lanzar una serie de « Castle », la historia centrada en Derrick Storm.;
21;es;¿En qué año recibió Meghan Markle una licenciatura en teatro y relaciones internacionales ?;2003;2005;2007;2009;Expert;Meghan Markle estudió en escuelas privadas en Los Ángeles y luego en la Universidad Northwestern en Chicago, Illinois.;https://es.wikipedia.org/wiki/Meghan_de_Sussex
22;es;¿En qué país espera Meghan Markle seguir una carrera política ?;Argentina;España;Grecia;Canada;Expert;Después de la universidad, Meghan Markle trabajó durante un tiempo en la Embajada de los Estados Unidos en Buenos Aires, Argentina.;https://es.wikipedia.org/wiki/Meghan_de_Sussex
23;es;¿Qué negocio tiene Meghan Markle por cuenta propia para pagar sus facturas ?;Calligraphe;Veterinaria;Diseñador web;Contable;Expert;A tiempo parcial, Meghan Markle incluyó caligrafía personalizada en las tarjetas de invitación de boda.;https://es.wikipedia.org/wiki/Caligrafía
24;es;¿Para qué cadena de tiendas por departamento se ha convertido Meghan Markle en una franquicia publicitaria ?;Reitmans;Hamleys;Ganso de Canadá;Liberty And Co;Expert;A Meghan Markle le encanta comprar en línea en Reitmans, la cadena minorista de moda femenina líder en Canadá.;https://es.wikipedia.org/wiki/Meghan_de_Sussex
25;es;¿Para qué cumbre anual habló Meghan Markle sobre la esclavitud moderna ?;Un mundo joven;Gordonia;Nozem;Fimcap;Expert;Los jóvenes líderes de esta cumbre son elegidos después de un largo proceso de selección, juzgados por su potencial de liderazgo.;
26;es;¿Qué chef culinaria canadiense, Meghan Markle, se separó en 2016 ?;Cory Vitiello;Renaud Cyr;Anthony Sedlak;Normand Laprise;Expert;Meghan Markle habría pasado dos años con el chef de Toronto Cory Vitiello, habiéndolo encontrado en su antiguo restaurante.;https://es.wikipedia.org/wiki/Meghan_de_Sussex
27;es;Además de Meghan Markle, ¿qué otro divorciado estadounidense también ha ingresado en la familia real ?;Wallis Simpson;Sally Howard;Priscilla Presbury;Sarah Cassaway;Expert;Después de su divorcio de Earl Winfield Spencer Jr., Wallis Simpson se volvió a casar el 21 de julio de 1928 con Ernest Aldrich Simpson.;https://es.wikipedia.org/wiki/Wallis_Simpson
28;es;¿Qué rey de Inglaterra es ancestro del padre de Meghan Markle ?;Edward III;Enrique III;John sin tierra;Carlos II;Expert;Edward fue coronado en Westminster (Londres) el 1 de febrero de 1327, a la edad de 14 años, debido al despido de su padre Edward II.;
29;es;¿Qué mejor amiga de Meghan Markle la acompañó a su boda principesca ?;Jessica Mulroney;Sarah Rafferty;Katherine Heigl;Amanda Schull;Expert;Rachel Meghan Markle, conocida como Meghan Markle, nació el 4 de agosto de 1981 en Los Ángeles, California, de padres estadounidenses.;https://es.wikipedia.org/wiki/Boda_real_entre_Enrique_de_Sussex_y_Meghan_Markle
30;es;¿Cuánto costó la costosa pieza que empujó las tradiciones en su boda principesca con Harry ?;EUR 57,000;EUR 43,000;EUR 38,000;EUR 22,000;Expert;Rompiendo con el clásico budín de fruta confitada, este pastel real, hecho con ingredientes orgánicos, fue hecho por Claire Ptak.;https://es.wikipedia.org/wiki/Boda_real_entre_Enrique_de_Sussex_y_Meghan_Markle
1;it;Quale titolo ha ricevuto Meghan Markle dopo il suo secondo matrimonio ?;Duchessa del Sussex;Contessa di York;Altezza reale;Principessa di Windsor;Débutant;In precedenza, non c'era mai stata una duchessa del Sussex, anche se Augustus Frederick (primo proprietario) si sposò due volte.;https://it.wikipedia.org/wiki/Duca_di_Sussex
2;it;Qual era il lavoro di Meghan Markle prima di diventare una duchessa ?;Attrice;Giocatore di tennis;Avvocato;Presentatore televisivo;Débutant;Fu nella famosa serie TV americana « Suits » che Meghan Markle interpretò Rachel Zane, un'assistente legale.;https://it.wikipedia.org/wiki/Suits
3;it;Dopo quale stagione Meghan Markle ha lasciato la serie « Suits » ?;Settimo;Sesto;Quinto;Otto;Débutant;Nel 2017, in seguito ai suoi impegni con il principe Harry, ha lasciato la serie « Suits » e ha preso la decisione di interrompere la sua carriera di attrice.;https://it.wikipedia.org/wiki/Meghan,_duchessa_di_Sussex
4;it;Con quale macchina famosa Meghan Markle è andata in televisione ?;K 2000;Christine;Generale Lee;Mystery Machine;Débutant;« The Return of K 2000 » (Knight Rider) è una serie drammatica americana creata da David Andron e prodotta da Doug Liman.;https://it.wikipedia.org/wiki/Knight_Rider_(serie_televisiva_2008)
5;it;Da quanti anni Meghan Markle è il compleanno di suo marito, il principe Harry ?;Tre anni;Cinque anni;Sette anni;Nove anni;Débutant;L'8 novembre 2016, è stato annunciato ufficialmente che Meghan Markle era la compagna del principe Harry, e questo dal giugno 2016.;https://it.wikipedia.org/wiki/Matrimonio_del_principe_Harry_e_Meghan_Markle
6;it;Quanti figli d'onore hanno accompagnato Meghan Markle al suo matrimonio principesco ?;Dieci;Otto;Sei;Quattro;Débutant;Meghan Markle ne ha scelti cinque : i suoi due figliolini Rylan e Remi Ritt e i tre figli della sua migliore amica, Jessica Mulroney.;https://it.wikipedia.org/wiki/Matrimonio_del_principe_Harry_e_Meghan_Markle
7;it;Quali affari vengono ancora esercitati oggi dalla madre di Meghan Markle ?;Insegnante di yoga;Stilista;Estetista;Romanziere;Débutant;Meghan Markle è cresciuta a Los Angeles da sua madre afroamericana, Doria Ragland, e da suo padre, Thomas Wayne Markle.;https://it.wikipedia.org/wiki/Meghan,_duchessa_di_Sussex
8;it;Quanti ospiti erano presenti al servizio di matrimonio principesco di Meghan Markle ?;600;500;400;300;Débutant;Il codice di abbigliamento impone un abito o una coda per uomo, un abito da cocktail e un cappello per donna.;https://it.wikipedia.org/wiki/Matrimonio_del_principe_Harry_e_Meghan_Markle
9;it;Chi ha scritto Meghan Markle a una famosa lettera di denuncia all'età di undici anni ?;Hillary Clinton;Laura Bush;Michelle Obama;Nancy Reagan;Débutant;Il presidente di Procter And Gamble cambierà il testo di uno spot televisivo nazionale che considerava troppo sessista.;https://it.wikipedia.org/wiki/Hillary_Clinton
10;it;Qual era il segno dell'abito da sposa di Meghan Markle al suo secondo matrimonio ?;Givenchy;Lacroix;Versace;Chanel;Débutant;Indossava un panino basso sormontato da una tiara di diamanti donata dalla regina, risalente al 1932, su una spilla del 1893.;https://it.wikipedia.org/wiki/Matrimonio_del_principe_Harry_e_Meghan_Markle
11;it;In quale soap opera Meghan Markle ha fatto la sua prima apparizione sugli schermi ?;« Ospedale centrale »;« Emergenza »;« Dr. House »;« Chicago Med »;Confirmé;Oggi è la prima soap opera americana più lunga e più antica in produzione di fronte a « The Fires of Love » e « Love, Glory and Beauty ».;
12;it;In quale paese Meghan Markle è andato nel 2014 per sostenere le truppe statunitensi ?;Afghanistan;Giordania;Mongolia;Cambogia;Confirmé;Questo faceva parte del tour organizzato dalle United Service Organizations, presieduto dal Capo di stato maggiore dell'esercito americano.;https://it.wikipedia.org/wiki/Meghan,_duchessa_di_Sussex
13;it;In quale serie di fantascienza Meghan Markle ha incarnato Amy Jessup ?;« Frangia »;« X-Files »;« Dark Angel »;« Oltre »;Confirmé;Nella serie, il team utilizza ciò che è noto in inglese come scienza marginale per studiare fenomeni inspiegabili.;
14;it;Quale produttore californiano Meghan Markle si è sposata dopo sette anni insieme ?;Trevor Engelson;Marc Sorkin;Michel Gohou;Roy Marten;Confirmé;Trevor Engelson è nato nel 1976 a Great Neck, New York, ha una nazionalità americana e appartiene alla comunità etnica bianca.;https://it.wikipedia.org/wiki/Meghan,_duchessa_di_Sussex
15;it;In quale film di Robert Pattinson è apparso Meghan Markle ?;« Ricordami »;« Bel Ami »;« Cosmopolis »;« Rover »;Confirmé;Nonostante le eccellenti ricette, i critici erano molto scettici, lamentandosi del fatto che il film fosse troppo simile alla saga di « Twilight ».;https://it.wikipedia.org/wiki/Remember_Me_(film)
16;it;Qual è stata la religione adottata da Meghan Markle prima di diventare anglicana ?;Protestante;Cattolica;Ortodossa;Indù;Confirmé;La cerimonia privata è stata celebrata nella Cappella reale di Saint James Palace, presieduta dall'arcivescovo di Canterbury, Justin Welby.;https://it.wikipedia.org/wiki/Meghan,_duchessa_di_Sussex
17;it;In quale film drammatico inglese-ungherese Meghan Markle ha interpretato il suo ultimo ruolo ?;« Antisociale »;« Paper World »;« Il figlio di Saul »;« Estinzione »;Confirmé;In questo film, varie azioni vengono eseguite nella città di Londra, ai nostri tempi, contro l'ambiente violento del traffico di armi.;
18;it;Quale fiore caro a Diana ha illuminato il bouquet del secondo matrimonio di Meghan Markle ?;Miosotis;Magnolia;Mimosa;Erba di San Giovanni;Confirmé;I fiori furono raccolti dallo stesso principe Harry, il giorno prima del matrimonio, nel giardino della loro residenza a Kensington Palace.;https://it.wikipedia.org/wiki/Myosotis
19;it;In quale serie di « esperti » Meghan Markle ha interpretato Veronica Perez ?;Manhattan;Miami;San Francisco;Texas;Confirmé;« Gli esperti: Manhattan » hanno solo alcune scene all'aperto girate a New York, il resto è girato in studio.;https://it.wikipedia.org/wiki/CSI:_NY
20;it;In quale serie Meghan Markle ha interpretato la bella addormentata ?;« Castello »;« Eroi »;« Gossip Girl »;« Ugly Betty »;Confirmé;Secondo la rivista Variety, ABC potrebbe presto lanciare una serie di « Castle », la trama incentrata su Derrick Storm.;
21;it;In quale anno Meghan Markle ha conseguito una laurea in teatro e relazioni internazionali ?;2003;2005;2007;2009;Expert;Meghan Markle ha studiato in scuole private a Los Angeles e poi alla Northwestern University di Chicago, Illinois.;https://it.wikipedia.org/wiki/Meghan,_duchessa_di_Sussex
22;it;In quale paese Meghan Markle spera di seguire una carriera politica ?;Argentina;Spagna;Grecia;Canada;Expert;Dopo il college, Meghan Markle ha lavorato per un po 'presso l'ambasciata americana a Buenos Aires, in Argentina.;https://it.wikipedia.org/wiki/Meghan,_duchessa_di_Sussex
23;it;Quali affari Meghan Markle ha freelance per pagare le bollette ?;Calligraphe;Veterinario;Web designer;Contabile;Expert;Esercizio part-time, Meghan Markle includeva calligrafia personalizzata su biglietti d'invito per il matrimonio.;https://it.wikipedia.org/wiki/Calligrafia
24;it;Per quale catena di grandi magazzini Meghan Markle è diventata un franchising pubblicitario ?;Reitmans;Hamleys;Canada Goose;Liberty And Co;Expert;Meghan Markle ama fare shopping online presso Reitmans, la principale catena di negozi al dettaglio di moda femminile in Canada.;https://it.wikipedia.org/wiki/Meghan,_duchessa_di_Sussex
25;it;Per quale summit annuale Meghan Markle ha parlato della schiavitù moderna ?;Un mondo giovane;Gordonia;Nozem;Fimcap;Expert;I giovani leader di questo vertice vengono scelti dopo un lungo processo di selezione, giudicato per il loro potenziale di leadership.;
26;it;Quale chef culinario canadese, Meghan Markle, si è sciolto nel 2016 ?;Cory Vitiello;Renaud Cyr;Anthony Sedlak;Normand Laprise;Expert;Meghan Markle avrebbe trascorso due anni con lo chef di Toronto Cory Vitiello, incontrandolo nel suo vecchio ristorante.;https://it.wikipedia.org/wiki/Meghan,_duchessa_di_Sussex
27;it;A parte Meghan Markle, quale altro divorzio americano è entrato anche nella famiglia reale ?;Wallis Simpson;Sally Howard;Priscilla Presbury;Sarah Cassaway;Expert;Dopo il divorzio da Earl Winfield Spencer Jr., Wallis Simpson si risposò il 21 luglio 1928 con Ernest Aldrich Simpson.;https://it.wikipedia.org/wiki/Wallis_Simpson
28;it;Quale re d'Inghilterra è un antenato del padre di Meghan Markle ?;Edoardo III;Henri III;Giovanni senza terra;Carlo II;Expert;Edward fu incoronato a Westminster (Londra) il 1 ° febbraio 1327, all'età di 14 anni, a causa del licenziamento di suo padre Edoardo II.;
29;it;Quale migliore amica di Meghan Markle l'ha accompagnata al suo matrimonio principesco ?;Jessica Mulroney;Sarah Rafferty;Katherine Heigl;Amanda Schull;Expert;Rachel Meghan Markle, conosciuta come Meghan Markle, è nata il 4 agosto 1981 a Los Angeles, in California, da genitori americani.;https://it.wikipedia.org/wiki/Matrimonio_del_principe_Harry_e_Meghan_Markle
30;it;Quanto costò il costoso pezzo che spinse le tradizioni al suo matrimonio principesco con Harry ?;57.000 EUR;43.000 EUR;38.000 EUR;22.000 EUR;Expert;Rompere con il classico budino di frutta candita, questa torta reale, fatta con ingredienti biologici, è stata prodotta da Claire Ptak.;https://it.wikipedia.org/wiki/Matrimonio_del_principe_Harry_e_Meghan_Markle
1;nl;Welke titel kreeg Meghan Markle na haar tweede huwelijk ?;Hertogin van Sussex;Gravin van York;Koninklijke Hoogheid;Prinses van Windsor;Débutant;Voorheen was er nooit een hertogin van Sussex, hoewel Augustus Frederick (eerste eigenaar) twee keer trouwde.;https://nl.wikipedia.org/wiki/Hertog_van_Sussex
2;nl;Wat was het werk van Meghan Markle voordat hij hertogin werd ?;Actrice;Tennisspeler;Advocaat;Tv-presentator;Débutant;Het was in de beroemde Amerikaanse tv-serie « Suits » dat Meghan Markle Rachel Zane, een juridisch assistent, uitvoerde.;https://nl.wikipedia.org/wiki/Suits_(televisieserie)
3;nl;Na welk seizoen verliet Meghan Markle de serie « Suits » ?;Zevende;Zesde;Vijfde;Acht;Débutant;In 2017, na haar verlovingen met Prins Harry, verliet ze de serie « Suits » en nam ze de beslissing om haar carrière als actrice te onderbreken.;https://nl.wikipedia.org/wiki/Meghan_Markle
4;nl;Met welke beroemde auto ging Meghan Markle op televisie ?;K 2000;Christine;Generaal Lee;Mystery Machine;Débutant;« The Return of K 2000 » (Knight Rider) is een Amerikaanse dramaserie gemaakt door David Andron en geproduceerd door Doug Liman.;https://nl.wikipedia.org/wiki/Knight_Rider_(2008)
5;nl;Hoeveel jaar is Meghan Markle de verjaardag van haar echtgenoot, Prins Harry ?;Drie jaar;Vijf jaar;Zeven jaar;Negen jaar;Débutant;Op 8 november 2016 werd officieel aangekondigd dat Meghan Markle de metgezel van Prins Harry was, en dit sinds juni 2016.;
6;nl;Hoeveel erekinderen hebben Meghan Markle vergezeld op haar prinselijke bruiloft ?;Tien;Acht;Zes;Vier;Débutant;Meghan Markle heeft er vijf uitgekozen : haar twee petekinderen Rylan en Remi Ritt en de drie kinderen van haar beste vriendin, Jessica Mulroney.;
7;nl;Welk bedrijf wordt vandaag nog steeds uitgeoefend door de moeder van Meghan Markle ?;Yoga leraar;Stylist;Schoonheidsspecialiste;Romanschrijver;Débutant;Meghan Markle werd in Los Angeles grootgebracht door haar Afro-Amerikaanse moeder, Doria Ragland, en haar vader, Thomas Wayne Markle.;https://nl.wikipedia.org/wiki/Meghan_Markle
8;nl;Hoeveel gasten waren aanwezig bij de prinselijke huwelijksservice van Meghan Markle ?;600;500;400;300;Débutant;De dresscode legt een pak of staart op voor mannen, een cocktailjurk en een hoed voor vrouwen.;
9;nl;Wie heeft Meghan Markle op elfjarige leeftijd een beroemde klachtenbrief geschreven ?;Hillary Clinton;Laura Bush;Michelle Obama;Nancy Reagan;Débutant;De president van Procter And Gamble zal de tekst van een nationale televisiecommercial wijzigen die zij te seksistisch vond.;https://nl.wikipedia.org/wiki/Hillary_Clinton
10;nl;Wat was het kenmerk van de trouwjurk van Meghan Markle bij haar tweede huwelijk ?;Givenchy;Lacroix;Versace;Chanel;Débutant;Ze droeg een laag broodje met daarboven een diamanten tiara geschonken door de koningin, uit 1932, op een broche van 1893.;
11;nl;In welke soapserie verscheen Meghan Markle voor het eerst op de schermen ?;« Centraal ziekenhuis »;« Noodgeval »;« Dr. House »;« Chicago Med »;Confirmé;Het is vandaag de eerste langste en oudste Amerikaanse soapserie in productie voor « The Fires of Love » en « Love, Glory and Beauty ».;
12;nl;Naar welk land ging Meghan Markle in 2014 om Amerikaanse troepen te ondersteunen ?;Afghanistan;Jordanië;Mongolië;Cambodja;Confirmé;Dit was onderdeel van de tour georganiseerd door United Service Organisations, voorgezeten door de stafchef van het Amerikaanse leger.;https://nl.wikipedia.org/wiki/Meghan_Markle
13;nl;In welke serie sciencefiction heeft Meghan Markle Amy Jessup belichaamd ?;« Fringe »;« X-bestanden »;« Dark Angel »;« Voorbij »;Confirmé;In de serie gebruikt het team wat in het Engels bekend staat als fringe science om onverklaarbare fenomenen te onderzoeken.;
