1;fr;Quel titre Meghan Markle a-t-elle reçu suite à son deuxième mariage ?;Duchesse de Sussex;Comtesse de York;Altesse royale;Princesse de Windsor;Débutant;Auparavant, il n'y a jamais eu de duchesse de Sussex, même si Augustus Frederick (premier titulaire) s'est marié deux fois.;https://fr.wikipedia.org/wiki/Duc_de_Sussex
2;fr;Quel était le métier de Meghan Markle avant de devenir duchesse ?;Actrice;Joueuse de tennis;Juriste;Présentatrice télé;Débutant;C'est dans la célèbre série télévisée américaine « Suits » que Meghan Markle a interprété Rachel Zane, une assistante juridique.;https://fr.wikipedia.org/wiki/Suits_:_Avocats_sur_mesure
3;fr;À l'issue de quelle saison Meghan Markle a-t-elle quitté la série « Suits » ?;Septième;Sixième;Cinquième;Huitième;Débutant;En 2017, à la suite de ses fiançailles avec le Prince Harry, elle quitte la série « Suits » et prend la décision d'interrompre sa carrière d'actrice.;https://fr.wikipedia.org/wiki/Meghan_Markle
4;fr;En compagnie de quelle célèbre voiture Meghan Markle a-t-elle tourné à la télévision ?;K 2000;Christine;General Lee;Mystery Machine;Débutant;« Le Retour de K 2000 » (Knight Rider) est une série télévisée américaine créée par David Andron et produite par Doug Liman.;https://fr.wikipedia.org/wiki/Le_Retour_de_K_2000
5;fr;De combien d'années Meghan Markle est-elle l'aînée de son mari, le prince Harry ?;Trois ans;Cinq ans;Sept ans;Neuf ans;Débutant;Le 8 novembre 2016, il fut officiellement annoncé que Meghan Markle était la compagne du prince Harry, et ce depuis juin 2016.;https://fr.wikipedia.org/wiki/Mariage_du_prince_Harry_et_de_Meghan_Markle
6;fr;Combien d'enfants d'honneur ont accompagné Meghan Markle lors de son mariage princier ?;Dix;Huit;Six;Quatre;Débutant;Meghan Markle en a choisi cinq : ses deux filleules Rylan et Remi Ritt ainsi et les trois enfants de sa meilleure amie, Jessica Mulroney.;https://fr.wikipedia.org/wiki/Mariage_du_prince_Harry_et_de_Meghan_Markle
7;fr;Quel métier est encore à ce jour exercé par la mère de Meghan Markle ?;Professeur de yoga;Styliste;Esthéticienne;Romancière;Débutant;Meghan Markle fut élevée à Los Angeles par sa mère afro-américaine, Doria Ragland, et son père, Thomas Wayne Markle.;https://fr.wikipedia.org/wiki/Meghan_Markle
8;fr;Combien d'invités étaient à l'office religieux du mariage princier de Meghan Markle ?;600;500;400;300;Débutant;Le code vestimentaire impose un complet ou queue de pie pour les hommes, une robe de cocktail et un chapeau pour les femmes.;https://fr.wikipedia.org/wiki/Mariage_du_prince_Harry_et_de_Meghan_Markle
9;fr;À qui Meghan Markle a-t-elle écrit une célèbre lettre de réclamation à l'âge de onze ans ?;Hillary Clinton;Laura Bush;Michelle Obama;Nancy Reagan;Débutant;Le président de Procter And Gamble fera ainsi changer le texte d'une publicité télévisée nationale qu'elle a jugé trop sexiste.;https://fr.wikipedia.org/wiki/Hillary_Clinton
10;fr;Quelle était la marque de la robe de mariée de Meghan Markle à son deuxième mariage ?;Givenchy;Lacroix;Versace;Chanel;Débutant;Elle était coiffée d'un chignon bas surmonté d'une tiare de diamants offerte par la reine, datant de 1932, sur une broche de 1893.;https://fr.wikipedia.org/wiki/Mariage_du_prince_Harry_et_de_Meghan_Markle
11;fr;Dans quel soap opera Meghan Markle a-t-elle fait sa première apparition sur les écrans ?;« Hôpital central »;« Urgence »;« Dr House »;« Chicago Med »;Confirmé;Il est à ce jour le premier plus long et ancien feuilleton américain en production devant « Les Feux de l'amour » et « Amour, Gloire et Beauté ».;https://fr.wikipedia.org/wiki/Hôpital_central
12;fr;Où Markle s'est-elle rendu en 2014 pour soutenir les troupes américaines ?;Afghanistan;Jordanie;Mongolie;Cambodge;Confirmé;Ceci dans le cadre de la tournée organisée par l'United Service Organizations, présidée par le chef d'État-Major des armées US.;https://fr.wikipedia.org/wiki/Meghan_Markle
13;fr;Dans quelle série de science-fiction policière Meghan Markle a-t-elle incarné Amy Jessup ?;« Fringe »;« X-Files »;« Dark Angel »;« Beyond »;Confirmé;Dans la série, l'équipe a recours à ce qu'on appelle en anglais la fringe science pour enquêter sur des phénomènes inexpliqués.;https://fr.wikipedia.org/wiki/Fringe_(série_télévisée)
14;fr;Quel producteur californien Meghan Markle a-t-elle épousé après 7 ans de vie commune ?;Trevor Engelson;Marc Sorkin;Michel Gohou;Roy Marten;Confirmé;Trevor Engelson est né en 1976 à Great Neck, New York, possède une nationalité américaine et appartient au milieu ethnique blanc.;https://fr.wikipedia.org/wiki/Meghan_Markle
15;fr;Dans quel long métrage porté par Robert Pattinson Meghan Markle est-elle apparue ?;« Remember Me »;« Bel Ami »;« Cosmopolis »;« The Rover »;Confirmé;Malgré d'excellentes recettes, les critiques ont été très sévères, déplorant que le film soit trop semblable à la saga « Twilight ».;https://fr.wikipedia.org/wiki/Remember_Me_(film,_2010)
16;fr;Quelle était la religion adoptée par Meghan Markle avant de devenir anglicane ?;Protestante;Catholique;Orthodoxe;Hindoue;Confirmé;La cérémonie privée a été célébrée dans la chapelle royale du palais Saint James, présidée par l'archevêque de Cantorbéry, Justin Welby.;https://fr.wikipedia.org/wiki/Meghan_Markle
17;fr;Dans quel film dramatique britannico-hongrois Meghan Markle a-t-elle joué son dernier rôle ?;« Anti-Social »;« Paper World »;« Le Fils de Saul »;« Extinction »;Confirmé;Dans ce film, différentes actions sont menées dans la ville de Londres, à notre époque, contre le milieu violent du trafic d'armes.;https://fr.wikipedia.org/wiki/Anti-Social
18;fr;Quelle fleur chère à Diana illuminait le bouquet du second mariage de M. Markle ?;Myosotis;Magnolia;Mimosa;Millepertuis;Confirmé;Des fleurs furent cueillies par le prince Harry lui-même, la veille du mariage, dans le jardin de leur résidence à Kensington Palace.;https://fr.wikipedia.org/wiki/Myosotis
19;fr;Dans quelle série des « Experts » Meghan Markle a-t-elle incarné Veronica Perez ?;Manhattan;Miami;San Francisco;Texas;Confirmé;« Les Experts : Manhattan » ne comportent que quelques scènes extérieures filmées à New York, le reste étant tourné en studio.;https://fr.wikipedia.org/wiki/Les_Experts_:_Manhattan
20;fr;Dans quelle série télévisée Meghan Markle a-t-elle interprété la Belle au bois dormant ?;« Castle »;« Heroes »;« Gossip Girl »;« Ugly Betty »;Confirmé;Selon le magazine Variety, ABC pourrait bientôt lancer une série dérivée de « Castle », l'histoire se centrant sur Derrick Storm.;https://fr.wikipedia.org/wiki/Castle_(série_télévisée)
21;fr;En quelle année Meghan Markle a-t-elle reçu une licence en relations internationales ?;2003;2005;2007;2009;Expert;Meghan Markle a étudié au sein d'écoles privées à Los Angeles puis à l'université Northwestern de Chicago, dans l'Illinois.;https://fr.wikipedia.org/wiki/Meghan_Markle
22;fr;Dans quel pays Meghan Markle espérait-elle suivre une carrière politique ?;Argentine;Espagne;Grèce;Canada;Expert;Après l'université, Meghan Markle a travaillé un moment pour l'ambassade américaine de Buenos Aires, en Argentine.;https://fr.wikipedia.org/wiki/Meghan_Markle
23;fr;Quel métier Meghan Markle a-t-elle exercé en freelance pour payer ses factures ?;Calligraphe;Vétérinaire;Web designer;Comptable;Expert;Exercé à mi-temps, Meghan Markle proposait notamment des calligraphies personnalisées sur des cartons d'invitation de mariage.;https://fr.wikipedia.org/wiki/Calligraphie
24;fr;Pour quelle chaîne de grands magasins Meghan Markle est-elle devenue l'égérie ?;Reitmans;Hamleys;Canada Goose;Liberty And Co;Expert;Meghan Markle adore magasiner en ligne chez Reitmans, importante chaîne de commerce au détail de mode féminine au Canada.;https://fr.wikipedia.org/wiki/Meghan_Markle
25;fr;Pour quel sommet annuel Meghan Markle s'est-elle exprimé sur l'esclavage moderne ?;One Young World;Gordonia;Nozem;Fimcap;Expert;Les jeunes leaders de ce sommet sont choisis après un long processus de sélection, jugés pour leur potentiel de leadership.;https://fr.wikipedia.org/wiki/One_Young_World
26;fr;Avec quel chef culinaire canadien Meghan Markle a-t-elle rompu en 2016 ?;Cory Vitiello;Renaud Cyr;Anthony Sedlak;Normand Laprise;Expert;Meghan Markle aurait fréquenté deux ans le chef torontois Cory Vitiello, après l'avoir rencontré dans son ancien restaurant.;https://fr.wikipedia.org/wiki/Meghan_Markle
27;fr;Hormis Meghan Markle, quelle autre américaine divorcée a visé la famille royale ?;Wallis Simpson;Sally Howard;Priscilla Presbury;Sarah Cassaway;Expert;Après son divorce avec Earl Winfield Spencer Jr., Wallis Simpson s'est remarié le 21 juillet 1928 avec Ernest Aldrich Simpson.;https://fr.wikipedia.org/wiki/Wallis_Simpson
28;fr;Quel roi d'Angleterre est un ancêtre du père de Meghan Markle ?;Édouard III;Henri III;Jean sans Terre;Charles II;Expert;Édouard fut couronné à Westminster (Londres) le 1er février 1327, à l'âge de 14 ans, en raison de la destitution de son père Édouard II.;https://fr.wikipedia.org/wiki/Édouard_III
29;fr;Quelle meilleure amie de Meghan Markle l'a accompagné à son mariage princier ?;Jessica Mulroney;Sarah Rafferty;Katherine Heigl;Amanda Schull;Expert;Rachel Meghan Markle, dite Meghan Markle, est née le 4 août 1981 à Los Angeles, en Californie, de parents américains.;https://fr.wikipedia.org/wiki/Mariage_du_prince_Harry_et_de_Meghan_Markle
30;fr;Combien a coûté la pièce montée du mariage princier de Meghan Markle ?;57 000 euros;43 000 euros;38 000 euros;22 000 euros;Expert;Rompant avec le classique pudding aux fruits confits, ce gâteau royal, composé d'ingrédients bio, fut réalisé par Claire Ptak.;https://fr.wikipedia.org/wiki/Mariage_du_prince_Harry_et_de_Meghan_Markle
1;en;What title did Meghan Markle receive after her second marriage ?;Duchess of Sussex;Countess of York;Royal Highness;Princess of Windsor;Débutant;Previously, there was never a Duchess of Sussex, even though Augustus Frederick (first owner) married twice.;https://en.wikipedia.org/wiki/Duke_of_Sussex
2;en;What was Meghan Markle's job before becoming a Duchess ?;Actress;Tennis player;Lawyer;TV host;Débutant;It was in the famous American TV series « Suits » that Meghan Markle performed Rachel Zane, a legal assistant.;https://en.wikipedia.org/wiki/Suits_(American_TV_series)
3;en;After what season did Meghan Markle leave the « Suits » series ?;Seventh;Sixth;Fifth;Eight;Débutant;In 2017, following her engagements with Prince Harry, she left the series « Suits » and made the decision to interrupt her career as an actress.;https://en.wikipedia.org/wiki/Meghan,_Duchess_of_Sussex
4;en;With what famous car did Meghan Markle go on television ?;K 2000;Christine;General Lee;Mystery Machine;Débutant;« The Return of K 2000 » (Knight Rider) is an American drama series created by David Andron and produced by Doug Liman.;https://en.wikipedia.org/wiki/Knight_Rider_(2008_TV_series)
5;en;How many years is Meghan Markle the birthday of her husband, Prince Harry ?;Three years;Five years;Seven years;Nine years;Débutant;On November 8, 2016, it was officially announced that Meghan Markle was the companion of Prince Harry, and this since June 2016.;https://en.wikipedia.org/wiki/Wedding_of_Prince_Harry_and_Meghan_Markle
6;en;How many children of honor have accompanied Meghan Markle at her princely wedding ?;Ten;Eight;Six;Four;Débutant;Meghan Markle has chosen five : her two godchildren Rylan and Remi Ritt and the three children of her best friend, Jessica Mulroney.;https://en.wikipedia.org/wiki/Wedding_of_Prince_Harry_and_Meghan_Markle
7;en;What business is still exercised today by Meghan Markle's mother ?;Yoga teacher;Stylist;Esthetician;Novelist;Débutant;Meghan Markle was raised in Los Angeles by her African-American mother, Doria Ragland, and her father, Thomas Wayne Markle.;https://en.wikipedia.org/wiki/Meghan,_Duchess_of_Sussex
8;en;How many guests were present at the princely wedding service of Meghan Markle ?;600;500;400;300;Débutant;The dress code imposes a suit or tail for men, a cocktail dress and a hat for women.;https://en.wikipedia.org/wiki/Wedding_of_Prince_Harry_and_Meghan_Markle
9;en;Who did Meghan Markle write a famous letter of complaint at the age of eleven ?;Hillary Clinton;Laura Bush;Michelle Obama;Nancy Reagan;Débutant;The president of Procter And Gamble will change the text of a national television commercial that she considered too sexist.;https://en.wikipedia.org/wiki/Hillary_Clinton
10;en;What was the mark of the wedding dress of Meghan Markle at her second marriage ?;Givenchy;Lacroix;Versace;Chanel;Débutant;She was wearing a low bun surmounted by a diamond tiara donated by the queen, dating from 1932, on a brooch of 1893.;https://en.wikipedia.org/wiki/Wedding_of_Prince_Harry_and_Meghan_Markle
11;en;In which soap opera did Meghan Markle make her first appearance on the screens ?;« Central Hospital »;« Emergency »;« Dr. House »;« Chicago Med »;Confirmé;It is today the first longest and oldest American soap opera in production in front of « The Fires of Love » and « Love, Glory and Beauty ».;
12;en;In which country did Meghan Markle go in 2014 to support US troops ?;Afghanistan;Jordan;Mongolia;Cambodia;Confirmé;This was part of the tour organized by United Service Organizations, chaired by the US Army Chief of Staff.;https://en.wikipedia.org/wiki/Meghan,_Duchess_of_Sussex
13;en;In which series of sci-fi fiction has Meghan Markle embodied Amy Jessup ?;« Fringe »;« X-Files »;« Dark Angel »;« Beyond »;Confirmé;In the series, the team uses what is known in English as fringe science to investigate unexplained phenomena.;
14;en;Which Californian producer Meghan Markle married after seven years together ?;Trevor Engelson;Marc Sorkin;Michel Gohou;Roy Marten;Confirmé;Trevor Engelson was born in 1976 in Great Neck, New York, has an American nationality and belongs to the white ethnic community.;https://en.wikipedia.org/wiki/Meghan,_Duchess_of_Sussex
15;en;In which feature film by Robert Pattinson did Meghan Markle appear ?;« Remember Me »;« Bel Ami »;« Cosmopolis »;« The Rover »;Confirmé;Despite excellent recipes, the critics were very skeptical, complaining that the movie was too similar to the « Twilight » saga.;https://en.wikipedia.org/wiki/Remember_Me_(2010_film)
16;en;What was the religion adopted by Meghan Markle before becoming Anglican ?;Protestant;Catholic;Orthodox;Hindu;Confirmé;The private ceremony was celebrated in the Royal Chapel of Saint James Palace, presided over by the Archbishop of Canterbury, Justin Welby.;https://en.wikipedia.org/wiki/Meghan,_Duchess_of_Sussex
17;en;In which British-Hungarian drama film did Meghan Markle play her last role ?;« Anti-Social »;« Paper World »;« The Son of Saul »;« Extinction »;Confirmé;In this film, various actions are carried out in the city of London, at our time, against the violent environment of arms trafficking.;
18;en;Which flower dear to Diana lit up the bouquet of Meghan Markle's second wedding ?;Myosotis;Magnolia;Mimosa;St. John's Wort;Confirmé;Flowers were picked by Prince Harry himself, the day before the wedding, in the garden of their residence at Kensington Palace.;https://en.wikipedia.org/wiki/Myosotis
19;en;In which series of « Experts » did Meghan Markle play Veronica Perez ?;Manhattan;Miami;San Francisco;Texas;Confirmé;« The Experts: Manhattan » only have a few outdoor scenes filmed in New York, the rest being shot in the studio.;https://en.wikipedia.org/wiki/CSI:_NY
20;en;In which series did Meghan Markle interpret the Sleeping Beauty ?;« Castle »;« Heroes »;« Gossip Girl »;« Ugly Betty »;Confirmé;According to Variety magazine, ABC could soon launch a series of « Castle », the story centering on Derrick Storm.;
21;en;In which year did Meghan Markle receive a BA in Theater and International Relations ?;2003;2005;2007;2009;Expert;Meghan Markle studied at private schools in Los Angeles and then at Northwestern University in Chicago, Illinois.;https://en.wikipedia.org/wiki/Meghan,_Duchess_of_Sussex
22;en;In which country does Meghan Markle hope to follow a political career ?;Argentina;Spain;Greece;Canada;Expert;After college, Meghan Markle worked for a while at the American Embassy in Buenos Aires, Argentina.;https://en.wikipedia.org/wiki/Meghan,_Duchess_of_Sussex
23;en;What business Meghan Markle has freelance to pay his bills ?;Calligraphe;Veterinary;Web designer;Accountant;Expert;Part-time exercise, Meghan Markle included personalized calligraphy on wedding invitation cards.;https://en.wikipedia.org/wiki/Calligraphy
24;en;For which department store chain has Meghan Markle become an advertising franchise ?;Reitmans;Hamleys;Canada Goose;Liberty And Co;Expert;Meghan Markle loves shopping online at Reitmans, Canada's leading women's fashion retail chain.;https://en.wikipedia.org/wiki/Meghan,_Duchess_of_Sussex
25;en;For what annual summit did Meghan Markle talk about modern slavery ?;One Young World;Gordonia;Nozem;Fimcap;Expert;The young leaders of this summit are chosen after a long process of selection, judged for their leadership potential.;https://en.wikipedia.org/wiki/One_Young_World
26;en;Which Canadian culinary chef, Meghan Markle, broke up in 2016 ?;Cory Vitiello;Renaud Cyr;Anthony Sedlak;Normand Laprise;Expert;Meghan Markle would have spent two years with Toronto chef Cory Vitiello, having met him at his old restaurant.;https://en.wikipedia.org/wiki/Meghan,_Duchess_of_Sussex
27;en;Aside from Meghan Markle, what other American divorcee has also entered the royal family ?;Wallis Simpson;Sally Howard;Priscilla Presbury;Sarah Cassaway;Expert;After his divorce from Earl Winfield Spencer Jr., Wallis Simpson remarried on July 21, 1928 with Ernest Aldrich Simpson.;https://en.wikipedia.org/wiki/Wallis_Simpson
28;en;Which king of England is an ancestor of the father of Meghan Markle ?;Edward III;Henri III;John without Land;Charles II;Expert;Edward was crowned in Westminster (London) on February 1, 1327, at the age of 14, because of the dismissal of his father Edward II.;
29;en;What better friend of Meghan Markle accompanied her to her princely wedding ?;Jessica Mulroney;Sarah Rafferty;Katherine Heigl;Amanda Schull;Expert;Rachel Meghan Markle, known as Meghan Markle, was born on August 4, 1981 in Los Angeles, California, to American parents.;https://en.wikipedia.org/wiki/Wedding_of_Prince_Harry_and_Meghan_Markle
30;en;How much did the expensive piece that jostled the traditions at his princely wedding with Harry cost ?;EUR 57,000;EUR 43,000;EUR 38,000;EUR 22,000;Expert;Breaking with the classic candied fruit pudding, this royal cake, made from organic ingredients, was made by Claire Ptak.;https://en.wikipedia.org/wiki/Wedding_of_Prince_Harry_and_Meghan_Markle
1;de;Welchen Titel erhielt Meghan Markle nach ihrer zweiten Ehe ?;Herzogin von Sussex;Gräfin von york;Königliche Hoheit;Prinzessin von Windsor;Débutant;Zuvor gab es keine Herzogin von Sussex, obwohl Augustus Frederick (erster Besitzer) zweimal verheiratet war.;https://de.wikipedia.org/wiki/Duke_of_Sussex
2;de;Was war Meghan Markles Job, bevor sie Herzogin wurde ?;Schauspielerin;Tennisspieler;Anwalt;Fernsehmoderator;Débutant;In der berühmten amerikanischen Fernsehserie « Suits » spielte Meghan Markle die Rechtsassistentin Rachel Zane.;https://de.wikipedia.org/wiki/Suits_(Fernsehserie)
3;de;Nach welcher Saison hat Meghan Markle die Serie « Suits » verlassen ?;Siebte;Sechste;Fünfter;Acht;Débutant;Nach ihrer Verlobung mit Prince Harry verließ sie 2017 die Serie « Suits » und beschloss, ihre Karriere als Schauspielerin zu unterbrechen.;https://de.wikipedia.org/wiki/Meghan,_Duchess_of_Sussex
4;de;Mit welchem berühmten Auto ist Meghan Markle ins Fernsehen gegangen ?;K 2000;Christine;General Lee;Mystery Machine;Débutant;« Die Rückkehr von K 2000 » (Knight Rider) ist eine amerikanische Dramaserie, die von David Andron kreiert und von Doug Liman produziert wurde.;https://de.wikipedia.org/wiki/Knight_Rider_(2008)
5;de;Wie viele Jahre hat Meghan Markle, Prinz Harry, Geburtstag ?;Drei Jahre;Fünf Jahre;Sieben Jahre;Neun Jahre;Débutant;Am 8. November 2016 wurde offiziell bekannt gegeben, dass Meghan Markle die Gefährtin von Prince Harry ist, und das seit Juni 2016.;https://de.wikipedia.org/wiki/Hochzeit_von_Prinz_Harry_und_Meghan_Markle
6;de;Wie viele Ehrenkinder haben Meghan Markle bei ihrer fürstlichen Hochzeit begleitet ?;Zehn;Acht;Sechs;Vier;Débutant;Meghan Markle hat fünf ausgewählt : ihre beiden Patenkinder Rylan und Remi Ritt und die drei Kinder ihrer besten Freundin Jessica Mulroney.;https://de.wikipedia.org/wiki/Hochzeit_von_Prinz_Harry_und_Meghan_Markle
7;de;Welches Geschäft übt Meghan Markles Mutter heute noch aus ?;Yogalehrer;Stylist;Kosmetikerin;Romancier;Débutant;Meghan Markle ist in Los Angeles von ihrer afroamerikanischen Mutter Doria Ragland und ihrem Vater Thomas Wayne Markle aufgewachsen.;https://de.wikipedia.org/wiki/Meghan,_Duchess_of_Sussex
8;de;Wie viele Gäste waren beim fürstlichen Hochzeitsservice von Meghan Markle anwesend ?;600;500;400;300;Débutant;Die Kleiderordnung schreibt einen Anzug oder Schwanz für Männer, ein Cocktailkleid und einen Hut für Frauen vor.;https://de.wikipedia.org/wiki/Hochzeit_von_Prinz_Harry_und_Meghan_Markle
9;de;Wem hat Meghan Markle im Alter von elf Jahren einen berühmten Beschwerdebrief geschrieben ?;Hillary Clinton;Laura Bush;Michelle Obama;Nancy Reagan;Débutant;Die Präsidentin von Procter And Gamble wird den Text einer nationalen Fernsehwerbung ändern, die sie für zu sexistisch hält.;https://de.wikipedia.org/wiki/Hillary_Clinton
10;de;Was zeichnete das Brautkleid von Meghan Markle in ihrer zweiten Ehe aus ?;Givenchy;Lacroix;Versace;Chanel;Débutant;Sie trug ein niedriges Brötchen, das von einer Diamant-Tiara überragt war, die die Königin aus dem Jahr 1932 an einer Brosche von 1893 gestiftet hatte.;https://de.wikipedia.org/wiki/Hochzeit_von_Prinz_Harry_und_Meghan_Markle
11;de;In welcher Seifenoper trat Meghan Markle zum ersten Mal auf den Bildschirmen auf ?;« Zentralkrankenhaus »;« Notfall »;« Dr. House »;« Chicago Med »;Confirmé;Es ist heute die erste längste und älteste amerikanische Seifenoper in Produktion vor « The Fires of Love » und « Love, Glory and Beauty ».;
12;de;In welches Land ist Meghan Markle 2014 gegangen, um US-Truppen zu unterstützen ?;Afghanistan;Jordanien;Mongolei;Kambodscha;Confirmé;Dies war Teil der Tour, die von United Service Organizations unter dem Vorsitz des Stabschefs der US-Armee organisiert wurde.;https://de.wikipedia.org/wiki/Meghan,_Duchess_of_Sussex
13;de;In welcher Science-Fiction-Serie hat Meghan Markle Amy Jessup verkörpert ?;« Rand »;« X-Files »;« Dunkler Engel »;« Beyond »;Confirmé;In der Serie verwendet das Team die im Englischen als Randwissenschaft bekannte Methode, um ungeklärte Phänomene zu untersuchen.;
14;de;Welche kalifornische Produzentin Meghan Markle hat nach sieben gemeinsamen Jahren geheiratet ?;Trevor Engelson;Marc Sorkin;Michel Gohou;Roy Marten;Confirmé;Trevor Engelson wurde 1976 in Great Neck, New York, geboren, hat eine amerikanische Staatsangehörigkeit und gehört der weißen ethnischen Gemeinschaft an.;https://de.wikipedia.org/wiki/Meghan,_Duchess_of_Sussex
15;de;In welchem  ? ?Spielfilm von Robert Pattinson war Meghan Markle zu sehen ?;« Erinnere dich an mich »;« Bel Ami »;« Cosmopolis »;« Der Rover »;Confirmé;Trotz hervorragender Rezepte waren die Kritiker sehr skeptisch und beschwerten sich, dass der Film der « Twilight » Saga zu ähnlich sei.;https://de.wikipedia.org/wiki/Remember_Me_ ?_Lebe_den_Augenblick
16;de;Welche Religion hat Meghan Markle angenommen, bevor sie Anglikanerin wurde ?;Protestantisch;Katholisch;Orthodox;Hindu;Confirmé;Die private Zeremonie wurde in der königlichen Kapelle des Saint James Palace unter dem Vorsitz des Erzbischofs von Canterbury, Justin Welby, gefeiert.;https://de.wikipedia.org/wiki/Meghan,_Duchess_of_Sussex
17;de;In welchem britisch-ungarischen Drama spielte Meghan Markle ihre letzte Rolle ?;« unsozial »;« Papierwelt »;« Der Sohn von Saul »;« Aussterben »;Confirmé;In diesem Film werden in der heutigen Stadt London verschiedene Aktionen gegen das gewalttätige Umfeld des Waffenhandels durchgeführt.;
18;de;Welche Blume, die Diana lieb ist, hat den Strauß von Meghan Markles zweiter Hochzeit beleuchtet ?;Myosotis;Magnolie;Mimosa;Johanniskraut;Confirmé;Am Tag vor der Hochzeit pflückte Prinz Harry selbst im Garten seiner Residenz im Kensington Palace Blumen.;https://de.wikipedia.org/wiki/Vergissmeinnicht
19;de;In welcher Reihe von « Experten » spielte Meghan Markle Veronica Perez ?;Manhattan;Miami;San Francisco;Texas;Confirmé;« The Experts: Manhattan » hat nur wenige Outdoor-Szenen in New York gedreht, der Rest wird im Studio gedreht.;https://de.wikipedia.org/wiki/CSI:_NY
20;de;In welcher Serie interpretierte Meghan Markle das Dornröschen ?;« Schloss »;« Helden »;« Klatschmädchen »;« Hässliche Betty »;Confirmé;Laut Variety Magazine könnte ABC in Kürze eine Serie von « Castle » herausbringen, die sich auf Derrick Storm konzentriert.;
21;de;In welchem Jahr erhielt Meghan Markle einen BA in Theater und Internationale Beziehungen ?;2003;2005;2007;2009;Expert;Meghan Markle studierte an Privatschulen in Los Angeles und anschließend an der Northwestern University in Chicago, Illinois.;https://de.wikipedia.org/wiki/Meghan,_Duchess_of_Sussex
