23;nl;Wie is de meest succesvolle Franse freestyleskiër in haar discipline ?;Perrine Laffont;Candice Gilg;Jennifer Heil;Sandra Schmitt;Expert;Ze is vijfvoudig wereldkampioen en heeft negen kristallen bollen vast voor haar overwinningen op de Wereldbekerranglijst.;https://nl.wikipedia.org/wiki/Perrine_Laffont
24;nl;Welke Zilveren Bal scoorde in 2015 een schitterend doelpunt tegen Mexico ?;Amandine Henry;Eva Périsset;Wendie Renard;Emelyne Laurent;Expert;In 2017, kort na de komst van Corinne Diacre als bondscoach, wordt zij aanvoerder van de Bleues.;https://nl.wikipedia.org/wiki/Amandine_Henry
25;nl;Wie was de eerste die alleen de drie grote noordwanden van de Alpen beklom ?;Catherine Destivelle;Sophie Lavaud;Marie Marvingt;Liliane Barrard;Expert;Vanaf 2011 begon ze samen met Bruno Dupety boeken te publiceren (Éditions du Mont-Blanc) over bergen en bergbeklimmen.;
26;nl;Welke freestyle-zwemspecialist woont als koppel bij Jérémy Desplanches ?;Charlotte Bonnet;Federica Pellegrini;Camelia Potec;Michelle Smith;Expert;Charlotte Bonnet verliet Fabrice Pellerin, haar coach gedurende tien jaar in Nice, om zich bij Philippe Lucas te voegen in Martigues.;https://nl.wikipedia.org/wiki/Charlotte_Bonnet
27;nl;Wie was de eerste geregistreerde vrouw die de marathon van Boston liep ?;Kathrine Switzer;Mary Decke;Molly Huddle;Shalane Flanagan;Expert;Op 17 april 2017 liep ze op 70-jarige leeftijd (50 jaar na haar eerste deelname) de marathon met hetzelfde startnummer als in 1967.;https://nl.wikipedia.org/wiki/Kathrine_Switzer
28;nl;Welke Australische is zij de jongste surfer die wint in de WCT ?;Stephanie Gilmore;Tyler Wright;Carissa Moore;Johanne Defay;Expert;Het is de eerste keer in de geschiedenis van deze sport dat een surfer in het eerste jaar van deelname wereldkampioen wordt.;
29;nl;Wie was 16 jaar lang houder van het wereldrecord op de marathon voor dames ?;Paula Radcliffe;Edna Kiplagat;Rose Chelimo;Lidia Simon;Expert;Hoewel ze in haar vroege jaren aan astma en bloedarmoede leed, begon ze op zevenjarige leeftijd met hardlopen, aangemoedigd door haar vader.;https://nl.wikipedia.org/wiki/Paula_Radcliffe
30;nl;Welke Olympisch kampioene crosscountry mountainbike beëindigde haar carrière op 32-jarige leeftijd ?;Julie Bresset;Jolanda Neff;Sabine Spitz;Paula Pezzo;Expert;In 2014 kreeg ze tijdens het seizoen een burn-out. Een virale infectie zorgt er dan voor dat hij drie maanden competitie moet missen.;
