3;es;¿Cuál de estos personajes del juego no es del universo de Mario ?;Mylord;Luigi;Melocotón;Wario;Débutant;La serie « Mario » es la serie más vendida en la historia de los videojuegos, con más de 195 millones de copias vendidas.;https://es.wikipedia.org/wiki/Mario_(personaje)
4;es;¿Qué videojuego de deportes, desarrollado y publicado por Nintendo, se ofreció por la compra de una Wii ?;« Wii Sports »;« Wii Mix »;« Juegos de Wii »;« Wii Play »;Débutant;El juego se incluyó en un paquete promocional con Wii en todos los territorios excepto Japón y Corea del Sur.;https://es.wikipedia.org/wiki/Wii_Sports
5;es;¿Qué personaje de videojuego de ficción representa la montura incondicional de Mario ?;Yoshi;Birbo;Kirby;Melocotón;Débutant;Yoshi hizo su primera aparición (en el juego) en « Super Mario World » nivel 1-2 para Super Nintendo, lanzado en 1990 en Japón.;https://es.wikipedia.org/wiki/Yoshi
6;es;¿Qué gorila fornido fue uno de los primeros personajes famosos de Nintendo ?;Donkey Kong;Abu;King Kong;Mookie;Débutant;Creado por Shigeru Miyamoto, este gorila es originalmente el enemigo de Jumpman, su maestro, cuya prometida ha secuestrado.;https://es.wikipedia.org/wiki/Donkey_Kong
7;es;¿Qué significa el acrónimo DS para Nintendo DS, una consola portátil lanzada en 2005 en Europa ?;Pantalla dual;Super Data;Disparo directo;Detectar sistema;Débutant;La Nintendo DS se convirtió en la consola más vendida de todos los tiempos durante el mes de diciembre de 2012.;https://es.wikipedia.org/wiki/Nintendo_DS
8;es;¿Cuál de estas categorías de Game Boy nunca podrás encontrar en las tiendas ?;Impresora;Color;Advance;Bolsillo;Débutant;A pesar del lanzamiento de consolas portátiles tecnológicamente más avanzadas, la Game Boy ha sido un verdadero éxito.;https://es.wikipedia.org/wiki/Game_Boy
9;es;¿Qué accesorio destinado a conectarse a la consola Wii está asociado con el juego « Wii Fit » ?;Tablero de equilibrio de Wii;Disparo de Wii;Wii Zapper;Wii Gun;Débutant;La Wii Balance Board es un accesorio de balanza electrónico diseñado para las consolas de juegos Wii y Wii U.;https://es.wikipedia.org/wiki/Wii_Balance_Board
10;es;En el universo de Nintendo, ¿qué habitante de Dream Land tiene forma de bola rosa ?;Kirby;Pinky;Dadidou;Yoshi;Débutant;Lo especial de Kirby es que puede absorber todo lo que ve, ya sean objetos o enemigos.;https://es.wikipedia.org/wiki/Kirby_(personaje)
11;es;¿Qué arma usa Luigi en « Luigi's Mansion » con el nombre de Ectoblast 3000 ?;Aspiradora;Lanzallamas;Martillo;Raquetas de nieve;Confirmé;El juego narra las aventuras de Luigi en una mansión que ganó en un concurso en el que nunca participó.;
12;es;¿Cuál fue el primer nombre de Mario, que apareció en 1981 en el juego « Donkey Kong » ?;Jumpman;Enlace;Yoshi;Zelda;Confirmé;Los juegos de la serie « Super Mario » han jugado un papel importante en la evolución de los juegos de plataformas.;https://es.wikipedia.org/wiki/Mario_(personaje)
13;es;¿Cuál era el nombre del prototipo de la Wii desde la conferencia de prensa antes del E3 2004 ?;Revolución;Super GameCube;Wiitendo;Nintendo 64;Confirmé;La Wii se mencionó anteriormente con los nombres de GCNext y N5 (N5 significa quinta generación de consolas de Nintendo).;https://es.wikipedia.org/wiki/Wii
14;es;¿Qué ciudad de la región de Kanto es la ciudad natal de Ash en « Pokémon » ?;Paleta de Bourg;Tierra de Sacha;Tierra de ensueño;Kong City;Confirmé;Kanto es la región que se utiliza en las versiones verde (solo en Japón), rojo, azul, amarillo, dorado, plateado y rojo fuego.;
15;es;¿Qué accesorio convierte el wiimote y el nunchuk de Wii en un simulador de metralleta ?;Wii Zapper;Wii Gun;Wii Wiz;Disparo de Wii;Confirmé;El Wii Zapper, vendido con « Link's Crossbow Training », recibió este nombre en referencia al arma óptica NES, el NES Zapper.;
16;es;Creada en 1983, ¿cuál fue la primera consola doméstica de Nintendo ?;Famicom;Nintendo 64;Wii;GameCube;Confirmé;Nintendo expandió su base de clientes exportando el renombrado Nintendo Entertainment System a los Estados Unidos en 1985.;
17;es;¿Qué consola, con un diseño muy similar, ha triunfado la Nintendo DSi ?;DS Lite;Game Boy;Advance;DS;Confirmé;El DSi está equipado con dos cámaras, un lector de tarjetas SD, un navegador web Opera integrado y un reproductor de audio.;https://es.wikipedia.org/wiki/Nintendo_DSi
18;es;¿Cuál de estas revolucionarias consolas de Nintendo puede funcionar con un lápiz óptico ?;DS;GameCube;Famicom;Nintendo 64;Confirmé;Su juego insignia, « New Super Mario Bros. », sigue siendo uno de los juegos más vendidos del mundo.;https://es.wikipedia.org/wiki/Nintendo_DS
19;es;¿Qué mensaje aparece con frecuencia detrás de la heroína del juego « Donkey Kong » ?;¡AYUDA;BONUS;SMILE;PUSH;Confirmé;A pesar de las dudas iniciales del equipo estadounidense, « Donkey Kong » fue un gran éxito en Japón y América del Norte.;
20;es;¿Cuál de estas consolas fue considerada por Nintendo como un fracaso comercial ?;Chico virtual;3DS;Wii;Game Cube;Confirmé;Virtual Boy es la consola menos vendida en la historia de las consolas de videojuegos de Nintendo (770.000 unidades vendidas).;https://es.wikipedia.org/wiki/Virtual_Boy
21;es;¿Qué pequeño astronauta es un personaje imaginario e icónico de Nintendo ?;Olimar;Kirby;Louie;Pikmin;Expert;Olimar está equipado con un traje de buceo que siempre se pone en el Planeta Distante porque, para él, el oxígeno es tóxico.;https://es.wikipedia.org/wiki/Capitán Olimar
22;es;¿Cuál fue el primer trabajo de Mario antes de convertirse en plomero en « Mario Bros. » ?;Carpintero;Mago;Pizza Maker;Baker;Expert;Se dice que el nombre de Mario fue elegido en honor al entonces propietario de las instalaciones de Nintendo of America, Mario Segali.;https://es.wikipedia.org/wiki/Mario_(personaje)
23;es;¿Cuál era el nombre del prototipo de la consola de videojuegos doméstica GameCube ?;Delfín;Juego 128;Revolución;Famicom;Expert;El 24 de agosto de 2000, la máquina se presentó oficialmente con su nuevo nombre, GameCube.;https://es.wikipedia.org/wiki/Nintendo GameCube
24;es;En « Super Mario Kart », ¿cuántas vueltas tiene cada carrera ?;5;4;3;2;Expert;En « Super Mario Kart », el jugador controla uno de los ocho personajes del universo « Super Mario ».;https://es.wikipedia.org/wiki/Super_Mario_Kart
25;es;¿En qué ciudad se encuentra la sede de la empresa Nintendo, fundada por Fusajiro Yamauchi ?;Kyoto;Tokio;Beijing;Shanghai;Expert;Nintendo es una de las pocas empresas de videojuegos que ha podido traer algunas de sus licencias, en particular « Mario » o « Pokémon ».;https://es.wikipedia.org/wiki/Nintendo
26;es;¿Qué diosa creó la vida en el videojuego insignia « Zelda: Ocarina of time » ?;Farore;Din;Nayru;Eikichi;Expert;Las tres diosas de Hyrule son Din, diosa de la fuerza, Nayru, diosa de la sabiduría y el tiempo, y Farore, diosa del coraje.;
27;es;¿Qué producía la empresa Nintendo antes de desarrollar videojuegos ?;Jugando a las cartas;Relojes;Libros;Dados para jugar;Expert;Fue a partir de la década de 1970 que la empresa Nintendo diversificó sus actividades produciendo juguetes y máquinas recreativas.;https://es.wikipedia.org/wiki/Nintendo
28;es;¿Cómo se llama la consola Nintendo DS de segunda generación ?;DS Lite;DS3D;DSi;Advance;Expert;La Nintendo DS Lite, con 93 millones de ventas, es hoy la consola portátil más vendida de todos los tiempos.;https://es.wikipedia.org/wiki/Nintendo_DS
29;es;¿En qué año se hizo pública Nintendo ?;1962;1972;1982;1992;Expert;Fue gracias a un contrato firmado con Disney en 1959 que la compañía adquirió una dimensión internacional y se hizo pública en 1962.;https://es.wikipedia.org/wiki/Nintendo
30;es;¿Cómo se llama la novia de Jumpman en « Donkey Kong » ?;Lady;Pauline;Daisy;Zelda;Expert;Abusado por el carpintero, Donkey Kong escapa y secuestra a la novia de Jumpman, conocida como Lady.;
1;it;Quale idraulico di videogiochi, vestito di rosso, è anche la mascotte dell'azienda Nintendo ?;Mario;Luigi;Pesca;Wario;Débutant;Mario è facilmente riconoscibile per i baffi, la tuta, i guanti bianchi e il berretto rosso contrassegnato con una M.;https://it.wikipedia.org/wiki/Mario_(personaggio)
2;it;Su quale console Nintendo sono stati rilasciati i primi due giochi « Pokémon » ?;Game Boy;Super Nintendo;Nintendo DS;Game Cube;Débutant;Il giocatore controlla il personaggio principale tramite una vista aerea e lo dirige attraverso la regione immaginaria di Kanto.;
3;it;Quale di questi personaggi del gioco non proviene dall'universo di Mario ?;Mylord;Luigi;Pesca;Wario;Débutant;La serie « Mario » è la serie più venduta nella storia dei videogiochi, con oltre 195 milioni di copie vendute.;https://it.wikipedia.org/wiki/Mario_(personaggio)
4;it;Quale videogioco sportivo, sviluppato e pubblicato da Nintendo, è stato offerto per l'acquisto di una Wii ?;« Wii Sports »;« Wii Mix »;« Giochi Wii »;« Wii Play »;Débutant;Il gioco è stato incluso in un pacchetto promozionale con Wii in tutti i territori tranne il Giappone e la Corea del Sud.;https://it.wikipedia.org/wiki/Wii_Sports
5;it;Quale personaggio immaginario dei videogiochi rappresenta il fedele cavallo di Mario ?;Yoshi;Birbo;Kirby;Pesca;Débutant;Yoshi ha fatto la sua prima apparizione (nel gioco) nel livello 1-2 di « Super Mario World » per Super Nintendo, uscito nel 1990 in Giappone.;https://it.wikipedia.org/wiki/Yoshi
6;it;Quale muscoloso gorilla è stato uno dei primi personaggi famosi di Nintendo ?;Donkey Kong;Abu;King Kong;Mookie;Débutant;Creato da Shigeru Miyamoto, questo gorilla è originariamente il nemico di Jumpman, il suo padrone, di cui ha rapito la fidanzata.;https://it.wikipedia.org/wiki/Donkey_Kong_(personaggio)
7;it;Cosa significa l'acronimo DS per Nintendo DS, una console portatile rilasciata nel 2005 in Europa ?;Doppio schermo;Super Data;Colpo diretto;Rileva sistema;Débutant;Il Nintendo DS è diventata la console più venduta di tutti i tempi durante il mese di dicembre 2012.;https://it.wikipedia.org/wiki/Nintendo_DS
8;it;Quale di queste categorie di Game Boy non riuscirai mai a trovare nei negozi ?;Stampante;Colore;Advance;Pocket;Débutant;Nonostante l'uscita di console portatili tecnologicamente più avanzate, il Game Boy è stato un vero successo.;https://it.wikipedia.org/wiki/Game_Boy
9;it;Quale accessorio destinato a essere collegato alla console Wii è associato al gioco « Wii Fit » ?;Wii Balance Board;Wii Shot;Wii Zapper;Wii Gun;Débutant;La Wii Balance Board è una bilancia elettronica progettata per le console di gioco Wii e Wii U.;https://it.wikipedia.org/wiki/Wii_Fit#Wii_Balance_Board
10;it;Nell'universo Nintendo, quale abitante di Dream Land ha la forma di una palla rosa ?;Kirby;Pinky;Dadidou;Yoshi;Débutant;La particolarità di Kirby è che può risucchiare tutto ciò che vede, che si tratti di oggetti o nemici.;https://it.wikipedia.org/wiki/Kirby_(personaggio)
11;it;Quale arma è usata Luigi in « Luigi's Mansion » con il nome Ectoblast 3000 ?;Aspirapolvere;Lanciafiamme;Hammer;Ciaspolate;Confirmé;Il gioco ripercorre le avventure di Luigi in una villa che ha vinto in un concorso a cui non ha mai partecipato.;
12;it;Qual era il vero nome di Mario, apparso nel 1981 nel gioco « Donkey Kong » ?;Jumpman;Link;Yoshi;Zelda;Confirmé;I giochi della serie « Super Mario » hanno svolto un ruolo importante nell'evoluzione dei giochi di piattaforma.;https://it.wikipedia.org/wiki/Mario_(personaggio)
13;it;Qual era il nome prototipo del Wii dalla conferenza stampa prima dell'E3 2004 ?;Rivoluzione;Super GameCube;Wiitendo;Nintendo 64;Confirmé;Il Wii è stato precedentemente menzionato con i nomi di GCNext e N5 (N5 significa quinta generazione di console Nintendo).;https://it.wikipedia.org/wiki/Wii
14;it;Quale città nella regione di Kanto è la città natale di Ash in « Pokémon » ?;Tavolozza Bourg;Sacha Land;Dream Land;Kong City;Confirmé;Kanto è la regione utilizzata nelle versioni verde (solo Giappone), rossa, blu, gialla, oro, argento e rosso fuoco.;
15;it;Quale accessorio trasforma il Wii Wiimote e il nunchuk in un simulatore di mitragliatrice ?;Wii Zapper;Wii Gun;Wii Wiz;Wii Shot;Confirmé;Il Wii Zapper, venduto con « Link's Crossbow Training », ha ricevuto questo nome in riferimento alla pistola ottica NES, il NES Zapper.;
16;it;Creata nel 1983, qual è stata la prima console domestica di Nintendo ?;Famicom;Nintendo 64;Wii;GameCube;Confirmé;Nintendo ha ampliato la sua base di clienti esportando il rinominato Nintendo Entertainment System negli Stati Uniti nel 1985.;
17;it;Quale console, con un design molto simile, ha avuto successo con il Nintendo DSi ?;DS Lite;Game Boy;Advance;DS;Confirmé;Il DSi è dotato di due fotocamere, un lettore di schede SD, un browser web Opera integrato e un lettore audio.;https://it.wikipedia.org/wiki/Nintendo_DSi
18;it;Quale di queste rivoluzionarie console Nintendo può funzionare con uno stilo ?;DS;GameCube;Famicom;Nintendo 64;Confirmé;Il suo gioco di punta, « New Super Mario Bros. », rimane uno dei giochi più venduti al mondo.;https://it.wikipedia.org/wiki/Nintendo_DS
19;it;Quale messaggio compare spesso dietro l'eroina del gioco « Donkey Kong » ?;AIUTO;BONUS;SMILE;PUSH;Confirmé;Nonostante i dubbi iniziali del team americano, « Donkey Kong » è stato un enorme successo in Giappone e Nord America.;
20;it;Quale di queste console è stata considerata da Nintendo un fallimento commerciale ?;Ragazzo virtuale;3DS;Wii;Game Cube;Confirmé;Virtual Boy è la console meno venduta nella storia delle console per videogiochi Nintendo (770.000 unità vendute).;https://it.wikipedia.org/wiki/Virtual_Boy
21;it;Quale piccolo astronauta è un personaggio Nintendo immaginario e iconico ?;Olimar;Kirby;Louie;Pikmin;Expert;Olimar è dotato di una muta da sub che mette sempre sul Pianeta Distante perché, per lui, l'ossigeno è tossico.;https://it.wikipedia.org/wiki/Olimar
22;it;Qual è stato il primo vero lavoro di Mario prima di diventare un idraulico in « Mario Bros. » ?;Falegname;Mago;Pizzaiolo;Baker;Expert;Si dice che il nome di Mario sia stato scelto in onore dell'allora proprietario dei locali di Nintendo of America, Mario Segali.;https://it.wikipedia.org/wiki/Mario_(personaggio)
23;it;Qual era il nome prototipo della console per videogiochi domestica GameCube ?;Delfino;Gioco 128;Rivoluzione;Famicom;Expert;Il 24 agosto 2000, la macchina è stata ufficialmente presentata con il suo nuovo nome, GameCube.;https://it.wikipedia.org/wiki/Nintendo GameCube
24;it;In « Super Mario Kart », ogni gara ha quanti giri ciascuna ?;5;4;3;2;Expert;In « Super Mario Kart », il giocatore controlla uno degli otto personaggi dell'universo di « Super Mario ».;https://it.wikipedia.org/wiki/Super_Mario_Kart
25;it;In quale città si trova la sede dell'azienda Nintendo, fondata da Fusajiro Yamauchi ?;Kyoto;Tokyo;Pechino;Shanghai;Expert;Nintendo è una delle poche società di videogiochi ad aver potuto introdurre alcune delle sue licenze, in particolare « Mario » o « Pokémon ».;https://it.wikipedia.org/wiki/Nintendo
26;it;Quale dea ha creato la vita nel videogioco di punta « Zelda: Ocarina of time » ?;Farore;Din;Nayru;Eikichi;Expert;Le tre dee di Hyrule sono Din, dea della forza, Nayru, dea della saggezza e del tempo e Farore, dea del coraggio.;
27;it;Cosa produceva la società Nintendo prima di sviluppare videogiochi ?;Carte da gioco;Orologi;Libri;Dadi da giocare;Expert;È dagli anni '70 che la società Nintendo diversifica le sue attività producendo giocattoli e macchine da sala giochi.;https://it.wikipedia.org/wiki/Nintendo
28;it;Qual è il nome della console Nintendo DS di seconda generazione ?;DS Lite;DS3D;DSi;Advance;Expert;Il Nintendo DS Lite, con 93 milioni di vendite, è oggi la console portatile più venduta di tutti i tempi.;https://it.wikipedia.org/wiki/Nintendo_DS
29;it;In che anno Nintendo è diventata pubblica ?;1962;1972;1982;1992;Expert;Fu grazie a un contratto firmato con Disney nel 1959 che la compagnia assunse una dimensione internazionale e si quotò in borsa nel 1962.;https://it.wikipedia.org/wiki/Nintendo
30;it;Qual è il nome della ragazza di Jumpman in « Donkey Kong » ?;Signora;Pauline;Daisy;Zelda;Expert;Abusato dal falegname, Donkey Kong fugge e rapisce la ragazza di Jumpman, conosciuta come Lady.;
1;nl;Welke loodgieter in een videogame, gekleed in het rood, is ook de mascotte van het bedrijf Nintendo ?;Mario;Luigi;Perzik;Wario;Débutant;Mario is gemakkelijk te herkennen aan zijn snor, overall, witte handschoenen en rode pet gemarkeerd met een M.;https://nl.wikipedia.org/wiki/Mario_(Nintendo)
2;nl;Op welk Nintendo-systeem zijn de eerste twee « Pokémon » -games uitgebracht ?;Game Boy;Super Nintendo;Nintendo DS;Game Cube;Débutant;De speler bestuurt de hoofdpersoon via een luchtfoto en leidt ze door de fictieve Kanto-regio.;
3;nl;Welke van deze gamekarakters komt niet uit het Mario-universum ?;Mylord;Luigi;Perzik;Wario;Débutant;De « Mario » -serie is de best verkochte serie in de geschiedenis van videogames, met meer dan 195 miljoen verkochte exemplaren.;https://nl.wikipedia.org/wiki/Mario_(Nintendo)
4;nl;Welke sportvideogame, ontwikkeld en uitgegeven door Nintendo, werd aangeboden voor de aankoop van een Wii ?;« Wii Sports »;« Wii Mix »;« Wii-spellen »;« Wii Play »;Débutant;De game was opgenomen in een promotiepakket met de Wii in alle gebieden behalve Japan en Zuid-Korea.;https://nl.wikipedia.org/wiki/Wii_Sports
5;nl;Welk fictief videogamekarakter vertegenwoordigt Mario's onwankelbare rijdier ?;Yoshi;Birbo;Kirby;Perzik;Débutant;Yoshi maakte zijn eerste (in-game) optreden in « Super Mario World » level 1-2 voor Super Nintendo, uitgebracht in 1990 in Japan.;https://nl.wikipedia.org/wiki/Yoshi
6;nl;Welke vlezige gorilla was een van de eerste beroemde personages van Nintendo ?;Donkey Kong;Abu;King Kong;Mookie;Débutant;Deze gorilla, gemaakt door Shigeru Miyamoto, is oorspronkelijk de vijand van Jumpman, zijn meester, wiens verloofde hij heeft ontvoerd.;https://nl.wikipedia.org/wiki/Donkey_Kong_(personage)
7;nl;Wat betekent het acroniem DS voor de Nintendo DS, een draagbare console die in 2005 in Europa werd uitgebracht ?;Dubbel scherm;Super gegevens;Directe opname;Systeem detecteren;Débutant;De Nintendo DS werd in december 2012 de bestverkochte console aller tijden.;https://nl.wikipedia.org/wiki/Nintendo_DS
8;nl;Welke van deze Game Boy-categorieën zul je nooit in winkels kunnen vinden ?;Printer;Kleur;Vooruit;Zak;Débutant;Ondanks de release van technologisch geavanceerdere draagbare consoles, is de Game Boy een groot succes geworden.;https://nl.wikipedia.org/wiki/Game_Boy
9;nl;Welk accessoire dat bedoeld is om op het Wii-systeem te worden aangesloten, is gekoppeld aan het spel « Wii Fit » ?;Wii Balance Board;Wii Shot;Wii Zapper;Wii Gun;Débutant;Het Wii Balance Board is een elektronische weegschaal die is ontworpen voor de Wii en Wii U-spelconsoles.;https://nl.wikipedia.org/wiki/Wii_Balance_Board
10;nl;Welke inwoner van Dream Land in het Nintendo-universum heeft de vorm van een roze bal ?;Kirby;Pinky;Dadidou;Yoshi;Débutant;Het bijzondere aan Kirby is dat hij alles kan opzuigen wat hij ziet, of het nu objecten of vijanden zijn.;https://nl.wikipedia.org/wiki/Kirby_(personage)
11;nl;Welk wapen gebruikt Luigi in « Luigi's Mansion » onder de naam Ectoblast 3000 ?;Stofzuiger;Vlammenwerper;Hamer;Sneeuwschoenwandelen;Confirmé;De game volgt Luigi's avonturen in een landhuis dat hij won in een wedstrijd waar hij nooit aan deelnam.;
12;nl;Wat was Mario's allereerste naam, die in 1981 verscheen in het spel « Donkey Kong » ?;Jumpman;Link;Yoshi;Zelda;Confirmé;De games in de « Super Mario » -serie hebben een belangrijke rol gespeeld in de evolutie van platformgames.;https://nl.wikipedia.org/wiki/Mario_(Nintendo)
13;nl;Hoe heette het prototype van de Wii sinds de persconferentie vóór E3 2004 ?;Revolutie;Super GameCube;Wiitendo;Nintendo 64;Confirmé;De Wii werd eerder genoemd onder de namen GCNext en N5 (N5 betekent vijfde generatie Nintendo-consoles).;https://nl.wikipedia.org/wiki/Wii
14;nl;Welke stad in de Kanto-regio is de geboorteplaats van Ash in « Pokémon » ?;Bourg Palette;Sacha Land;Droomland;Kong City;Confirmé;Kanto is de regio die wordt gebruikt in de versies Groen (alleen Japan), Rood, Blauw, Geel, Goud, Zilver en Vuurrood.;
15;nl;Welk accessoire verandert de Wii Wiimote en Nunchuk in een machinepistool-simulator ?;Wii Zapper;Wii Gun;Wii Wiz;Wii Shot;Confirmé;De Wii Zapper, verkocht met « Link's Crossbow Training », kreeg deze naam als verwijzing naar het optische NES-pistool, de NES Zapper.;
16;nl;Wat was de eerste thuisconsole van Nintendo, gemaakt in 1983 ?;Famicom;Nintendo 64;Wii;GameCube;Confirmé;Nintendo breidde zijn klantenbestand uit door in 1985 het hernoemde Nintendo Entertainment System naar de Verenigde Staten te exporteren.;
17;nl;Welke console, met een vergelijkbaar ontwerp, is de Nintendo DSi geslaagd ?;DS Lite;Game Boy;Vooruit;DS;Confirmé;De DSi is uitgerust met twee camera's, een SD-kaartlezer, een geïntegreerde Opera-webbrowser en een audiospeler.;https://nl.wikipedia.org/wiki/Nintendo_DSi
18;nl;Welke van deze revolutionaire Nintendo-consoles kunnen met een stylus werken ?;DS;GameCube;Famicom;Nintendo 64;Confirmé;Zijn vlaggenschip, « New Super Mario Bros. », blijft een van de best verkochte games ter wereld.;https://nl.wikipedia.org/wiki/Nintendo_DS
19;nl;Welk bericht verschijnt vaak achter de heldin van het spel « Donkey Kong » ?;HELP;BONUS;GLIMLACH;PUSH;Confirmé;Ondanks de aanvankelijke twijfels van het Amerikaanse team, was « Donkey Kong » een groot succes in Japan en Noord-Amerika.;
20;nl;Welke van deze consoles werd door Nintendo als een commerciële mislukking beschouwd ?;Virtuele jongen;3DS;Wii;Game Cube;Confirmé;De Virtual Boy is de minst verkochte console in de geschiedenis van Nintendo-gameconsoles (770.000 verkochte exemplaren).;https://nl.wikipedia.org/wiki/Virtual_Boy
21;nl;Welke kleine astronaut is een denkbeeldig en iconisch Nintendo-personage ?;Olimar;Kirby;Louie;Pikmin;Expert;Olimar is uitgerust met een duikpak dat hij altijd op de Distant Planet aantrekt, omdat zuurstof voor hem giftig is.;
22;nl;Wat was Mario's allereerste baan voordat hij loodgieter werd in « Mario Bros. » ?;Timmerman;Goochelaar;Pizza Maker;Bakker;Expert;Mario's naam zou zijn gekozen ter ere van de toenmalige eigenaar van het pand van Nintendo of America, Mario Segali.;https://nl.wikipedia.org/wiki/Mario_(Nintendo)
23;nl;Wat was de naam van het prototype van de GameCube-videogameconsole voor thuis ?;Dolfijn;Spel 128;Revolutie;Famicom;Expert;Op 24 augustus 2000 werd de machine officieel gepresenteerd met zijn nieuwe naam, de GameCube.;https://nl.wikipedia.org/wiki/Nintendo GameCube
24;nl;In « Super Mario Kart » heeft elke race hoeveel ronden elk ?;5;4;3;2;Expert;In « Super Mario Kart » bestuurt de speler een van de acht personages uit het « Super Mario » -universum.;https://nl.wikipedia.org/wiki/Super_Mario_Kart
25;nl;In welke stad is het hoofdkantoor van het bedrijf Nintendo, opgericht door Fusajiro Yamauchi ?;Kyoto;Tokio;Peking;Sjanghai;Expert;Nintendo is een van de weinige videogamebedrijven die een aantal van zijn licenties heeft kunnen binnenhalen, met name « Mario » of « Pokémon ».;https://nl.wikipedia.org/wiki/Nintendo
26;nl;Welke godin heeft het leven geschapen in de vlaggenschipvideogame « Zelda: Ocarina of time »;Farore;Din;Nayru;Eikichi;Expert;De drie godinnen van Hyrule zijn Din, godin van kracht, Nayru, godin van wijsheid en tijd, en Farore, godin van moed.;
27;nl;Wat produceerde het bedrijf Nintendo voordat het videogames ontwikkelde ?;Speelkaarten;Horloges;Boeken;Dobbelstenen om te spelen;Expert;Het was vanaf de jaren 70 dat het bedrijf Nintendo zijn activiteiten diversifieerde door speelgoed en speelautomaten te produceren.;https://nl.wikipedia.org/wiki/Nintendo
28;nl;Hoe heet de tweede generatie Nintendo DS-console ?;DS Lite;DS3D;DSi;Vooruit;Expert;De Nintendo DS Lite is met 93 miljoen verkochte exemplaren de best verkochte handheld-console aller tijden.;https://nl.wikipedia.org/wiki/Nintendo_DS
29;nl;In welk jaar ging Nintendo naar de beurs ?;1962;1972;1982;1992;Expert;Het was dankzij een contract getekend met Disney in 1959 dat het bedrijf een internationale dimensie kreeg en in 1962 naar de beurs ging.;https://nl.wikipedia.org/wiki/Nintendo
30;nl;Hoe heet de vriendin van Jumpman in « Donkey Kong » ?;Dame;Pauline;Madeliefje;Zelda;Expert;Donkey Kong wordt misbruikt door de timmerman en ontsnapt en ontvoert de vriendin van Jumpman, bekend als Lady.;
