29;de;In welchem Jahr landete der Yorkshire Terrier zum ersten Mal in Frankreich ?;1920;1950;1980;1890;Expert;Nach Ansicht vieler Historiker geht die Geburt der Rasse auf die zweite industrielle Revolution zu Beginn des 19. Jahrhunderts zurück.;https://de.wikipedia.org/wiki/Yorkshire_Terrier
30;de;Welchen Hundesport kann der Yorkshire Terrier als Spiel ausüben ?;Agilität;Piréna;Ring;Obi;Expert;Agilität bedeutet, Hunde dazu zu bringen, verschiedene Hindernisse zu überwinden, um ihre Intelligenz und Flexibilität zu demonstrieren.;https://de.wikipedia.org/wiki/Agility
1;es;¿De qué país de habla inglesa es el Yorkshire Terrier ?;Inglaterra;India;Japón;China;Débutant;El Yorkshire Terrier es una raza canina perteneciente al grupo de los terrier y originaria del condado inglés del mismo nombre.;https://es.wikipedia.org/wiki/Yorkshire_terrier
2;es;¿De qué color es el pelaje largo y sedoso del Yorkshire Terrier ?;Azul y Fuego;rojo y blanco;Rojo y dorado;Blanco y negro;Débutant;Muy popular en las competiciones, este perro apodado Yorkie está en el origen de otras razas como el Australian Silky Terrier.;https://es.wikipedia.org/wiki/Yorkshire_terrier
3;es;¿Cuál es el promedio de vida de un Yorkshire Terrier ?;14 años;11 años;8 años;17 años;Débutant;El Yorkshire es ante todo un perro hecho para vivir en la ciudad y no necesita estar todo el día al aire libre, al contrario.;https://es.wikipedia.org/wiki/Yorkshire_terrier
4;es;¿Cuál es la forma más común de las orejas del Yorkshire Terrier ?;en forma de V;cuadrado;Óvalo;Ronda;Débutant;El borde de la cabeza es largo, rojizo, de color más profundo a los lados de la cabeza, en la base de las orejas y en el hocico.;https://es.wikipedia.org/wiki/Yorkshire_terrier
5;es;¿Cuál de estos calificadores se acerca más al Yorkshire Terrier ?;elegante;agresivo;Dominador;Pasivo;Débutant;Aunque de tamaño pequeño, la elegancia del Yorkshire Terrier ha traspasado fronteras y es el orgullo de los amos de esta raza canina.;https://es.wikipedia.org/wiki/Yorkshire_terrier
6;es;¿Cuál es el color común de la nariz del Yorkshire Terrier ?;Negro;morena;rojo;Blanco;Débutant;El hocico no es largo, la nariz negra. Los maxilares y los dientes se articulan en una perfecta, regular y completa mordida en tijera.;https://es.wikipedia.org/wiki/Yorkshire_terrier
7;es;¿Contra qué enfermedad es el Yorkshire Terrier una verdadera cura ?;depresión;Sobrepeso;Bronquitis;Osteoporosis;Débutant;El Yorkshire Terrier ama a su amo y se lo hace saber pidiéndole atención, caricias y amor.;https://es.wikipedia.org/wiki/Yorkshire_terrier
8;es;¿De qué color nacen la mayoría de los cachorros de Yorkshire Terrier ?;Negro;pelirroja;Blanco;azul;Débutant;Unos meses más tarde, el negro se vuelve gris acero, mientras que la cabeza y el pecho toman colores dorados.;https://es.wikipedia.org/wiki/Yorkshire_terrier
9;es;¿Qué apodo se le da con frecuencia al Yorkshire Terrier ?;yorkies;perrito;Bolsa antipulgas;sinvergüenza;Débutant;El Yorkshire terrier, apodado Yorkie, fue también el origen de otras razas como el Australian Silky Terrier.;https://es.wikipedia.org/wiki/Yorkshire_terrier
10;es;¿Cuál es el peso máximo de un Yorkshire Terrier sano ?;3kg;5 libras;7kg;9 libras;Débutant;El Yorkshire Terrier necesita ejercicio regular y largas caminatas para estirar las piernas y mantener su forma.;https://es.wikipedia.org/wiki/Yorkshire_terrier
11;es;¿Cuánta croqueta debe darle a su Yorkshire terrier cada día ?;40 gramos;20 gramos;60 gramos;80 gramos;Confirmé;Asegúrate de llevar un tipo de croqueta adaptada a su pequeño tamaño y raza (calidad premium si es posible).;https://es.wikipedia.org/wiki/Yorkshire_terrier
12;es;¿En qué siglo se originó Yorkshire en el condado del mismo nombre ?;XIX;diecisiete;XV;XIII;Confirmé;De hecho, la raza es originaria de Yorkshire y los alrededores de Manchester, una región accidentada en el norte de Inglaterra.;https://es.wikipedia.org/wiki/Yorkshire_terrier
13;es;¿Cuál de estas afirmaciones no designa un rasgo de carácter típico del Yorkshire Terrier ?;Peligroso;Espumoso;inteligente;Confiado;Confirmé;Muy cómodo con los hombres, el Yorkshire Terrier puede impacientarse rápidamente cuando juega con niños.;https://es.wikipedia.org/wiki/Yorkshire_terrier
14;es;Contrariamente a la creencia popular, ¿qué le encanta hacer al Yorkshire Terrier en los paseos ?;ensuciarse;Corteza;Beber;Dormir;Confirmé;Al Yorkshire Terrier le gusta caminar por el bosque, aspirar los aromas del suelo y frotarse en la tierra y la hierba que encuentra.;https://es.wikipedia.org/wiki/Yorkshire_terrier
15;es;¿Qué tan pronto puede esperar ver limpio a su yorkshire terrier ?;7 meses;3 meses;12 meses;16 meses;Confirmé;Como la mayoría de los cachorros, la educación de los primeros seis meses es fundamental para beneficiarse posteriormente de un perro limpio.;https://es.wikipedia.org/wiki/Yorkshire_terrier
16;es;¿Qué es mejor aportar en la alimentación de tu yorkshire terrier ?;Vitaminas;Azúcares;Grasas;gluten;Confirmé;Muy glotón, el Yorkshire Terrier aprecia el pescado, las frutas como el melón o la sandía, así como los helados.;https://es.wikipedia.org/wiki/Yorkshire_terrier
17;es;¿Qué papel puede mantener el pelo del perro sin romperlo ?;papillote;papiro;Kraft;Papiroflexia;Confirmé;Es posible notar la caída del pelo durante las 2 primeras semanas de acicalado, tiempo de adaptación del perro.;
18;es;¿Qué función puede realizar el Yorkshire Terrier a pesar de su pequeño tamaño ?;perro guardián;buscador de trufas;perro de caza;perro de trineo;Confirmé;Aunque naturalmente es incapaz de detener físicamente a un ladrón, sus ladridos lo convierten en un perro guardián eficaz.;https://es.wikipedia.org/wiki/Yorkshire_terrier
19;es;¿Qué puede perder Yorkshire rápidamente con niños demasiado juguetones ?;Su paciencia;Su inteligencia;Su destreza;Su alegría de vivir;Confirmé;El Yorkshire Terrier, bajo su apariencia, sigue siendo un perro con personalidad plena y bastante nervioso.;https://es.wikipedia.org/wiki/Yorkshire_terrier
20;es;¿Cuál de estas características se aplica al Yorkshire Terrier ?;No muda;El no juega;el no esta llorando;El no ladra;Confirmé;El Yorkshire Terrier sigue siendo uno de los perros favoritos en los Estados Unidos, pero también en Francia y Bélgica.;https://es.wikipedia.org/wiki/Yorkshire_terrier
21;es;¿Cuál es el precio promedio de compra de un Yorkshire Terrier de un criador ?;1.000 €;500 euros;1.500 €;2.000 €;Expert;Utilizado principalmente como perro de compañía, el Yorkshire Terrier es un animal muy cariñoso con su amo.;https://es.wikipedia.org/wiki/Yorkshire_terrier
22;es;¿Para qué se usaban originalmente los Yorkshire de los trabajadores escoceses ?;escalfado;Encontrar trufas;Regatear;Mantener caliente;Expert;El pequeño tamaño del Yorkie permitía a su dueño llevarlo en una alforja y sacarlo para sacar un conejo.;https://es.wikipedia.org/wiki/Yorkshire_terrier
23;es;En el siglo pasado, ¿en qué país ayudaba el Yorkshire Terrier a las familias pobres ?;Escocia;India;Perú;España;Expert;A través del cruce con varios terriers locales, incluido el bichón maltés, los criadores pudieron obtener el Yorkshire Terrier.;https://es.wikipedia.org/wiki/Yorkshire_terrier
24;es;¿De qué color suelen ser las orejas del Yorkshire Terrier ?;cervatillo;Blanco;Negro;azul;Expert;Pequeñas y en forma de V, las orejas del Yorkshire Terrier se llevan erguidas, ligeramente separadas y cubiertas de pelo corto.;https://es.wikipedia.org/wiki/Yorkshire_terrier
25;es;¿Qué cazaba una vez el Yorkshire Terrier en las minas ?;Ratas;Liebres;erizos;lunares;Expert;El pequeño tamaño del Yorkshire Terrier y su pelo largo son elementos imprescindibles para su extracción de las madrigueras.;https://es.wikipedia.org/wiki/Yorkshire_terrier
26;es;¿Qué macho sería el origen de la raza Yorkshire tal y como la conocemos ?;Cangrejo viejo;Mejor tiburón;Delfín nuevo;Pasado Medusa;Expert;Una hembra llamada Kitty y otra hembra cuyo nombre no se ha conservado en la historia también son el origen de la raza.;https://es.wikipedia.org/wiki/Yorkshire_terrier
27;es;¿En qué año se registró el primer Yorkie en el American Kennel Club ?;1878;1898;1918;1938;Expert;El Yorkshire se alejó gradualmente de sus funciones primitivas para ser adoptado por los habitantes de la ciudad y convertirse en un perro de compañía.;https://es.wikipedia.org/wiki/Yorkshire_terrier
28;es;¿Cuál de estas razas se cruzó para dar el Yorkshire Terrier ?;Terrier de Clydesdale;Terrier de la región de los lagos;Terrier fronterizo;Terrier de Norwich;Expert;Originario de Escocia, el Paisley Terrier fue criado como una versión del Skye Terrier como animal de compañía y perro de caza.;https://es.wikipedia.org/wiki/Yorkshire_terrier
29;es;¿En qué año aterrizó por primera vez el Yorkshire Terrier en Francia ?;1920;1950;1980;1890;Expert;Según muchos historiadores, el nacimiento de la raza se remonta a la segunda revolución industrial, a principios del siglo XIX.;https://es.wikipedia.org/wiki/Yorkshire_terrier
30;es;¿Qué deporte canino puede jugar el Yorkshire Terrier como juego ?;agilidad;Pirena;Anillo;Obe;Expert;La agilidad implica hacer que los perros superen varios obstáculos para mostrar su inteligencia y flexibilidad.;https://es.wikipedia.org/wiki/Agility
1;it;Da quale paese di lingua inglese proviene lo Yorkshire Terrier ?;Inghilterra;India;Giappone;Cina;Débutant;Lo Yorkshire Terrier è una razza di cane appartenente al gruppo dei terrier e originaria dell'omonima contea inglese.;https://it.wikipedia.org/wiki/Yorkshire_terrier
2;it;Qual è il colore del lungo mantello setoso dello Yorkshire Terrier ?;Blu e fuoco;Rosso e bianco;Rosso e oro;Bianco e nero;Débutant;Molto popolare nelle competizioni, questo cane soprannominato Yorkie è all'origine di altre razze come l'Australian Silky Terrier.;https://it.wikipedia.org/wiki/Yorkshire_terrier
3;it;Qual è la durata media della vita di uno Yorkshire Terrier ?;14 anni;11 anni;8 anni;17 anni;Débutant;Lo Yorkshire è soprattutto un cane fatto per vivere in città e non ha bisogno di stare fuori tutto il giorno, anzi.;https://it.wikipedia.org/wiki/Yorkshire_terrier
4;it;Qual è la forma più comune delle orecchie dello Yorkshire Terrier ?;forma a V;quadrato;ovale;tondo;Débutant;Il bordo della testa è lungo, fulvo, di colore più intenso ai lati della testa, alla base delle orecchie e sul muso.;https://it.wikipedia.org/wiki/Yorkshire_terrier
5;it;Quale di queste qualificazioni si avvicina di più allo Yorkshire Terrier ?;Elegante;aggressivo;dominatore;passivo;Débutant;Anche se di piccola taglia, l'eleganza dello Yorkshire Terrier ha varcato i confini ed è l'orgoglio dei padroni di questa razza di cane.;https://it.wikipedia.org/wiki/Yorkshire_terrier
6;it;Qual è il colore del naso comune dello Yorkshire Terrier ?;nero;bruna;rosso;bianco;Débutant;Il muso non è lungo, il naso nero. Le mascelle e i denti sono articolati in una perfetta, regolare e completa chiusura a forbice.;https://it.wikipedia.org/wiki/Yorkshire_terrier
7;it;Contro quale malattia lo Yorkshire Terrier è una vera cura ?;depressione;Sovrappeso;Bronchite;Osteoporosi;Débutant;Lo Yorkshire Terrier ama il suo padrone e glielo fa conoscere chiedendogli attenzioni, carezze e amore dal suo padrone.;https://it.wikipedia.org/wiki/Yorkshire_terrier
8;it;Di che colore sono nati la maggior parte dei cuccioli di Yorkshire Terrier ?;nero;rossa;bianco;blu;Débutant;Pochi mesi dopo, il nero vira al grigio acciaio, mentre la testa e il petto assumono colori dorati.;https://it.wikipedia.org/wiki/Yorkshire_terrier
9;it;Quale soprannome viene spesso dato allo Yorkshire Terrier ?;yorkies;cagnolino;Sacco antipulci;farabutto;Débutant;Lo Yorkshire terrier, soprannominato Yorkie, era anche l'origine di altre razze come l'Australian Silky Terrier.;https://it.wikipedia.org/wiki/Yorkshire_terrier
10;it;Qual è il peso massimo di uno Yorkshire Terrier sano ?;3 kg;5 sterline;7 kg;9 sterline;Débutant;Lo Yorkshire Terrier ha bisogno di esercizio fisico regolare e lunghe passeggiate per sgranchirsi le gambe e mantenersi in forma.;https://it.wikipedia.org/wiki/Yorkshire_terrier
11;it;Quante crocchette dovresti dare al tuo Yorkshire terrier ogni giorno ?;40 grammi;20 grammi;60 grammi;80 grammi;Confirmé;Assicurati di prendere un tipo di crocchette adatto alle sue piccole dimensioni e razza (qualità premium se possibile).;https://it.wikipedia.org/wiki/Yorkshire_terrier
12;it;In quale secolo ebbe origine lo Yorkshire nella contea omonima ?;XIX;XVII;XV;XIII;Confirmé;La razza è infatti originaria dello Yorkshire e intorno a Manchester, una regione aspra nel nord dell'Inghilterra.;https://it.wikipedia.org/wiki/Yorkshire_terrier
13;it;Quale di queste affermazioni non designa un tratto caratteriale tipico dello Yorkshire Terrier ?;pericoloso;Frizzante;intelligente;fiducioso;Confirmé;Molto a suo agio con gli uomini, lo Yorkshire Terrier può tuttavia diventare rapidamente impaziente quando gioca con i bambini.;https://it.wikipedia.org/wiki/Yorkshire_terrier
14;it;Contrariamente alla credenza popolare, cosa ama fare lo Yorkshire Terrier durante le passeggiate ?;sporcarsi;corteccia;Bere;Dormire;Confirmé;Lo Yorkshire Terrier ama passeggiare nei boschi, respirando i profumi della terra e strofinandosi con la terra e le erbe che incontra.;https://it.wikipedia.org/wiki/Yorkshire_terrier
15;it;Dopo quanto tempo puoi aspettarti di vedere il tuo Yorkshire Terrier pulito ?;7 mesi;3 mesi;12 mesi;16 mesi;Confirmé;Come la maggior parte dei cuccioli, l'educazione dei primi sei mesi è fondamentale per beneficiare in seguito di un cane pulito.;https://it.wikipedia.org/wiki/Yorkshire_terrier
16;it;Cosa è meglio fornire nel cibo del tuo Yorkshire Terrier ?;vitamine;Zuccheri;grassi;glutine;Confirmé;Molto goloso, lo Yorkshire Terrier apprezza il pesce, la frutta come il melone o l'anguria oltre al gelato.;https://it.wikipedia.org/wiki/Yorkshire_terrier
17;it;Quale pezzo di carta può mantenere il pelo del cane senza romperlo ?;papillote;Papiro;Kraft;Origami;Confirmé;È possibile notare la caduta del pelo durante le prime 2 settimane di toelettatura, tempo di adattamento del cane.;
18;it;Quale funzione può svolgere lo Yorkshire Terrier nonostante le sue piccole dimensioni ?;Cane da guardia;Cercatore di tartufi;cane da caccia;Cane da slitta;Confirmé;Sebbene sia naturalmente incapace di fermare fisicamente un ladro, il suo abbaiare lo rende un efficace cane da guardia.;https://it.wikipedia.org/wiki/Yorkshire_terrier
19;it;Cosa può perdere rapidamente lo Yorkshire con bambini eccessivamente giocosi ?;La sua pazienza;La sua intelligenza;La sua manualità;La sua gioia di vivere;Confirmé;Lo Yorkshire Terrier, sotto il suo aspetto, rimane un cane con una personalità piena e abbastanza nervoso.;https://it.wikipedia.org/wiki/Yorkshire_terrier
20;it;Quale di queste caratteristiche si applica allo Yorkshire Terrier ?;Non muta;Non gioca;Non sta piangendo;Non abbaia;Confirmé;Lo Yorkshire Terrier rimane uno dei cani preferiti negli Stati Uniti, ma anche in Francia e Belgio.;https://it.wikipedia.org/wiki/Yorkshire_terrier
21;it;Qual è il prezzo medio di acquisto di uno Yorkshire Terrier da un allevatore ?;1.000€;500 euro;1.500€;2.000€;Expert;Usato principalmente come cane da compagnia, lo Yorkshire Terrier è un animale molto affettuoso con il suo padrone.;https://it.wikipedia.org/wiki/Yorkshire_terrier
22;it;A cosa servivano originariamente gli Yorkshire dei lavoratori scozzesi ?;bracconaggio;Alla ricerca del tartufo;contrattare;Stai al caldo;Expert;Le piccole dimensioni dello Yorkie permettevano al suo proprietario di portarlo in una bisaccia e tirarlo fuori per stanare un coniglio.;https://it.wikipedia.org/wiki/Yorkshire_terrier
23;it;Nel secolo scorso, in quale paese lo Yorkshire Terrier ha aiutato le famiglie povere ?;Scozia;India;Perù;Spagna;Expert;Attraverso l'incrocio con diversi terrier locali, tra cui il Bichon Maltese, gli allevatori sono stati in grado di ottenere lo Yorkshire Terrier.;https://it.wikipedia.org/wiki/Yorkshire_terrier
24;it;Qual è il colore delle orecchie dello Yorkshire Terrier di solito ?;Fulvo;bianco;nero;blu;Expert;Piccole ea forma di V, le orecchie dello Yorkshire Terrier sono portate erette, leggermente divaricate e ricoperte di pelo corto.;https://it.wikipedia.org/wiki/Yorkshire_terrier
25;it;Cosa cacciava una volta lo Yorkshire Terrier nelle miniere ?;Ratti;lepri;Ricci;talpe;Expert;Le piccole dimensioni dello Yorkshire Terrier e il suo lungo pelo sono elementi essenziali per la sua estrazione dalle tane.;https://it.wikipedia.org/wiki/Yorkshire_terrier
26;it;Quale maschio sarebbe l'origine della razza Yorkshire come la conosciamo ?;Vecchio granchio;Il miglior squalo;Nuovo delfino;Passato Medusa;Expert;Una femmina di nome Kitty e un'altra femmina il cui nome non è stato mantenuto dalla storia sono anche l'origine della razza.;https://it.wikipedia.org/wiki/Yorkshire_terrier
27;it;In che anno è stato registrato il primo Yorkie all'American Kennel Club ?;1878;1898;1918;1938;Expert;Lo Yorkshire si allontanò gradualmente dalle sue funzioni primitive per essere adottato dagli abitanti delle città e diventare un cane da compagnia.;https://it.wikipedia.org/wiki/Yorkshire_terrier
28;it;Quale di queste razze è stata incrociata per dare lo Yorkshire Terrier ?;Terrier di Clydesdale;Terrier dei laghi;Border Terrier;Norwich Terrier;Expert;Originario della Scozia, il Paisley Terrier è stato allevato come una versione dello Skye Terrier come animale da compagnia e cane da caccia.;https://it.wikipedia.org/wiki/Yorkshire_terrier
29;it;In che anno lo Yorkshire Terrier è atterrato per la prima volta in Francia ?;1920;1950;1980;1890;Expert;Secondo molti storici, la nascita della razza risale alla seconda rivoluzione industriale, all'inizio del XIX secolo.;https://it.wikipedia.org/wiki/Yorkshire_terrier
30;it;Quale sport per cani può giocare lo Yorkshire Terrier come gioco ?;agilità;Pirena;Anello;Obe;Expert;L'agilità consiste nel far superare ai cani vari ostacoli per mostrare la loro intelligenza e flessibilità.;https://it.wikipedia.org/wiki/Agility dog
1;nl;Uit welk Engelssprekend land komt de Yorkshire Terrier ?;Engeland;Indië;Japan;China;Débutant;De Yorkshire Terrier is een hondenras dat behoort tot de terriërgroep en afkomstig is uit het gelijknamige Engelse graafschap.;https://nl.wikipedia.org/wiki/Yorkshireterriër
2;nl;Wat is de kleur van de lange, zijdeachtige vacht van de Yorkshire Terrier ?;Blauw en vuur;Rood en wit;Rood en goud;Zwart en wit;Débutant;Deze hond met de bijnaam Yorkie is erg populair in wedstrijden en staat aan de basis van andere rassen, zoals de Australische Silky Terrier.;https://nl.wikipedia.org/wiki/Yorkshireterriër
3;nl;Wat is de gemiddelde levensduur van een Yorkshire Terrier ?;14 jaar oud;11 jaar;8 jaar;17 jaar oud;Débutant;De Yorkshire is vooral een hond die gemaakt is om in de stad te leven en hoeft niet de hele dag buiten te zijn, integendeel.;https://nl.wikipedia.org/wiki/Yorkshireterriër
4;nl;Wat is de meest voorkomende vorm van de oren van de Yorkshire Terrier ?;V-vorm;Vierkant;Ovaal;Rond;Débutant;De hoofdafwerking is lang, geelbruin, dieper van kleur aan de zijkanten van het hoofd, aan de basis van de oren en op de snuit.;https://nl.wikipedia.org/wiki/Yorkshireterriër
5;nl;Welke van deze kwalificaties komt het dichtst bij de Yorkshire Terrier ?;Elegant;Agressief;Dominator;Passief;Débutant;Hoewel klein van formaat, heeft de elegantie van de Yorkshire Terrier grenzen overschreden en is de trots van de meesters van dit rashond.;https://nl.wikipedia.org/wiki/Yorkshireterriër
6;nl;Wat is de gemeenschappelijke neuskleur van de Yorkshire Terrier ?;Zwart;brunette;Rood;Wit;Débutant;De snuit is niet lang, de neus zwart. De kaken en tanden zijn gearticuleerd in een perfect, regelmatig en compleet schaargebit.;https://nl.wikipedia.org/wiki/Yorkshireterriër
7;nl;Tegen welke ziekte is de Yorkshire Terrier een echt geneesmiddel ?;depressie;Overgewicht;Bronchitis;Osteoporose;Débutant;De Yorkshire Terrier houdt van zijn baasje en laat hem dat weten door aandacht, liefkozingen en liefde van zijn baasje te vragen.;https://nl.wikipedia.org/wiki/Yorkshireterriër
8;nl;Welke kleur worden de meeste Yorkshire Terrier-puppy's geboren ?;Zwart;roodharige;Wit;Blauw;Débutant;Een paar maanden later verandert het zwart in staalgrijs, terwijl het hoofd en de borst gouden kleuren krijgen.;https://nl.wikipedia.org/wiki/Yorkshireterriër
9;nl;Welke bijnaam wordt vaak aan de Yorkshire Terrier gegeven ?;Yorkies;hondje;Vlooienzak;schurk;Débutant;De Yorkshire Terriër, bijgenaamd Yorkie, was ook de oorsprong van andere rassen zoals de Australische Silky Terrier.;https://nl.wikipedia.org/wiki/Yorkshireterriër
10;nl;Wat is het maximale gewicht van een gezonde Yorkshire Terrier ?;3 kg;5 pond;7 kg;9 pond;Débutant;De Yorkshire Terrier heeft regelmatige lichaamsbeweging en lange wandelingen nodig om zijn benen te strekken en zijn vorm te behouden.;https://nl.wikipedia.org/wiki/Yorkshireterriër
11;nl;Hoeveel brokjes moet u uw Yorkshire terrier elke dag geven ?;40 gram;20 gram;60 gram;80 gram;Confirmé;Zorg ervoor dat u een type brok neemt dat is aangepast aan zijn kleine formaat en ras (hoogwaardige kwaliteit indien mogelijk).;https://nl.wikipedia.org/wiki/Yorkshireterriër
12;nl;In welke eeuw ontstond Yorkshire in het gelijknamige graafschap ?;XIX;XVII;XVe;XIIIe;Confirmé;Het ras is inderdaad inheems in Yorkshire en rond Manchester, een ruige regio in Noord-Engeland.;https://nl.wikipedia.org/wiki/Yorkshireterriër
13;nl;Welke van deze uitspraken duidt niet op een typische karaktereigenschap van de Yorkshire Terrier ?;Gevaarlijk;Sprankelend;Slim;Zelfverzekerd;Confirmé;Zeer comfortabel met mannen, kan de Yorkshire Terrier echter snel ongeduldig worden bij het spelen met kinderen.;https://nl.wikipedia.org/wiki/Yorkshireterriër
14;nl;In tegenstelling tot wat vaak wordt gedacht, wat doet de Yorkshire Terrier graag tijdens wandelingen ?;vies worden;Schors;Drinken;Slaap;Confirmé;De Yorkshire Terrier wandelt graag in het bos, ademt de geuren op de grond in en wrijft zich in de aarde en het gras dat hij tegenkomt.;https://nl.wikipedia.org/wiki/Yorkshireterriër
15;nl;Hoe snel kun je verwachten dat je Yorkshire Terrier schoon is ?;7 maanden;3 maanden;12 maanden;16 maanden;Confirmé;Zoals de meeste puppy's, is de opvoeding van de eerste zes maanden essentieel om later te kunnen profiteren van een schone hond.;https://nl.wikipedia.org/wiki/Yorkshireterriër
16;nl;Wat kun je het beste in het voer van je Yorkshire Terrier doen ?;Vitaminen;Suikers;Vetten;Gluten;Confirmé;Zeer gulzig, de Yorkshire Terrier waardeert vis, fruit zoals meloen of watermeloen, evenals ijs.;https://nl.wikipedia.org/wiki/Yorkshireterriër
17;nl;Welk stuk papier kan het haar van de hond onderhouden zonder het te breken ?;papillot;Papyrus;Kraft;Origami;Confirmé;Het is mogelijk om haaruitval op te merken tijdens de eerste 2 weken van de trimbeurt, de aanpassingstijd van de hond.;
18;nl;Welke functie kan de Yorkshire Terrier ondanks zijn kleine formaat vervullen ?;waakhond;Truffelzoeker;jachthond;Sledehond;Confirmé;Hoewel hij van nature niet in staat is een inbreker fysiek tegen te houden, maakt zijn geblaf hem tot een effectieve waakhond.;https://nl.wikipedia.org/wiki/Yorkshireterriër
19;nl;Wat kan Yorkshire snel verliezen met overdreven speelse kinderen ?;Zijn geduld;Zijn intelligentie;Zijn behendigheid;Zijn levensvreugde;Confirmé;De Yorkshire Terrier blijft naar zijn uiterlijk een hond met een vol karakter en behoorlijk nerveus.;https://nl.wikipedia.org/wiki/Yorkshireterriër
20;nl;Welke van deze kenmerken is van toepassing op de Yorkshire Terrier ?;Het vervelt niet;Hij speelt niet;Hij huilt niet;Hij blaft niet;Confirmé;De Yorkshire Terrier blijft een van de favoriete honden in de Verenigde Staten, maar ook in Frankrijk en België.;https://nl.wikipedia.org/wiki/Yorkshireterriër
21;nl;Wat is de gemiddelde aankoopprijs van een Yorkshire Terrier bij een fokker ?;€ 1.000;500 euro;€ 1.500;€ 2.000;Expert;De Yorkshire Terrier, die voornamelijk als gezelschapshond wordt gebruikt, is een zeer aanhankelijk dier met zijn baasje.;https://nl.wikipedia.org/wiki/Yorkshireterriër
22;nl;Waar werden de Yorkshires van de Schotse arbeiders oorspronkelijk voor gebruikt ?;Pocheren;Truffels vinden;Afdingen;Warm houden;Expert;Door het kleine formaat van de Yorkie kon de eigenaar hem in een zadeltas dragen en eruit halen om een konijn uit te spoelen.;https://nl.wikipedia.org/wiki/Yorkshireterriër
23;nl;In welk land hielp de Yorkshire Terrier in de vorige eeuw arme gezinnen ?;Schotland;Indië;Peru;Spanje;Expert;Door kruising met verschillende lokale terriers, waaronder de Bichon Maltese, konden fokkers de Yorkshire Terrier verkrijgen.;https://nl.wikipedia.org/wiki/Yorkshireterriër
24;nl;Wat is de kleur van de oren van de Yorkshire Terriër ?;reekalf;Wit;Zwart;Blauw;Expert;Klein en V-vormig, de oren van de Yorkshire Terrier worden rechtop gedragen, iets uit elkaar en bedekt met kort haar.;https://nl.wikipedia.org/wiki/Yorkshireterriër
25;nl;Wat heeft de Yorkshire Terrier ooit in de mijnen gejaagd ?;Ratten;Hazen;Egels;Mollen;Expert;De kleine omvang van de Yorkshire Terrier en zijn lange haar zijn essentiële elementen voor de extractie uit de holen.;https://nl.wikipedia.org/wiki/Yorkshireterriër
26;nl;Welk mannetje zou de oorsprong zijn van het Yorkshire-ras zoals wij het kennen ?;Oude Krab;Beste haai;Nieuwe dolfijn;Voorbij Medusa;Expert;Een teefje genaamd Kitty en een ander vrouwtje wiens naam niet door het verhaal is behouden, zijn ook de oorsprong van het ras.;https://nl.wikipedia.org/wiki/Yorkshireterriër
