29;de;Reverchon und Montmorency sind Sorten welcher Frucht ?;Kirsche;Zitrone;Clementine;Schwarze Johannisbeere;Expert;Die Kirschernte erfolgt in der Regel zwischen Ende Mai und Mitte August, die bekanntesten Sorten sind Burlat und Bigarreau.;
30;de;Auf welcher alten französischen Banknote erschien Eugène Delacroix ?;100 Franken;50 Franken;200 Franken;500 Franken;Expert;Eugène Delacroix, 1863 in Paris gestorben, war ein bedeutender französischer romantischer Maler, der zu Beginn des 19. Jahrhunderts auftrat.;
1;es;¿Qué actor interpreta al sirviente de Louis de Funès en « La Folie des grandeurs » ?;Yves Montand;Bourvil;Coluche;Michel Galabru;Débutant;En esta película, dirigida por Gérard Oury y estrenada en 1971, Alice Sapritch es doblada en la escena del striptease por Sophia Palladium.;
2;es;¿De cuántos miembros estaba Les Inconnus en los años 1990 ?;Tres;Cuatro;Cinco;Seis;Débutant;Smaïn y Seymour Brussel abandonaron el grupo un año después de su creación y, por tanto, antes del éxito de « La Télé des Inconnus ».;
3;es;¿Dónde le encanta pasar los días a la cantante Jenifer en una de sus canciones ?;Al sol;En el trabajo;En el gimnasio;Por teléfono;Débutant;Revelada por su participación en la Star Academy, Jenifer está representada desde 2007 por su estatua de cera en el Museo Grévin de París.;https://es.wikipedia.org/wiki/Jenifer
4;es;¿Carlomagno fue parte de qué gran dinastía de reyes francos ?;carolingios;merovingios;Capetos;Cistercienses;Débutant;Coronado emperador de Occidente en el año 800, Carlomagno amplió su reino mediante una serie de campañas militares.;https://es.wikipedia.org/wiki/Carlomagno
5;es;¿Qué instrumento musical se utiliza como trombones bajos ?;Snorkel;Trompeta;Triángulo;Timbales;Débutant;La invención de la tuba por parte de la firma Moritz tiene su origen en la invención del pistón que revolucionó la fabricación de instrumentos de metal.;https://es.wikipedia.org/wiki/Tuba
6;es;¿Qué cantante fue el líder del grupo de rock británico Genesis en 1976 ?;Phil Collins;Pedro Gabriel;Sting;Bryan Adams;Débutant;Genesis es un grupo de rock clasificado entre los creadores del género progresivo, con 150 millones de álbumes vendidos en todo el mundo.;https://es.wikipedia.org/wiki/Genesis
7;es;¿En qué puerto se puede visitar un teatro de ópera con un techo en forma de velas ?;Sídney;Róterdam;Singapur;Amberes;Débutant;La elevada factura de la Ópera (se requirieron 102 millones de dólares australianos) se pagó mediante una lotería pública.;
8;es;¿Dónde está la marca común de los hermanos en « Los tres hermanos » ?;En la nalga;En el estómago;En la nariz;Debajo del brazo;Débutant;Tres hermanos, que no se conocen, se reúnen ante notario para recibir una herencia de 3 millones de su madre.;
9;es;¿Cuál es el nombre de la sobrina del famoso inspector Gadget ?;Sofía;Sonia;Sara;Susana;Débutant;El inspector Gadget es un policía cibernético que lucha contra la organización MAD, equipado con numerosos gadgets integrados en su cuerpo.;
10;es;¿En cuántos decanatos se divide cada signo del Zodíaco ?;Tres;Cuatro;Cinco;Seis;Débutant;En astrología, un decanato es una subdivisión de un mes asociado a un signo, cada signo se divide en tres decanatos de diez grados.;
11;es;¿Qué película reunió en la pantalla a Catherine Zeta-Jones, Richard Gere y Renée Zelleweger ?;« Chicago »;« Palm Beach »;« Vegas »;« Miami »;Confirmé;La película dirigida por Rob Marshall y estrenada en 2002 está adaptada de la comedia musical del mismo nombre de Bob Fosse, John Kander y Fred Ebb.;https://es.wikipedia.org/wiki/Chicago_(película_de_2002)
12;es;¿Qué festival de cine, también llamado Zinemaldia, es el más importante de España ?;San Sebastián;La Foá;Locarno;Cabourg;Confirmé;También conocido como Zinemaldia, este festival se celebra cada año en septiembre en la ciudad vasca de San Sebastián.;
13;es;¿Cuántas sinfonías compuso Ludwig Van Beethoven durante su vida ?;Nuevo;Siete;Once;trece;Confirmé;Último gran representante del clasicismo vienés, el compositor alemán preparó la evolución hacia el romanticismo en la música.;https://es.wikipedia.org/wiki/Ludwig_van_Beethoven
14;es;Fundada el 6 de agosto de 1538, ¿de qué país es capital Bogotá ?;Colombia;Chile;Cuba;Costa Rica;Confirmé;Ubicada en el centro de Colombia, Bogotá es la ciudad más grande de Colombia y la tercera capital más alta del mundo.;https://es.wikipedia.org/wiki/Bogotá
15;es;¿Quién postuló por primera vez a la presidencia de la República en Francia ?;Arlette Laguiller;Simone Weill;Ségolène Royal;Brigitte Bout;Confirmé;Portavoz del movimiento trotskista Lutte Ouvrière, Arlette Laguiller ostenta el récord de número de candidatos en estas elecciones.;https://es.wikipedia.org/wiki/Arlette_Laguiller
16;es;¿Qué artista femenina se asocia a menudo con el Château des Milandes ?;Josephine Baker;Marie-Josée Nat;Isabelle Aubrey;Berthe Silva;Confirmé;En 1947, Joséphine Baker compró el castillo de Milandes y posteriormente vivió allí con su marido y sus doce hijos adoptivos.;
17;es;¿En qué isla griega vivió Safo, la famosa poeta de la Antigüedad ?;Lesbos;Lemnos;Tasos;Paros;Confirmé;Safo es conocida principalmente por haber expresado en sus escritos su atracción por las chicas jóvenes, de ahí el término safismo.;https://es.wikipedia.org/wiki/Safo
18;es;¿Cuántas muertes hay por prescripción médica en una película de Jacques Rouffio ?;Siete;Seis;Ocho;Nuevo;Confirmé;Dos cirujanos son víctimas de maniobras, rumores, presiones y desaprobación que finalmente los empujan al suicidio.;
19;es;¿Qué cantante causó escándalo al interpretar una versión iconoclasta de « la Marsellesa » ?;Serge Gainsbourg;Renaud;Jacques Dutronc;Michel Polnareff;Confirmé;Abordando muchos estilos musicales, Serge Gainsbourg ha tenido una influencia considerable en artistas como Bijou o Taxi Girl.;https://es.wikipedia.org/wiki/Serge_Gainsbourg
20;es;¿En qué documento puedes ver los activos y pasivos de tu negocio ?;Balance contable;Resumen;Informe;Minutos;Confirmé;Un balance es uno de los estados financieros que resume en un momento dado lo que posee la empresa y sus recursos.;
21;es;¿Quién fue el primer presidente y líder de las fuerzas armadas de los Estados Unidos en 1789 ?;George Washington;Abraham Lincoln;Thomas Jefferson;Richard Nixon;Expert;El presidente es elegido cada cuatro años junto con el vicepresidente por sufragio universal indirecto.;
22;es;¿En qué gran ciudad se encuentra el barrio llamado Alphabet City ?;Nueva York;Londres;Los Ángeles;Glasgow;Expert;Alphabet City es un barrio del distrito de Manhattan que toma su nombre de la plaza formada por las avenidas A, B, C y D.;https://es.wikipedia.org/wiki/Alphabet_City
23;es;¿Con los huesos de qué animal muy joven se jugaba a los nudillos en la antigua Grecia ?;Ovejas;Marmota;Mangosta;macaco;Expert;Su particular forma les permite deslizarse hasta las raíces de los dedos, siendo los huesecillos artificiales más pequeños que los naturales.;https://es.wikipedia.org/wiki/Juego_de_las_tabas
24;es;¿Quién compuso el famoso « Concierto para la mano izquierda » ?;Enmarañar;Rajmáninov;Rimski-Kórsakov;Rossini;Expert;El considerable virtuosismo de esta obra de Ravel reside en su parte pianística escrita únicamente para la mano izquierda del intérprete.;https://es.wikipedia.org/wiki/Concierto_para_piano_para_la_mano_izquierda
25;es;¿A qué escritor le debemos la novela filosófica y autobiográfica « Nausée » ?;Jean-Paul Sartre;Alberto Camus;Borís Vian;André Malraux;Expert;« Nausée » es una novela filosófica y un tanto autobiográfica, resultado de ocho años de desarrollo.;
26;es;¿Qué variedad de paloma europea también se llama paloma torcaz ?;Paloma torcaz;Beso;Colombia;Cauchois;Expert;Las poblaciones de Europa occidental son erráticas y sedentarias, mientras que las del norte y el este de Europa son migratorias.;https://es.wikipedia.org/wiki/Columba_palumbus
27;es;¿Qué pez de color azul grisáceo oscuro también se llama anguila de mar ?;Congrio;Rodaballo;Barra;Mero;Expert;Los congrios, que se diferencian de las anguilas por sus mandíbulas, a menudo viven sin cola, devorados por las morenas.;https://es.wikipedia.org/wiki/Conger
28;es;¿Cómo se llama una figura geométrica de once lados ?;Endecágono;hipotenusa;Heptágono;Hexaedro;Expert;Construidos por los venecianos, los once baluartes de las murallas de Nicosia, capital de Chipre, ocupan las cimas de un endecágono.;
29;es;¿Reverchon y montmorency son variedades de qué fruta ?;Cereza;Limón;Clementina;Grosella negra;Expert;La recolección de la cereza se realiza generalmente entre finales de mayo y mediados de agosto, siendo las variedades más conocidas Burlat y Bigarreau.;https://es.wikipedia.org/wiki/Cereza
30;es;¿En qué antiguo billete de banco francés apareció Eugène Delacroix ?;100 francos;50 francos;200 francos;500 francos;Expert;Fallecido en París en 1863, Eugène Delacroix fue un importante pintor romántico francés que apareció a principios del siglo XIX.;
1;it;Quale attore interpreta il servitore di Louis de Funès in « La Folie des grandeurs » ?;Yves Montand;Bourvil;Coluche;Michel Galabru;Débutant;In questo film, diretto da Gérard Oury e uscito nel 1971, Alice Sapritch è doppiata nella scena dello spogliarello da Sophia Palladium.;https://it.wikipedia.org/wiki/Mania_di_grandezza
2;it;Da quanti componenti erano costituiti Les Inconnus negli anni '90 ?;Tre;Quattro;Cinque;Sei;Débutant;Smaïn e Seymour Brussel lasciano il gruppo un anno dopo la sua creazione e quindi prima del successo di « La Télé des Inconnus ».;
3;it;Dove ama trascorrere le sue giornate la cantante Jenifer in una delle sue canzoni ?;Al sole;Al lavoro;In palestra;Al telefono;Débutant;Rivelata dalla sua partecipazione alla Star Academy, Jenifer è rappresentata dal 2007 dalla sua statua di cera al Museo Grévin di Parigi.;https://it.wikipedia.org/wiki/Jenifer
4;it;Carlo Magno faceva parte di quale grande dinastia di re franchi ?;Carolingi;Merovingi;Capetingi;Cistercensi;Débutant;Incoronato imperatore d'Occidente nell'anno 800, Carlo Magno espanse il suo regno attraverso una serie di campagne militari.;https://it.wikipedia.org/wiki/Carlo Magno
5;it;Quale strumento musicale viene utilizzato come trombone basso ?;Fare snorkeling;Tromba;Triangolo;Timpani;Débutant;L'invenzione della tuba da parte della ditta Moritz nasce dall'invenzione del pistone che rivoluzionò la costruzione degli ottoni.;https://it.wikipedia.org/wiki/Tuba_(strumento_musicale)
6;it;Quale cantante era il frontman del gruppo rock britannico Genesis nel 1976 ?;Phil Collins;Peter Gabriel;Sting;Bryan Adams;Débutant;I Genesis sono un gruppo rock da classificare tra gli ideatori del genere progressive, con 150 milioni di album venduti in tutto il mondo.;https://it.wikipedia.org/wiki/Genesis
7;it;In quale porto si può visitare un teatro d'opera con il tetto a forma di vela ?;Sidney;Rotterdam;Singapore;Anversa;Débutant;L'alto conto del Teatro dell'Opera (erano richiesti 102 milioni di dollari australiani) è stato pagato tramite una lotteria pubblica.;
8;it;Dov'è il tratto comune dei fratelli ne « eI tre fratelli » ?;Sulla natica;Sullo stomaco;Al naso;Sotto il braccio;Débutant;Tre fratelli che non si conoscono si incontrano davanti a un notaio per ricevere dalla madre un'eredità di 3 milioni.;
9;it;Qual è il nome della nipote del famoso ispettore Gadget ?;Sofia;Sonya;Sara;Susan;Débutant;L'ispettore Gadget è un agente di polizia informatico che combatte contro l'organizzazione MAD, dotato di numerosi gadget integrati nel suo corpo.;
10;it;In quanti decani è diviso ogni segno dello zodiaco ?;Tre;Quattro;Cinque;Sei;Débutant;In astrologia un decano è una suddivisione di un mese associato ad un segno, ogni segno è diviso in tre decani di dieci gradi.;
11;it;Quale film ha riunito sullo schermo Catherine Zeta-Jones, Richard Gere e Renée Zelleweger ?;« Chicago »;« Palm Beach »;« Vegas »;« Miami »;Confirmé;Il film diretto da Rob Marshall e uscito nel 2002 è adattato dalla commedia musicale omonima di Bob Fosse, John Kander e Fred Ebb.;https://it.wikipedia.org/wiki/Chicago_(film_2002)
12;it;Quale festival cinematografico, chiamato anche Zinemaldia, è il più importante in Spagna ?;San Sebastiano;Il Foa;Locarno;Cabourg;Confirmé;Conosciuto anche come Zinemaldia, questo festival si tiene ogni anno a settembre nella città basca di San Sebastián.;
13;it;Quante sinfonie ha composto Ludwig Van Beethoven durante la sua vita ?;Nuovo;Sette;Undici;Tredici;Confirmé;Ultimo grande rappresentante del classicismo viennese, il compositore tedesco ha preparato l'evoluzione verso il romanticismo in musica.;https://it.wikipedia.org/wiki/Ludwig_van_Beethoven
14;it;Fondata il 6 agosto 1538, di quale paese è Bogotà la capitale ?;Colombia;Cile;Cuba;Costa Rica;Confirmé;Situata nella Colombia centrale, Bogotà è la città più grande della Colombia e la terza capitale più alta del mondo.;https://it.wikipedia.org/wiki/Bogotà
15;it;Chi si è candidato per primo alla presidenza della Repubblica in Francia ?;Arlette Laguiller;Simone Weill;Ségolène Royal;Brigitte Bout;Confirmé;Portavoce del movimento trotskista Lutte Ouvrière, Arlette Laguiller detiene il record per numero di candidati a queste elezioni.;https://it.wikipedia.org/wiki/Arlette_Laguiller
16;it;Quale artista donna è spesso associata allo Château des Milandes ?;Josephine Baker;Marie-Josée Nat;Isabelle Aubrey;Berthe Silva;Confirmé;Fu nel 1947 che Joséphine Baker acquistò lo Château des Milandes e successivamente vi visse con il marito e dodici figli adottivi.;
17;it;In quale isola greca visse Saffo, la famosa poetessa dell'antichità ?;Lesbo;Lemno;Taso;Paro;Confirmé;Saffo è nota soprattutto per aver espresso nei suoi scritti la sua attrazione per le giovani ragazze, da qui il termine saffismo.;https://it.wikipedia.org/wiki/Saffo
18;it;Quante morti ci sono su prescrizione in un film di Jacques Rouffio ?;Sette;Sei;Otto;Nuovo;Confirmé;Due chirurghi sono vittime di manovre, voci, pressioni e disapprovazione che li spingono infine al suicidio.;
19;it;Quale cantante ha suscitato scandalo eseguendo una versione iconoclasta della « la Marseillaise » ?;Serge Gainsbourg;Renaud;Jacques Dutronc;Michel Polnareff;Confirmé;Affrontando molti stili musicali, Serge Gainsbourg ha avuto una notevole influenza su artisti come Bijou o Taxi Girl.;https://it.wikipedia.org/wiki/Serge_Gainsbourg
20;it;Su quale documento puoi vedere le attività e le passività della tua attività ?;Bilancio contabile;Sommario;Rapporto;Minuti;Confirmé;Uno stato patrimoniale è uno dei rendiconti finanziari che riassume in un dato momento ciò che l'azienda possiede e le sue risorse.;
21;it;Chi fu il primo presidente e capo delle forze armate degli Stati Uniti nel 1789 ?;George Washington;Abraham Lincoln;Thomas Jefferson;Richard Nixon;Expert;Il presidente è eletto ogni quattro anni insieme al vicepresidente a suffragio universale indiretto.;
22;it;In quale grande città si trova il quartiere chiamato Alphabet City ?;Nuova York;Londra;Los Angeles;Glasgow;Expert;Alphabet City è un quartiere del quartiere di Manhattan che prende il nome dalla piazza formata dalle Avenue A, B, C e D.;https://it.wikipedia.org/wiki/Alphabet_City
23;it;Con le ossa di quale animale giovanissimo si giocava con gli astragali nell'antica Grecia ?;Pecore;Marmotta;Mangusta;Macaco;Expert;La loro particolare forma permette loro di infilarsi nelle radici delle dita, essendo gli ossicini artificiali più piccoli di quelli naturali.;https://it.wikipedia.org/wiki/Aliossi
24;it;Chi ha composto il famoso « Concerto per la mano sinistra » ?;Ravello;Rachmaninoff;Rimsky-Korsakov;Rossini;Expert;Il notevole virtuosismo di quest'opera di Ravel risiede nella parte pianistica scritta esclusivamente per la mano sinistra dell'esecutore.;https://it.wikipedia.org/wiki/Concerto_per_la_mano_sinistra
25;it;A quale scrittore dobbiamo il romanzo filosofico e autobiografico « Nausée » ?;Jean-Paul Sartre;Alberto Camus;Boris Vian;André Malraux;Expert;« Nausée » è un romanzo filosofico e in qualche modo autobiografico, il risultato di otto anni di sviluppo.;
26;it;Quale varietà di colombaccio europeo è anche chiamato colombaccio ?;Colombaccio;Bacio;Colombino;Cauchois;Expert;Le popolazioni dell'Europa occidentale sono irregolari e sedentarie, mentre quelle dell'Europa settentrionale e orientale sono migratrici.;https://it.wikipedia.org/wiki/Columba_palumbus
27;it;Quale pesce grigio-blu scuro è anche chiamato anguilla marina ?;Grongo;Rombo;Barra;Cernia;Expert;I gronghi, che differiscono dalle anguille per le mascelle, spesso vivono senza coda, divorati dalle murene.;https://it.wikipedia.org/wiki/Conger
28;it;Qual è il nome di una figura geometrica con undici lati ?;Endecagono;Ipotenusa;Ettagono;Esaedro;Expert;Costruiti dai veneziani, gli undici bastioni dei bastioni di Nicosia, capitale di Cipro, occupano le sommità di un endecagono.;
29;it;Il Reverchon e il Montmorency sono varietà di quale frutto ?;Ciliegia;Limone;Clementina;Ribes nero;Expert;La raccolta delle ciliegie avviene generalmente tra la fine di maggio e la metà di agosto, le varietà più conosciute sono Burlat e Bigarreau.;https://it.wikipedia.org/wiki/Ciliegia
30;it;Su quale vecchia banconota francese è apparso Eugène Delacroix ?;100 franchi;50 franchi;200 franchi;500 franchi;Expert;Morto a Parigi nel 1863, Eugène Delacroix fu un importante pittore romantico francese apparso all'inizio del XIX secolo.;
1;nl;Welke acteur speelt de dienaar van Louis de Funès in « La Folie des grandeurs » ?;Yves Montand;Bourvil;Coluche;Michel Galabru;Débutant;In deze film, geregisseerd door Gérard Oury en uitgebracht in 1971, wordt Alice Sapritch in de stripteasescène nagesynchroniseerd door Sophia Palladium.;https://nl.wikipedia.org/wiki/La_folie_des_grandeurs
2;nl;Uit hoeveel leden bestond Les Inconnus in de jaren negentig ?;Drie;Vier;Vijf;Zes;Débutant;Smaïn en Seymour Brussel verlieten de groep een jaar na de oprichting en dus vóór het succes van « La Télé des Inconnus ».;
3;nl;Waar brengt zangeres Jenifer het liefst haar dagen door in een van haar liedjes ?;In de zon;Op het werk;In de sportschool;Aan de telefoon;Débutant;Jenifer, onthuld door haar deelname aan de Star Academy, wordt sinds 2007 vertegenwoordigd door haar wassen beeld in het Grévin Museum in Parijs.;https://nl.wikipedia.org/wiki/Jenifer Bartoli
4;nl;Van welke grote dynastie van Frankische koningen maakte Karel de Grote deel uit ?;Karolingers;Merovingers;Capetianen;Cisterciënzers;Débutant;Karel de Grote werd in het jaar 800 tot westerse keizer gekroond en breidde zijn koninkrijk uit via een reeks militaire campagnes.;https://nl.wikipedia.org/wiki/Karel de Grote
5;nl;Welk muziekinstrument wordt gebruikt als bastrombone ?;Snorkelen;Trompet;Driehoek;Pauken;Débutant;De uitvinding van de tuba door de firma Moritz komt voort uit de uitvinding van de zuiger, die een revolutie teweegbracht in het maken van koperblazers.;https://nl.wikipedia.org/wiki/Tuba_(instrument)
6;nl;Welke zanger was in 1976 frontman van de Britse rockgroep Genesis ?;Phil Collins;Peter Gabriël;Sting;Brian Adams;Débutant;Genesis is een rockgroep die behoort tot de makers van het progressieve genre, met wereldwijd 150 miljoen verkochte albums.;https://nl.wikipedia.org/wiki/Genesis_(band)
7;nl;In welke haven kun je een operagebouw bezoeken met een dak in de vorm van zeilen ?;Sydney;Rotterdam;Singapore;Antwerpen;Débutant;De hoge rekening van het Opera House (A $ 102 miljoen was vereist) werd betaald via een openbare loterij.;
8;nl;Waar is het gemeenschappelijke kenmerk van de broers in « The Three Brothers » ?;Op de bil;Op de buik;Op de neus;Onder de arm;Débutant;Drie broers, die elkaar niet kennen, ontmoeten elkaar bij een notaris om van hun moeder een erfenis van 3 miljoen te ontvangen.;
9;nl;Wat is de voornaam van het nichtje van de beroemde Inspector Gadget ?;Sofie;Sonya;Sara;Susan;Débutant;Inspector Gadget is een cyberpolitieagent die vecht tegen de MAD-organisatie, uitgerust met talloze gadgets die in zijn lichaam zijn geïntegreerd.;
10;nl;In hoeveel decanen is elk teken van de dierenriem verdeeld ?;Drie;Vier;Vijf;Zes;Débutant;In de astrologie is een decan een onderverdeling van een maand die geassocieerd is met een teken; elk teken is verdeeld in drie decanen van tien graden.;
11;nl;Welke film bracht Catherine Zeta-Jones, Richard Gere en Renée Zelleweger op het scherm samen ?;« Chicago »;« Palm Beach »;« Vegas »;« Miami »;Confirmé;De film, geregisseerd door Rob Marshall en uitgebracht in 2002, is een bewerking van de gelijknamige muzikale komedie van Bob Fosse, John Kander en Fred Ebb.;https://nl.wikipedia.org/wiki/Chicago_(2002)
12;nl;Welk filmfestival, ook wel Zinemaldia genoemd, is het belangrijkste in Spanje ?;San Sebastián;De Foa;Locarno;Cabourg;Confirmé;Dit festival, ook bekend als Zinemaldia, wordt elk jaar in september gehouden in de Baskische stad San Sebastián.;
13;nl;Hoeveel symfonieën componeerde Ludwig Van Beethoven tijdens zijn leven ?;Nieuw;Zeven;Elf;Dertien;Confirmé;Als laatste grote vertegenwoordiger van het Weense classicisme bereidde de Duitse componist de evolutie naar de romantiek in de muziek voor.;https://nl.wikipedia.org/wiki/Ludwig_van_Beethoven
14;nl;Van welk land is Bogota de hoofdstad, opgericht op 6 augustus 1538 ?;Colombia;Chili;Cuba;Costa Rica;Confirmé;Bogota, gelegen in centraal Colombia, is de grootste stad van Colombia en de derde hoogste hoofdstad ter wereld.;https://nl.wikipedia.org/wiki/Bogota (stad)
15;nl;Wie heeft zich voor het eerst kandidaat gesteld voor het presidentschap van de Republiek in Frankrijk ?;Arlette Laguiller;Simone Weill;Segolène Royal;Brigitte Bout;Confirmé;Woordvoerder van de trotskistische beweging Lutte Ouvrière, Arlette Laguiller, is recordhouder van het aantal kandidaten bij deze verkiezingen.;https://nl.wikipedia.org/wiki/Arlette_Laguiller
16;nl;Welke vrouwelijke kunstenaar wordt vaak geassocieerd met Château des Milandes ?;Josephine Baker;Marie-Josée Nat;Isabelle Aubrey;Berthe Silva;Confirmé;Het was in 1947 dat Joséphine Baker het Château des Milandes kocht en er vervolgens met haar man en twaalf geadopteerde kinderen ging wonen.;
17;nl;Op welk Grieks eiland woonde Sappho, de beroemde dichter uit de oudheid ?;Lesbos;Lemnos;Thasos;Paros;Confirmé;Sappho staat vooral bekend omdat ze in haar geschriften haar aantrekkingskracht op jonge meisjes heeft uitgedrukt, vandaar de term sapphisme.;https://nl.wikipedia.org/wiki/Sappho
18;nl;Hoeveel sterfgevallen zijn er op recept in een film van Jacques Rouffio ?;Zeven;Zes;Acht;Nieuw;Confirmé;Twee chirurgen zijn het slachtoffer van manoeuvres, geruchten, druk en afkeuring die hen uiteindelijk tot zelfmoord drijven.;
19;nl;Welke zanger veroorzaakte een schandaal door een iconoclastische versie van « la Marseillaise » uit te voeren ?;Serge Gainsbourg;Renaud;Jacques Dutronc;Michel Polnareff;Confirmé;Serge Gainsbourg richt zich op vele muziekstijlen en heeft een aanzienlijke invloed gehad op artiesten als Bijou of Taxi Girl.;https://nl.wikipedia.org/wiki/Serge_Gainsbourg
20;nl;Op welk document kunt u de bezittingen en schulden van uw onderneming zien ?;Boekhoudkundige balans;Samenvatting;Rapport;Minuten;Confirmé;Een balans is een van de financiële overzichten die op een bepaald moment samenvat wat het bedrijf bezit en wat zijn middelen zijn.;
21;nl;Wie was de eerste president en leider van de strijdkrachten van de Verenigde Staten in 1789 ?;George Washington;AbrahamLincoln;Thomas Jefferson;Richard Nixon;Expert;De president wordt samen met de vice-president elke vier jaar via indirecte algemene verkiezingen gekozen.;
22;nl;In welke grote stad ligt de wijk Alphabet City ?;New York;Londen;Los Angeles;Glasgow;Expert;Alphabet City is een wijk in de wijk Manhattan die zijn naam ontleent aan het plein gevormd door de Avenues A, B, C en D.;
23;nl;Met de botten van welk heel jong dier werd in het oude Griekenland knokkels gespeeld ?;Schapen;Marmot;Mangoest;Makaak;Expert;Door hun bijzondere vorm kunnen ze in de wortels van de vingers glijden, omdat de kunstmatige gehoorbeentjes kleiner zijn dan de natuurlijke.;https://nl.wikipedia.org/wiki/Bikkelspel
24;nl;Wie componeerde het beroemde « Concert voor de linkerhand » ?;Ravel;Rachmaninov;Rimski-Korsakov;Rossini;Expert;De aanzienlijke virtuositeit van dit werk van Ravel schuilt in de pianistische partij die uitsluitend voor de linkerhand van de uitvoerder is geschreven.;https://nl.wikipedia.org/wiki/Pianoconcert_voor_de_linkerhand_(Ravel)
25;nl;Aan welke schrijver hebben we de filosofische en autobiografische roman « Nausée » te danken ?;Jean-Paul Sartre;Albert Camus;Boris Vian;André Malraux;Expert;« Nausée » is een filosofische en enigszins autobiografische roman, het resultaat van acht jaar ontwikkeling.;
26;nl;Welke Europese duivensoort wordt ook wel houtduif genoemd ?;Houtduif;Kus;Colombine;Cauchois;Expert;De West-Europese bevolking is grillig en sedentair, terwijl die in Noord- en Oost-Europa migrerend zijn.;https://nl.wikipedia.org/wiki/Houtduif
27;nl;Welke donkergrijsblauwe vis wordt ook wel zeepaling genoemd ?;Zeepaling;Tarbot;Balk;Tandbaars;Expert;Zeepaling, die door hun kaken van paling verschilt, leeft vaak zonder staart, verslonden door murenen.;https://nl.wikipedia.org/wiki/Conger (geslacht)
28;nl;Wat is de naam van een geometrische figuur met elf zijden ?;Hendecagon;Hypotenusa;Zevenhoek;Zesvlak;Expert;De elf bastions van de wallen van Nicosia, de hoofdstad van Cyprus, gebouwd door de Venetianen, bezetten de toppen van een twaalfhoek.;
