29;de;Wie heißt die dritte Eröffnung des Animes, die in den Episoden 116 bis 168 enthalten ist ?;Hikari E;Wir sind;Starkes Wort;Glaube;Expert;Die Going Merry segelt dann auf ruhiger See mit kreisenden Möwen, mit Robin in ihrem lila Outfit an der Spitze.;https://de.wikipedia.org/wiki/One_Piece
30;de;Welcher Pirat aus der Rocks-Crew wurde von Gecko Moria wiederbelebt ?;John;Ryuma;perona;Absolut;Expert;Die Höhle und den Schatz von Captain John zu finden, ist der Traum von Baggy, dem Clown mit den tausend Teilen, der zum Kaiser wurde.;https://de.wikipedia.org/wiki/One_Piece
1;es;¿Qué mangaka, nacido en Kumamoto en 1975, es el autor del manga « One Piece » ?;Eiichiro Oda;Akira Toriyama;Hayao Miyazaki;Naoki Urasawa;Débutant;El primer capítulo de « One Piece », que entró en el Libro Guinness de los récords mundiales, se publicó en Weeky Shonen Jump en 1997.;
2;es;¿Quién ocupa el rol de navegante dentro de la tripulación del Sombrero de Paja ?;Nami;Usopp;Zoro;Petirrojo;Débutant;Exmiembro de la tripulación de Arlong, Nami es el segundo personaje en unirse a los Sombreros de Paja, después de Zoro.;https://es.wikipedia.org/wiki/Nami (One Piece)
3;es;¿Qué tipo de fruta del diablo te permite transformarte en un animal ?;Zoan;Paramecia;Logia;Toki;Débutant;El término se utilizó por primera vez durante la lucha de Dalton contra Wapol del Reino Maligno de Black Drum.;https://es.wikipedia.org/wiki/One_Piece
4;es;En « One Piece », ¿con qué otro nombre se conoce a Marshall D. Teach ?;Barbanegra;Barba Blanca;Shanks;Big Mom;Débutant;Marshall D. Teach fue el único Capitán Corsario que ingresó al grupo sin recompensa y sin ser conocido por el Gobierno Mundial.;https://es.wikipedia.org/wiki/Anexo:Personajes_de_One_Piece
5;es;¿Quién era el jefe de las Obras Barrocas, una organización misteriosa en « One Piece » ?;cocodrilo;nico robin;Bon Clay;Doflamingo;Débutant;La palabra barroco en este caso se refiere al funcionamiento de las organizaciones mafiosas italianas en el siglo XVII.;https://es.wikipedia.org/wiki/Anexo:Personajes_de_One_Piece
6;es;¿De qué tripulación pirata es miembro Yasopp, el padre de Usopp ?;Shanks;Barba Blanca;Gol D.Roger;Kaido;Débutant;Con una altura de 1,83 metros, Yasopp ocupa el puesto de francotirador de los piratas de Roux, al igual que su hijo Usopp.;https://es.wikipedia.org/wiki/One_Piece
7;es;En « One Piece », ¿cómo se llama el capitán de la tripulación del Heart ?;Law;Kid;Big Mom;Baggy;Débutant;Trafalgar D. Water Law es el único pirata conocido que es a la vez uno de los once Supernovas y uno de los siete Capitanes Piratas.;https://es.wikipedia.org/wiki/One_Piece
8;es;¿Qué isla, situada al final del Grand Line, albergaría el famoso One Piece ?;Laught Tale;Mont Corvo;Marie-Joie;Little Garden;Débutant;Los cuatro Poneglyphs forman una X cuando los puntos donde se encuentran se cruzan, indicando dónde está Laugh Tale.;https://es.wikipedia.org/wiki/One_Piece
9;es;¿De qué raza se conocieron Dorry y Broggy en Little Garden ?;Gigantes;Hombres pez;Minks;Shandias;Débutant;Dorry el demonio azul (2260 cm) y Broggy el demonio rojo (2130 cm) se encuentran entre los gigantes que pueden vivir más de 345 años.;https://es.wikipedia.org/wiki/One_Piece
10;es;En « One Piece », ¿quién es la única mujer Gran Corsaria ?;Boa Hancock;Big Mom;Stussy;Ivankov;Débutant;De los 7 Grand Corsairs originales, Boa Hancock es la única que nunca ha luchado directamente contra Luffy o su tripulación.;https://es.wikipedia.org/wiki/Anexo:Personajes_de_One_Piece
11;es;¿En qué restaurante trabajó Sanji antes de unirse a Luffy ?;Baratie;Moby Dick;Oro Jackson;Vogue Merry;Confirmé;El barco restaurante visto en la primera temporada, el Baratie, está ubicado cerca de Grand Line, lo que atrae a muchos piratas allí.;https://es.wikipedia.org/wiki/One_Piece
12;es;¿Cuántos años duraron los puntos suspensivos después de los acontecimientos de Marinefod ?;2 años;3 años;5 años;10 años;Confirmé;El salto temporal de dos años se tradujo en realidad como una pausa de un mes durante la cual Oda se fue de vacaciones a Hawaii.;https://es.wikipedia.org/wiki/One_Piece
13;es;¿Quién era el comandante de la tercera división de Barbablanca ?;Joz;Ace;Marco;Vista;Confirmé;La historia cuenta que una vez un fan le preguntó a Eiichiro Oda si el pene de Diamond Joz era un diamante, y Oda respondió que sí.;https://es.wikipedia.org/wiki/One_Piece
14;es;¿Cuál es el papel de Crocus en la tripulación de Gol D. Roger ?;Médico del barco;Navegador;Cocinero;Músico;Confirmé;Aunque pasó la mayor parte de su vida como vigilante del faro, también navegó junto a Roger durante tres años.;https://es.wikipedia.org/wiki/Anexo:Personajes_de_One_Piece
15;es;¿En qué zona marítima de « One Piece » se encuentra Arlong Park ?;East Blue;South Blue;West Blue;North Blue;Confirmé;La arquitectura del Parque Arlong, que da directamente al océano y donde residían Arlong y su pandilla, se basa en los templos indonesios.;https://es.wikipedia.org/wiki/One_Piece
16;es;¿Qué película de « One Piece » se centra en el personaje de Shiki, el León Dorado ?;« Strong World »;« Gold »;« Stampede »;« Red »;Confirmé;Luffy y sus compañeros tendrán que luchar contra una naturaleza todopoderosa y animales gigantescos para liberar a Nami.;https://es.wikipedia.org/wiki/One_Piece_Film:_Strong_World
17;es;¿Qué personaje de « One Piece » se llamó a sí mismo Whitebeard Junior ?;Webble;Albion;Machvise;Raízo;Confirmé;Mencionadas por primera vez por Brandnew, sus cicatrices parecen más el resultado de una cirugía que los restos de lesiones.;https://es.wikipedia.org/wiki/One_Piece
18;es;¿Quién es el miembro de mayor edad de la tripulación de Don Quijote Dolfamingo ?;Lao G;Trébol;Jora;Señor Pink;Confirmé;Lao significa viejo en chino, mientras que G significa abuelo : por lo tanto, el nombre Lao G debería significar viejo abuelo.;https://es.wikipedia.org/wiki/Anexo:Personajes_de_One_Piece
19;es;¿Cómo se llama el padre de Nefertari Vivi, cuya madre es Titi ?;Cobra;Pell;Igaram;Chaka;Confirmé;Descendiente de Nefertari D. Lillie, el apellido Nefertari seguramente proviene del nombre de Nefertari, la gran esposa de Ramsés II.;https://es.wikipedia.org/wiki/One_Piece
20;es;¿Qué dragón celestial obeso de cara ancha fue derribado por Luffy en Sabaody ?;San Carlos;San Rosward;San Mjosgard;San Camael;Confirmé;Coleccionista de hermosas esclavas, poseedor de ocho esposas, antes había tenido trece, pero despidió a cinco.;https://es.wikipedia.org/wiki/Anexo:Personajes_de_One_Piece
21;es;¿Qué personaje se convirtió en director de Impel Down, tras la degradación de Magallanes ?;Hannyabal;Shiliew;Sadi;Domino;Expert;Hannyabal ofrece boxers con diferentes estampados : fresas, flores, pechos grandes, setas rosas, froufrou, elefante y bikini.;https://es.wikipedia.org/wiki/Anexo:Personajes_de_One_Piece
22;es;¿En qué organización estaba Nero the Sea Otter ?;Cipher Pol;Baroque Works;El inframundo;Los revolucionarios;Expert;El PC es una organización de espías que realiza trabajos encubiertos para el Gobierno Mundial, conocido desde el CP1 al CP8.;https://es.wikipedia.org/wiki/One_Piece
23;es;Babanuki, gerente de mina en Wano Country, ¿se comió la SONRISA de qué animal ?;Elefante;León;Ovejas;Caballo;Expert;Las frutas SMILE son un tipo natural de fruta del diablo tipo Zoan creada por Caesar Clown.;https://es.wikipedia.org/wiki/One_Piece
24;es;¿Qué videojuego de One Piece, lanzado en 2023, es un juego de rol por turnos ?;« Odyssey »;« World Seeker »;« Romance Dawn »;« Gear Spirit »;Expert;Eiichiro Oda participó en el juego, cuyo desarrollo tardó casi tres años, incluido el diseño de personajes.;
25;es;En « One Piece », ¿quién se comió el Hira Hira no Mi, fruto del vol-au-vent ?;Diamante;Smoker;Bellamy;Kuzan;Expert;Diamante, miembro de los Piratas de Don Quijote Doflamingo y líder de la tripulación, entrenó a Trafalgar Law en el manejo de la espada.;https://es.wikipedia.org/wiki/One_Piece
26;es;¿Qué hijo de la familia Charlotte fue derrotado por Urouge y perdió su rango de general ?;Snack;Cracker;Smoothie;Katakuri;Expert;A menudo se ve a Urouge sonriendo, excepto cuando es derrotado por Kizaru y un Pacifista, y cuando habla con Kaidou mientras ora por él.;https://es.wikipedia.org/wiki/Anexo:Personajes_de_One_Piece
27;es;¿Qué comandante del ejército revolucionario está a cargo del ejército del norte ?;Karasu;Betty;Morley;Lindbergh;Expert;La voz de Karasu es tan débil (lleva una máscara de metal con forma de pico sobre su rostro) que necesita un megáfono para hablar.;https://es.wikipedia.org/wiki/One_Piece
28;es;¿Qué rango ocupaba Smoker entre los acontecimientos de Arabasta y los del salto temporal ?;Contraalmirante;Vicealmirante;Capitán;Subalmirante;Expert;Debido a sus acciones contra Luffy en Loguetown, Smoker puede ser visto como el principal antagonista del arco de Loguetown.;https://es.wikipedia.org/wiki/One_Piece
29;es;¿Cómo se llama el tercer opening del anime, incluido en los episodios 116 al 168 ?;Hikari E;Somos;Strong Word;Believe;Expert;Luego, el Vogue Merry navega en un mar en calma con gaviotas dando vueltas, con Robin con su traje morado al frente.;https://es.wikipedia.org/wiki/One_Piece
30;es;¿Qué pirata de la tripulación de Rocks fue resucitado por Gecko Moria ?;Juan;ryuma;perona;Absoluto;Expert;Encontrar la cueva y el tesoro del Capitán John es el sueño de Baggy, el Payaso de las Mil Piezas, convertido en Emperador.;https://es.wikipedia.org/wiki/One_Piece
1;it;Quale mangaka, nato a Kumamoto nel 1975, è l'autore del manga di « One Piece » ?;Eiichiro Oda;Akira Toriyama;Hayao Miyazaki;Naoki Urasawa;Débutant;Il primo capitolo di « One Piece », entrato nel Guinness dei primati, è stato pubblicato su Weeky Shonen Jump nel 1997.;
2;it;Chi occupa il ruolo di navigatore all'interno della ciurma di Cappello di Paglia ?;Nami;Usopp;Zorò;Pettirosso;Débutant;Ex membro dell'equipaggio di Arlong, Nami è il secondo personaggio ad unirsi alla ciurma di Cappello di Paglia, dopo Zoro.;https://it.wikipedia.org/wiki/Nami
3;it;Quale tipo di frutto del diavolo ti permette di trasformarti in un animale ?;Zoan;Paramecia;Loggia;Toki;Débutant;Il termine è stato usato per la prima volta durante la lotta di Dalton contro Wapol del regno malvagio di Black Drum.;https://it.wikipedia.org/wiki/One_Piece
4;it;In « One Piece », con quale altro nome è conosciuto Marshall D. Teach ?;Barbanera;Barba Bianca;Shanks;Big Mom;Débutant;Marshall D. Teach è stato l'unico capitano corsaro ad entrare nel gruppo senza una taglia e senza essere conosciuto dal governo mondiale.;https://it.wikipedia.org/wiki/Personaggi_di_One_Piece
5;it;Chi era il capo della Barocco Works, un'organizzazione misteriosa in « One Piece » ?;coccodrillo;Nico Robin;Bon Clay;Doflamingo;Débutant;La parola Barocco in questo caso si riferisce al funzionamento delle organizzazioni mafiose italiane nel XVII secolo.;https://it.wikipedia.org/wiki/Personaggi_di_One_Piece
6;it;Di quale ciurma di pirati fa parte Yasopp, il padre di Usopp ?;Shanks;Barba Bianca;Gol D.Roger;Kaido;Débutant;Alto 1,83 metri, Yasopp occupa il ruolo di cecchino dei pirati di Roux, nella stessa veste di suo figlio Usopp.;https://it.wikipedia.org/wiki/One_Piece
7;it;In « One Piece », come si chiama il capitano dell'equipaggio del Cuore ?;Law;Kid;Big Mom;Baggy;Débutant;Trafalgar D. Water Law è l'unico pirata conosciuto che è sia una delle undici Supernove che uno dei sette Capitani Pirata.;https://it.wikipedia.org/wiki/One_Piece
8;it;Quale isola, situata alla fine della Rotta Maggiore, ospiterebbe il famoso One Piece ?;Laught Tale;Mont Corvo;Marie-Joie;Little Garden;Débutant;I quattro Poneglifi formano una X quando i punti in cui si trovano si intersecano, indicando dove si trova Laugh Tale.;https://it.wikipedia.org/wiki/One_Piece
9;it;Di che razza sono Dorry e Broggy incontrati a Little Garden ?;Giganti;Uomini-pesce;Minks;Shandias;Débutant;Dorry il demone blu (2260 cm) e Broggy il demone rosso (2130 cm) sono tra i giganti che possono vivere più di 345 anni.;https://it.wikipedia.org/wiki/One_Piece
10;it;In « One Piece », chi è l'unico Gran Corsaro donna ?;Boa Hancock;Big Mom;Stussy;Ivankov;Débutant;Dei 7 Grandi Corsari originali, Boa Hancock è l'unico che non ha mai combattuto direttamente contro Rufy o il suo equipaggio.;https://it.wikipedia.org/wiki/Personaggi_di_One_Piece
11;it;In quale ristorante lavorava Sanji prima di unirsi a Rufy ?;Baratie;Moby Dick;Oro Jackson;Vogue Merry;Confirmé;Barca ristorante vista nella prima stagione, la Baratie si trova vicino alla Rotta Maggiore e trasporta lì molti pirati.;https://it.wikipedia.org/wiki/One_Piece
12;it;Quanti anni sono durati i puntini di sospensione dopo gli eventi di Marinefod ?;2 anni;3 anni;5 anni;10 anni;Confirmé;Il salto temporale di due anni si è tradotto in realtà come una pausa di un mese durante il quale Oda è andato in vacanza alle Hawaii.;https://it.wikipedia.org/wiki/One_Piece
13;it;Chi era il comandante della terza divisione di Barbabianca ?;Joz;Ace;Marco;Vista;Confirmé;La storia racconta che una volta un fan chiese a Eiichiro Oda se il pene di Diamond Joz fosse diamante e Oda rispose di sì.;https://it.wikipedia.org/wiki/One_Piece
14;it;Qual è il ruolo di Crocus nella squadra di Gol D. Roger ?;Medico di bordo;Navigatore;Cuoco;Musicista;Confirmé;Pur avendo trascorso gran parte della sua vita come guardiano del faro, navigò anche al fianco di Roger per tre anni.;https://it.wikipedia.org/wiki/Personaggi_di_One_Piece
15;it;In quale zona di mare di « One Piece » si trova Arlong Park ?;East Blue;South Blue;West Blue;North Blue;Confirmé;L'architettura di Arlong Park, che si affaccia direttamente sull'oceano e dove risiedevano Arlong e la sua banda, è basata sui templi indonesiani.;https://it.wikipedia.org/wiki/One_Piece
16;it;Quale film di « One Piece » è incentrato sul personaggio di Shiki, il Leone d'Oro ?;« Strong World »;« Gold »;« Stampede »;« Red »;Confirmé;Rufy e i suoi compagni dovranno combattere contro una natura onnipotente e animali giganteschi per liberare Nami.;https://it.wikipedia.org/wiki/One_Piece_-_Avventura_sulle_isole_volanti
17;it;Quale personaggio di « One Piece » si è chiamato Barbabianca Junior ?;Weeble;Albion;Machvise;Raizo;Confirmé;Menzionate per la prima volta da Brandnew, le sue cicatrici sembrano più il risultato di un intervento chirurgico che i resti di ferite.;https://it.wikipedia.org/wiki/One_Piece
18;it;Chi è il membro più anziano della ciurma di Don Chisciotte Dolfamingo ?;Lao G;Trebol;Jora;Señor Pink;Confirmé;Lao significa vecchio in cinese, mentre G significa nonno : il nome Lao G dovrebbe quindi significare Vecchio Nonno.;https://it.wikipedia.org/wiki/Personaggi_di_One_Piece
19;it;Qual è il nome del padre di Nefertari Vivi, la cui madre è Titi ?;Cobra;Pell;Igaram;Chaka;Confirmé;Discendente di Nefertari D. Lillie, il cognome Nefertari deriva sicuramente dal nome di Nefertari, la grande moglie di Ramses II.;https://it.wikipedia.org/wiki/One_Piece
20;it;Quale drago celeste obeso dalla faccia larga è stato abbattuto da Rufy in Sabaody ?;San Carlo;San Rosario;San Mjosgard;Saint-Camaël;Confirmé;Collezionista di bellissime schiave, possessore di otto mogli, ne aveva prima tredici, ma ne congedò cinque.;https://it.wikipedia.org/wiki/Personaggi_di_One_Piece
21;it;Quale personaggio è diventato il regista di Impel Down, dopo la retrocessione di Magellan ?;Hannyabal;Shiliew;Sadi;Domino;Expert;Hannyabal propone boxer con diverse fantasie : fragole, fiori, seni grandi, funghi rosa, froufrou, elefante e bikini.;https://it.wikipedia.org/wiki/Personaggi_di_One_Piece
22;it;In quale organizzazione faceva parte Nerone la Lontra Marina ?;Cipher Pol;Baroque Works;Gli Inferi;I rivoluzionari;Expert;Il CP è un'organizzazione di spie, che svolge attività segreta per il Governo Mondiale, conosciuta dal CP1 al CP8.;https://it.wikipedia.org/wiki/One_Piece
23;it;Babanuki, direttore della miniera nel Paese di Wano, ha mangiato il SORRISO di quale animale ?;Elefante;Leone;Pecore;Cavallo;Expert;I frutti SMILE sono un tipo esclusivamente naturale di frutto del diavolo di tipo Zoan creato da Caesar Clown.;https://it.wikipedia.org/wiki/One_Piece
24;it;Quale videogioco di One Piece, uscito nel 2023, è un gioco di ruolo a turni ?;« Odyssey »;« World Seeker »;« Romance Dawn »;« Gear Spirit »;Expert;Eiichiro Oda è stato coinvolto nel gioco, il cui sviluppo ha richiesto quasi tre anni, compreso il design dei personaggi.;
25;it;In « One Piece », chi ha mangiato l'Hira Hira no Mi, frutto del vol-au-vent ?;Diamante;Smoker;Bellamy;Kuzan;Expert;Diamante, membro dei pirati di Don Chisciotte Doflamingo e capo dell'equipaggio, ha addestrato Trafalgar Law nell'arte della spada.;https://it.wikipedia.org/wiki/One_Piece
26;it;Quale figlio della famiglia Charlotte fu sconfitto da Urouge e perse il grado di generale ?;Snack;Cracker;Smoothie;Katakuri;Expert;Urouge viene spesso visto sorridere, tranne quando viene sconfitto da Kizaru e da un Pacifista, e quando parla con Kaidou mentre prega per lui.;https://it.wikipedia.org/wiki/Personaggi_di_One_Piece
27;it;Quale comandante dell'esercito rivoluzionario è a capo dell'esercito del nord ?;Karasu;Betty;Morley;Lindbergh;Expert;La voce di Karasu è così debole (indossa una maschera a forma di becco di metallo sul viso) che ha bisogno di un megafono per parlare.;https://it.wikipedia.org/wiki/One_Piece
28;it;Che rango occupava Smoker tra gli eventi di Alabasta e quelli del salto temporale ?;Contrammiraglio;Vice-Ammiraglio;Capitano;Sottoammiraglio;Expert;A causa delle sue azioni contro Rufy a Loguetown, Smoker può essere visto come il principale antagonista dell'arco di Loguetown.;https://it.wikipedia.org/wiki/One_Piece
29;it;Come si chiama la terza sigla dell'anime, inclusa negli episodi dal 116 al 168 ?;Hikari E;Noi siamo;Parola forte;Credi;Expert;La Going Merry poi naviga su un mare calmo con i gabbiani che volteggiano intorno, con Robin nel suo vestito viola nella parte anteriore.;https://it.wikipedia.org/wiki/One_Piece
30;it;Quale pirata della ciurma di Rocks è stato resuscitato da Gecko Moria ?;Giovanni;ryuma;perona;Assolo;Expert;Trovare la caverna e il tesoro del Capitano John è il sogno di Baggy, il Clown dai mille pezzi, diventato Imperatore.;https://it.wikipedia.org/wiki/One_Piece
1;nl;Welke mangaka, geboren in Kumamoto in 1975, is de auteur van « One Piece » manga ?;Eiichiro Oda;Akira Toriyama;Hayao Miyazaki;Naoki Urasawa;Débutant;Het eerste hoofdstuk van « One Piece », dat in het Guinness Book of World Records is opgenomen, werd in 1997 gepubliceerd in Weeky Shonen Jump.;
2;nl;Wie vervult de rol van navigator binnen de Straw Hat crew ?;Nami;Usopp;Zoro;Robin;Débutant;Nami, een voormalig lid van de Arlong-crew, is het tweede personage dat zich na Zoro bij de Straw Hats voegt.;
3;nl;Met welk soort duivelsfruit kun je in een dier veranderen ?;Zoan;Paramecia;Logia;Toki;Débutant;De term werd voor het eerst gebruikt tijdens de strijd van Dalton tegen Wapol van het Evil Kingdom of Black Drum.;https://nl.wikipedia.org/wiki/One_Piece
4;nl;Onder welke andere naam is Marshall D. Teach in « One Piece » bekend ?;Zwartbaard;Witte Baard;Shanks;Big Mom;Débutant;Marshall D. Teach was de enige Corsair-kapitein die de groep binnenkwam zonder premie en zonder bekend te zijn bij de Wereldregering.;
5;nl;Wie was het hoofd van de Barokwerken, een mysterieuze organisatie in « One Piece » ?;krokodil;Nico Robin;Bon Clay;Doflamingo;Débutant;Het woord barok verwijst in dit geval naar het functioneren van Italiaanse maffiaorganisaties in de 17e eeuw.;
6;nl;Van welke piratenploeg is Yasopp, de vader van Usopp, lid ?;Shanks;Witte Baard;Gol D.Roger;Kaido;Débutant;Met een lengte van 1,83 meter bekleedt Yasopp de positie van sluipschutter van de piraten van Roux, in dezelfde hoedanigheid als zijn zoon Usopp.;https://nl.wikipedia.org/wiki/One_Piece
7;nl;Wat is de naam van de kapitein van de bemanning van de Heart in « One Piece » ?;Wet;Kid;Big Mom;Baggy;Débutant;Trafalgar D. Water Law is de enige bekende piraat die zowel een van de elf Supernova's als een van de zeven Pirate Captains is.;https://nl.wikipedia.org/wiki/One_Piece
8;nl;Op welk eiland, gelegen aan het einde van de Grand Line, zou het beroemde One Piece te vinden zijn ?;Laught Tale;Mont Corvo;Marie-Joie;Kleine tuin;Débutant;De vier Poneglyphs vormen een X wanneer de punten waar ze staan elkaar kruisen, wat aangeeft waar Laugh Tale is.;https://nl.wikipedia.org/wiki/One_Piece
9;nl;Welk ras zijn Dorry en Broggy, ontmoet op Little Garden ?;Reuzen;Vismannen;Minks;shandia's;Débutant;Dorry de blauwe demon (2260 cm) en Broggy de rode demon (2130 cm) behoren tot de reuzen die meer dan 345 jaar kunnen leven.;https://nl.wikipedia.org/wiki/One_Piece
10;nl;Wie is in « One Piece » de enige vrouwelijke Grand Corsair ?;Boa Hancock;Big Mom;Stussy;Ivankov;Débutant;Van de oorspronkelijke zeven Grand Corsairs is Boa Hancock de enige die nog nooit rechtstreeks tegen Luffy of zijn bemanning heeft gevochten.;
11;nl;In welk restaurant werkte Sanji voordat hij bij Luffy kwam ?;Baratie;Moby Dick;Oro Jackson;Vogue Merry;Confirmé;Restaurantboot gezien in het eerste seizoen, de Baratie ligt vlakbij de Grand Line en brengt daar veel piraten heen.;https://nl.wikipedia.org/wiki/One_Piece
12;nl;Hoeveel jaar duurde de ellips na de gebeurtenissen van Marinefod ?;2 jaar;3 jaar;5 jaar;10 jaar;Confirmé;Het tijdsverschil van twee jaar vertaalde zich in werkelijkheid als een pauze van een maand waarin Oda op vakantie ging naar Hawaï.;https://nl.wikipedia.org/wiki/One_Piece
13;nl;Wie was de commandant van Witbaards derde divisie ?;Joz;Ace;Marco;Vista;Confirmé;Het verhaal gaat dat een fan ooit aan Eiichiro Oda vroeg of de penis van Diamond Joz van diamant was, en Oda antwoordde dat dat zo was.;https://nl.wikipedia.org/wiki/One_Piece
14;nl;Wat is de rol van Crocus in de bemanning van Gol D. Roger ?;Scheepsarts;Browser;Kok;Muzikant;Confirmé;Hoewel hij het grootste deel van zijn leven als vuurtorenwachter had doorgebracht, zeilde hij ook drie jaar naast Roger.;
15;nl;In welk zeegebied van « One Piece » ligt Arlong Park ?;East Blue;South Blue;Westblauw;North Blue;Confirmé;De architectuur van Arlong Park, dat direct uitkijkt over de oceaan en waar Arlong en zijn bende woonden, is gebaseerd op Indonesische tempels.;https://nl.wikipedia.org/wiki/One_Piece
16;nl;Welke « One Piece »-film draait om het personage Shiki, de Gouden Leeuw ?;« Strong World »;« Gold »;« Stampede »;« Red »;Confirmé;Luffy en zijn metgezellen zullen moeten vechten tegen een almachtige natuur en gigantische dieren om Nami te bevrijden.;
17;nl;Welk « One Piece »-personage noemde zichzelf Whitebeard Junior ?;Weeble;Albion;machinaal;Raizo;Confirmé;Voor het eerst genoemd door Brandnew, lijken zijn littekens meer op het resultaat van een operatie dan op de overblijfselen van verwondingen.;https://nl.wikipedia.org/wiki/One_Piece
18;nl;Wie is het oudste lid van de Don Quixote Dolfamingo-crew ?;Lao G;Trebol;Jora;Señor Pink;Confirmé;Lao betekent oud in het Chinees, terwijl G grootvader betekent : de naam Lao G zou daarom Oude Grootvader moeten betekenen.;
19;nl;Hoe heet de vader van Nefertari Vivi, wiens moeder Titi is ?;Cobra;pel;Igaram;Chaka;Confirmé;Afstammeling van Nefertari D. Lillie, de achternaam Nefertari komt zeker van de naam van Nefertari, de grote vrouw van Ramses II.;https://nl.wikipedia.org/wiki/One_Piece
20;nl;Welke zwaarlijvige hemelse draak met breed gezicht werd neergeslagen door Luffy in Sabaody ?;Sint-Charlos;Sint Rosward;Sint-Mjosgard;Sint-Camaël;Confirmé;Verzamelaar van mooie slavinnen, bezitter van acht vrouwen, hij had er voorheen dertien, maar hij stuurde er vijf weg.;
21;nl;Welk personage werd regisseur van Impel Down, na de degradatie van Magellan ?;Hannyabal;Shiliew;Sadi;Domino;Expert;Hannyabal biedt boxers met verschillende patronen : aardbeien, bloemen, grote borsten, roze paddenstoelen, froufrou, olifant en bikini.;
22;nl;In welke organisatie zat Nero de Zeeotter ?;Cipher Pol;Barokke werken;De onderwereld;De revolutionairen;Expert;De CP is een organisatie van spionnen die heimelijk werk doet voor de Wereldregering, bekend van CP1 tot CP8.;https://nl.wikipedia.org/wiki/One_Piece
23;nl;Babanuki, mijnmanager in Wano Country, at de GLIMLACH van welk dier ?;Olifant;Leeuw;Schapen;Paard;Expert;SMILE Fruits zijn een soort Zoan-type Devil Fruit, gemaakt door Caesar Clown.;https://nl.wikipedia.org/wiki/One_Piece
24;nl;Welke One Piece-videogame, uitgebracht in 2023, is een turn-based rollenspel ?;« Odyssey »;« World Seeker »;« Romance Dawn »;\u003cI\u003eGear Spirit\u003c/I\u003e;Expert;Eiichiro Oda was betrokken bij de game, die bijna drie jaar in beslag nam om te ontwikkelen, inclusief het karakterontwerp.;
25;nl;Wie at in « One Piece » de Hira Hira no Mi, vrucht van de vol-au-vent ?;Diamante;Smoker;Bellamy;Kuzan;Expert;Diamante, lid van de Don Quixote Doflamingo Pirates en leider van de bemanning, trainde Trafalgar Law in zwaardvechten.;https://nl.wikipedia.org/wiki/One_Piece
26;nl;Welk kind uit de familie Charlotte werd verslagen door Urouge en verloor zijn rang van generaal ?;Snack;Kraken;Smoothie;Katakuri;Expert;Urouge wordt vaak glimlachend gezien, behalve wanneer hij wordt verslagen door Kizaru en een Pacifista, en wanneer hij met Kaidou praat terwijl hij voor hem bidt.;
27;nl;Welke revolutionaire legercommandant heeft de leiding over het noordelijke leger ?;Karasu;Betty;morley;Lindbergh;Expert;Karasu's stem is zo zwak (hij draagt een metalen snavelachtig masker over zijn gezicht) dat hij een megafoon nodig heeft om te kunnen spreken.;https://nl.wikipedia.org/wiki/One_Piece
