14;nl;Welke koningin van de nacht verliet ons op 1 mei 2022, op 92-jarige leeftijd ?;Regine;Barbara;Davia;Gelou;Confirmé;Na succes te hebben gehad met « Les P'tits Papiers », opende Régine nachtclubs die haar naam over de hele wereld droegen.;
15;nl;Welke acteur werd in « Hannibal » gedwongen een stukje van zijn hersenen levend op te eten ?;Ray Liotta;Anthony Hopkins;Gary Oldman;David Andrews;Confirmé;Ray Liotta stierf in zijn slaap op 26 mei 2022 op 67-jarige leeftijd in de Dominicaanse Republiek, waar hij « Dangerous Waters » aan het filmen was.;https://nl.wikipedia.org/wiki/Ray_Liotta
16;nl;Wie speelde Sonny Corleone in « The Godfather » van Francis Ford Coppola ?;James Caan;Don Johnson;George Burns;Mark Hamill;Confirmé;Volgens zijn overlijdensakte, gepubliceerd door de site TMZ, stierf de acteur aan een hartaanval als gevolg van een coronaire hartziekte.;https://nl.wikipedia.org/wiki/James_Caan
17;nl;Welk voormalig model en echtgenote van Donald Trump heeft ons op 14 juli 2022 verlaten ?;Ivana Trump;Marla Maples;Ivanka Trump;Tiffany Trump;Confirmé;Ski-instructeur Ivana Trump zal ook model zijn en de Olympische Zomerspelen van 1976 promoten.;https://nl.wikipedia.org/wiki/Ivana_Trump
18;nl;Welke actrice heeft drie en een half jaar bij Ellen DeGeneres gewoond ?;Anne Heche;Jennifer Fox;Sarah Boyd;Julie Dash;Confirmé;In haar autobiografie, « Call me Crazy », beschrijft Anne Heche hoe ze door haar vader werd verkracht vanaf haar geboorte tot haar twaalfde.;https://nl.wikipedia.org/wiki/Anne_Heche
19;nl;Welke Sovjet- en toenmalige Russische staatsman stond bekend om zijn wijnvlek ?;Michail Gorbatsjov;Andrej Gromyko;Vladimir Poetin;Joeri Andropov;Confirmé;Michail Gorbatsjov, gewaardeerd in de westerse wereld, ontving in 1990 de Nobelprijs voor de Vrede, maar blijft zeer impopulair in Rusland.;
20;nl;Welke volslagen Frans-Zwitserse filmmaker beheerste de montage van zijn films ?;Jean-Luc Godard;Gerard Leblanc;Claude Barma;Roger Andrieux;Confirmé;Jean-Luc Godard trad daar af en toe op, soms in een kleine rol, soms niet als acteur maar als sprekend onderwerp.;https://nl.wikipedia.org/wiki/Jean-Luc_Godard
21;nl;Wie verzorgde de televisiestem van Hannibal Smith en J.R. Ewing ?;Dominique Paturel;Olivier Pajot;Christian Pélissier;Claude Piéplu;Expert;Hij was ook de stem van Robin Hood van Disney Studios en de voice-over van de aftiteling van de animatieserie « Captain Flam ».;
22;nl;Aan welke pionier van de elektronische muziek hebben we de soundtrack van de film « 1492 » te danken ?;Vangelis;Klaus Schulze;David Arkenstone;Mike Oldfield;Expert;Toen hij in mei 1968 naar Parijs kwam, vormde hij samen met zijn vriend Demis Roussos en Lucas Sideras de progressieve rockgroep Aphrodite's Child.;https://nl.wikipedia.org/wiki/Vangelis
23;nl;Welke medeoprichter en lid van de Depeche Mode-groep heeft ons op 26 mei 2022 verlaten ?;Andrew Fletcher;Dave Gahan;Martin Goré;Alan Wilder;Expert;Andrew Fletcher richtte samen met Vince Clarke de muziekgroep Composition of Sound op, waarin hij als bassist fungeerde.;https://nl.wikipedia.org/wiki/Andrew_Fletcher
24;nl;Welke Franse tv-man lanceerde het personage Casimir ?;Christophe Izard;Maurice Le Roux;Remy Grumbach;Jean-Louis Cap;Expert;We zijn hem talloze programma's verschuldigd : « L'Île aux enfants », « Les Visiteurs du mercredi », « Le Village dans les nuages  » en «  Salut les Mickey ».;
25;nl;Welke actrice is vandaag de dag nog steeds beroemd vanwege haar rol als Jessica Fletcher ?;Angela Lansbury;Sharon Gless;Regina Taylor;Kathy Baker;Expert;Angela Lansbury heeft zich naast de grootste sterren ook onderscheiden in tal van Hollywood-producties.;https://nl.wikipedia.org/wiki/Angela_Lansbury
26;nl;Wie was de eerste Bahamaanse die in 1964 de Academy Award voor Beste Acteur won ?;Sidney Poitier;Rex Harrison;Gregory Peck;Lee Marvin;Expert;Ridder Commandeur in de Orde van het Britse Rijk en ambassadeur van de Bahama's, hij verliet ons op 6 januari 2022.;https://nl.wikipedia.org/wiki/Sidney_Poitier
27;nl;Wie heeft zijn stem geleend aan documentaires als « Diana, Princess of the People » ?;Jacques Perrin;Jean Desailly;Charles Berling;Hervé Lacroix;Expert;Als officier in de burgerreserve van de Nationale Marine vond zijn begrafenis plaats in het Hôtel des Invalides op 21 april 2022.;https://nl.wikipedia.org/wiki/Jacques_Perrin
28;nl;Welke actrice werd beloond voor haar eerste rol in de film « Rouge Baiser » ?;Charlotte Valandrey;Isabelle Adjani;Victoria Abril;Juliette Binoche;Expert;Ze kondigde aan dat ze vanwege gezondheidsproblemen wachtte op een tweede harttransplantatie, omdat haar hart het einde van zijn levensduur had bereikt.;
29;nl;Welk voormalig model behaalde succes met het nummer « Comme un boemerang » ?;Dani;Imany;Douchka;Capucine;Expert;In 2001 keerde Dani terug op de voorgrond, dankzij de vasthoudendheid van Étienne Daho die deze titel met haar produceerde en zong.;
30;nl;Aan welke Amerikaanse componist hebben we de muziek voor de serie « Twin Peaks » te danken ?;Angelo Badalamenti;Scott Bradlee;Henry Mancini;Edgar Sampson;Expert;Angelo Badalamenti staat bekend om zijn lange samenwerking met David Lynch, wiens muziek hij talloze malen schreef.;https://nl.wikipedia.org/wiki/Angelo_Badalamenti
