22;de;Welchem Pionier der elektronischen Musik verdanken wir den Soundtrack des Films « 1492 » ?;Vangelis;Klaus Schulze;David Arkenstone;Mike Oldfield;Expert;Als er im Mai 1968 nach Paris kam, gründete er mit seinem Freund Demis Roussos und Lucas Sideras die Progressive-Rock-Gruppe Aphrodite's Child.;https://de.wikipedia.org/wiki/Vangelis
23;de;Welcher Mitbegründer und Mitglied der Depeche Mode-Gruppe hat uns am 26. Mai 2022 verlassen ?;Andrew Fletcher;Dave Gahan;Martin Gore;Alan Wilder;Expert;Andrew Fletcher gründete mit Vince Clarke die Musikgruppe Composition of Sound, in der er als Bassist fungierte.;https://de.wikipedia.org/wiki/Andrew_Fletcher_(Musiker)
24;de;Welcher französische Fernsehmann hat die Rolle des Casimir ins Leben gerufen ?;Christophe Izard;Maurice Le Roux;Remy Grumbach;Jean-Louis Cap;Expert;Wir verdanken ihm zahlreiche Programme : « L'Île aux enfants », « Les Visiteurs du mercredi », « Le Village dans les nuages  » und «  Salut les Mickey ».;
25;de;Welche Schauspielerin ist bis heute für ihre Rolle als Jessica Fletcher berühmt ?;Angela Lansbury;Sharon Gless;Regina Taylor;Kathy Baker;Expert;Angela Lansbury hat sich auch in zahlreichen Hollywood-Produktionen an der Seite der größten Stars hervorgetan.;https://de.wikipedia.org/wiki/Angela_Lansbury
26;de;Wer war der erste Bahamaser, der 1964 den Oscar als bester Hauptdarsteller gewann ?;Sidney Poitier;Rex Harrison;Gregory Peck;Lee Marvin;Expert;Er ist Knight Commander des Order of the British Empire und Botschafter der Bahamas und hat uns am 6. Januar 2022 verlassen.;https://de.wikipedia.org/wiki/Sidney_Poitier
27;de;Wer hat Dokumentarfilmen wie « Diana, Prinzessin des Volkes » seine Stimme geliehen ?;Jacques Perrin;Jean Desailly;Charles Berling;Hervé Lacroix;Expert;Als Offizier der Bürgerreserve der Nationalen Marine fand seine Beerdigung am 21. April 2022 im Hôtel des Invalides statt.;https://de.wikipedia.org/wiki/Jacques_Perrin
28;de;Welche Schauspielerin wurde für ihre erste Rolle im Film « Rouge Baiser » ausgezeichnet ?;Charlotte Valandrey;Isabelle Adjani;Victoria Abril;Juliette Binoche;Expert;Sie gab bekannt, dass sie aufgrund gesundheitlicher Probleme auf eine zweite Herztransplantation warte, da ihr Herz das Ende seiner Lebensdauer erreicht habe.;https://de.wikipedia.org/wiki/Charlotte_Valandrey
29;de;Welches ehemalige Model hatte mit dem Song « Comme un boomerang » Erfolg ?;Dani;Imany;Duschka;Capucine;Expert;Im Jahr 2001 kehrte Dani dank der Hartnäckigkeit von Étienne Daho, der diesen Titel mit ihr produzierte und sang, in den Vordergrund zurück.;https://de.wikipedia.org/wiki/Dani_(Schauspielerin)
30;de;Welchem amerikanischen Komponisten verdanken wir die Musik zur Serie « Twin Peaks » ?;Angelo Badalamenti;Scott Bradlee;Henry Mancini;Edgar Sampson;Expert;Angelo Badalamenti ist bekannt für seine langjährige Zusammenarbeit mit David Lynch, dessen Musik er mehrfach schrieb.;https://de.wikipedia.org/wiki/Angelo_Badalamenti
1;es;¿Qué animador y ensayista de ciencia ficción nos dejó el 2 de enero de 2022 ?;Ígor Bogdanoff;Jacques Bergier;Alexéi Filippenko;Albert Jacquard;Débutant;Formando un dúo cercano e inseparable a lo largo de su carrera, los Bogdanoff se hicieron conocidos como divulgadores.;https://es.wikipedia.org/wiki/Igor_y_Grichka_Bogdanoff
2;es;¿Qué actor francés perdió la vida a los 37 años tras un accidente de esquí ?;Gaspard Ulliel;Pierre Niney;Benoît Magimel;Mathieu Amalric;Débutant;Actor y modelo, Garpard Ulliel también era conocido por haber sido el rostro del perfume Bleu de Chanel durante doce años.;https://es.wikipedia.org/wiki/Gaspard_Ulliel
3;es;¿Quién presentó en particular el « periódico de las 13:00 » durante 33 años ?;Jean-Pierre Pernaut;Michel Denisot;Jean-Claude Bourret;Jacques Legros;Débutant;En febrero de 2022, ingresó en el hospital tras varios accidentes cerebrovasculares y complicaciones relacionadas con una cirugía a corazón abierto.;
4;es;¿Qué cantante y actor belga, nacido en Ostende, murió a los 72 años en Bruselas ?;Arno;Jeff Bodart;Saule;Jofroi;Débutant;Iconoclasta y entrañable, hizo de su belga un arte importante que marcó la música europea con sus conmovedores textos.;https://es.wikipedia.org/wiki/Arno_(cantante)
5;es;¿Quién se hizo muy popular interpretando a Moisés en « Los Diez Mandamientos » ?;Daniel Leví;Pedro Alves;Pablo Villafranca;Patrice Carmona;Débutant;Daniel Lévi, que padecía cáncer colorrectal desde 2019 y era padre de cuatro hijos, falleció el 6 de agosto de 2022 en Marsella, a la edad de 60 años.;
6;es;¿Quién interpretó el papel de Sandy en « Grease » junto a John Travolta ?;Olivia Newton-John;Sara Storer;Kasey Chambers;Sherrie Austin;Débutant;En 1980 filmó un romance musical con Gene Kelly, « Xanadu », que no tuvo mucho éxito, salvo la banda sonora.;https://es.wikipedia.org/wiki/Olivia_Newton-John
7;es;¿Quién fue Reina del Reino Unido e Irlanda del Norte durante setenta años ?;Elizabeth II;Alejandra de Kent;Carlota de Gales;Beatriz de York;Débutant;Es la segunda monarca de la era moderna que ha tenido el reinado más largo en Europa, detrás del rey de Francia Luis XIV.;
8;es;¿Qué futbolista brasileño sigue siendo el único tres veces ganador de la Copa del Mundo ?;Pelé;Roberto;Fontana;Edu;Débutant;Una importante figura del fútbol, Edson Arantes do Nascimento, conocido como Pelé, es considerado el mejor jugador de todos los tiempos.;
9;es;¿Cómo se llamaba Beineix, el director francés al que le debemos la película « 37°2 le matin » ?;Jean-Jacques;Philippe-André;Marc-Antoine;Pierre-Paul;Débutant;Fallecido el 13 de enero de 2022, con sólo seis películas en su haber, Jean-Jacques Beineix sigue siendo uno de los pilares del cine de mirada francés.;https://es.wikipedia.org/wiki/Jean_Jacques_Beineix
10;es;¿Qué diseñador italiano incorporó el estilo casual chic a la moda masculina ?;Niño Cerruti;Paco Rabanne;Emanuel Ungaro;Gianni Versace;Débutant;Fallecido el 15 de enero de 2022, Nino Cerruti fundó su casa de alta costura en 1967 en París 8, en el número 3 de la Madeleine.;
11;es;¿A qué director le debemos « Los Cazafantasmas », « Jumeaux » y « Beethoven » ?;Iván Reitman;Tom Cavanagh;Rick Moranis;Arturo Hiller;Confirmé;Ivan Reitman murió mientras dormía el 12 de febrero de 2022 a la edad de 75 años, y luego fue enterrado en el cementerio de Santa Bárbara.;https://es.wikipedia.org/wiki/Ivan_Reitman
12;es;¿Qué francés diseñó el vestido que lució Kim Kardashian en la Met Gala ?;Thierry Mugler;Christian Dior;Guy Laroche;Pierre Balmain;Confirmé;Nunca se dejó encarcelar en el estatus de un gran modisto y, en particular, rechazó las retrospectivas de sus creaciones.;https://es.wikipedia.org/wiki/Thierry_Mugler
13;es;¿Qué actor estadounidense se destacó en la película « Children of Silence » ?;William Hurt;Dustin Hoffman;Jeremy Irons;Anthony Hopkins;Confirmé;Hablando francés con fluidez, conoció a Sandrine Bonnaire en el rodaje de « La Peste », con quien tuvo una hija nacida en 1994.;https://es.wikipedia.org/wiki/William_Hurt
14;es;¿Qué reina de la noche nos dejó el 1 de mayo de 2022, a los 92 años ?;Régine;Bárbara;Davía;Gelou;Confirmé;Después del éxito con « Les P'tits Papiers », Régine abrió discotecas que llevaron su nombre en todo el mundo.;
15;es;¿Qué actor se vio obligado a comerse vivo un trozo de su cerebro en « Hannibal » ?;Ray Liotta;Anthony Hopkins;Gary Oldman;David Andrews;Confirmé;Ray Liotta murió mientras dormía el 26 de mayo de 2022 a la edad de 67 años, en República Dominicana, donde se encontraba filmando « Aguas Peligrosas ».;https://es.wikipedia.org/wiki/Ray_Liotta
16;es;¿Quién interpretó a Sonny Corleone en « El Padrino », de Francis Ford Coppola ?;James Caan;Don Johnson;George Burns;Mark Hamill;Confirmé;Según su certificado de defunción publicado por el sitio TMZ, el actor murió de un ataque al corazón tras una enfermedad de las arterias coronarias.;https://es.wikipedia.org/wiki/James_Caan
17;es;¿Qué exmodelo y esposa de Donald Trump nos dejó el 14 de julio de 2022 ?;Ivana Trump;Marla Maples;Ivanka Trump;Tiffany Trump;Confirmé;La instructora de esquí, Ivana Trump, también será modelo y promoverá los Juegos Olímpicos de Verano de 1976.;https://es.wikipedia.org/wiki/Ivana_Trump
18;es;¿Qué actriz vivió con Ellen DeGeneres durante tres años y medio ?;Anne Heche;Jennifer Fox;Sarah Boyd;Julie Dash;Confirmé;En su autobiografía, « Llámame loca », Anne Heche describe cómo fue violada por su padre desde que nació hasta los doce años.;https://es.wikipedia.org/wiki/Anne_Heche
19;es;¿Qué estadista soviético y luego ruso fue conocido por su mancha de vino ?;Mijaíl Gorbachov;Andréi Gromiko;Vladímir Putin;Yuri Andrópov;Confirmé;Apreciado en el mundo occidental, Mikhail Gorbachev recibió el Premio Nobel de la Paz en 1990, pero sigue siendo muy impopular en Rusia.;
20;es;¿Qué cineasta franco-suizo domina perfectamente el montaje de sus películas ?;Jean-Luc Godard;Gerard Leblanc;Claude Barma;Roger Andrieux;Confirmé;Jean-Luc Godard apareció allí de vez en cuando, a veces en un pequeño papel, a veces no como actor sino como sujeto hablante.;https://es.wikipedia.org/wiki/Jean-Luc_Godard
21;es;¿Quién proporcionó la voz televisiva de Hannibal Smith y J. R. Ewing ?;Dominique Paturel;Olivier Pajot;Christian Pelissier;Claude Piéplu;Expert;También fue la voz de Robin Hood de los Estudios Disney y la voz en off de los créditos de la serie animada « Capitán Flam ».;
22;es;¿A qué pionero de la música electrónica le debemos la banda sonora de la película « 1492 » ?;Vangelis;Klaus Schulze;David Arkenstone;Mike Oldfield;Expert;Llegó a París en mayo de 1968 y formó el grupo de rock progresivo Aphrodite's Child, con su amigo Demis Roussos y Lucas Sideras.;https://es.wikipedia.org/wiki/Vangelis
23;es;¿Qué cofundador y miembro del grupo Depeche Mode nos dejó el 26 de mayo de 2022 ?;Andrés Fletcher;Dave Gahan;Martín Gore;Alan Wilder;Expert;Andrew Fletcher fundó el grupo musical Composition of Sound con Vince Clarke, en el que se desempeñó como bajista.;https://es.wikipedia.org/wiki/Andrew_Fletcher
24;es;¿Qué presentador de la televisión francesa lanzó el personaje de Casimir ?;Christophe Izard;Mauricio Le Roux;Rémy Grumbach;Jean-Louis Cap;Expert;Le debemos numerosos programas : « L'Île aux enfants », « Les Visiteurs du mercredi », « Le Village dans les nuages  » y «  Salut les Mickey ».;
25;es;¿Qué actriz sigue siendo famosa hoy por su papel de Jessica Fletcher ?;Ángela Lansbury;Sharon Gless;Regina Taylor;Kathy Baker;Expert;Angela Lansbury también se ha distinguido en numerosas producciones de Hollywood junto a las estrellas más importantes.;https://es.wikipedia.org/wiki/Angela_Lansbury
26;es;¿Quién fue el primer bahameño en ganar el Premio de la Academia al Mejor Actor en 1964 ?;Sidney Poitier;Rex Harrison;Gregory Peck;Lee Marvin;Expert;Caballero Comendador de la Orden del Imperio Británico y Embajador de las Bahamas, nos dejó el 6 de enero de 2022.;https://es.wikipedia.org/wiki/Sidney_Poitier
27;es;¿Quién ha prestado su voz a documentales como « Diana, Princesa del Pueblo » ?;Jacques Perrin;Jean Desailly;Charles Berling;Hervé Lacroix;Expert;Como oficial de la reserva ciudadana de la Armada Nacional, su funeral tuvo lugar en el Hôtel des Invalides el 21 de abril de 2022.;https://es.wikipedia.org/wiki/Jacques_Perrin
28;es;¿Qué actriz fue premiada por su primer papel en la película « Rouge Baiser » ?;Charlotte Valandrey;Isabelle Adjani;Victoria Abril;Juliette Binoche;Expert;Anunció que estaba esperando un segundo trasplante de corazón debido a problemas de salud, ya que su corazón había llegado al final de su vida.;
29;es;¿Qué ex modelo logró el éxito con la canción « Comme un boomerang » ?;Dani;Imany;Douchka;Capucine;Expert;En 2001, Dani volvió a la escena gracias a la tenacidad de Étienne Daho, que produjo y cantó este título con ella.;https://es.wikipedia.org/wiki/Dani_(cantante)
30;es;¿A qué compositor americano le debemos la música de la serie « Twin Peaks » ?;Angelo Badalamenti;Scott Bradlee;Henry Mancini;Edgar Sampson;Expert;Angelo Badalamenti es conocido por su larga colaboración con David Lynch, cuya música escribió en numerosas ocasiones.;https://es.wikipedia.org/wiki/Angelo_Badalamenti
1;it;Quale animatore e saggista di fantascienza ci ha lasciato il 2 gennaio 2022 ?;Igor Bogdanoff;Jacques Bergier;Alexei Filippenko;Albert Jacquard;Débutant;Formando una coppia affiatata e inseparabile per tutta la loro carriera, i Bogdanoff divennero noti come divulgatori.;
2;it;Quale attore francese ha perso la vita all'età di 37 anni in seguito ad un incidente sugli sci ?;Gaspard Ulliel;Pierre Niney;Benoît Magimel;Mathieu Amalric;Débutant;Attore e modello, Garpard Ulliel era noto anche per essere stato per dodici anni il volto del profumo Bleu de Chanel.;https://it.wikipedia.org/wiki/Gaspard_Ulliel
3;it;Chi ha presentato per 33 anni il « giornale delle 13 » ?;Jean-Pierre Pernaut;Michel Denisot;Jean-Claude Bourret;Jacques Legros;Débutant;Nel febbraio 2022 è entrato in ospedale a seguito di diversi ictus e complicazioni legate a un intervento chirurgico a cuore aperto.;
4;it;Quale cantante e attore belga, nato a Ostenda, è morto all'età di 72 anni a Bruxelles ?;Arno;Jeff Bodart;Saule;Jofroi;Débutant;Iconoclasta e accattivante, ha fatto del suo essere belga un'arte importante che ha segnato la musica europea con i suoi testi toccanti.;https://it.wikipedia.org/wiki/Arno_(cantante)
5;it;Chi è diventato molto popolare interpretando Mosè ne « EI Dieci Comandamenti » ?;Daniel Lévi;Pedro Alves;Pablo Villafranca;Patrice Carmona;Débutant;Affetto da cancro del colon-retto dal 2019, padre di quattro figli, Daniel Lévi è morto il 6 agosto 2022 a Marsiglia all'età di 60 anni.;
6;it;Chi ha interpretato il ruolo di Sandy in « Grease » insieme a John Travolta ?;Olivia Newton-John;Sara Storer;Kasey Chambers;Sherrie Austin;Débutant;Nel 1980, girò una storia d'amore musicale con Gene Kelly, « Xanadu », che non ebbe molto successo, fatta eccezione per la colonna sonora.;https://it.wikipedia.org/wiki/Olivia_Newton-John
7;it;Chi è stata per settant'anni la regina del Regno Unito e dell'Irlanda del Nord ?;Elisabetta II;Alessandra di Kent;Carlotta del Galles;Beatrice di York;Débutant;È la seconda monarca dell'era moderna ad aver avuto il regno più lungo in Europa, dietro al re di Francia Luigi XIV.;
8;it;Quale calciatore brasiliano rimane l'unico tre volte vincitore della Coppa del Mondo ?;Pelè;Roberto;Fontana;Edu;Débutant;Una figura di spicco del calcio, Edson Arantes do Nascimento, noto come Pelé, è considerato il più grande giocatore di tutti i tempi.;
9;it;Qual era il nome di battesimo di Beineix, il regista francese a cui dobbiamo il film « 37°2 le matin » ?;Jean-Jacques;Philippe-André;Marc-Antoine;Pierre-Paul;Débutant;Morto il 13 gennaio 2022, con solo sei film al suo attivo, Jean-Jacques Beineix resta uno dei pilastri del cinema dal look francese.;https://it.wikipedia.org/wiki/Jean-Jacques_Beineix
10;it;Quale stilista italiano ha portato lo stile casual chic nella moda maschile ?;Nino Cerruti;Paco Rabanne;Emanuel Ungaro;Gianni Versace;Débutant;Morto il 15 gennaio 2022, Nino Cerruti fonda la sua casa di alta moda nel 1967 a Parigi 8, al 3 place de la Madeleine.;https://it.wikipedia.org/wiki/Nino_Cerruti
11;it;A quale regista dobbiamo « Ghostbusters », « Jumeaux » e « Beethoven » ?;Ivan Reitman;Tom Cavanagh;Rick Moranis;Arthur Hiller;Confirmé;Ivan Reitman è morto nel sonno il 12 febbraio 2022 all'età di 75 anni, successivamente sepolto nel cimitero di Santa Barbara.;https://it.wikipedia.org/wiki/Ivan_Reitman
12;it;Quale francese ha disegnato l'abito indossato da Kim Kardashian al Met Gala ?;Thierry Mugler;Christian Dior;Guy Laroche;Pierre Balmain;Confirmé;Non si è mai lasciato imprigionare nello status di grande couturier e ha rifiutato soprattutto le retrospettive delle sue creazioni.;https://it.wikipedia.org/wiki/Thierry_Mugler
13;it;Quale attore americano è stato famoso nel film « Children of Silence » ?;William Hurt;Dustin Hoffman;Jeremy Irons;Anthony Hopkins;Confirmé;Parla correntemente il francese, ha incontrato Sandrine Bonnaire sul set di « La Peste », dalla quale ha avuto una figlia nata nel 1994.;https://it.wikipedia.org/wiki/William_Hurt
14;it;Quale regina della notte ci ha lasciato il 1 maggio 2022, all'età di 92 anni ?;Régine;Barbara;Davia;Gelou;Confirmé;Dopo aver riscosso successo con « Les P'tits Papiers », Régine aprì locali notturni che portarono il suo nome in tutto il mondo.;
15;it;Quale attore è stato costretto a mangiare vivo un pezzo del suo cervello in « Hannibal » ?;Ray Liotta;Anthony Hopkins;Gary Oldman;David Andrews;Confirmé;Ray Liotta è morto nel sonno il 26 maggio 2022 all'età di 67 anni, nella Repubblica Dominicana, dove stava girando « Dangerous Waters ».;https://it.wikipedia.org/wiki/Ray_Liotta
16;it;Chi ha interpretato Sonny Corleone ne « EIl Padrino », di Francis Ford Coppola ?;James Caan;Don Johnson;George Burns;Mark Hamill;Confirmé;Secondo il certificato di morte pubblicato dal sito TMZ, l'attore è morto per un infarto in seguito ad una malattia coronarica.;https://it.wikipedia.org/wiki/James_Caan
17;it;Quale ex modella e moglie di Donald Trump ci ha lasciato il 14 luglio 2022 ?;Ivana Trump;Marla Maples;Ivanka Trump;Tiffany Trump;Confirmé;Maestra di sci, Ivana Trump farà anche la modella e promuoverà le Olimpiadi estive del 1976.;https://it.wikipedia.org/wiki/Ivana_Trump
18;it;Quale attrice ha vissuto con Ellen DeGeneres per tre anni e mezzo ?;Anne Heche;Jennifer Fox;Sarah Boyd;Julie Dash;Confirmé;Nella sua autobiografia, « Call me Crazy », Anne Heche descrive di essere stata violentata da suo padre dalla sua nascita fino all'età di dodici anni.;https://it.wikipedia.org/wiki/Anne_Heche
19;it;Quale statista sovietico e poi russo era noto per la sua macchia di vino ?;Michail Gorbaciov;Andrej Gromyko;Vladimir Putin;Yuri Andropov;Confirmé;Apprezzato nel mondo occidentale, Mikhail Gorbaciov ha ricevuto il Premio Nobel per la pace nel 1990, ma resta molto impopolare in Russia.;
20;it;Quale cineasta franco-svizzero completo ha padroneggiato il montaggio dei suoi film ?;Jean-Luc Godard;Gerard Leblanc;Claude Barma;Roger Andrieux;Confirmé;Jean-Luc Godard vi appariva occasionalmente, a volte in un piccolo ruolo, a volte non come attore ma come soggetto parlante.;https://it.wikipedia.org/wiki/Jean-Luc_Godard
21;it;Chi ha fornito la voce televisiva di Hannibal Smith e J. R. Ewing ?;Dominique Paturel;Olivier Pajot;Christian Pélissier;Claude Pieplu;Expert;È stato anche la voce di Robin Hood dei Disney Studios e la voce fuori campo dei titoli di coda della serie animata « Capitan Flam ».;
22;it;A quale pioniere della musica elettronica dobbiamo la colonna sonora del film « 1492 » ?;Vangelis;Klaus Schulze;David Arkenstone;Mike Oldfield;Expert;Giunto a Parigi nel maggio 1968, formò il gruppo rock progressivo Aphrodite's Child, con il suo amico Demis Roussos e Lucas Sideras.;https://it.wikipedia.org/wiki/Vangelis
23;it;Quale co-fondatore e membro del gruppo Depeche Mode ci ha lasciato il 26 maggio 2022 ?;Andrew Fletcher;Dave Gahan;Martin Gore;Alan Wilder;Expert;Andrew Fletcher ha fondato il gruppo musicale Composition of Sound con Vince Clarke, nel quale ha servito come bassista.;https://it.wikipedia.org/wiki/Andrew_Fletcher
24;it;Quale personaggio televisivo francese ha lanciato il personaggio di Casimiro ?;Christophe Izard;Maurizio Le Roux;Remy Grumbach;Jean-Louis Cap;Expert;A lui dobbiamo numerosi programmi : « L'isola dei bambini », « Visitatori del mercoledì », « Il villaggio tra le nuvole » e « Salut les Mickey ».;
25;it;Quale attrice rimane famosa oggi per il suo ruolo di Jessica Fletcher ?;Angela Lansbury;Sharon Gless;Regina Taylor;Kathy Baker;Expert;Angela Lansbury si è distinta anche in numerose produzioni hollywoodiane al fianco delle più grandi star.;https://it.wikipedia.org/wiki/Angela_Lansbury
26;it;Chi è stato il primo delle Bahamas a vincere l'Oscar come miglior attore nel 1964 ?;Sidney Poitier;Rex Harrison;Gregory Peck;Lee Marvin;Expert;Cavaliere Comandante dell'Ordine dell'Impero Britannico e Ambasciatore delle Bahamas, ci ha lasciato il 6 gennaio 2022.;https://it.wikipedia.org/wiki/Sidney_Poitier
27;it;Chi ha prestato la propria voce a documentari tra cui « Diana, Princess of the People » ?;Jacques Perrin;Jean Desailly;Charles Berling;Hervé Lacroix;Expert;In qualità di ufficiale della riserva cittadina della Marina Nazionale, il suo funerale si è svolto all'Hôtel des Invalides il 21 aprile 2022.;https://it.wikipedia.org/wiki/Jacques_Perrin
28;it;Quale attrice è stata premiata per il suo primo ruolo nel film « Rouge Baiser » ?;Charlotte Valandrey;Isabelle Adjani;Victoria Abril;Juliette Binoche;Expert;Ha annunciato che era in attesa di un secondo trapianto di cuore a causa di problemi di salute, poiché il suo cuore era giunto al termine della sua vita.;https://it.wikipedia.org/wiki/Charlotte_Valandrey
29;it;Quale ex modella ha raggiunto il successo con la canzone « Comme un boomerang » ?;Dani;Imany;Douchka;Capucine;Expert;Nel 2001, Dani ritorna alla ribalta, grazie alla tenacia di Étienne Daho che produce e canta con lei questo titolo.;https://it.wikipedia.org/wiki/Danièle_Graule
30;it;A quale compositore americano dobbiamo la musica per la serie « Twin Peaks » ?;Angelo Badalamenti;Scott Bradlee;Henry Mancini;Edgar Sampson;Expert;Angelo Badalamenti è noto per la sua lunga collaborazione con David Lynch, di cui ha scritto la musica in numerose occasioni.;https://it.wikipedia.org/wiki/Angelo_Badalamenti
1;nl;Welke sciencefictionanimator en essayist heeft ons op 2 januari 2022 verlaten ?;Igor Bogdanoff;Jacques Bergier;Alexei Filippenko;Albert Jacquard;Débutant;De Bogdanoffs vormden gedurende hun hele carrière een hecht en onafscheidelijk duo en werden bekend als popularisatoren.;https://nl.wikipedia.org/wiki/Igor_en_Grichka_Bogdanoff
2;nl;Welke Franse acteur kwam op 37-jarige leeftijd om het leven na een ski-ongeluk ?;Gaspard Ulliel;Pierre Niney;Benoît Magimel;Mathieu Amalric;Débutant;Acteur en model Garpard Ulliel stond ook bekend als het gezicht van het parfum Bleu de Chanel gedurende twaalf jaar.;https://nl.wikipedia.org/wiki/Gaspard_Ulliel
3;nl;Wie presenteerde met name 33 jaar lang de « krant van 13.00 uur » ?;Jean-Pierre Pernaut;Michel Denisot;Jean-Claude Bourret;Jacques Legros;Débutant;In februari 2022 werd hij naar het ziekenhuis gebracht na verschillende beroertes en complicaties die verband hielden met een openhartoperatie.;https://nl.wikipedia.org/wiki/Jean-Pierre_Pernaut
4;nl;Welke Belgische zanger en acteur, geboren in Oostende, stierf op 72-jarige leeftijd in Brussel ?;Arno;Jeff Bodart;Wilg;Jofroi;Débutant;Beeldenstormend en vertederend maakte hij van zijn Belg-zijn een belangrijke kunst die met zijn ontroerende teksten de Europese muziek markeerde.;https://nl.wikipedia.org/wiki/Arno_(zanger)
5;nl;Wie werd erg populair als Mozes in « De Tien Geboden » ?;Daniël Levi;Pedro Alves;Pablo Villafranca;Patrice Carmona;Débutant;Daniel Lévi lijdt sinds 2019 aan colorectale kanker en vader van vier kinderen. Hij stierf op 6 augustus 2022 in Marseille op 60-jarige leeftijd.;
6;nl;Wie speelde de rol van Sandy in « Grease » naast John Travolta ?;Olivia Newton-John;Sarah Storer;Kasey Chambers;Sherrie Austin;Débutant;In 1980 filmde ze een muzikale romance met Gene Kelly, « Xanadu », die niet erg succesvol was, behalve de soundtrack.;https://nl.wikipedia.org/wiki/Olivia_Newton-John
7;nl;Wie was zeventig jaar lang koningin van Groot-Brittannië en Noord-Ierland ?;Elizabeth II;Alexandra van Kent;Charlotte van Wales;Beatrijs van York;Débutant;Zij is de tweede monarch van de moderne tijd die de langste regering in Europa heeft gehad, na de Franse koning Lodewijk XIV.;
8;nl;Welke Braziliaanse voetballer blijft de enige drievoudig WK-winnaar ?;Pelé;Roberto;Fontana;Edu;Débutant;Een belangrijke voetbalfiguur, Edson Arantes do Nascimento, bekend als Pelé, wordt beschouwd als de grootste speler aller tijden.;
9;nl;Wat was de voornaam van Beineix, de Franse regisseur aan wie we de film « 37°2 le matin » te danken hebben ?;Jean-Jacques;Philippe-André;Marc-Antoine;Pierre-Paul;Débutant;Jean-Jacques Beineix stierf op 13 januari 2022 en had slechts zes films op zijn naam staan. Hij blijft een van de pijlers van de Franse cinema.;
10;nl;Welke Italiaanse ontwerper bracht de casual chique stijl in de herenmode ?;Nino Cerruti;Paco Rabanne;Emanuel Ungaro;Gianni Versace;Débutant;Nino Cerruti, overleden op 15 januari 2022, richtte in 1967 zijn haute couture-huis op in Parijs 8e, op de 3e place de la Madeleine.;
11;nl;Aan welke regisseur hebben we « Ghostbusters », « Jumeaux » en « Beethoven » te danken ?;Ivan Reitman;Tom Cavanagh;Rick Moranis;Arthur Hiller;Confirmé;Ivan Reitman stierf in zijn slaap op 12 februari 2022 op 75-jarige leeftijd, later begraven op de begraafplaats van Santa Barbara.;https://nl.wikipedia.org/wiki/Ivan_Reitman
12;nl;Welke Fransman ontwierp de jurk die Kim Kardashian droeg tijdens het Met Gala ?;Thierry Mugler;Christian Dior;Guy Laroche;Pierre Balmain;Confirmé;Hij liet zich nooit opsluiten in de status van grote couturier en weigerde met name retrospectieven van zijn creaties.;https://nl.wikipedia.org/wiki/Thierry_Mugler
13;nl;Welke Amerikaanse acteur was opmerkelijk in de film « Children of Silence » ?;William Hurt;Dustin Hoffman;Jeremy Irons;Anthony Hopkins;Confirmé;Hij spreekt vloeiend Frans en ontmoette Sandrine Bonnaire op de set van « La Peste », met wie hij in 1994 een dochter kreeg.;https://nl.wikipedia.org/wiki/William_Hurt
